location,source,target,ID,fuzzy,context,translator_comments,developer_comments
"S """"",S_f9bfc65a,"Эй, страж! Теперь, когда я выполнила все поручения, я жду свою награду.",,,,,
"""""",narrator_ccefabc0,"Сара ощущала себя очень довольной и гордой, когда говорила это. Для нее борьба за эссенцию оказалась сложнее, чем любая другая до этого, поэтому вкус победы был особенно сладок.",,,,,
"G """"",G_5a5bcbdb,"Она твоя, с этим спорить не буду. Но есть одно неприятное 'но'.",,,,,
"""""",narrator_63664b64,"Сара недовольно посмотрела на стража, от чего тот медленно попятился назад. После всего, что ей пришлось пережить ради этой эссенции, она не хотела ничего слышать и знать о каких-то нюансах.",,,,,
"""""",narrator_12cb2eff,"Лиззара, стоящая позади Сары, тоже была возмущена. Она как никто другой знала, что им пришлось пережить.",,,,,
"L """"",L_cb0a0155,(Но? Какой вздор!),,,,,
"S """"",S_94248755,!!!,,,,,
"S """"",S_cced787e,А ты здесь откуда? Ты меня напугала!,,,,,
"L """"",L_f20f5535,"А... ну я подумала, что тебе пригодится моя помощь...",,,,,
"L """"",L_0d4e83dc,"Да и я была бы рада вместе с Сарой закончить это дело. Так сказать, вместе начали – вместе закончим, хи-хи, ты же не против?",,,,,
"S """"",S_fcae1fe6,"Нет, конечно, просто не подкрадывайся...",,,,,
"L """"",L_6d8879e9,"Ой извини. Действительно, нужно было заранее тебя предупредить...",,,,,
"G """"",G_3ea6e665,"Да, я знал, что ты и... твоя подруга, полагаю, не будете в восторге. Однако я не могу уже ничего вернуть назад. Тебе придется самой забрать эссенцию.",,,,,
"S """"",S_8d23c44f,"И что же такого неприятного в том, что я сама приду и заберу ее?",,,,,
"G """"",G_3cd22d3e,Как сказать...,,,,,
"G """"",G_9147150c,"Пойдемте, я должен вам кое-что показать.",,,,,
"centered """"",centered_aeba1549,"(Вот черт, каждый раз одно и тоже, неужели нельзя просто взять и отдать свою эссенцию...)",,,,,
"centered """"",centered_86d4ddf9,Гр...,,,,,
"S """"",S_9e57c2ea,Да...,,,,,
"L2side6 """"",L2side6_6f40ca7b,Ч-что это...,,,,,
"""""",narrator_81467092,"Сара и Лиззара стояли перед небольшим бассейном, наполненным доверху семенем. Запах стоял специфический, но отчего-то он успокаивал девушку и направлял ее настрой в другое русло. Протосс не могла сказать такого же. Ее этот вид больше пугал, чем манил.",,,,,
"L2side6 """"",L2side6_a9151024,"Кажется, он не соврал...",,,,,
"S """"",S_71f0100d,Боюсь представить зачем вам оно нужно...,,,,,
"""""",narrator_3a734b3c,"В голову Сары лезли разные пошлые и комичные мысли, связанные с зергами и кучей густой жидкости. Она так и видела красочную картинку, где страж во главе брызгался на других своим семенем в лучах яркого солнца.",,,,,
"S """"",S_34cb6979,"(Как жаль, что это не может быть правдой.)",,,,,
"S """"",S_e0a3d5d4,Хех...,,,,,
"Gside1 """"",Gside1_923e69f3,"Это не для того, о чем ты могла подумать.",,,,,
"S """"",S_65d9c3f9,А о чем я могла подумать?,,,,,
"Gside1 """"",Gside1_0b1665dd,Я не...,,,,,
"Gside1 """"",Gside1_9378797f,Это не важно.,,,,,
"""""",narrator_6292ed8d,"Девушка с интересом наблюдала, как эмоции на морде стража активно сменяют друг друга.",,,,,
"S """"",S_e399a85c,"(Удивительно, они все покрыты толстым слоем хитина, но при этом их смятение все равно так легко заметить.)",,,,,
"S """"",S_0314cdc2,"Могу согласиться, это не важно.",,,,,
"S """"",S_64b06841,"Если опустить все шутки, то... Зачем мы здесь?",,,,,
"""""",narrator_4cdf99a2,"Сара указала на то, что видела перед собой. Ей было неподдельно интересно, кто и зачем придумал что-то подобное в таком месте.",,,,,
"S """"",S_71174c8f,Это что-то изощренное для тренировки новых рабов?,,,,,
"""""",narrator_64c2e38e,"От этих слов Лиззару передернуло. В голове сама по себе стала проявляться картина, как ее окунают туда. Или чего еще похуже.",,,,,
"S """"",S_016fa325,Владычица вполне бы пошла на такое...,,,,,
"Gside1 """"",Gside1_609ec4b7,"Нет, все немного по-другому... Этот здоровенный резервуар и есть моя эссенция.",,,,,
"""""",narrator_cddd952e,!!!,,,,,
"centered """"",centered_69ef0f15,"Девушки были ошеломлены услышанным, они и не могли подумать, что ее может быть так много.",,,,,
"S """"",S_33deb2f7,Т-ты наверное шутишь?,,,,,
"L2side6 """"",L2side6_f1bdd3ef,"Б-быть такого не может, ей придется... ее... всю...",,,,,
"""""",narrator_98c5792f,Протос от удивления сглотнула накопившуюся во рту жидкость.,,,,,
"Gside1 """"",Gside1_64faa12f,"Точнее, это его... особый защитный механизм.",,,,,
"""""",narrator_343cf2f8,"Девушка уже не пыталась скрыть свое удивление, она широко открытыми глазами смотрела на бассейн и очень хотела узнать, как именно семя может защитить эссенцию.",,,,,
"S """"",S_ac75e2eb,Поподробнее...,,,,,
"Gside1 """"",Gside1_962b106d,Я придумал это еще давным-давно...,,,,,
"S """"",S_64c0de1d,...,,,,,
"Gside1 """"",Gside1_51185c23,"Так как мы... движемся в своем темпе, мы подвержены частным захватам. Это подвергает сохранность эссенции опасности, поэтому я решил, что лучше будет разделиться с ней и хранить в самом недоступном месте.",,,,,
"L2side5 """"",L2side5_f19bcc40,В семени??? СЕРЬЕЗНО???,,,,,
"S """"",S_48e9a40d,"Мне больше интересно, как вы это сохранное место наполняли!",,,,,
"S """"",S_8abcb819,"Нет-нет-нет, стоп, я передумала, я определенно не хочу этого знать. Ляпнула, не подумав...",,,,,
"Gside1 """"",Gside1_90021f42,"Это было гениальным решением: даже если меня захватят, то останутся без эссенции. А значит, все время, что они потратили, не принесло им ничего, что равносильно поражению.",,,,,
"Gside1 """"",Gside1_ed31d2b9,"Да и кто бы мог подумать, что зерг по своей личной воле разделится со своей эссенцией?",,,,,
"Gside1 """"",Gside1_f924d8f1,"Но смотря на ситуацию сейчас, вижу, что это действительно создает некую проблему...",,,,,
"Gside1 """"",Gside1_b7333e3f,"Думал ли я, что однажды настанет тот самый день и придет терран, подружившийся с протоссом, пройдет мутацию и я по собственной воле пожелаю ему отдать свою эссенцию?",,,,,
"Gside1 """"",Gside1_f3481162,Определенно - нет.,,,,,
"S """"",S_b0f831cf,"Да, соглашусь...",,,,,
"Gside1 """"",Gside1_b5d64be5,"Тем более мы вообще должны быть рады, что у нас есть хоть какая-то возможно забрать ее. Ведь одной из идей было запечатать ее навсегда, но тогда это было бы равносильно моей смерти.",,,,,
"S """"",S_263d3206,Я слышу это каждый раз.,,,,,
"Gside1 """"",Gside1_67be04d6,"В общем, внутри этого резервуара находится сгусток моей эссенции, который тебе просто нужно найти и поглотить.",,,,,
"S """"",S_cb5621a4,Что???,,,,,
"L2side6 """"",L2side6_2a3c3d67,!!!,,,,,
"Gside1 """"",Gside1_fbdbfe42,"Остальная часть резервуара ничего не содержит, это просто мое семя.",,,,,
"S """"",S_61860094,Да ладно? Неужели я уже недостаточно постаралась ради этого? Мне еще придется заниматься поиском малюсенького сгустка посреди бидона спермы???,,,,,
"""""",narrator_288fc996,"Сара обреченно посмотрела вниз, присев на корточки и не видя дна. Ей в последнюю очередь была интересна мысль о том, каково быть полностью погруженной в сперму.",,,,,
"S """"",S_4eab0771,Чтож... это будет трудный заплыв.,,,,,
"S """"",S_267b67e7,"А ты что думаешь по этому поводу, Лиззара?",,,,,
"""""",narrator_66f3cdec,"Протосс будто вышла из транса, перестав смотреть на кучу сильно пахнущей жидкости.",,,,,
"L2side6 """"",L2side6_37eabccb,А? Я? Боже...,,,,,
"S """"",S_74ebe90d,"Ну да, раньше я точно так же реагировала, как и ты. Что ж, привыкай, дорогуша, тут такое сплошь и рядом.",,,,,
"S """"",S_47a0ee04,"(Черт, почему меня это забавляет...)",,,,,
"Gside1 """"",Gside1_21d6ddf3,У меня есть одна мысль.,,,,,
"Gside1 """"",Gside1_a174f09c,Мы закрепим тебя вниз головой и опустим. Тебе останется только найти эссенцию и дело с концом.,,,,,
"L2side4 """"",L2side4_0962b36f,"М-может, лучше я? Ты и так много сделала. Не так уж и трудно!",,,,,
"L2side2 """"",L2side2_b71e86e4,Монстров же там точно больше не будет?,,,,,
"S """"",S_5e041342,"(Хех, она такая милая. Несмотря на шок, все равно собирается лезть в резервуар вместо меня...)",,,,,
"S """"",S_19ce457f,Вряд ли...,,,,,
"S """"",S_22ce356b,"Даже если бы это и получилось, по моему личному опыту, эссенция очень хрупкая... Даже не знаю, как тебе объяснить. Это нечто, что нельзя просто передать руками.",,,,,
"S """"",S_49786eb2,"Поймет только тот, кто однажды ее вкусил...",,,,,
"Gside1 """"",Gside1_fcc4a849,"Другого я от тебя не ожидал, поэтому и планировал связать тебе руки.",,,,,
"L2side6 """"",L2side6_4d614ad6,Ч-что? Связать руки???,,,,,
"S """"",S_f86ec20c,"Другого я и не ожидала, все же я уже хорошенько улавливаю ваш настрой...",,,,,
"S """"",S_7dcd627e,"Не переживай, Лиззара, я не настолько уставшая, чтобы не справиться с этим.",,,,,
"S """"",S_c463fd2f,"По поводу привязываний и опусканий в резервуар... это ведь тоже не просто так. Верно, Страж?",,,,,
"Gside1 """"",Gside1_0fd7c8bf,"Да, это семя очень вязкое и если ты нырнешь в него без страховки, оно может засосать тебя. Не хватит воздуха, чтобы найти эссенцию и вернуться.",,,,,
"""""",narrator_86e594aa,"Лиззара побледнела, хватаясь за руку девушки. Сара лишь успокаивающе накрыла ее ладонь, сжимая.",,,,,
"Gside1 """"",Gside1_e103a9ea,"Так что единственным способом остается закрепить тебя. Кстати, тут нам Лиззара как раз сможет помочь, она будет отвечать за твое погружение. И подъем, естественно.",,,,,
"S """"",S_4f194216,"Ооо, ну вот и отлично. Слышишь, Лиззара? И для тебя работка нашлась, а ты переживала.",,,,,
"L2side5 """"",L2side5_335596c0,"Д-да! Хорошо, я обязательно с этим справлюсь, я тебя не подведу!",,,,,
"S """"",S_31110290,"Не переживай, в ком-ком, а в тебе я не сомневаюсь!",,,,,
"S """"",S_25311a44,"Быть захваченной спермой... Я даже не знаю, как это расценивать.",,,,,
"S """"",S_787f99e9,"Хм, меня тут посетила мысль. А что если попробовать достать ее с помощью пс-силы?",,,,,
"""""",narrator_0f022cb2,"Сара подняла руку, ехидно улыбаясь, пытаясь напакостить.",,,,,
"Gside1 """"",Gside1_f931af6b,"Не выйдет, эссенция не что-то настолько материальное, чтобы ее можно было перемещать. Да и по структуре своей не сильно отличается от здешней жидкости.",,,,,
"Gside1 """"",Gside1_5ee93c4f,"Туда она была помещена не для развлечения, а для защиты. А в делах безопасности я никому не уступаю. Я все же страж, как-никак.",,,,,
"S """"",S_9beff31b,{size=-4}То-то мы шпиль восстанавливали...{/size},,,,,
"S """"",S_a55d1e3e,"Эх, все как всегда, ничего не меняется, нет ни минутки покоя... Вот когда все закончится, я тако-о-о-о-й опуск себе забабахаю!",,,,,
"""""",narrator_fd69356d,"Сара начала разминать шею и руки, готовясь к предстоящему испытанию.",,,,,
"""""",narrator_e0fe6a14,"Страж и его подчиненные бегали кругом, подготавливая все к полному погружению. Они с особой осторожностью закрепляли девушку и поднимали ее в воздух. Никому не хотелось вызвать гнев могущественной Сары.",,,,,
"L """"",L_f3df82db,Ты точно будешь в порядке?,,,,,
"S """"",S_111d341e,"А? Это? Не переживай, это пустяки. Ты сейчас стоишь рядом со мной. Этого достаточно.",,,,,
"""""",narrator_d7f6ef23,"Лиззара коротко кивнула, отходя немного дальше, чтобы не мешать. В ней еще не исчезло рвение помогать, поэтому она решительно была настроена.",,,,,
"S """"",S_1e438deb,"(Чувствую, как кровь приливает к голове... Может, так я смогу быстрее придумать, как достать эту эссенцию не спустя вечность.)",,,,,
"S """"",S_3f8f0f59,"Давайте разберемся на берегу, и повторим еще раз. Когда я делаю вот так, что нужно сделать?",,,,,
"""""",narrator_943c2a0f,"Сара начала шевелить ногой, подергивая ее слегка со стороны в сторону.",,,,,
"L """"",L_eb9f9cb1,"Это сигнал, что тебя нужно вытаскивать. Пока это пробное ныряние, мы не погрузим тебя полностью, чтобы ты могла осмотреться.",,,,,
"S """"",S_ea0fd55f,"Все верно, отлично. Ну теперь я могу быть спокойной, что хоть не буду погребена вместе с его эссенцией.",,,,,
"S """"",S_922487cc,"Вы же помните, да? Запас воздуха в моих легких тоже не бесконечный. Я подам сигнал заранее, но вы там долго не тяните.",,,,,
"""""",narrator_a2830f7a,"Сара еще раз решила собраться, сделав парочку контрольных вдохов и выдохов. Благо это было частью тренировки призрака, их готовили к самым разным заданиям.",,,,,
"S """"",S_76d065f1,"Ну что ж, тогда полное погружение, капитан. Можете меня опускать.",,,,,
"""""",narrator_f791201e,"Сара ощущала небольшое волнение внутри. Хоть она была и уверена в своих силах, но не до конца верила в зергов. Те резко уронили ее вниз, заставляя прочувствовать контраст теплого воздуха и прохладного семени, хотя и опустили всего лишь по плечи.",,,,,
"""""",narrator_d476b438,"Девушке казалось, что вся ее кожа резко сжалась от подобного перепада и соски стали более чувствительными. Эссенция на мгновение ушла на второй план, оставляя массу вопросов и новых ощущений.",,,,,
"S """"",S_72fac4f4,"(Л-ладно, нужно следовать п-плану. Стража я потом с-сюда окуну.)",,,,,
"S """"",S_fc23e422,(Для начала мне нужно сделать следующее.),,,,,
"""""",narrator_98c23ed6,"Сара сосредоточилась, готовясь к чему-то. После небольшой паузы, ее глаза начали светиться и она смогла их открыть.",,,,,
"S """"",S_e8959ce6,"(Отлично, все мы знаем, что будет, если эта сперма попадет в глаза... я просто ослепну тут.)",,,,,
"""""",narrator_b7f7da53,"Это было действительно отличной мыслью: с помощью пси-силы сделать защитный слой для глаза. Теперь девушка могла видеть, что происходит внутри.",,,,,
"""""",narrator_f416a8b8,"Картинка перед открытыми глазами была мутная, но Сара прекрасно помнила, каким ярким свечением обладает эссенция.",,,,,
"S """"",S_0c9b26c1,"(Мда, она весьма плотная... )",,,,,
"S """"",S_3bfe15db,(Они точно тут ее оставили? Я ничего не вижу...),,,,,
"""""",narrator_cc1b9df7,"Сара вертела головой, пытаясь осмотреться со всех сторон, но перед глазами картинка никак не менялась.",,,,,
"S """"",S_922aeb10,"(Не может быть такого, что я ее не вижу...)",,,,,
"S """"",S_fadf52ba,"(Черт, кажется, для первого раза хватит... из-за переживаний удерживать воздух в разы сложнее...)",,,,,
"""""",narrator_0f26d5e2,"Девушка была растеряна от того, что все идет не гладко. Она приняла волевое решение и была готова к всплытию, поэтому активно задергала ногой.",,,,,
"S """"",S_1f491e73,(А???),,,,,
"S """"",S_7728012b,"(Ч-черт, они что, издеваются?)",,,,,
"S """"",S_6f13d8dd,(Почему нет никакой реакции?),,,,,
"S """"",S_78266fda,"(Черт, нет! Воздуха все меньше.)",,,,,
"""""",narrator_e919821a,"Волнение начинало нарастать и Сара невольно стала выдыхать запасы воздуха. Ей казалось, что пузыри воздуха будут дополнительным сигналом, что ее нужно вынимать, поэтому стала выпускать все содержимое из легких через рот.",,,,,
"""""",narrator_5a1b7ed0,"Жидкость действительно была очень вязкой и бесконтрольно стала попадать в рот. Вся ротовая полость и горло наполнились до отказа. Девушка пыталась глотать ее, но получалось это с трудом.",,,,,
"""""",narrator_87335939,"Веревки, плотно обхватывающие тело, только распаляли ее фантазию. Она представляла себя со стороны, такой пошлой, связанной и глотающей сперму.",,,,,
"S """"",S_94248755_1,!!!,,,,,
"S """"",S_63912902,Б-х-х-х-ха-а-а-а...,,,,,
"""""",narrator_8a771bc1,"Так же резко, как Сара оказалась в бассейне, она оказалась и снаружи. Девушка даже не успела понять, когда ее вытащили, потому что произошло это почти мгновенно. Невыпитая сперма вытекала из приоткрытого рта, ставя Сару в еще более неловкое положение.",,,,,
"""""",narrator_b9ff1c26,"Лиззара перепугано мельтешила из стороны в сторону, радостно выдыхая, увидев Сару.",,,,,
"S """"",S_5aff1520,Вы...,,,,,
"S """"",S_1ebabe0e,ВЫ!!!,,,,,
"S """"",S_7bfb5b68,Какого черта вы держали меня там так долго? Я чуть не откинулась...,,,,,
"S """"",S_d64a0c63,Я подавала вам сигнал! Как вы вообще посмели...!,,,,,
"G """"",G_6b8d8e02,"Я же говорил тебе, что это не судорога!",,,,,
"L """"",L_a51c921c,"Прости, Сара... Это действительно выглядело как судорога...",,,,,
"G """"",G_67292670,"Веревка так часто дергалась, что наша ошибка не удивительна.",,,,,
"S """"",S_99d6315c,"Да ладно? А может, потому что мне в этом резервуаре спермы нужно найти что-то? Вы хоть представляете, насколько это тяжело?!",,,,,
"""""",narrator_b263cb27,"Сара зло нахмурила брови, понимая, что была на волосок от провала.",,,,,
"L """"",L_97163c5b,"Такого больше не повторится, прости еще раз.",,,,,
"S """"",S_86e1bc16,"Не нужно извиняться, просто сделайте в следующий раз все правильно!",,,,,
"G """"",G_a243d917,"А пузыри-то, кажется, означали совсем другое.",,,,,
"S """"",S_30c7acd7,Это была экстренная ситуация!,,,,,
"S """"",S_d40b36ba,"Из-за вас мне пришлось наглотаться этой жижи! Хочешь попробовать, каково это?!",,,,,
"S """"",S_e6857db0,"До сих пор горло саднит от того, что она не хотела проходить дальше...",,,,,
