location,source,target,ID,fuzzy,context,translator_comments,developer_comments
"S """"",S_392ddcc5,"После того, как все закончится, ты обязательно пойдешь следом!",,,,,
"G """"",G_df2908a2,"Мы тут не за этим собрались, лучше скажи, получилось освоиться там?",,,,,
"S """"",S_e867fb1b,"А что она сама лезет везде, куда можно, не предупреждал!",,,,,
"""""",narrator_4f09f330,"Сара выглядела возмущенной, хотя в глубине души неприятные ощущения дополнительно стимулировали ее сознание. Ей хотелось выглядеть серьезно перед будущими подчиненными, а не показывать себя сразу с темной стороны.",,,,,
"G """"",G_4a29256b,"Кто знал, что ты захочешь открыть рот? Я не силен в видении будущего.",,,,,
"S """"",S_38c98633,"Очень жаль, иначе бы ты уже увидел, как я топлю тебя зде...",,,,,
"G """"",G_2aff5c5e,"Ну что, готова ко второму заходу?",,,,,
"S """"",S_a2edf573,Подождите! Дайте хоть секундочку дух перевести...,,,,,
"S """"",S_436bc6d6,"Бр... Никто не предупреждал, что она такая холодная!",,,,,
"G """"",G_3a4a683f,У нас нет времени на отдых! Опускаем!,,,,,
"L """"",L_6c9d3c87,"Давай, Сара, постарайся!",,,,,
"S """"",S_694bf9a5,А...?!! Ч-т...,,,,,
"S """"",S_94248755_2,!!!,,,,,
"""""",narrator_e7de0b48,"Сара снова была погружена в бассейн. Ее тело не успело даже слегка обсохнуть перед тем, как ее погрузили снова. Температура семени стала ощущаться лучше и девушка была к ней готова.",,,,,
"""""",narrator_a3030bdb,"Пошлые мысли все еще посещали ее, но она старалась отгонять их. Сара была весьма на взводе.",,,,,
"S """"",S_2c0d5c3c,"(Я ВЕДЬ НЕ СКАЗАЛА, ЧТО УСПЕЛА ПЕРЕВЕСТИ ДЫХАНИЕ! УБЬЮ!)",,,,,
"S """"",S_df01acd1,"(Нужно попробовать запрокинуть голову... Бассейн глубокий, она могла оказаться на самом дне. Возможно, есть разница в их плотности.)",,,,,
"""""",narrator_7d6a7a2c,"Девушка не без труда посмотрела в самый низ, пытаясь сощурить глаза для лучшей картинки. Сначала ей казалось, что там ничего нет, потому что жидкость слишком перекрывала обзор из-за своей плотности. Но, чуть присмотревшись, глаза Сары зацепились за едва уловимое свечение.",,,,,
"S """"",S_e286f509,Вот она!!!,,,,,
"S """"",S_94248755_3,!!!,,,,,
"S """"",S_1017abe2,"(Нет, не сейчас!)",,,,,
"""""",narrator_47e2d923,"От радости девушка на мгновение забыла, где находится, и опять заглотнула большое количество спермы. Вязкая жижа встала поперек горла и вызвала приступ кашля, от чего Сара заглатывала все больше и больше семени. По мере заполнения желудка по телу начало распространяться приятное ощущение.",,,,,
"S """"",S_e78f4d80,Кхе...,,,,,
"S """"",S_cd7e1a61,"(Это... Чем-то напоминает питательную жидкость. Возбуждает, но не так сильно...)",,,,,
"""""",narrator_4c93ffc6,"Девушка чувствовала себя все пошлее, не обращая внимания на все, что происходит. Даже когда ее вытянули, она не сразу начала дышать, чувствуя себя внизу.",,,,,
"L """"",L_584ffe73,"Сара, вдыхай!",,,,,
"S """"",S_de2f5c24,*Глубокий вдох*,,,,,
"S """"",S_0bb64f29,Кхе... Я же... не...,,,,,
"L """"",L_f058e914,"Что там произошло? Веревка не двигалась, но пузыри так хаотично подымались на поверхность.",,,,,
"S """"",S_9af65b35,"(Я ГОВОРЮ, Я НЕ ПОДАВАЛА СИГНАЛ!)",,,,,
"""""",narrator_de84a87a,"Сара не могла спокойно говорить, поэтому решила воспользоваться телепатией, чтобы выразить свое недовольство.",,,,,
"S """"",S_aec16fa8,"Я увидела... эссенцию и в этот момент... угадайте, что?",,,,,
"S """"",S_c11c3a9e,"Вы меня вытащили... мне кажется, вы тут собрались, чтобы только мешать!",,,,,
"S """"",S_1aa7c86f,Черт...,,,,,
"S """"",S_f348da9c,"В итоге наглоталась еще больше, чем в первый раз. С такими темпами этого бассейна скоро не будет.",,,,,
"S """"",S_ee5b6d94,Я до эссенции просто так доберусь...,,,,,
"G """"",G_1c29ed11,Это вряд ли. Твой желудок такого не потянет.,,,,,
"S """"",S_c2cac27c,Даже не хочу с этим спорить.,,,,,
"S """"",S_d1b2a56f,"Ладно, вы все равно правильно сделали, что вытащили меня.",,,,,
"S """"",S_58b0c129,"У нас совсем другая проблема. Эссенция почти на дне бассейна, поэтому меня нужно опустить ниже.",,,,,
"L """"",L_717b41c0,Ниже???,,,,,
"G """"",G_f4485ff5,"Ты уверена? Чем ниже, тем опаснее. Плотность жидкости и давление повышается, ты можешь потерять сознание.",,,,,
"L """"",L_132f0067,"Сара, может, не стоит?",,,,,
"S """"",S_5613e518,"Делайте, что я сказала!",,,,,
"""""",narrator_5efb90d6,"Лиззара не стала спорить, командуя погружение на более опасную глубину.",,,,,
"""""",narrator_c20e07cd,"Сара ощущала, как погружение стало дольше по времени, они не рисковали опускать ее быстро, чтобы не создавать лишние перепады давления.",,,,,
"S """"",S_04158773,"(Ну же, быстрее...)",,,,,
"S """"",S_b79934fe,(Я так не опущусь никогда...),,,,,
"S """"",S_52897832,(Остановились? Уже?),,,,,
"""""",narrator_d992e9b8,"Сара посмотрела вниз, понимая, что до эссенции осталось далеко, хоть и чуть ближе, чем раньше.",,,,,
"S """"",S_fa079db0,(Мне кажется... Или она чуть передвинулась?),,,,,
"S """"",S_9d5130cc,(Хотя могли и меня чуть в стороне опустить... Но все равно странно.),,,,,
"S """"",S_ee13a6f5,"(Если она еще и двигаться будет, то мы тут застрянем навеки!)",,,,,
"S """"",S_e3ed9a9b,(Но если я выпущу немного воздуха... Должна ли я опуститься ниже?),,,,,
"S """"",S_08a3ab55,(От нескольких пузырей меня же не подымут.),,,,,
"S """"",S_d3829a03,(Есть только один способ это проверить!),,,,,
"""""",narrator_7ef7eaf9,"Сара морально готовилась к возможности наглотаться спермы, воспринимая это все проще. Голова немного затуманилась и все происходящее перестало быть таким уж серьезным. Она стала понемногу выпускать пузыри, радуясь, что дно бассейна начало понемногу приближаться.",,,,,
"S """"",S_010bf53d,"(Наверное, веревка не в натяжении, раз я могу опуститься пониже. Это спасет обстановку, но я не опущусь таким способом.)",,,,,
"""""",narrator_5d769bb3,"Потеряв бдительность, девушка упустила момент, когда рот стал наполняться семенем. Не проглотить это было невозможно, но и желание сопротивляться куда-то стремительно пропало. Перед Сарой мелькали воспоминания, как она заглатывала тентакль, чтобы получить пищу, и как это ее возбуждало..",,,,,
"S """"",S_162dd93c,"(Это не так, как питание... Та жидкость пощипывала и действовала моментально, эта мягче. Намного мягче...)",,,,,
"""""",narrator_d89d67d1,"Сара начала привыкать к плотности, заглатывая все больше и больше жидкости. Казалось, что она начала входить во вкус, пока ее не выдернули наружу.",,,,,
"G """"",G_2c30518f,"Боюсь спросить, почему содержимое бассейна стало уменьшаться.",,,,,
"S """"",S_56f27502,"Мне же... Нужно как-то достать до эссенции, ик. Вы опускаете меня недостаточно глубоко!",,,,,
"S """"",S_f50c150d,"Ты вообще почему возмущаешься? После того, как я поглощу твою эссенцию, нужды в резервуаре уже не будет!",,,,,
"""""",narrator_15350323,"Лиззара смущенно хихикнула, смотря на покрасневшую и мокрую подругу. Сара выглядела вполне довольной, чтобы позволить протоссу не волноваться так сильно.",,,,,
"G """"",G_13e19750,"Ладно-ладно, просто я так долго его наполнял... На это ушло так много времени, у меня будто жизнь перед глазами проходит с каждым твоим глотком...",,,,,
"S """"",S_b5c0ceb6,(Чтобы кто-то мне рассказал такую историю... в жизни бы не поверила...),,,,,
"S """"",S_db7bced0,"Ты лучше за меня переживай, чтобы я быстрее ее достала.",,,,,
"S """"",S_b8677f97,"(Отлично, я готова! Опускайте ниже!)",,,,,
"G """"",G_67768863,"Мы рискнем, но ответственность вся на тебе.",,,,,
"""""",narrator_ebde6fb3,"Сара все еще слышала недовольные нотки стража. Мол, он не зря все это наполнял, чтобы потом кто-то это просто выпил, даже после погружения. Но ей было все равно.",,,,,
"S """"",S_a7ee4970,"(Теперь я наконец нахожусь достаточно близко к ней! Ты моя, маленькая эссенция!!!)",,,,,
"S """"",S_a04cd01c,(Ч-что?! Она действительно двигается?!),,,,,
"C """"",C_52ccb9a8,(Я так и знал.),,,,,
"S """"",S_969cdaa8,(Сай'мон?),,,,,
"C """"",C_dffe015b,"(Да, у меня выдалась свободная минутка, я решил проанализировать , происходящее.)",,,,,
"S """"",S_309a19b0,"(Черт, не появляйся так резко.)",,,,,
"C """"",C_45948b57,"(Поверь, когда я 'проснулся', то был удивлен, в какой ситуации ты оказалась.)",,,,,
"C """"",C_e45f7442,"(Так вот, плотность жидкости играет важную роль. Видимо, эссенция реагирует на нее при глубоком погружении из-за колебаний, которые ты создаешь глотанием этой самой жидкости.)",,,,,
"S """"",S_ba3300c1,"(Сай'мон, ты действительно думаешь, что сейчас лучшее время для твоих лекций?.)",,,,,
"C """"",C_3e1cc9ee,"(В общем, она чувствует эти колебания и запускает процесс перемещения эссенции. Глубже или в какую-то из сторон. Любой объект, особенно легче, чем субстанция, в которой он находится, будет больше подвержен колебаниям при любом физическом взаимодействии с субстанцией.)",,,,,
"S """"",S_2aadbefa,"(Почему она не поднимается выше, раз я глотаю эту жидкость?)",,,,,
"C """"",C_0d424647,"(Хороший вопрос, не забывай, страж говорил о защитном механизме. Думаю, он мог это предвидеть.)",,,,,
"C """"",C_844b91a7,"(Думаю, ты должна находиться ближе, чтобы это так работало. Сейчас ты находишься на том расстоянии, которое будет отталкивать этим потоком все от тебя.)",,,,,
"S """"",S_89520610,(Это ужасно... я так никогда не получу ее.),,,,,
"S """"",S_aff2a403,"(Черт, нужно выбираться. Воздуха уже мало.)",,,,,
"S """"",S_9e151cef,Страж!,,,,,
"S """"",S_0cd13ba9,Почему я опускаюсь и вижу эссенцию на другом месте?,,,,,
"S """"",S_f50496b7,Сай'мон пытался рассказывать о каком-то давлении... Колебаниях.,,,,,
"G """"",G_bcfe5362,Ммммм...,,,,,
"G """"",G_718484c1,Хммммм...,,,,,
"S """"",S_fde7e3b8,Хм???,,,,,
"G """"",G_e2eb18f3,"В чем-то он прав. Я специально сделал все, чтобы эссенция была в максимальной сохранности. Точнее, 'резервуар' устроен так, чтобы любая хитрость играла против захватчиков.",,,,,
"G """"",G_2f4511c4,"Ее нельзя просто так получить. Необходимо максимально сбилизиться с ней, а это трудно.",,,,,
"G """"",G_86e4e357,"Если действовать по-хитрому, то она перемещается дальше от источника проблем.",,,,,
"G """"",G_07cc5439,НО есть одна уязвимость.,,,,,
"S """"",S_51049c03,Уязвимость??? Ты мне о ней говоришь только сейчас?,,,,,
"L """"",L_f10b7cf3,Страж! С твоей стороны очень некрасиво поступать с Сарой вот так!,,,,,
"G """"",G_11a25286,"Не в этом дело, я совсем забыл. Ты думаешь, творцы всегда помнят обо всех тонкостях созданных ими творений?",,,,,
"S """"",S_7eb922ba,"Мы твое сокрытие обсудим позже. Говори уже, в чем дело.? Времени мало!",,,,,
"G """"",G_af9c04b2,Изначально она остается на одном месте - то есть она статична.,,,,,
"G """"",G_832a3c35,"Как только ей грозит опасность, срабатывает механизм начинает стадию перемещения. Изначально она будет несильно перемещаться, в пределах одной и той же условной локации, просто усложняя ее поглощение.",,,,,
"G """"",G_ee26f39d,"Но через какое-то время она полностью изменит свое положение. С каждым разом все быстрее и дальше станет перемещаться. Это происходит из-за таких же частых ныряний. То, что ты глотаешь содержимое бассейна, конечно, влияет, но не в полной мере.",,,,,
"G """"",G_caee2130,"Никакое живое существо не может пробыть там долго, от количества его заплывов эссенция будет перемещаться все чаще и дальше.",,,,,
"G """"",G_1aeef3ab,"Поэтому тебе нельзя надолго задерживаться тут, иначе уплывет, а ты и не увидишь.",,,,,
"G """"",G_0a3f06c2,"Но у нее есть ограничения, она не может переместиться за пределы данного резервура!",,,,,
"S """"",S_0f34d5c5,"Класс, вот это крутая инфа, будто я этого не знала.",,,,,
"S """"",S_162c824b,Вы! Вы!!!,,,,,
"S """"",S_306dde5b,Секунду... А где Лиззара?,,,,,
"G """"",G_da2647d2,"Твоя подружка? Она куда-то резко сорвалась и убежала. Сказала подождать ее, когда мы вытащим тебя.",,,,,
"G """"",G_f4a902c3,Она всегда такая странная?,,,,,
"S """"",S_bbc3738e,Она не странная!,,,,,
"G """"",G_51c8939c,"Я впервые вижу, чтобы кто-то так сильно рвался помогать. А она рвется постоянно.",,,,,
"S """"",S_ad1db8bf,Она не всем помогает.,,,,,
"G """"",G_96cf9a6c,"Как жаль... Я бы воспользовался такой добротой, хе.",,,,,
"""""",narrator_5bdd5711,"Сара почувствовала приближение Лиззары, отвлекаясь от разговора. Протосс выглядела очень взволнованно и трясла что-то в руке.",,,,,
"L """"",L_6daa0810,Помочь! Я могу тебе помочь!,,,,,
"S """"",S_968ed67b,"Что случилось? Говорят, ты резко сорвалась...",,,,,
"L """"",L_7904c630,"Вот! Я заметила, что время, когда ты просишь тебя поднять, пропорционально уменьшается. В тот раз ты пробыла внизу вдвое меньше, да? И я вспомнила!",,,,,
"""""",narrator_8dc81510,"Лиззара держала в руках знакомую для Сары вещицу. Для остальных это была просто груда пластика, но девушка довольно улыбалась, смотря на нее.",,,,,
"S """"",S_663142bb,"О, это же часы! Где ты откопала такую редкость на этом корабле?",,,,,
"""""",narrator_5cee5cbd,"Лиззара немного замялась, краснея.",,,,,
"L """"",L_42c6a16b,"Я слышала, как Стуков носился с этими... часами? Он что-то восторженно бормотал про время, прошлое и свою родину.",,,,,
"L """"",L_118cd194,"Я вспомнила о них и подумала, что они как-то помогут высчитывать время.",,,,,
"S """"",S_ed969c2d,"Отлично, это то, что нужно! Внешне они напоминают очень старинные часы... Такие застали только мои древние предки, но кто-то их модифицировал и добавил цифровой циферблат. Кажется, их называли просто 'часы с будильником'!",,,,,
"L """"",L_8ba8c744,"И мы можем выставлять время, чтобы вытаскивать тебя. Тебе не придется подавать какие-либо сигналы!",,,,,
"""""",narrator_9a44f54b,Страж с удивлением наблюдал за восторженными возгласами девушек.,,,,,
"G """"",G_3e91f2fe,"Ага-ага, это все отлично. Ты ныряешь, мы настраиваем эту вещь. Часы или как их там.",,,,,
"S """"",S_97eef292,Хватит разговоров!,,,,,
"S """"",S_c57172ef,Нельзя терять времени!,,,,,
"L """"",L_99e5ecd8,На сколько поставить время?,,,,,
"S """"",S_a9e68729,"Хм, дай подумать. Мне кажется, тут должна быть какая-то закономерность. Если страж говорит, что время уменьшается, то было бы логично, если бы нужное время уменьшалось вдвое, но вот какое тогда изначальное?",,,,,
"L """"",L_19d47a9a,"Тридцать секунд. Думаю, можем начать с этого времени, а там построим.",,,,,
"S """"",S_5f1cf328,"Отлично, тогда я ныряю и посмотрю, через сколько эссенция снова начнет перемещаться.",,,,,
"""""",narrator_5582da56,*Бульк*,,,,,
"centered """"",centered_b7b66c79,"Теперь задачей Лиззары было подымать Сару строго по времени, которое устанавливается на часах.",,,,,
"L """"",L_7ce4e05b,"Она же точно справится, страж, как ты считаешь?",,,,,
"G """"",G_a537fb66,"Ну, скажу я честно, она быстро раскусила мой механизм защиты. Она так быстро узнала принцип его работы, что наши шансы весьма высоки.",,,,,
"L """"",L_8693a193,"Да, я тоже была удивлена, Сара так отдается своему делу, вне зависимости от того, что от нее требуется... она ничего не боится.",,,,,
"G """"",G_88f1732d,С этим сложно поспорить.,,,,,
"""""",narrator_240ea512,"Лиззара хаотично переводила взгляд с часов на бассейн с торчащей в ней Сарой и обратно, отсчитывая каждую секунду. Для нее время текло совсем по-другому, секунда казалась вечностью, а все из-за переживаний за подругу.",,,,,
"L """"",L_6c758531,"(Ну же Сара, продержись, у тебя все получится. Ты справишься.)",,,,,
"""""",narrator_8d435953,На часах осталось десять секунд.,,,,,
"L """"",L_b3988961,Она же там жива? С ней все в порядке?,,,,,
"G """"",G_929bd137,Совсем скоро мы об этом узнаем.,,,,,
"L """"",L_032e6d6f,Ха? Ч-что это? В-время вышло?,,,,,
"G """"",G_8a80f0d5,"Я не встречал раньше такой технологии, но, думаю, да!",,,,,
"""""",narrator_d799133c,"Будильник продолжал звенеть, что означал только одно:, пришло время вытаскивать Сару.",,,,,
"S """"",S_5880f015,Пха-а-а-а-а-а-а-а!,,,,,
"S """"",S_7859274f,Отлично! Мы почти угадали со временем.,,,,,
"""""",narrator_31782f68,На лице девушки была довольная улыбка.,,,,,
"S """"",S_282b6632,"Как хорошо, что этот будильник точно такой же, как и были старинные, со своим громким и дотошным гулом, такой звон и покойника поднимет.",,,,,
"S """"",S_cd70ba54,"Прямо во время перемещения я услышала звон часов, а это значит, что время подобрано почти идеально. Ну, возможно, плюс-минус пара секунд.",,,,,
"L """"",L_4328107c,"Отлично, тогда на сколько уменьшаем?",,,,,
"S """"",S_d730e510,"Ставь на пятнадцать, у меня будет всего пятнадцать секунд, чтобы поглотить ее.",,,,,
"S """"",S_f355afa1,"(Она еще никогда так близко ко мне не была, в этот раз я определенно поглощу ее...)",,,,,
