location,source,target,ID,fuzzy,context,translator_comments,developer_comments
"S """"",S_1b52b88d,It just can't be! Everything was going so good...,,,,,
"S """"",S_1f64752b,I couldn't get stuck. again! I just couldn't!,,,,,
"S """"",S_aacf38af,Please tell me this is a bad joke and I'm going to move now!,,,,,
"""""",narrator_ebb1c9a4,"The girl tried to move further, but failed.",,,,,
"S """"",S_325ded40,Argh... Heck! Can I retreat?,,,,,
"""""",narrator_88a192e8,"Sarah moved towards the exit, but her body was tightly stuck, not allowing her to move in any direction.",,,,,
"S """"",S_fba9994b,The miracle did not happen...,,,,,
"C """"",C_d154e615,(You're staying true to yourself.),,,,,
"S """"",S_9e39c7cd,I didn't even think about this!,,,,,
"C """"",C_ec1c0729,(So these dirty deeds find you by themselves. You're like a magnet to them.),,,,,
"S """"",S_e80565b9,Now is not the time for this! What if this creature is aggressive and tries to harm me?,,,,,
"S """"",S_8112785b,"This is not Stukov, more predictable than a natural law.",,,,,
"S """"",S_bd8cdf44,"This is a wild creature, whose mind is a mystery.",,,,,
"C """"",C_ca44e608,(You're in such a comfortable position. His animal instincts will definitely take over.),,,,,
"S """"",S_6238e23a,This outcome does not make me very happy either...,,,,,
"S """"",S_a1bdb76f,(Come on! MOVE! COME ON!),,,,,
"S """"",S_d1c9d42b,"Damn, it's not working... I-I can't get out... Nothing good will come of it if I don't get out now!",,,,,
"""""",narrator_63e06df5,"The girl did not lose hope of getting out, but still, the situation seemed rather hopeless.",,,,,
"S """"",S_8fbb96a5,We need a new plan... Hiding. That's all I have left.,,,,,
"S """"",S_3fc861c8,Maybe he won't find me and everything will go smoothly.,,,,,
"S """"",S_2f6aa4db,"Stupid... he knew where I was before. And he was heading straight for me, despite the fact that I was covering my tracks...",,,,,
"S """"",S_d9277fdc,"Mmm... With the help of the psi force, I would have gotten out, but he's so close.",,,,,
"""""",narrator_b7f6b641,"Sarah groaned painfully, realizing the hopelessness of her situation.",,,,,
"S """"",S_96af3aa4,"Damn, am I really scared... fear is bad. He can smell it better than anything else.",,,,,
"S """"",S_0fb5561a,"No, no, no, I'm acting like a cornered victim. Which means it's easy for him to find me.",,,,,
"S """"",S_a1e6d5e0,"Now, Sarah, calm down... no need to panic. I'm not a victim, it's not like that!",,,,,
"S """"",S_6e8a163a,"I've got everything under control, I'm about to get out.",,,,,
"S """"",S_24ca587d,He is... He'll only notice me faster that way. I need to calm down.,,,,,
"""""",narrator_6ad40b0b,"Sarah was completely lost in her thoughts, not noticing how the monster was already standing next to her.",,,,,
"S """"",S_67c59a4f,Is he here already?! When?,,,,,
"S """"",S_09775a49,"Couldn't play along, you ruthless bastard...",,,,,
"S """"",S_e3f9a34e,I need to drive him away! And... I can't.,,,,,
"S """"",S_169096da,"It's not safe to use psi power. The situation is too stressful, I won't be able to restrain myself.",,,,,
"S """"",S_9e46cde1,What a lousy fate... I can't just stand here with my hands folded when the enemy is almost behind me.,,,,,
"""""",narrator_d9e6a350,The monster did not share Sarah's opinion. The girl could hear it coming closer and closer with no intention of changing the route.,,,,,
"S """"",S_1b289d81,"He is so loud... How big is he? Damn, this situation...",,,,,
"S """"",S_086e60c5,!!!,,,,,
"S """"",S_1c914cf5,W-what are you doing?!,,,,,
"S """"",S_5523c1d2,No need to lick my armor! It's yucky!,,,,,
"S """"",S_34120ee5,Why are you?...,,,,,
"""""",narrator_c5562761,"After a couple of seconds, Sarah heard a strange sound, after which she realized that her armor began to dissolve from the monster's saliva.",,,,,
"S """"",S_26938b47,That...,,,,,
"S """"",S_f75e59d1,Why is his saliva eating away at my suit?,,,,,
"S """"",S_089a748d,I'm in deep trouble...,,,,,
"C """"",C_c28e02f5,(Or a deep pipe? Hah!),,,,,
"S """"",S_42a1366e,How kind of you to show up... You better help me deal with all this.,,,,,
"S """"",S_d2edf53e,I feel cool... He dealt with my armor so quickly.,,,,,
"C """"",C_f03303d8,"(And he has good abilities. More precisely, convenient and multifaceted. Of course, it is likely that this is the task of his saliva - to get to the goal. He's still a combat unit.)",,,,,
"S """"",S_6b1a6b40,Whose side are you on now? You should be more worried about my safety.,,,,,
"C """"",C_c38833c6,"(Don't worry, your pussy is very well trained, what can happen to it?)",,,,,
"S """"",S_5c0c3dc7,...,,,,,
"C """"",C_d2f445e9,"(Relax and have fun, he definitely won't stay here for long.)",,,,,
"S """"",S_6626fa14,It's always so simple with you...,,,,,
"C """"",C_0e222b2b,"(You wanted to know more about him, so I'm informing you. His mutation is very interesting because he uses his saliva on a new level. You should take note of that. Here's some useful info for you.)",,,,,
"S """"",S_f71a7a8f,"I will definitely think about it, but obviously not now!",,,,,
"S """"",S_00696c2c,"Now I would love to hear your options for retreat, and not about the mutation of the one who corroded my armor!",,,,,
"C """"",C_117c1b06,"(Eh, some things change, but some things remains eternal. Sarah is a lover of getting stuck, hehe)",,,,,
"S """"",S_6ebff52f,Look who's complaining! All you do is process information. And I have to deal with all this! Do you think it's nice? Like hell it is.,,,,,
"""""",narrator_4c9d55ff,*Slurp* *Slurp* *Slurp*,,,,,
"S """"",S_9e67428e,Mmh!,,,,,
"S """"",S_6ebad023,He... He keeps licking me!,,,,,
"S """"",S_9113a26e,S-stop trying to eat me...,,,,,
"S """"",S_5ecb6a9f,"No, no, no! It almost ate away the bottom of my armor!",,,,,
"""""",narrator_02b36492,"Surprisingly, Sarah was right, the lower part of her armor completely melted, revealing a defenseless crotch for show to the monster.",,,,,
"S """"",S_23d5623a,Ahhhh... Stop it!!!,,,,,
"""""",narrator_f25294b5,Sarah noticed that the monster was persistently undressing her. The girl felt a wet tongue on the bare parts of her buttocks.,,,,,
"S """"",S_87d1f199,"You better stop right now! Otherwise, I... I definitely won't hold back!",,,,,
"S """"",S_e43c385d,Mmm... I'll use psi power and you'll regret it!,,,,,
"S """"",S_8e2abca1,"(Damn, I just thought that everything was going so well, and here's...)",,,,,
"""""",narrator_f06de53f,"The monster did not react to her screams in any way, pursuing its goals.",,,,,
"S """"",S_640b6072,"Well, that's it!",,,,,
"S """"",S_6f2c12cd,Get ready!...,,,,,
"""""",narrator_cf77e960,...,,,,,
"S """"",S_df9e3559,Aaaahhh!!!,,,,,
"S """"",S_9d7fc988,S-stop it now! N-no! You can't take advantage of this whole situation like this!,,,,,
"S """"",S_3dc15bae,(I can't... I can't concentrate!!!),,,,,
"S """"",S_109e0078,He... He's so big! His cock is so big!!!,,,,,
"S """"",S_cecb6768,He doesn't belong in my ass at all!,,,,,
"S """"",S_4f035b05,"(I must urgently focus on the psi force or he will tear me apart with his huge dick, mmm...)",,,,,
"S """"",S_cb433351,Oh my God!!!,,,,,
"""""",narrator_b5c2bb93,"The beast was building up the pace, showing who was in charge in this situation, and there was nothing Sarah could do about it. She couldn't resist, but the action wasn't that unpleasant either.",,,,,
"S """"",S_a1897230,Y-you're gonna rip my ass! G-get out of there now!,,,,,
"""""",narrator_df83beb5,The girl had no choice but to start enjoying what was happening while the giant monster leisurely enjoyed her body.,,,,,
"S """"",S_442f0623,"AAARGH! Stop, you lustful animal!!!",,,,,
"S """"",S_792e0c02,(My anus... These are such mixed feelings! I wasn't ready.),,,,,
"C """"",C_66116cc9,(I knew it would end up like this.),,,,,
"S """"",S_389c4c12,You little! The last time you persuaded me to agree to Stukov's request was enough for me...,,,,,
"S """"",S_53ee670a,My anus wasn't ready to go through it again... But his cock is even bigger! He'll tear me up!!!,,,,,
"S """"",S_2cb39fd9,"Aaah, why couldn't he choose the pussy?",,,,,
"S """"",S_1a18781e,"Mmmmh, he's pushing deeper. And deeper!",,,,,
"C """"",C_920848b8,(He won't leave you alone anymore. So...),,,,,
"S """"",S_c746a2d3,"Aaaaarch, easy for you to say... I knew this would go wrong!",,,,,
"S """"",S_42b91bae,He has such a strange penis shape... The sensations are completely unreal.,,,,,
"S """"",S_55a33948,WHO EVEN CAME UP WITH SUCH A DICK?,,,,,
"""""",narrator_374e3653,"Sarah wasn't sure how she felt about it. On the one hand, the curved and lumpy penis was perfect for her anus, and on the other she cursed this day.",,,,,
"S """"",S_cc751a38,MMMMMGH!!!,,,,,
"S """"",S_bc227f40,W-why did you follow me at all?,,,,,
"S """"",S_2f7dca75,Did you want individual service so much?,,,,,
"S """"",S_9e4c7273,HAPPY NOW?!,,,,,
"""""",narrator_be5768aa,"The girl was getting more and more turned on, provoking the beast to active actions.",,,,,
"S """"",S_7105fa40,"I... I can't take that for long, mmmh!",,,,,
"S """"",S_dd112d41,C-come on already and leave me alone!,,,,,
"S """"",S_69f18dda,"I should have used psi power earlier, damn it...",,,,,
"S """"",S_1fe0c122,"He's coming in so tight... I can feel him whole, ah.",,,,,
"""""",narrator_dfbd22d9,The monster accelerated its pace when Sarah was just getting used to its size.,,,,,
"S """"",S_634fbcef,AAAAHHHH! I'm starting to regret my words...,,,,,
"S """"",S_cc0feda4,He's coming in at such a furious pace...,,,,,
"S """"",S_92398631,"From here, I-I can only hear his screams... He seems to be very pleased there.",,,,,
"S """"",S_0765c36e,But my ass... It's just not made for this size!,,,,,
"S """"",S_d3d39e24,mmmm... And he's not even going to stop!,,,,,
"""""",narrator_5fb4949b,"Sarah accepted the monster's penis completely, marveling at her own capabilities.",,,,,
"S """"",S_54cfdd32,My head is spinning... He's so fast and big... Mmmm...,,,,,
"S """"",S_855b6ab8,"(Lizzara was right about his speed, now he's decided to bring it all down on me!)",,,,,
"S """"",S_e836d371,"How much sperm will be in such a big guy... It will overwhelm me, ahh.",,,,,
"S """"",S_00eb8d3c,Will I burst?,,,,,
"S """"",S_7eeadb5e,Of course!,,,,,
"S """"",S_c4490f40,How many times is he bigger than me?,,,,,
"""""",narrator_dd13f005,"The monster beat every word out of Sarah, bringing her closer to orgasm. At some point, the girl began to lose consciousness from the frenzied pace.",,,,,
"S """"",S_955a23ff,S-stop... You! AH!,,,,,
"""""",narrator_9ccbf477,The pipe was a great support for Sarah and helped keep her in this already lost battle.,,,,,
"S """"",S_ab24e68a,YOU'LL CRUSH ME! S-stop!,,,,,
"S """"",S_73574529,(M-my pussy... It won't survive this! My insides are getting bruised!),,,,,
"""""",narrator_1b433144,"The girl felt discomfort when the beast was pounding into her without preparation, but imagining the huge dick inside her made her even more wet.",,,,,
"""""",narrator_5acc8e2c,*Shlick* *Shlick* *Shlick*,,,,,
"S """"",S_7a5e87a6,Aaah...,,,,,
"""""",narrator_afe15ec2,Sarah moved her hand back as far as possible to grab her buttcheek and spread herself for the monster.,,,,,
"S """"",S_77a7933a,T-that's better... Like a knife through butter...,,,,,
"""""",narrator_aef3e523,"The girl rolled her eyes up in pleasure, no dick has ever given her such pleasure before.",,,,,
"S """"",S_738ef734,"Y-you... Sure mutated correctly, AAAAH!!!",,,,,
"S """"",S_a5c43829,MMMMMMH!!!,,,,,
"""""",narrator_709c85b2,*Squish* *Smack* *Squish*,,,,,
"""""",narrator_bb9e33eb,"Sarah didn't want to think anything anymore. The beastial dick pushed all thoughts that didn't involve being penetrated by it out of her head. She couldn't even vocalize her moans, just silently opening her mouth.",,,,,
"S """"",S_f796e72f,W-what are you doing to me...,,,,,
"""""",narrator_940074d4,"Sarah squeezed closer to the cold pipe, trying to cool her blazing body at least a little. But the friction of her nipples against the metal only encouraged her dirty thoughts.",,,,,
"S """"",S_35968cf1,JUST CUM IN ME AND LET ME GO!!!,,,,,
"""""",narrator_37183f21,"Sarah squeezed her walls, keeping the beast still. He growled in pleasure, although he couldn't move.",,,,,
"S """"",S_b13c0a7a,Give me your sperm and let's finish this!,,,,,
"""""",narrator_12d373b1,"Instinctively, the creature tried to push a few more times before its penis inflated, completely immobilizing itself inside the girl",,,,,
"S """"",S_5999e641,Shit... This cock is literally a cork right now...,,,,,
"S """"",S_c338160e,"Ah, not a drop will spill...",,,,,
"""""",narrator_8d36510a,Sarah wasn't sure whether she was scared or glad because of that. She just kept her cheeks spread and walls squeezed.,,,,,
"S """"",S_195b1f79,"Come on... Finish this, ah!",,,,,
"""""",narrator_214be867,GR-A-A-A!,,,,,
"S """"",S_872d7717,{size=+4}OH MY GOD!!!{/size},,,,,
"""""",narrator_53dac707,"The beast howled in response, tensing up and shooting the first load. Sarah's breathing hitched, the liquid was almost inflating her.",,,,,
"S """"",S_aff204ec,(SO GOOD!),,,,,
"S """"",S_b7c79739,Why... W-WHY IS THIS SO GOOD!!!,,,,,
"S """"",S_9e522955,Damn... DAMN!!!,,,,,
"""""",narrator_51382a7e,"Sarah screamed in pleasure, feeling even more and more stuck in the pipe due to her swollen belly. Only after the beast's penis softened a little could some sperm escape it's warm vessel.",,,,,
"S """"",S_961109c5,Ah! N-no!,,,,,
"S """"",S_960c6cd6,This shouldn't have ended like this! FUCK!!,,,,,
"""""",narrator_a90545ad,"The liquid flowed over her sensitive clitoris, lengthening her spasms. Sarah didn't feel any lighter with the liquid escaping her, her walls continued to squeeze, making her stay full regardless of how much liquid escaped.",,,,,
"S """"",S_d3d5953e,I... Can't... Anymore...,,,,,
"""""",narrator_410a5152,"Each pulse rang in her ears. The ringing grew, eventually turning into deafening silence.",,,,,
"S """"",S_f77d0f82,"Ha-ah... damn, and how do I get out with such a swollen belly...",,,,,
"""""",narrator_72f9181d,*Squish* *Squish*,,,,,
"S """"",S_1e2f2567,AH!,,,,,
"""""",narrator_dcfb79d7,"Sarah opened her eyes, feeling more thrusts incoming.",,,,,
"S """"",S_482f9ae4,Y-you... YOU JUST CAME IN ME!,,,,,
"S """"",S_a5a90579,Stop right now! I'll use psi force {i}this time{/i} and you'll regret it! You'll regret cumming in me!,,,,,
"S """"",S_964a056e,"Ah... no, if he comes again, my stomach... I'm definitely never getting out of here!",,,,,
"S """"",S_3e48bc72,No-o-o-o-o!,,,,,
"S """"",S_93d8c1aa,I'm finally free... What a day. I need to go and free Lizzara before she is completely done...,,,,,
"C """"",C_436d8540,(But it was a wonderful experience. Now we know your weaknesses.),,,,,
"S """"",S_ea506bea,And it would be better if they didn't know! It wasn't supposed to be like that at all.,,,,,
"C """"",C_0be70416,"(But you completed the task. You had to lead him away, you lead him away. It was necessary to distract him, so you perfectly distracted him for a very long time.)",,,,,
"S """"",S_01bbffd8,It would be better if it didn't involve my ass!,,,,,
"S """"",S_f786f881,I regret that you are in my head and you cannot be mocked in reality.,,,,,
"C """"",C_e87e206a,"(Come on, why would you do that? After all, everything went fine. You completed the mission completely. More than completely, if you consider how hard you tried. And your protoss, too.)",,,,,
"S """"",S_468d3b64,Only my regeneration is not one hundred percent. I can't feel my ass at all...,,,,,
"S """"",S_fde788b5,"I don't even want to talk about walking... Damn, it seems to me that even a guardian would overtake me now...",,,,,
"C """"",C_f0b9ac78,"(Ha, ha, ha, that's really funny.)",,,,,
"C """"",C_b8bbdd22,"(Don't worry, these are just temporary difficulties. A couple of days and you'll be as good as new. And if you use the pool, then it's a couple of hours.)",,,,,
"S """"",S_3b532afb,"Will the pool restore my elasticity, too???",,,,,
"S """"",S_4537f288,"Okay, I can do that later, now I need to at least walk...",,,,,
"C """"",C_fd9b08bb,(But this situation may happen again... Don't you think you need to start training both your holes?),,,,,
"S """"",S_a90c75cf,Are you kidding me?,,,,,
"C """"",C_1dae8305,"(I'm totally serious. Training the anus is just as important to be ready for any outcome without, so to speak, 'difficulties'. You never know what will happen tomorrow.)",,,,,
"S """"",S_345474ab,I've somehow managed without it all my life.,,,,,
"C """"",C_08030666,"(Very wrong! If you had done this earlier, you would have had a lot of opportunities now.)",,,,,
"C """"",C_d03e45f8,"(Yes, yes, yes, that's how life works, you always need to look ahead.)",,,,,
"S """"",S_254c4b83,"Wow, Sai'mon. This is the best advice in my life. Really, how did I live without it before. We need to fix this urgently.",,,,,
"C """"",C_37f079d0,(You took it so seriously... I'm glad.),,,,,
"S """"",S_6d2caaf0,"First of all, I will develop exercises for my anus. Of course, I'll come back to the bridge and that's all I'll do.",,,,,
"C """"",C_14d63b31,(No need to be so zealous. You still need to recover.),,,,,
"S """"",S_b53235cf,This is sarcasm! I'm not going to do that at all.,,,,,
"C """"",C_4a84a5ad,...,,,,,
"C """"",C_8b851789,(As you wish. Then don't complain that your ass hurts.),,,,,
"S """"",S_5862d080,Why don't you follow your own advice. Let's walk the rest of the way in silence.,,,,,
"C """"",C_f33d7937,"(It's beyond my ability to make your anus stop squishing. Apparently, not everything has worked out yet, although he has developed you well there ...)",,,,,
"S """"",S_c0c609c4,"Sai'mon... You'd be dead, were you not inside my head!",,,,,
"C """"",C_5341e521,(What if I turn on soothing music? How about classics? Bach? Mozart? Maybe something more modern?),,,,,
"centered """"",centered_57029b98,"Sarah continued to move, and behind another mound on the horizon, the silhouette of a chained protoss was already visible, which was getting bigger and bigger.",,,,,
"S """"",S_9197496b,Lizzara! I'm so glad to see you!,,,,,
"L """"",L_885b7bcd,Sarah!,,,,,
"""""",narrator_f875f5c0,"The girls looked at each other with such ecstasy, realizing that everything was finally over.",,,,,
"S """"",S_a325842e,We need to get out of here. I don't want to stay here any longer! Not a second more!,,,,,
"L """"",L_c2df30b6,"Yes... I'm glad to see you, too.",,,,,
"""""",narrator_f087b44a,"Sarah headed for the shackles holding Lizzara back from escaping. As she approached, the girl began to notice how much 'liquid' was around and on protoss. Everything was a mess, everything smelled of animal.",,,,,
"""""",narrator_25ee79c5,"It was also impossible to hide from Lizzara that Sarah wasn't just hiding. Naked Sarah was hard not to notice, especially when she left rather clothed.",,,,,
"L """"",L_f0301fb6,Your clothes... What happened?,,,,,
"""""",narrator_02cf2146,"The girls examined each other from all sides, assessing the scale of the tragedy. ",,,,,
"S """"",S_2331c487,"Oh, that... Don't worry. I had to throw them out after what he did... When I get back, I'll find a replacement.",,,,,
"S """"",S_07634c62,It's not that much of a problem.,,,,,
"""""",narrator_565ce40a,Lizzara was horrified to imagine what the monster could've done that her armor was completely destroyed and thrown away.,,,,,
"L """"",L_94c09054,"So, h-he... still caught up with you...",,,,,
"S """"",S_d907a664,"Yes, this creature was very nimble... But that wasn't even the main problem.",,,,,
"S """"",S_e6264349,I fell into a trap...,,,,,
"L """"",L_94325a78,Oh... You heard that too? What could it mean?,,,,,
"S """"",S_eae3d4a8,"I don't know, but if it wasn't for it, I don't know how much longer it would have lasted...",,,,,
"""""",narrator_73ef602f,"Lizzara nodded in agreement, clearly not wanting to remember the horror that had happened.",,,,,
"L """"",L_e7b89e35,"I agree, there was no hint of satisfaction coming from them. It seemed like they could keep fucking me for days on end...",,,,,
"G """"",G_766a65dd,"Guardian Airlines, the fastest transportation lines are in touch! How are you?",,,,,
"S """"",S_17ad0cba,You'd better say it's done.,,,,,
"S """"",S_cfdc406f,Did you manage to pick up what you needed?,,,,,
"G """"",G_36ac0292,"Oh, how well everything went! Not only did I manage to pick it up, we made such a fuss there with the guys.",,,,,
"G """"",G_45fb3c2a,You should have seen it!,,,,,
"""""",narrator_0b64c8e9,"The girls looked at each other, realizing what kind of howl it was. Apparently, it is issued by creatures when their lair is in danger.",,,,,
"S """"",S_f03572d1,"Ha-ha-ha, so it turns out that we should thank you?",,,,,
"G """"",G_90cb682f,"Yes, it's nothing. Without your perfect distraction, the plan wouldn't have worked! We did it because everyone did what they had to do. This is the key to success!",,,,,
"G """"",G_1996e07b,"Okay... I'm flying up to the base in no time! So come on, come back soon. We'll discuss everything here.",,,,,
"G """"",G_fec61160,I still have a lot of work to do! We need to rebuild the Spire!,,,,,
"G """"",G_7e784098,"I haven't felt so great in such a long time! Even before the loss of the spire, I didn't feel so good! YAH-Oh-OH!",,,,,
"""""",narrator_4f2bddb3,Protoss couldn't help smiling at such childish delight in the face of an adult and wise being.,,,,,
"S """"",S_7ad3edfc,"(Damn... after everything that's been done to us... why can't I get a smile off my face either... hee-hee, smiling like this...)",,,,,
"S """"",S_b0bad7ab,Yes! We'll talk at the base. Over and out.,,,,,
"S """"",S_b3aca0c2,"Hey! Let me set you free already. Otherwise, you'll grow roots here.",,,,,
"""""",narrator_6b47bd2d,"The girl began to unlock the handcuff, not noticing Lizzara's uncomfortable twitching at all. It took her a couple of seconds to realize that she needed to get the toy first.",,,,,
"S """"",S_29bd34f8,Oh... right...,,,,,
"L """"",L_4b4fb241,Huh?,,,,,
"""""",narrator_b71b4668,"Sarah radiated confidence with her speech, but the protoss still got nervous when the girl touched the entrance to her anus.",,,,,
"L """"",L_8baf36f3,M-maybe later?,,,,,
"S """"",S_444b67ff,"No. We need to get it now. Don't worry, it's not the first time.",,,,,
"L """"",L_c7b38abf,"I believe, but...",,,,,
"L """"",L_be52d072,!!!,,,,,
"""""",narrator_555de19c,"Sarah abruptly pulled the beads out of the anus in one move, watching the slowly stretching thread of fluid between them.",,,,,
"L """"",L_773323f3,O KHALA!!!! I am!!! AAAAAAHHHH!!!,,,,,
"""""",narrator_61da07b5,"The Protoss hung, held only by the handcuffs. The sharp movement renewed her orgasm, which was abruptly interrupted by the howl.",,,,,
"S """"",S_cce28781,"Trust me, this is really the best outcome. Getting them out slowly is a hassle...",,,,,
"L """"",L_550667dd,H-a-a-a... I-I believe... mmm...,,,,,
"""""",narrator_e2dbf1f1,"Lizzara gradually stopped spasming in fits of orgasm, squeezing the ring of her muscles.",,,,,
"L """"",L_de4d089a,Yes... that... Another hassle...,,,,,
"L """"",L_8e951003,I-I understand.,,,,,
"L """"",L_186262fa,O-of course I understand...,,,,,
"centered """"",centered_fa9aee14,"The protoss got to her feet, allowing the girl to finally unfasten her. Her hands were a little worn and her skin was sore, but Lizzara preferred to keep silent about it.",,,,,
