location,source,target,ID,fuzzy,context,translator_comments,developer_comments
"""""",narrator_64e5a0b1,Stuokv hurried to the room exit. Seemed like he was very eager to confirm the purchase.,,,,,
"S """"",S_dcfbc049,(S-sai'mon... What did you think about those outfits?),,,,,
"C """"",C_0c693dce,"(I think we have the same taste. Although it's hard to tell without any pictures what the outfits actually look like, I think I'd have chosen the same one you did.)",,,,,
"S """"",S_361e6db7,"Hopefully, I made the right choice...",,,,,
"S """"",S_349fdbae,You've come here at such an ungodly hour again... what do you want?,,,,,
"A """"",A_0d1f99d7,"Heh-heh-heh, I have good news, today I received your new costume.",,,,,
"S """"",S_82b64896,!!!,,,,,
"S """"",S_e271d60a,It's already here? So soon?,,,,,
"S """"",S_b561a845,(Time flies by...),,,,,
"A """"",A_90c42ed1,It is. Here you go.,,,,,
"""""",narrator_90107760,Item 'container' added to inventory.,,,,,
"""""",narrator_f9dcac13,"Stukov gave Sarah another container, which was exactly like the last one, but with a different set of clothes inside.",,,,,
"A """"",A_37c51df9,"Damn, can't wait to see it on you! Heh-heh-heh.",,,,,
"A """"",A_4e6b6ac9,!!!,,,,,
"A """"",A_26dc9464,Ahah..,,,,,
"A """"",A_1f099c4e,"*Ahem*, there's also something else...{w} you have to try it on and I have to make sure that it fits you, that the size is right, you know, that stuff!",,,,,
"A """"",A_3399360a,"{size=-3}Heh-heh-heh, thus I will be able to see her in it right now.{/size}",,,,,
"S """"",S_a85908d3,...,,,,,
"S """"",S_1e450e6e,Do you think I'm deaf?,,,,,
"A """"",A_2be46311,"*Ahem* it is absolutely necessary to check, if it fits you. So, what are you waiting for?",,,,,
"A """"",A_68a56a0f,"Well, don't procrastinate, and I'll stay here.",,,,,
"A """"",A_fe1b6165,"Actually no, I better go. Call me when you're ready, just don't waste time!",,,,,
"S """"",S_a85908d3_1,...,,,,,
"S """"",S_4aab9a6d,He's acting strangely because of this set. Is he really so desperate to see it?,,,,,
"S """"",S_906f635d,"Okay, time to see what I ordered... There were no pictures, after all...",,,,,
"""""",narrator_6b529644,"Still the same secure container Stukov gave you and which can be used to easily transfer a variety of things. It is roomy and looks very durable, but also hermetically sealed.",,,,,
"""""",narrator_47638def,"Like before, on top of the container is a small window that you can look through. It also has a button that opens it.",,,,,
"""""",narrator_2df92774,Sarah looks through the window of the container and sees a set of clothes and also some accessories.,,,,,
"S """"",S_df8db4da,"Well, it's not as bad as I thought...",,,,,
"C """"",C_6141293d,(I can understand why he's so eager.),,,,,
"S """"",S_b04ed469,You two would be happy to spend all your lives staring at lewd underwear...,,,,,
"S """"",S_f05a8ac0,"Well, it's high time to open it.",,,,,
"""""",narrator_da00f99d,"Sara pressed a button and the container began emitting a familiar sound. the sound of depressurization of the container. Momentarily, Sarah's eyes were able to take in the full beauty of the new set.",,,,,
"""""",narrator_24e21973,Item 'Set of underwear' added to inventory,,,,,
"S """"",S_cbe03087,"Mhm, I think I like it a bit. Hee-hee-hee.",,,,,
"S """"",S_76e62b20,I wonder how I'll look in it.,,,,,
"C """"",C_dd1695e5,"(Well, let's find that out, and call Stukov before he completely loses his mind.)",,,,,
"""""",narrator_086ffb75,And so Sarah began putting on another set of lingerie. This time Sarah showed much more enthusiasm than in the past.,,,,,
"""""",narrator_bbc97dcc,Some time later.,,,,,
"S """"",S_37fc2364,"Shit, why does lingerie have to be so complicated?",,,,,
"S """"",S_8ebc9a41,I think it's time to call Stukov.,,,,,
"""""",narrator_a3dd7710,A short time later Stukov came to Sarah's room.,,,,,
"Aside5 """"",Aside5_c61053f5,What in the void took you so long!!!,,,,,
"Aside8 """"",Aside8_b1ff01a2,!!!,,,,,
"S """"",S_d0b83d53,So... are you liking it...?,,,,,
"Aside10 """"",Aside10_f67d40f9,"Damn, that's even better than I imagined, heh-heh-heh.",,,,,
"S """"",S_0c5022ac,I thought my usual hairstyle wouldn't quite go together with this outfit. Isn't this one much better?,,,,,
"Aside11 """"",Aside11_07312211,"Yes, it is very suitable.",,,,,
"S """"",S_0306a932,I just realized that this set of clothes resembles the outfits that you described in your story about the Amazons.,,,,,
"Aside11 """"",Aside11_088f680d,"Heh-heh-heh, so you remember that story? Heh-heh-heh.",,,,,
"S """"",S_6f18d6d6,"You'd probably also want me to tie up and mount you, eh?",,,,,
"Aside4 """"",Aside4_0ddba732,"Ooh yeah baby, that's the right train of thought!",,,,,
"S """"",S_28ddff1d,"Mmm, but then I'd need two more friends from my tribe, wouldn't I?",,,,,
"Aside9 """"",Aside9_735093ff,"Damn, if you keep toying with me, I will stop resisting the temptation!",,,,,
"S """"",S_a6844f05,"Hee-hee-hee, no no no. You said it yourself that we were just taking a look at a new set. We can't do {i}that{/i} right now.",,,,,
"Aside8 """"",Aside8_276ee8aa,"You are playing with fire there! But you're right, today we are not doing anything but having a look. So it's paramount to somehow record your appearance right now.",,,,,
"Aside11 """"",Aside11_5f27e66c,"Heh, and now it's time to document your look.",,,,,
"""""",narrator_82373322,Stukov pulled out his device for making holograms.,,,,,
"S """"",S_5b9e9682,And maybe you want me to pose for you? Or maybe you'd like to see my other charms?,,,,,
"S """"",S_39957ef4,Is this better?,,,,,
"""""",narrator_2976cc51,Sarah took a lewd pose.,,,,,
"Aside10 """"",Aside10_9d18f4fe,"Heh-heh-heh, my lessons were not in vain, I see. I'm glad. I am very glad. Heh-heh-heh.",,,,,
"S """"",S_e7196d9b,"(Before I was scared by the sheer thought of allowing someone to take such depraved holograms of me, and now I'm the initiator.)",,,,,
"Aside11 """"",Aside11_5dca654d,"Heh-heh-heh, nice, amazing...",,,,,
"""""",narrator_56135b49,"Stukov continued to take holograms of Sarah. She, in turn, didn't try to disrupt him in any way, and rather helped him, assuming several lewd poses.",,,,,
"""""",narrator_10118e09,A short time later.,,,,,
"A """"",A_8512559b,"Damn, I...{w} I need to run. Keep the lingerie.",,,,,
"""""",narrator_f806478b,Stukov hastily left the room.,,,,,
"Aside11 """"",Aside11_272b3f1c,"Heh-heh-heh, soon my efforts will truly bear fruit.",,,,,
"""""",narrator_06a43fc7,To be continued.,,,,,
"""""",narrator_f7a98e21,There is no continuation of this scene in the current update.,,,,,
