location,source,target,ID,fuzzy,context,translator_comments,developer_comments
"AB """"",AB_e644c48c,The mutation is being completed. The finale is coming.,,,,,
"S """"",S_bf9aa72e,That tells me nothing! You could've stayed silent as well...,,,,,
"""""",narrator_76dc4d88,Sarah felt every sting in her. Even more clearly than when they were moving in her.,,,,,
"S """"",S_dac05508,(What you have to go through for the sake of great goals... Now something incomprehensible is going to get right into my chest... Why does this thought turn me on?),,,,,
"S """"",S_4f115210,Huh?,,,,,
"""""",narrator_329b4c60,"The skin finally began to tingle a little, no longer feeling the grip of the claws.",,,,,
"S """"",S_e706c130,Done? Is it over?,,,,,
"""""",narrator_2ca723f8,"Sarah watched as the bugs left her one by one, having done their job, they began to leave her breasts alone. Even the one who was so addicted to Sarah's nipple, left it alone.",,,,,
"""""",narrator_88d4ec2b,Now she could clearly see the marks of their stings and the liquid that was coming out of her chest a little.,,,,,
"S """"",S_232ebaef,"(I'm a little... Upset? I didn't think I could like this. Oh, how much will my chest ache after all this?)",,,,,
"S """"",S_4f14e5b2,Fu-u-u-u-h... what a mess you've made for me here...,,,,,
"S """"",S_8b719925,"Abathur, why are you staring at me like that? It's over, you can let me go. Or are you afraid that I will move too much and all the liquid will come out of me?",,,,,
"S """"",S_5d5a2750,"And your methods are rather lacking... My breasts almost didn't increase, although it feels like they pumped a couple of liters into me!",,,,,
"AB """"",AB_ef497237_3,...,,,,,
"S """"",S_709096c4,"Hey, Abathur? Release me!",,,,,
"S """"",S_f5b87bf1,Silent...,,,,,
"S """"",S_8f821dd1_2,!!!,,,,,
"S """"",S_594eb22d,Huh???,,,,,
"""""",narrator_ed03527f,"Sarah felt her breasts getting bigger and heavier. She could feel the liquid inside them clearer, its warmth.",,,,,
"S """"",S_56d762ed,(This... I've never felt like this! What's going on with my breasts? Why do I feel different?),,,,,
"S """"",S_ffe6b6a9,(I can feel my chest getting heavier... Is this not the end yet?),,,,,
"S """"",S_9afda325,AH!!! It's getting so sensitive! It'll be torn apart!,,,,,
"S """"",S_8812d057,(I can feel every drop of this liquid inside... I feel everything!),,,,,
"""""",narrator_114df82f,"Sarah was ready to howl, because even her breathing made her body tremble with pleasant spasms.",,,,,
"S """"",S_bc29c66f,I c-can't stand it!,,,,,
"S """"",S_75f92953,"M-my chest!!! Too sensitive... ah! I can't breathe! Abathur, do something!",,,,,
"S """"",S_5a2c87bb,(My chest is full! It's too much! It's too much for me!),,,,,
"S """"",S_079b6dad,It's burning from the inside! Enough!,,,,,
"S """"",S_2894dd0b,"Mmm, this... This is unbearable! UNBEARABLY PLEASANT! A-A-A-A-ahhhh!!!",,,,,
"""""",narrator_1616f987,"Sarah lost control of herself, forgetting that she was not alone.",,,,,
"AB """"",AB_1803b056_1,Hypersensitivity. Expected.,,,,,
"S """"",S_5903fd93,Ah! So you knew everything! And didn't say!!! W-when will it stop?,,,,,
"S """"",S_32489920,{size=+4}NNNNGH!!!{/size},,,,,
"S """"",S_be9de0c3,I-I feel it... How my skin is stretched on my chest! I feel everything! THAT'S IT!!!,,,,,
"S """"",S_ca76c0db,Mmmm!!!,,,,,
"""""",narrator_15831f90,"Sarah was ready to break away, but the tentacles prudently restrained her from acting upon her rash decisions.",,,,,
"S """"",S_d8d1ab05,This... This is my punishment!,,,,,
"S """"",S_c8380755,"I'm bursting! My body... It was not ready for this! Ah, it's numb with pleasure!",,,,,
"S """"",S_d5af1d9f,MMMM!!! Abathur! Do something or I'll... I'll...,,,,,
"S """"",S_d5b05fe0,CUUUM!!!,,,,,
"S """"",S_3b502ac7,NNNNNGH!!!,,,,,
"""""",narrator_f3dde6d9,"Sarah didn't pay attention to what was happening to her body. There was only a muffling white noise in her head, and her body was tense to the limit.",,,,,
"S """"",S_b233138c,Mmmnn...,,,,,
"S """"",S_d20c3ad6,Mmmh...,,,,,
"AB """"",AB_262e3a7f,Interesting reaction. Requires study.,,,,,
"S """"",S_0c9cd6b4,H-haa... mmm... mmm!!!,,,,,
"""""",narrator_1c14df46,"The girl was able to relax, but her body was still shaking, without anything provoking her.",,,,,
"S """"",S_44b71264,(Wh-what... Happened to my body?),,,,,
"""""",narrator_de00097d,"Sarah reflexively tried to touch herself, forgetting what position she was in.",,,,,
"S """"",S_e131ce94,Why... Are my breasts so wet?,,,,,
"AB """"",AB_1775225c_1,Lactation. Side effect.,,,,,
"S """"",S_289be721,Lactation?!,,,,,
"""""",narrator_e1030c97,"The girl had not yet had time to examine her new breasts, and her gaze quickly jumped straight to them.",,,,,
"S """"",S_b8a8ee12,{size=+4}Huh???{/size},,,,,
"S """"",S_77c335e7,Abathur! What have you done to my body?!,,,,,
"""""",narrator_122aba72,"Sarah abruptly recovered from her recent orgasm, stunned by the information she received.",,,,,
"S """"",S_65216ea6,G-girls lactate only after pregnancy! And this was not part of my plans!,,,,,
"AB """"",AB_2dd243a6,Hormonal failures lead to lactation. Terran mechanisms are too fragile. An unplanned mutation.,,,,,
"S """"",S_a718d7e5_2,...,,,,,
"S """"",S_8106e53c_1,Will it stay like this?,,,,,
"AB """"",AB_e24f2f2c,A detailed study is required.,,,,,
"S """"",S_8b294a01,That's it. I hope you study it properly and that it can be fixed somehow!,,,,,
"""""",narrator_d3e04188,"The girl looked at her new breasts with interest, imagining what it would feel like.",,,,,
"AB """"",AB_d93c348d,Training is necessary. Will allow control over mutation.,,,,,
"S """"",S_4655eab9,But... I didn't plan anything like this...,,,,,
"""""",narrator_b1604f1d,"Sarah swallowed involuntarily, realizing all the consequences of her decision.",,,,,
"AB """"",AB_2de492f2,The mutation is successful. Additional mutations are predictable.,,,,,
"S """"",S_8a2269a9,"Predictable? And this is what you call a successful mutation, I'm afraid to imagine what else you might have had predicted... maybe a third boob was also predictable and an acceptable side effect?",,,,,
"""""",narrator_f0984780,"Sarah began to examine her new breasts, mixed feelings were going through her head. The consequences of the orgasms she experienced still did not allow her to give a sound assessment of the situation.",,,,,
"S """"",S_8f51afb4,"(I don't know why, but I want to touch it so much, it's still mine...)",,,,,
"S """"",S_31647716,(My mind and body seem to be in a disagreement...),,,,,
"AB """"",AB_144cf084,Explanations: necessary.,,,,,
"S """"",S_1ccc1740,What? Why don't you just attach a manual to them???,,,,,
"AB """"",AB_a7058f4e,Done. The mutation is complete. Terrans genetics modified. Lactation is now controlled.,,,,,
"AB """"",AB_1e1a021b,"Body is improved, the absence of inefficiency is noted.",,,,,
"S """"",S_8cfed578,...Thank you for the praise. I tried.,,,,,
"AB """"",AB_236d920b,The ability to change the size of the breast. Requires training.,,,,,
"S """"",S_54dffa9e,"Well, I think I can handle that somehow...",,,,,
"AB """"",AB_53c08c91,"Size reduction, not available. Will be available later.",,,,,
"S """"",S_3f929753,"Is that how it works? Well, at least you didn't let me down there... I thought you were just going to increase it.",,,,,
"AB """"",AB_e83542ca,Inefficient.,,,,,
"S """"",S_4b2c9b41,"Come on? And I thought lactation wasn't effective either... maybe you're going to open a dairy business here. If anything, at least let me in on your plans.",,,,,
"AB """"",AB_1758464f_1,Do not understand.,,,,,
"S """"",S_a71b65ef,Forget it. And what else did you add without my knowledge?,,,,,
"AB """"",AB_6bfbeb5c,"Increasing the size, increases the sensitivity.",,,,,
"S """"",S_9cca46a2,Huh???,,,,,
"S """"",S_4929fa26,"D-damn, but this is dangerous, so that's why I got so lost... I couldn't believe my feelings...",,,,,
"AB """"",AB_ef21319f,Side effect.,,,,,
"S """"",S_8c55cc8c,"Well, well, yes... who could doubt that you decided to leave it. How many interesting side effects your treatments have, Abathur. Pretty random, huh?",,,,,
"S """"",S_927108f0,"I'm also interested in something else. What about this parasite? He won't be inside me, will he? Maybe you need to say some magic word and he will come out?",,,,,
"S """"",S_8cda6413,Damn... sounds so stupid... huh...,,,,,
"AB """"",AB_68f9ee5d,No. Disintegration occurs. The body turns into biomass. Feeds the changes.,,,,,
"S """"",S_55b68c6e,So I should tell Sai'mon to cancel the tea ceremony?,,,,,
"AB """"",AB_1758464f_2,Do not understand.,,,,,
"S """"",S_cbbba932,"If you understood, then I would have to start worrying, but just forget it.",,,,,
"AB """"",AB_f72fd04e,Defects discovered. Defects eliminated.,,,,,
"S """"",S_761410d3,"Hey, knowing you, I want to know what it is you 'eliminated', answer quickly.",,,,,
"AB """"",AB_a398dc98,Explanations unnecessary.,,,,,
"S """"",S_42e67ad8,I said speak!,,,,,
