"location","source","target","ID","fuzzy","context","translator_comments","developer_comments"
"S """"","S_YpjD8pDn","Oh, you...","","","","",""
"A """"","A_XazrsLHt","Isn't that nicer? Good old Stukov knows his stuff.","","","","",""
"S """"","S_rU2EcUAv","That is a damn lie!","","","","",""
"""""","narrator_oxqiQv68","Sarah couldn't stop the moans coming out of her. The penis inside her had already reached its peak, ready to pour out at any moment, but the man hesitated.","","","","",""
"S """"","S_CYpttrCQ","W-why are you... procrastinating...","","","","",""
"A """"","A_Kgpz6NP3","You know how I can come if I can't even see your face, right?","","","","",""
"""""","narrator_X9iM6Cpa","The girl began to move her pelvis faster, wanting to achieve her own without confirming someone else's rightness. She herself was already impatient for an orgasm, but Stukov had a will of tempered steel.","","","","",""
"A """"","A_LmEckXZW","You can't get to me like that, hehe.","","","","",""
"A """"","A_ieWKMVn9","Come on, come on, turn to me. We look like a loving couple, hehe. So, a kiss is just natural!","","","","",""
"S """"","S_kmJejqbx","Ammh... S-shut up! We don't look like anyone! J-just do it already!","","","","",""
"""""","narrator_3Rpq5qBy","She did not lose hope, moving closer. Sarah suddenly remembered the excitement she had experienced at the final test.","","","","",""
"""""","narrator_Zk4cAgV8","Although the girl denied it, somewhere deep down she did know how the two of them looked together, but she could not allow herself to lose control of the situation.","","","","",""
"S """"","S_Z6kLDMpP","Do you want to lose to me again?","","","","",""
"""""","narrator_mCUJZYU3","The girl's eyes flashed with psi power. She was almost squeezing the desired sperm out of the penis, clenching her insides hard enough to squeeze water out of stone. The erect penis enjoyed the tightness of the pussy pleasantly, releasing a couple of drops of liquid.","","","","",""
"A """"","A_MrJxHSGp","You're playing dirty...","","","","",""
"S """"","S_m7iteK4T","I had a great teacher for that...","","","","",""
"""""","narrator_PQVq3qbH","Sarah did not stop moving, touching another's body with each thrust. The girl planned that this would be the last step for her opponent, but it came back to bite her.","","","","",""
"A """"","A_AK9tSUYQ","But I was ready for something like this!","","","","",""
"A """"","A_ED5cdLQr","To hell with the kiss! Your psionics will do too, it's something even more personal! Ha ha!","","","","",""
"S """"","S_9Dd8jUNW","Eh? Damn!","","","","",""
"""""","narrator_Jx4bMVsS","The female sat down completely, feeling the languor spreading through her body. Her vagina convulsively squeezed around the penis inside it, getting double pleasure from the internal pulsation.","","","","",""
"A """"","A_KDwurjZo","Ha! Victory is mine!","","","","",""
"""""","narrator_PGjVJRgs","Stukov stopped restraining himself and let a fountain out that immediately filled the pulsing pussy to the brim.","","","","",""
"S """"","S_9ywkrySw","OH, SHIT!!!","","","","",""
"S """"","S_5qc8htJj","MMMMMM...","","","","",""
"""""","narrator_YYTaa5AY","Her small orgasm was suddenly gaining momentum when the girl felt the warmth pour into her. All the pent-up emotions began to burst out.","","","","",""
"""""","narrator_bhZ5hkVD","All of a sudden, Sarah could not care less about her shameful loss. For the sake of such an orgasm, she was ready to be defeated a thousand times over.","","","","",""
"A """"","A_rqeSQgwL","Damn... With whom else could we achieve such feelings... eh?","","","","",""
"S """"","S_ViQzG7fT","N-no one...","","","","",""
"S """"","S_qWLTsMtJ","W-what horror... What happened to me.","","","","",""
"""""","narrator_SmZRzmEY","Sarah could still see her own contented face in front of her. But the girl could not believe that such a thing really happened. She was shaking her head, trying to get this memory out of her head while it was persistently drilling itself into her mind. It was unbearable to see Stukov's satisfied face.","","","","",""
"""""","narrator_hrRDrHLL","The fragments of events swirled over the girl again, forcing her to see everything she had forgotten.","","","","",""
"A """"","A_VUwQK62n","You realize how much nicer it would be if all this happened during our signature kiss.","","","","",""
"S """"","S_gXPzCf8Z","(Ahh... n-no, don't even think about imagining it, you need to drive this pervert out as fast as possible.)","","","","",""
"S """"","S_5hUXWhkj","W-we're done, you're holding up the queue...","","","","",""
"A """"","A_hhKQXNP8","Hah, I'd love to, but you're clinging to me like an industrial clamp. Can you let go already?","","","","",""
"S """"","S_m3smFguc","???","","","","",""
"S """"","S_ibv4HxaS","Ah... y-yes, it's just that my leg is a little numb. Now I'm going to sit a little more, I can't feel it at all.","","","","",""
"S """"","S_SS76nxRG","Oh, you little minx!","","","","",""
"""""","narrator_7yn8D39H","Sarah was already in full swing with another zerg when a small zergling made his way through the whole crowd. The girl did not immediately notice his presence, too focused on the main action.","","","","",""
"""""","narrator_JT3QK6nW","She had to look away because of the loud noise. The intruder was circling around the bed, sniffing out something diligently.","","","","",""
"S """"","S_r3GTYBya","Hey, it's not your turn!","","","","",""
"""""","narrator_kGkS57Ge","The girl tried to brush him off, but rough thrusts forced her to stop her attempts.","","","","",""
"S """"","S_4GM52z77","(So damn good... And I have to be distracted by such trifles!)","","","","",""
"A """"","A_XtYpHNQm","Forget him and enjoy yourself!","","","","",""
"S """"","S_K8JuYAGV","Ah... these zerglings are too fond of creating problems!","","","","",""
"Z """"","Z_JEUyzDok","Skr!","","","","",""
"""""","narrator_pczbGkUU","The little guy deftly jumped onto the bed, coming closer to the true source of his interest. Loud moans and exclamations of the girl did not interest him yet.","","","","",""
"Z """"","Z_TQ5L6jFz","Skr-skr-skr...","","","","",""
"""""","narrator_cURfUC8N","The Zergling was creeping cautiously towards the cake. Sarah could clearly hear his nostrils twitch as he approached the dessert.","","","","",""
"S """"","S_MndFaopy","Hey! That is my cake!","","","","",""
"Z """"","Z_4ZFJVdWr","Skr-skr!","","","","",""
"""""","narrator_c6zyQZs7","The brat brazenly licked the cream, seeing that Terran could not stop him. His eyes sparkled with pleasure. A wave of endorphins hit his little head, creating new sensations.","","","","",""
"Z """"","Z_GuPsx9Ak","SKR-SKR-SKR!","","","","",""
"S """"","S_fqvgeyFQ","Mmm...tastes good, huh?","","","","",""
"Z """"","Z_pGir5xob","Skr!","","","","",""
"S """"","S_nQ2UnhdF","Get off my cake, little thing!","","","","",""
"""""","narrator_j3VD7rUB","It wasn't every day that she was presented with such a gift and she couldn't help but get pissed. The situation was worsened by the fact that Terran herself had not yet had time to taste a single bite of the dessert.","","","","",""
"Z """"","Z_ZgizrqNg","Skr...","","","","",""
"""""","narrator_heVkMpth","The Zergling took a huge bite with great pleasure, slurping loudly and licking his lips. He had never tasted anything so delicious, so even Sarah didn't scare him.","","","","",""
"S """"","S_3xwos2TG","HEY! I SAID ENOUGH!","","","","",""
"""""","narrator_kP6LSZAQ","The creature finally broke away from the delicacy, guided by the order given. The girl had to use her powers to save the rest of the cake for herself.","","","","",""
"Z """"","Z_kMVTFDwB","(Does the female want it too? Need to share with female!)","","","","",""
"S """"","S_qaU2ijyx","Share?","","","","",""
"S """"","S_R9Pf3fc5","Ah!","","","","",""
"""""","narrator_SUnJu3oa","The zerg hammering into Sarah's pussy decided to speed up his movements, distracting her from her small misfortune. The Zergling was freed from her control, free to decide how to share with the female.","","","","",""
"S """"","S_qYsndWsk","What are you...","","","","",""
"""""","narrator_rV2j8o3E","Due to his small size, the zergling easily poked his penis into the cake. He moved diligently, trying to smear as much of it as possible onto his love rod.","","","","",""
"S """"","S_s7cpbhfy","ММММH!!!","","","","",""
"Z """"","Z_QY3Ftvmn","(Need to feed female!)","","","","",""
"""""","narrator_PDm9pc6g","Opening her mouth in a groan, the terran felt a cloying sweetness on her tongue. The sweetness was replaced by the familiar taste of penis soon after. Sarah had to take a few seconds to understand everything that had happened.","","","","",""
"S """"","S_47LLgc5z","(Two at once?!)","","","","",""
"S """"","S_fiVgS4J8","(I-I hope these jerks at least marked their tickets...)","","","","",""
"A """"","A_GMqT7jWV","Wow, small but feisty!","","","","",""
"""""","narrator_cLAkBZVS","The zergling didn't waste a minute pushing his miniature cock deeper. Sarah could fully enjoy the taste of the cake, sharing the creature's delight.","","","","",""
"S """"","S_bYkmREVi","(IT'S SO DELICIOUS!)","","","","",""
"S """"","S_CQt3o4Ro","*Slurp* *Slurp*","","","","",""
"S """"","S_EVNcKdYZ","(I... of course, I mean the cake... it's been a long time since I've tried anything like this...)","","","","",""
"""""","narrator_HQKcdKun","The girl barely kept the abundance of saliva inside her mouth, starting to suck and lick the penis greedily. The cream smeared on her lips and chin, mixing with the leaking saliva.","","","","",""
"S """"","S_ocXGQ33g","(I can't help myself! But this is so dirty...)","","","","",""
"S """"","S_sQksY3Mm","MMMM!!! *Squish* *Smack*","","","","",""
"""""","narrator_hAeJMmjL","Sarah did not let the penis out of her mouth, enjoying the wonderful creamy taste. The thought of how she looked from the outside excited her. A big dick tormented her pussy while a smaller dick gave pleasure to her mouth and at the same time fed her a wonderful cake.","","","","",""
"S """"","S_TvV9tpgZ","(Why didn't anyone think of this before? I could eat the whole cake like this!)","","","","",""
"""""","narrator_dCGzqWtG","Thanks to the zergling's size, he could push the entirety of his penis inside the female's mouth. He was rather happy to receive so much attention while his brethren waited outside.","","","","",""
"""""","narrator_aPquet3A","Soon the little one caught the rhythm of the big zerg, entering Sarah from both sides at the same time. The girl was ready to cum from the sensations of two love lances bursting into her, pulsating inside her narrow passages.","","","","",""
"Z """"","Z_dMnJCsuT","SKR-SKR-SKR!!!","","","","",""
"""""","narrator_3U7WWA2y","The cream quickly ran out, but the terran continued to smack her lips with bliss in an attempt not to miss a single speck of it. Despite the lack of dessert, the taste lingered and made the penis penetrating her mouth seem incredibly delicious. Surprisingly, Sarah made no attempt to bite it off, not losing herself to the sensations.","","","","",""
"S """"","S_6pwtpVcf","MMMMMMM!!! *Squish *Squish*","","","","",""
"S """"","S_AvPfaanb","(Ooh... the... cream... he wants to treat me to some cream! S-stuffing! I love it!)","","","","",""
"S """"","S_L8XioU5J","(Come on, give it to me!)","","","","",""
"""""","narrator_QmNN7rju","The zerg stopped abruptly, pushing as deep as possible. The zergling felt the pounding stop and followed suit, pushing himself deep down too.","","","","",""
"S """"","S_dUi53fR6","(They're gonna cum together too?!)","","","","",""
"""""","narrator_JDfuCvDi","Sarah was beside herself with surprise and joy at their synchronicity.","","","","",""
"S """"","S_M8aDX22z","(This is such a gift!)","","","","",""
"""""","narrator_q2QjHUN2","The girl sucked in her cheeks, wanting to get every single drop straight into her stomach. In an instant, a shock passed through her whole body, sperm began to fill her stretched vagina and esophagus. The terran tensed up, trying to keep the liquid inside her for longer. All the previous attempts had failed at the preparation stage, but now Sarah was determined.","","","","",""
"A """"","A_bj2ZXD3r","*Whistling* I might have to ask these guys for advice!","","","","",""
"S """"","S_KadvpybK","MMM! *Squish*","","","","",""
"""""","narrator_8W4PwnG9","*PSHHH*","","","","",""
"""""","narrator_BHHoySH6","The sound of the liquid filling the girl to the top was audible even in the hall outside. The creatures in the queue made a noise of approval, foreshadowing the same stormy meeting with the female.","","","","",""
"S """"","S_9Pm8T9SJ","MMMMMG!","","","","",""
"""""","narrator_6vtjTNqg","Despite the size, the zerg filling Sarah's vagina finished first. His penis released a couple of servings of semen on the reddened pussy from the outside, the inside being way too cramped for all of it.","","","","",""
"S """"","S_YQVNy5s6","*Slurp* *Slurp*","","","","",""
"""""","narrator_5h7VszdB","She continued to suck the cock in her mouth, feeling her stomach begin to fill up. The feeling of sweetness had become fainter, but that only served to increase her pleasure.","","","","",""
"S """"","S_taZoe8Zv","Ngh...","","","","",""
"""""","narrator_NNTBerfg","Feeling the last drops trickle down her throat, Sarah leaned back.","","","","",""
"S """"","S_92BDCGdV","*Smack*","","","","",""
"""""","narrator_oTVTHpYb","The girl left a light kiss on the head of the penis leaving her mouth, thanking it for the new experience.","","","","",""
"S """"","S_ETrhb7An","(Oh, damn...)","","","","",""
"S """"","S_PpBwSBPj","I'm even glad you ruined my cake... So delicious...","","","","",""
"S """"","S_ERYaXS6i","(There was so much sperm, I just couldn't hold it all.. And after all, there are still so many tickets ahead.)","","","","",""
"""""","narrator_8MnmN5nM","As soon as the Zerg left, their sperm began to come out of Sarah.","","","","",""
"S """"","S_HdZB4caq","(It was just their dicks that held back all this huge amount of sperm... d-damn it...)","","","","",""
"""""","narrator_dYpRk2Da","Waves of pleasure from recent orgasms continued to pass through Sarah's body, and the thought that there were still many Zerg ahead gave rise to new waves.","","","","",""
"""""","narrator_YANHQ8rk","The terran's gaze was attracted by the completely ruined cake. On one side, a huge piece was torn off, and on the other, there was just a hole.","","","","",""
"""""","narrator_coFwtBAb","But the sight didn't cause any anger, on the contrary, it made the girl smile.","","","","",""
"""""","narrator_QWbFJK6j","While the terran was engrossed in the picture beside her, both Zerg disappeared as quickly as they appeared.","","","","",""
"""""","narrator_coS9wuSJ","But, as they say, nature abhors a vacuum...","","","","",""
"""""","narrator_PhSw6bWF","This time, Sarah was suspended in the air by a couple of dexterous tentacles. An interesting performance was waiting for her, which required special preparation. The only suitable place was the wall where the balloons were attached.","","","","",""
"S """"","S_sBC3JgSE","(Oh shit... the hydralisks are here too... their double members... I'm not ready to accept them right now. Especially while bound...)","","","","",""
"""""","narrator_PoFWXbT6","The creature, on the contrary, was impatiently waiting for all this to happen and the girl to be impaled on its cock. The balloons sparkled with a golden glow, deliciously framing the girl's hanging body.","","","","",""
"S """"","S_4h8ezf7z","(Ah... Is everything ready? He's going to...)","","","","",""
"""""","narrator_XrY3qEpf","The girl's mind was once again in disagreement with her body, and with a vulgar smile on her face she wiggled her hips, imagining how in one single movement all the emptiness inside her would fill up and her thirst for dick would subside for a while.","","","","",""
"S """"","S_BXRbz4kz","AH!!!","","","","",""
"""""","narrator_btcRV4nd","The hydralisk could not stand another minute of waiting, smelling the obviously eager female in front of him.The tentacles did not resist, and lowered the girl straight onto his appendages...","","","","",""
"S """"","S_iwGeB4gU","Can't resist anymore? Yes... You're not alone, hee-hee!","","","","",""
"""""","narrator_XjpaReTt","The creature growled, plunging the head of one of it's member into the girl's pussy. Despite all the desire of the girl, the lower member rested on her anus without any progress.","","","","",""
"S """"","S_MXaxbteh","Damn... Only one entered... they should have prepared better...","","","","",""
"""""","narrator_fiHigRkQ","The girl bit her lip in annoyance, burning with the desire to feel the cocks inside her fully. She gathered all her willpower to relax properly. Thoughts about future sensations turned the girl on and lubricant slowly began to flow down toward her anus.","","","","",""
"S """"","S_Tzf8wR2J","I can feel my holes getting wet... they rape me... and I'm helping with that... How stupid of me!","","","","",""
"S """"","S_ConQGjXU","Come on... push again and let me feel your two dicks tear me apart!","","","","",""
"S """"","S_TsQR6iDq","I want you to pump me full of your cum!","","","","",""
"""""","narrator_WPdSgZ8R","The Hydralisk, without even thinking of disobeying, pushed forward with extra tenacity. The tight passage gave way.","","","","",""
"S """"","S_Jt3gSjUR","Mmmmm... Yes!","","","","",""
"A """"","A_ASYuVuiq","Now that's a hell of a start! Did you secretly train after our games?","","","","",""
"S """"","S_3nv7Ld5Z","Hee-hee~. Keep wondering!","","","","",""
"""""","narrator_tEDaso8e","Sarah studied what she was feeling with interest. The Hydralisk was also engrossed in pleasure, not making any more movements.","","","","",""
"""""","narrator_hDbaLike","The old pervert did not miss the moment to manage the situation. The tentacles completely obeyed his commands, lowering and lifting the girl's body onto the zerg's dicks.","","","","",""
"S """"","S_igDQEirm","Ah... w-what are you doing! Hey, I know it's your doing!","","","","",""
"A """"","A_qJvmUyLo","Ha-ha-ha, well, what did you think, these tentacles lack experience in this matter! But I don't!","","","","",""
"""""","narrator_GigniaZP","Sarah had not experienced such tormenting tension for a long time, the members in both holes felt great.","","","","",""
"S """"","S_kauL4jdH","Ahhhh... two dicks... mmm...","","","","",""
"A """"","A_sCb474g6","Or did you think that only you know how to control them?","","","","",""
"S """"","S_sJ4pLiSD","Damn~ From this position, I can feel them rubbing against each other!","","","","",""
"""""","narrator_qu5hwqD6","Stukov ordered the tentacles to raise and lower Sarah, having thoroughly enjoyed her first penetration. The next movement was even more great for the girl, as the tips of the dicks passed by her erogenous zones with a powerful push.","","","","",""
"""""","narrator_P8qR7Hjh","Sarah threw her head back in bliss, trying to keep her body from cramping. Her fingers and toes clenched in an attempt to cope with the pleasant sensations.","","","","",""
"""""","narrator_YJnpVuv6","As warmth spread in her lower abdomen, blood flowed to her genitals, making them even more sensitive.","","","","",""
"S """"","S_tcMqjoq4","Why is it so good?! My head is spinning from this~...","","","","",""
"A """"","A_hay5ynJz","Hehe, I think the tentacles have learned the basic patterns. Now you can set the automatic mode!","","","","",""
"S """"","S_tnANQBLb","Wh-what? What are you up to?","","","","",""
"S """"","S_UEX7hNMh","Ah... ah... ah!!! I love these dicks!","","","","",""
"""""","narrator_M7dRDLZT","Sarah was less and less in control of what was happening, wanting only to finish as soon as possible. The tentacles picked up her mood, continuing to impale her body relentlessly.","","","","",""
"S """"","S_YDUkWyND","What lustful tentacles! Don't stop for a second~. Are you using me as a living toy?","","","","",""
"S """"","S_hYK6WQAb","(They have taken over the whole experience of this pervert and are now raping me!)","","","","",""
"S """"","S_ra3n2qvP","Well, I like being a masturbator for two cocks.","","","","",""
"""""","narrator_HBhFkGSs","Sarah enjoyed what was happening to the fullest, realizing neither the words leaving her mouth nor their meaning. All her attention was on the swollen members entering her.","","","","",""
"S """"","S_pgJFtsWZ","I'm burning to find out... Mmm, do you have as much sperm in you as in one penis? Or as in two?","","","","",""
"A """"","A_bUdDZEhK","Oh, yes, let's find out!","","","","",""
"""""","narrator_RPCqXZpm","The hydralisk seemed to understand Sarah, letting out some approving sounds of pleasure.","","","","",""
"S """"","S_be7VuSaV","Yes! Pour your cum all over my insides! Go as deep as possible!","","","","",""
"""""","narrator_ZQWXWsiW","The creature felt that the female was ready to receive his seed. The tentacles lowered her.","","","","",""
"S """"","S_Tr7AiciM","Do it right now!","","","","",""
"S """"","S_7RPiNh8z","AAAHHHH!!! So rude!","","","","",""
"S """"","S_r2qpjs5H","AHHHH!! A-A-A-ARGH!","","","","",""
"S """"","S_th2b834K","S-so deep! He is in my womb!","","","","",""
"""""","narrator_55yEHWwM","The girl was abruptly pulled out of her dreams by a loud bang that deafened her. Her vision and hearing blurred for a while, letting her focus on the rest of her senses. Sarah didn't understand what had happened, but she clearly noticed the walls of her pussy burning from the rapid friction.","","","","",""
"""""","narrator_d5UcyQtf","The lost sensitivity from the huge succession of members came back, heating up all the nerve endings.","","","","",""
"""""","narrator_Qm5mHDY5","*PSHHH*","","","","",""
"S """"","S_Lr9k3QHB","Two servings at once!!! You seem to have a lot of sperm in you... Give me all of it!","","","","",""
"""""","narrator_qcwcXPK9","The veil fell away, revealing a view of the heavily breathing and slightly upset hydralisk. His whole body tensed, releasing two hot jets of semen from his members.","","","","",""
"S """"","S_UFHZTZnD","(The heat is rising higher and higher! It fills all my organs! I'll carry it inside me until all the Zerg cum inside me, ah!)","","","","",""
"S """"","S_G66amgyJ","A-A-A-A-HHHH!!!","","","","",""
"""""","narrator_ofMK3uvC","Sarah experienced incredible feelings from the thought that the sperm would not leave her any time soon, it became much more pleasant for her.","","","","",""
"S """"","S_DnxUZYQY","(I'm cumming! Cumming while my belly is being pumped full of semen!)","","","","",""
"S """"","S_mR5aNTWZ","I want to get every last drop!","","","","",""
"S """"","S_dRBzxkVo","Hm...","","","","",""
"S """"","S_3qnmFvqw","(D-damn, it was almost too much, it almost came out the other end... just h-how much does he have...)","","","","",""
"""""","narrator_D6g3eA5w","The hydralisk began to slowly come out of the girl. It turned out to be a rather complex process as the strong orgasm turned the girl's insides into a clamp once again. But the tentacles pulled on the girl relentlessly.","","","","",""
"S """"","S_fGMmVnxB","Ah! No... It's coming out!","","","","",""
"""""","narrator_GEyCpieZ","The sperm began to pour out onto the floor in a constant seemingly unending stream as soon as the dicks left their temporary shelter. The girl's hands were bound, so all her attempts to stop the leaks were unsuccessful. There were golden scraps and puddles of white liquid everywhere, which grew in size with every second.","","","","",""
"S """"","S_dAD6G835","Damn... hee-hee, but should it count as two tickets?..","","","","",""
"S """"","S_qAjMLf7X","It's always so difficult with you Zerg... one has two members, another has tentacles instead of a member... grr...","","","","",""
"S """"","S_6iGHeDzU","Mmmg, empty again.. this is not the time to think about it! Next one! Hurry up!","","","","",""
"S """"","S_pvmWrpEU","Remember this moment well, Stukov. It will go down in history!","","","","",""
"A1side11 """"","A1side11_9QdJgPxx","I have no doubt...","","","","",""
"""""","narrator_8DignqHX","Stukov, with pleasure gushing from his every pore, watched a zerg finish inside the girl with his tongue sticking out from pleasure. There was so much sperm that with each thrust, it burst out of her vagina with a loud squish and joined the rest of the huge stream flowing down to the floor.","","","","",""
"A1side2 """"","A1side2_6XHBsGsr","I've documented everything! Our descendants will have something to see.","","","","",""
"""""","narrator_HoueqT63","Sarah was turned on by the malicious smile of the man who so was shamelessly jerking off to all the action befire him and did not forget to take some shots, as he claimed, for posterity. Although the feeling that she had been deceived somewhere, perhaps at the very start of this whole event, when Stukov burst in with an incredible story about some kind of initiation and a strange test, did not leave her for an instant...","","","","",""
"""""","narrator_FFyrgMoh","But what difference does it make? The girl got into a real fitting state of mind...","","","","",""
"S """"","S_AHA4Nr4n","Ah... At first I thought you were lying...","","","","",""
"""""","narrator_SqjBAaUz","Sarah playfully wound her hair around her finger, posing for a hologram on purpose.","","","","",""
"S """"","S_5NBhtcNi","I was sure... mmm!!! T-that it's impossible... Well, to pass this test of yours.","","","","",""
"A1side3 """"","A1side3_t5gFHuKH","Test of mine? What??? The blasphemy!","","","","",""
"A1side12 """"","A1side12_d8WADj4s","This is a century old tradition that...","","","","",""
"S """"","A1side3_UP69CrTE","Yes, yes, yes! I remember it all. And who passed it, and how... But how do you know all this?","","","","",""
