"location","source","target","ID","fuzzy","context","translator_comments","developer_comments"
"""""","narrator_peEYfa3P","The Queen of Blades thought for a second.","","","","",""
"S1 """"","S1_QNWoSkC2","Oh, yeah... Returning to our topic.","","","","",""
"S1 """"","S1_imdMNpTu","There are worse things besides death. You can get completely lost, lose your mind, become a sexy doll. But you're lucky, you're a tough nut to crack.","","","","",""
"L """"","L_EZPPBP2u","...","","","","",""
"S1 """"","S1_NfTE5znx","It will be necessary to try to play with another protoss somehow. Find out if you are all so stable or not...","","","","",""
"L """"","L_WUVcKKia","Hey, don't even think about it!","","","","",""
"S1 """"","S1_mjtZ5SAk","Ha-ha-ha, and what will you do? Come on, as if we need any of that silly resistance.","","","","",""
"L """"","L_7bY5PXQv","...","","","","",""
"S1 """"","S1_KwhcUwop","Okay, we've had a chat and that's enough. You've managed to pull me off topic with your pathetic appearance, let's stop wasting time, I still have so much to do, so much to see.","","","","",""
"""""","narrator_bbGz7UqT","The girl shrugged indifferently, not intending to linger there for a second more. Lizzara was left alone, replaying the question in her head and not finding clear answers.","","","","",""
"L """"","L_NGUFiUvp","Am I imagining thing or was that the first time she... just talked to me?","","","","",""
"L """"","L_4JqNyakz","It doesn't even feel right...","","","","",""
"L """"","L_RPkaoN3p","Br-r-r-r-r... I think that thought gave me goosebumps...","","","","",""
