"location","source","target","ID","fuzzy","context","translator_comments","developer_comments"
"A1side12 """"","A_ASNgYkXF","From reliable sources, of course! It's not for nothing that I'm trying to capture this too, heh-heh-heh.","","","","",""
"""""","narrator_dsgRgTHB","Zergling was trying to recover after the recent final stretch, it was difficult for him to do it.","","","","",""
"S """"","S_BUXpefad","Ha ha ha... it's so funny to watch you when you've just finished... so helpless...","","","","",""
"""""","narrator_oTmnmc6y","Stukov smiled with satisfaction, happy with the girl's attitude. He could not believe that his student had grown up so much and was ready to do anything for her goal without any hesitation.","","","","",""
"A1side3 """"","A1side3_AboJpciJ","That's exactly the motivation on par to Mistress's, no less. Such frenzy to serve her subordinates. To cheer up their fighting spirit!","","","","",""
"S """"","S_9ULsf2CC","You flatter me~.","","","","",""
"A1side3 """"","A1side3_oG5SP4Bb","No, no, I definitely don't remember anyone collecting SO MUCH sperm! Some of it must be mine even...","","","","",""
"""""","narrator_YMf9r5K4","Sarah bit her lip, trying to stifle a hoarse moan. The girl was excited by any hint or word. Her very appearance was the personification of excitement. Her uniform was torn by numerous fangs and claws, her body was smeared in cream, saliva and semen.","","","","",""
"""""","narrator_s8o7SkUK","The terran got a special high from the way the zerglings sucked on her nipples, which she had previously smeared with cream. Sarah blamed her behavior on the large abundance of absorbed sperm, which miraculously awakened all the most vulgar parts of her. This excuse untied her hands.","","","","",""
"S """"","S_T5ben3sF","God~ I'm so glad it's over...! My body aches from all the orgasms...","","","","",""
"""""","narrator_5TnV3cQt","Sarah felt a deep wild pleasure from what she had to go through, taking two or even three zerglings at once.","","","","",""
"""""","narrator_cYRpVAfe","Somewhere from the side there was a crunch and the sound of falling glass. Sarah clearly heard it, but it was not something out of the ordinary, chaos has been going on in the room for a while at this point, all the participants in the action were too busy to pay attention to much else but themselves.","","","","",""
"""""","narrator_8oLqw9zu","The thought of how sexy she looked filled her body with a pleasant glow, wherever it wasn't overfilled already. She liked to be looked at, to have her every movement and moan witnessed. And she could not restrain her moaning, despite the sore throat thanks to the dozens of cocks that recently paid it a visit.","","","","",""
"""""","narrator_3e9EFtJA","And each Zergling unconditionally and with great pleasure fulfilled her requests.","","","","",""
"""""","narrator_dZmYYx8B","During the action, Sarah came repeatedly, each time a powerful jet hit her insides. After so many orgasms, the girl could not scream, only open her mouth in a silent moan. Sound could no longer convey the full spectrum of her sensations.","","","","",""
"""""","narrator_SWMhbYvr","Occasionally Sarah grabbed the bed underneath her with her hands, as far as possible, and squeezed her eyes shut, trying to feel every moment, every instant of her orgasms. Squeeze everything out of it completely and fall exhausted back onto the bed.","","","","",""
"A1side2 """"","A1side2_hZt4bema","Well, now you've officially coped with everything, there are no tickets left...","","","","",""
"A1side7 """"","A1side7_632CkfJF","(Even though half of them were stolen by that jerk... and I had to count them all myself... what a task and a half that was, by the way ...)","","","","",""
"""""","narrator_pv2Lsk7y","The zergling had already disappeared by that time, having done his job and going to have a good rest. Sarah wasn't too upset, knowing that he was the last one.","","","","",""
"S """"","S_5hVvHkPh","Well, little guys? Great job from all of you!","","","","",""
"""""","narrator_BpU4CCEE","The girl allowed herself to relax so that all the cooled down sperm flowed out of her and her stomach shrank at least a little.","","","","",""
"S """"","S_5ZwASWoe","Ah, this is my favorite moment... What a sense of accomplishment!","","","","",""
"S """"","S_Ym2qLCb2","Oh my god! It's unbelievable!","","","","",""
"""""","narrator_MRkM8mt2","The girl was enjoying moments of rest before she had to return to her duties.","","","","",""
"S """"","S_DfrSLySy","Hm...","","","","",""
"""""","narrator_9rpUE5FW","A bright light spot caught her eye, attracting Sarah's attention. There was a mountain of broken glass on the floor, which continued to slowly grow thanks to the crumbling screen above it.","","","","",""
"S """"","S_BJvjH6Kq","How is it... ah... it doesn't matter!","","","","",""
"centered """"","narrator_hUt62tJB","Sarah closed her eyes, and at that moment there was silence.","","","","",""
"centered """"","narrator_pNHww4NT","Which meant only one thing.","","","","",""
"centered """"","narrator_kxrngaVQ","Even if one thousand Zerg couldn't stop her.","","","","",""
"centered """"","narrator_jmGdCQWu","Then no one could.","","","","",""
"""""","narrator_pQMMFz9X","Sarah shook her head, trying to make sense of what she saw.","","","","",""
"S """"","S_ii8czDAG","...","","","","",""
"S """"","S_tDy383Me",".......","","","","",""
"S """"","S_RaX6uQC7",".........","","","","",""
"S """"","S_YmdFh2ZN","(Was it me? Was it really me?)","","","","",""
"""""","narrator_boQn2m9h","The girl sat down on the bed, which, fortunately, was not far away. She was shaking a little from shock.","","","","",""
"S """"","S_PmVcvRxW","(How could she behave like this? I'm not that reckless, it couldn't be me. At least I wasn't back then.)","","","","",""
"S """"","S_GqZn2HXb","(Or have I always been like this?)","","","","",""
"""""","narrator_WpJw7xmV","Sarah froze, trying to not even breathe to understand what she felt from what she saw. It was unusual to see herself so pleased from the outside. It was as if this girl was a whole different person, but this girl was her.","","","","",""
"""""","narrator_WVZWVsYj","The terran shook her head again, pushing the thoughts away.","","","","",""
"S """"","S_5BaMYpBn","It was the machinations of the Queen of Blades! Precisely! It was her!","","","","",""
"""""","narrator_WprkyZru","Sarah exhaled contentedly, finding the cause of her confusion.","","","","",""
"S """"","S_7aNhRQjH","Oh, shit, it's the same bed... it's soaked through with cum!","","","","",""
"""""","narrator_KrsxoFsN","The girl abruptly got up from the bed in the hope of not getting dirty after all that she had seen just a minute ago.","","","","",""
"S """"","S_mPde7cqw","...","","","","",""
"S """"","S_7x7bU22H","Okay... now I can get back to work with a clean conscience.","","","","",""
"S """"","S_bKZLcKw5","I hope I won't find any more such gaps in my memory...","","","","",""
"S """"","S_T65KvZFR","I knew I needed to get out of this room, I didn't find anything useful here...","","","","",""
"S """"","S_8n8kbWzu","Why did I waste my time?..","","","","",""
