location,source,target,ID,fuzzy,context,translator_comments,developer_comments
"S """"",S_c83ba47f,"Ah! Ah! Y-yes! Inseminate me, cum as deep as you can!!! Straight into my pussy! Give me a baby! YES, YES, YES!",,,,,
"S """"",S_048106f4,"Still such pressure, mmm!!! Oh-he will definitely make me pregnant, ah! Zergling sperm...",,,,,
"""""",narrator_4aaeb3c0,"The Zergling continued to accelerate, gaining momentum. With each new movement, plunging deeper into Sarah's pussy.",,,,,
"S """"",S_2a8e6e66,Yes... Yes! YES!!!,,,,,
"S """"",S_d9869659,AAAAAAHHH!!! I'M CUMMING!!! I'M CUMMING!,,,,,
"Z """"",Z_331b4a11_2,Skr-skr-skr...,,,,,
"S """"",S_4302fcf3,Ah... ah... ha... Oh-he's flooding me! He cums deep inside me... He's giving me a baby!!!,,,,,
"S """"",S_26babc57,Ahhh!,,,,,
"""""",narrator_f5515efd,"The sperm of the zergling continued to erupt deep inside Sarah, filling her pussy to the brim. The flow of semen continued to give more and more pleasure to the girl, which she almost could not cope with.",,,,,
"S """"",S_27601da2,H-ha-a-a! Ah... hya...,,,,,
"S """"",S_0089198e,Y-you really did it... Came in me so much... Inside... J-just incredible!,,,,,
"S """"",S_f20a4418,"Damn, we really have a very juicy video coming out... Ahem, yes, forgive me, I lose control at such moments, hee-hee. Just think... I shouted that... Oh, and about the baby.",,,,,
"S """"",S_e51489a8,"Don't worry, I think it's impossible between our races. He came in me so many times that I would have been pregnant a long time ago. But I can't help myself...",,,,,
"S """"",S_791612a8,"It's so nice... And when you shout it out, it becomes even more pleasant.",,,,,
"""""",narrator_08d91a6d,"The Zergling stopped for a while, allowing the girl to catch her breath. But his cock was still inside her and it was only getting harder by the second.",,,,,
"Z """"",Z_a574ceec_2,Skir-skir!,,,,,
"S """"",S_4aa24001,"Ah? Mmm... Y-you want more again? Hee-hee-hee, of course... He wants more, one time is not enough for him. He's so insatiable!",,,,,
"S """"",S_cbc0d3fb,"I don't mind, ah... Just be careful! My body is very sensitive after orgasm.",,,,,
"S """"",S_e34b789b,"Ahh!!! Mmm... I am... I told you! It's so nice, he's always so gentle at first...",,,,,
"""""",narrator_61036ef5,"Along with the movements, sperm came out of Sarah's pussy, with which he filled it.",,,,,
"""""",narrator_cf48615f,"Everything was recorded on the device, and Sarah was constantly on edge because of this.",,,,,
"S """"",S_5cc2ef78,"Ah, I can't help myself! I'm losing control of my voice...",,,,,
"""""",narrator_380c0c9d,Sarah's moans began to echo throughout the room.,,,,,
"S """"",S_950179ba,Y-yes! Let's do it! Give it to me! Fill me up with your hot cum!,,,,,
"S """"",S_dcf40ffc,"D-come on... Ah, this time we're going to have a baby, right in front of the camera! Let's capture this moment, hee-hee.",,,,,
"Z """"",Z_a574ceec_3,Skir-skir!,,,,,
"S """"",S_dd897740,"Heck! He's just started... I can't believe I'm already at the limit. I'm... I'm already cumming! Ah... Come on! Dig into my chest, you like it so much...",,,,,
"S """"",S_71521449,"Your dick is already swollen, I can feel it. You want to inseminate me! You want to make me yours!",,,,,
"""""",narrator_86516bf9,"Each new push knocked out of Sarah more and more dirty things that she would never have allowed herself to say in a sober mind. The girl felt some strange influence on herself, but she could not understand whether it was the camera or her inflamed consciousness.",,,,,
"S """"",S_6a7e8a89,"Ah, mmm... My breasts... If you continue like this... I, ah-h-h-h!!!",,,,,
"S """"",S_2e7f584d,"I'm losing control completely... It's so weird to be strung on his dick and record a video at the same moment... Heck! Why didn't I think of this before?! AAAHH!! Yes! You like it too, don't you?",,,,,
"S """"",S_063b0f44,"He likes it when I'm on edge, hee-hee. When my body is all shaking from his assertive movements, a-a-ah! I can feel his cock getting so hard... He's ready to fill me to the brim. He's so deep... That touched my uterus, ah!",,,,,
"S """"",S_ee3a0435,Ah... Y-yes! Now for the most interesting part! P-please don't miss the moment when I get pregnant from him!,,,,,
"""""",narrator_3cef4911,"The Zergling sped up, greedily licking Sarah's nipples. Sarah's moans became much louder, which only amused the little zerg more.",,,,,
"S """"",S_489ac703,"Mmm! Yes, mmm!!! Cum for me! Release your seed! Fill me up completely, ah-h-h!!!",,,,,
"""""",narrator_cddf3182,"Sarah's gaze changed when she looked directly into the camera. It was as if she was looking into the depths of her soul, making her way to the deepest animal instincts.",,,,,
"""""",narrator_ba2bdd13,"There was only lust in her eyes. She couldn't think of anything else, completely surrendered to her feelings.",,,,,
"""""",narrator_d019be43,"Both were approaching discharge with each thrust. The movements became faster and deeper, the zerg tried to reach the innermost parts of her pussy.",,,,,
"S """"",S_091a0c14,AAAAAHHHH!!! He's doing it again... I'm so getting pregnant! Aaah... I'm going to have a little zergling! MMM!!!,,,,,
"Z """"",Z_8af8978f_1,Skir!,,,,,
"S """"",S_b0ef6d8d,And you keep watching... This filthy performance! Hee-hee-hee... And which one of us is the real pervert?,,,,,
"S """"",S_99648e98,Mmm! I feel... My portion of hot cum is coming! Are you ready?,,,,,
"S """"",S_6e19a513,I can't hear you-ooh-uh! NNNGGHH!!!,,,,,
"Z """"",Z_331b4a11_3,Skr-skr-skr...,,,,,
"S """"",S_cdec5e30,{size=+6}AAAAH!!!{/size},,,,,
"""""",narrator_d0ee55d0,"The Zerg stopped, entering Sarah as deeply as possible to cum inside. They froze, enjoying this moment.",,,,,
"S """"",S_d51bca10,"H-ha-a-a... this... It was really cool... Even better than the first time... ah... I was already flooded, mmm.",,,,,
"S """"",S_617869d6,"And now there's even more of it... He made me a little zergling, hee-hee. It was recorded right on camera how the zergling continued to inseminate me. Right into my insatiable pussy, ah.",,,,,
"S """"",S_87c77023,"Something happens to me at the moment when he is about to cum... I get a little... Dirty? What is he doing to me, hee-hee.",,,,,
"S """"",S_cc82b920,"But I can't help it, as soon as I think about his penis, I immediately lose my composure... ",,,,,
"S """"",S_32e180f7,"Ah... It's coming out! Coming out, mmm!!!",,,,,
"Z """"",Z_a574ceec_4,Skir-skir!,,,,,
"""""",narrator_a8864a2e,"From the unexpectedly surging feelings, Sarah received another discharge, feeling like the whole portion of sperm was trying to flow out of her abundantly.",,,,,
"S """"",S_1ff564f0,"Ha-a-a-a! H-his cum is coming out of me... There's so much of it that I can't help myself anymore, mmm... And he didn't even get his dick out. A-a-a-h!",,,,,
"S """"",S_20506e96,"It's so embarrassing... I hope you like perverts who adore insemination sex, and you fully enjoyed it...",,,,,
"S """"",S_f0905cfa,"And-I apologize for my slightly slurred speech... I'm still having small orgasms, mmm... my trembling voice is proof of that.",,,,,
"Z """"",Z_331b4a11_4,Skr-skr-skr...,,,,,
"S """"",S_04a1b8ac,"Ah? Mmm... O-stop, n-no! I'll lose my head so completely! I-I can't anymore!",,,,,
"S """"",S_82fafd8b,Ah! S-stop it...,,,,,
"""""",narrator_1d56fb60,"Sarah could hardly pronounce the words, the zergling's thrusts confounded her. Instead of clear words, only fragments of expressions came out, mixed with groans.",,,,,
"S """"",S_84f11fca,"Oh, he never... Never listens! Little... Pervert!",,,,,
"S """"",S_2b15cd20,Mmng... ah! Zergling! M-baby! Oh... I can't stand it...,,,,,
"""""",narrator_f47adedb,"Sarah felt overwhelmed due to the fact that most of the sperm was still inside. With each new movement, she continued to pour out, bringing unprecedented pleasure to both.",,,,,
"S """"",S_739d8a32,"NNGH! Oh-he... won't stop... Whatever I say, mmm! Whatever I do! He never stops... H-help me! Ah!",,,,,
"""""",narrator_43156700,The reaction of Sarah's body was dramatically different to her words. She couldn't stop the extra excitement the fact she was recorded gave her. She definitely liked having sex on camera more than anything she had tried before. She was on edge.,,,,,
"""""",narrator_3bbede08,All her exclamations and requests to stop seemed empty against the background of how much she liked being raped by a zergling. She quite enjoyed this action.,,,,,
"S """"",S_78726910,"Ah! Hya!!! You're as hard as ever... You've just finished, but you're ready again! MMM!",,,,,
"S """"",S_f5010842,N-no... already? I'm still... still! AHHHH!!!,,,,,
"Z """"",Z_a574ceec_5,Skir-skir!,,,,,
"S """"",S_a3709dbe,"One baby... Won't be enough for today, a-a-a-a-a-a-a-ah...",,,,,
"""""",narrator_064043f0,"Sarah opened her eyes, not immediately realizing where she was.",,,,,
"S """"",S_3953eac2,How did I fall asleep? Right... I was holding the crystal... But what happened next?,,,,,
"S """"",S_7a5a545d,Ouch... My body aches so strangely... It's like I've been kicked all night... oooh...,,,,,
"S """"",S_377e6153,I can't remember anything! As soon as I try... My head splits open... ah...,,,,,
"""""",narrator_69d77bae,"The girl stood up, examining her surroundings.",,,,,
"S """"",S_7b997ded,Eh?!,,,,,
"S """"",S_2c4a6488,What is the crystal doing on the ground? It doesn't belong there at all. Too dangerous a thing...,,,,,
"""""",narrator_7ff22375,"Sarah bent down for the crystal, casually picking it up, examining it a little for damage.",,,,,
"S """"",S_3c099705,Hmm... everything seems to be fine. At least it's the same as always.,,,,,
"S """"",S_0507fd0f,And how did it get there?! I couldn't have not hidden it... What the hell happened here?,,,,,
"S """"",S_db7fa90f,Maybe I just got overworked and forgot to put it away? But this has never happened before...,,,,,
"S """"",S_6f94a706_1,...,,,,,
"S """"",S_6f94a706_2,...,,,,,
"S """"",S_b830fb38,Aargh!,,,,,
"S """"",S_871ca0b1,To hell with it.,,,,,
"S """"",S_eb9ee91a,I better to put it back and not touch it anymore.,,,,,
"S """"",S_cbba183c,"My head... Sai'mon, do something with this headache...",,,,,
