"location","source","target","ID","fuzzy","context","translator_comments","developer_comments"
"""""","narrator_K5X5oAjA","In one of her free hours, Sarah was walking around the ship. Her little journey had no purpose and no meaning. From the outside, it would seem she was simply killing time, and the girl was inclined to agree with that. With a slow step, sighing heavily, the  Terran wandered from corridor to corridor.","","","","",""
"S """"","S_Ksg5BuSC","*Sigh*","","","","",""
"""""","narrator_UMfuLgcK","Sarah could not refuse her friend when she begged her to rest a little. It all started with persuasion to sleep, but the girl managed to convey that this was not necessary and it would take too much time.","","","","",""
"S """"","S_64MCR5vf","I've been around most of the ship... Do I have to go for the second round?","","","","",""
"""""","narrator_XqqeMauT","Sarah was about to turn as planned, but something caught her eye.","","","","",""
"S """"","S_dHEPwcca","No. I don't want to go back there... Surely I don't want to?","","","","",""
"""""","narrator_PqBNNck6","The girl could not take a single step, staring intently in the direction of the passage that was very familiar to her. She knew where it lead to, knew very well. Her mind was sounding the alarm and did not want to bring the negative memories to the surface, but her body moved its wobbly legs in the right direction.","","","","",""
"""""","narrator_Z8gT4PNj","Sarah didn't have time to realize how she found herself back in her former cell. It must've happened in a blink of an eye! The first thing the girl did was rush to the door. Not to escape, but to check that everything that happened after the chrysalis and the chrysalis itself was not a dream. That she didn't just wake up from her dreams of a future. The door was unlocked, the girl let her breath out and some stress went with it.","","","","",""
"""""","narrator_jvYVFzwQ","She didn't understand how her feet had brought her here by themselves. But Sarah assumed that all of this was the nasty machinations of the Queen of Blades, who wanted to intimidate her with this room, thereby shaking her confidence.","","","","",""
"S """"","S_YQRjughy","And why am I here? This is the last place I would like to be at...","","","","",""
"""""","narrator_47Ce8v3B","At first and inattentive glance, the room seemed exactly the same as when she left it. Not that the girl was eager to explore the place from which she had escaped long ago.","","","","",""
"""""","narrator_EVbGn2YM","Although, already standing here, Sarah found she didn't feel quite what she expected to. All those experiences were mere memory, and the place did bring them to the forefront of her mind, but failed to make her relive them. The new Sarah began to feel strange, but still looked around the room.","","","","",""
"""""","narrator_i2Vnvv5p","There was nothing special if it wasn't for a small lump of yellow material.","","","","",""
"S """"","S_iSaoydPG","Ah... my head...","","","","",""
"S """"","S_EajBgTih","What's this? I don't remember having anything yellow and glossy.","","","","",""
"""""","narrator_6tDRvcv6","Sarah squeezed her eyes shut from due to the unbearable headache. Something was waking up in her mind and wanted to be seen.","","","","",""
"S """"","S_ms3eVxEt","A-a-a-a-a-ah! N-no, something is getting into my head! AAAAAAH!","","","","",""
"S """"","S_dBoijBmC","I remember... I was here...","","","","",""
"""""","narrator_CtZiTa2H","The girl opened her eyes wide, seeing herself on the bed. She watched from the sidelines as she was very enthusiastically saying something... Stukov was standing in front of the bed and making a hologram of a holiday party.","","","","",""
"S """"","S_rddHwPeD","I can't hear what we're talking about... Mistress? Dedication? I remember something similar to that...","","","","",""
"S """"","S_HnePsXQU","But why am I getting so angry? And undressing?","","","","",""
"S """"","S_4gGX9MXm","I... I can't leave like this! I have to find out what the hell is going on here!","","","","",""
"S """"","S_hwmhss6e","It's too interesting.","","","","",""
"S """"","S_6oe5UoSB","A plate? How did a plate end up here?","","","","",""
"""""","narrator_jKHFegUs","For a moment, Sarah saw a whole dessert in front of her, untouched by anyone. The girl blinked a couple of times to make sure what she saw wasn't an illusion, but the mirage disappeared and the plate became empty again.","","","","",""
"S """"","S_Tp7RUWjm","I don't remember the last time I used cutlery... Or is it a gift to me for all my efforts?","","","","",""
"S """"","S_g3HozMNv","I wish I could remember the taste of my native food...","","","","",""
"""""","narrator_SjsG2DAM","Sarah picked up the familiar but completely unexpected object in front of her.","","","","",""
"S """"","S_9XLf2MwA","Covered in crumbs... Did I really eat Terran food at last? This can be the trick of only one creature on the ship... Who else would be able to use their connections and make fun of me?","","","","",""
"""""","narrator_DLcnPCVS","The girl collected the crumbs and remnants of something creamy on her finger, tasting it.","","","","",""
"""""","narrator_MEUVSeDG","Something was persistently trying to reach her conscious mind. Sarah could have sworn she saw someone bite off a piece of HER cake. But the anger disappeared, as did the memory before her eyes.","","","","",""
"""""","narrator_XHe7YJv6","...","","","","",""
"""""","narrator_PATh2s8L",".......","","","","",""
"""""","narrator_7aFZiPor","............","","","","",""
"S """"","S_iDcup4W7","Was it a cake? Mmmm... Well now it's more what's left of it...","","","","",""
"""""","narrator_EkfdoffQ","The more Sarah thought about what had happened, the more turned on she became. The memories could not catch on in any way, although the girl was sure that something interesting had happened.","","","","",""
"S """"","S_CgkbPL3z","Were we celebrating my release?","","","","",""
"S """"","S_YiZESXDP","Or my upcoming mutation?","","","","",""
"S """"","S_EvQipfT4","What nonsense am I saying...","","","","",""
"S """"","S_HiwPQsd9","Nobody eats cakes!","","","","",""
"S """"","S_LZAtxjhk","Especially here! What's it doing here?","","","","",""
"""""","narrator_scRaLUYu","Sarah dropped the plate from her hands. The terran moaned in resignation, having lost such an important clue and the remnants of delicious buttercream.","","","","",""
"""""","narrator_ijDZhR75","The girl felt a sharp blow to her head. Or at least what felt like one.","","","","",""
"""""","narrator_A9dF4QVf","Everything swam before her eyes, it seemed to Sarah that her vision broke into pieces and they floated before her.","","","","",""
"""""","narrator_bhru9QGZ","Her head began to hurt, the pain bending the girl in half. Before her eyes, everything turned green and rippled.","","","","",""
"S """"","S_7wttuKDt","W-what is it? Ah... my head!","","","","",""
"""""","narrator_83PZoZEm","Sarah saw the plate assemble itself and return to her hands. It looked as if an old film was put on rewind. Despite the desire to move away, the girl stood like a statue.","","","","",""
"S """"","S_kHb7XLuJ","Whole... w-what's happening to me...","","","","",""
"""""","narrator_ECh6atSz","The plate returned to its original place, allowing the crumbs to stick together on a stable surface. The cake began to take more familiar forms. At first, Sarah saw bite marks, obviously carelessly left by Zerglings. But they also gradually closed up, presenting a whole chocolate cake with cherries in front of the girl.","","","","",""
"S """"","S_FvWJx4v5","Ha-ah... w-what is it... zergling?","","","","",""
"S """"","S_mc6JETmK","M-my head...","","","","",""
"""""","narrator_3mEm4Dav","But time did not resume there. The cake was taken away by someone's shadow, slowly returning to the door. The girl was ready to rush after it, if not for her body still feeling like a statue.","","","","",""
"S """"","S_nURRGF94","Stop!","","","","",""
"S """"","S_W78nxz9k","This is...","","","","",""
"""""","narrator_kBhhGsPy","Sarah narrowed her eyes, trying to see or remember who was the one who brought this cake. The shadow slowly became clearer, acquiring shape and color.","","","","",""
"S """"","S_CS89RqQe","This... him! Well of course...","","","","",""
"S """"","S_PCNpfqjE","Stukov!","","","","",""
"""""","narrator_g3fUBSwJ","Sarah didn't know where she was again. After examining herself, she noticed a plate that had been broken a second ago, whole in her hands.","","","","",""
"S """"","S_sYF4pD7h","...","","","","",""
"S """"","S_9MBst25F","Huh?","","","","",""
"""""","narrator_FUmVSN85","Terrified, Sarah dropped the plate, which landed nearby on the bed.","","","","",""
"S """"","S_sAQXWXxs","What's going on here...","","","","",""
"S """"","S_ES4gzbAp","This room... there's definitely something wrong... Maybe I shouldn't be here.","","","","",""
"S """"","S_YdPZJnDc","I did not expect much, but definitely not this...","","","","",""
"S """"","S_9EBpJbxV","Hmm. Um...","","","","",""
"S """"","S_iojRbqLo","More scraps... How many are there?","","","","",""
"""""","narrator_p7uCwDVF","Most of these ragged pieces hung on spikes along the bed. Sarah tried to make something whole out of them and understand what it was, but the flaps did not seem to connect with each other in any way.","","","","",""
"""""","narrator_tCCyeiHW","Sarah was sure that she saw someone looking at something similar to it. The girl saw something in the blur, something golden, but also some human skin","","","","",""
"S """"","S_mNuUXJ7w","Maybe a swimsuit? Golden swimsuit... This is very much in the style of Stukov. Maybe he also ordered a huge cake and made me jump out of it?","","","","",""
"S """"","S_LodsEXgz","But there's too much material for just a swimsuit here... He would have considered it more appropriate to have a maximum of bare skin and a minimum of a swimsuit. To keep the mystery and interest...","","","","",""
"""""","narrator_NLavSqxA","A loud bang sounded in her head, along with memories flashing by. The spot didn't change much, so the girl was completely lost in guesses.","","","","",""
"S """"","S_Fv9soQvK","Pf... A visionary.","","","","",""
"""""","narrator_gS64RfjV","Sarah continued to examine the bed, her peripheral gaze catching on something on the wall.","","","","",""
"""""","narrator_6NEwh2SH","The girl recalled that the golden object was not alone. She remembered its shape and texture, as if she was rubbing against it with some part of her body.","","","","",""
"S """"","S_jTiNvh8r","One... One?","","","","",""
"""""","narrator_XU4Y5HBK","Sarah was surprised by the deflated, but almost intact balloon caught on a spike above the bed. It looked like the number one, but that did not lead Sarah to any grand revelations to its purpose or where it came from.","","","","",""
"S """"","S_oUA7ZyKX","Is this the first day of freedom? The first mutation? What did that mean?","","","","",""
"""""","narrator_NMkUy4Ej","Various images flashed before her eyes, but too quickly to notice anything. The girl shook her head, trying to see where and what she was seeing, but it was all in vain.","","","","",""
"""""","narrator_ZS7VvcNc","Sarah clutched her head, trying to calm the headache. Memories flashed through my head faster and faster. Images, figures, scraps gathered and scattered again into small pieces.","","","","",""
"S """"","S_mVrUauML","Thousand!","","","","",""
"S """"","S_nfgmQup7","...","","","","",""
"S """"","S_8HghbZNN","A thousand?","","","","",""
"""""","narrator_H7jCKjso","The pain was gone, but the memories did not become clear enough for the girl to understand anything.","","","","",""
"S """"","S_XERbNrZ5","And what did it give me?","","","","",""
"S """"","S_fjLm3YiS","Have we celebrated a thousand days here? No, I haven't been here that long...","","","","",""
"S """"","S_4a2XVAZV","Was it... Is it the future???","","","","",""
"S """"","S_WK8BUC7Q","Arg! I understand nothing...","","","","",""
"S """"","S_sCGWePZb","Damn room! It's driving me crazy!","","","","",""
"""""","narrator_3ysEZqQa","On the side of the bed, Sarah found a mountain of crumpled, torn and soaked paper. Some of it was flattened, but in general it looked somewhat like a nest.","","","","",""
"S """"","S_jjMEc7A3","There was definitely something written on them. Maybe this will help me understand?","","","","",""
"""""","narrator_3o5r7YCf","The girl was less and less sure that she participated in this event, because nothing in her head responded to the findings.","","","","",""
"S """"","S_RD8rBZ6v","The ink is completely blurred... Nothing can be made out of these blots.","","","","",""
"""""","narrator_ohwdcX6y","Sarah could have sworn that the little zerg was rummaging around the box right in front of her eyes, as if the whole pile wasn't there. Groans and exclamations could ber heard nearby, but the girl could not see what was happening through the fog.","","","","",""
"""""","narrator_buoLnEuD","The terran held out her hand, snapping back to reality. There was still a pile of damaged paper in front of her, and the zergling was gone.","","","","",""
"""""","narrator_WXGuBPay","Sarah was about to give up, stepping away from the bed, when something rustled under her foot.","","","","",""
"S """"","S_rmCoZo2G","Ticket number 826... Torn in half.","","","","",""
"S """"","S_Ljwdzrd9","How old-fashioned. This is how used passes were marked not even in the past centure, but the century before last one. What prehistoric creature made this pile?","","","","",""
"S """"","S_ZnxxznVU","...","","","","",""
"S """"","S_8abuY5rq","And once again only one creature comes to mind...","","","","",""
"""""","narrator_rnPbmGXc","The moans began to get louder, and the zergling no longer walked around the box. He was pulling the tape of tickets, creating a whole nest for himself. Sarah stared in surprise at the picture in front of her, not understanding what was happening and when.","","","","",""
"""""","narrator_feJxmFko","The zergling suddenly found himself under all the tickets, his eyes glittering predatory. He wasn't of much interest to Sarah. For her, what was happening next to it was more important.","","","","",""
"S """"","S_Mf5HRqhM","I don't remember anything... I can hear, but I can't see anything...","","","","",""
"S """"","S_hgyvjbsL","There was clearly something there. These tickets... Some kind of zergling...","","","","",""
"S """"","S_DpxuBrXK","The only question is why...","","","","",""
"""""","narrator_KJTPBhxV","Sarah walked around the room, noticing that no one even tried to clean it. Everything seemed to have been done in a hurry, but she was sure that some things were taken and some were put together into neat piles.","","","","",""
"S """"","S_W3FANEBd","How curious...","","","","",""
"""""","narrator_HwyMHPhy","Sarah saw a solid screen in front of her. Something was rustling nearby, but everything was so blurry that neither the source of the rustling nor the images on the screen could be made out.","","","","",""
"""""","narrator_oHoto8Xo","The girl was standing in front of a small screen. It turned out to be broken, but some pixels were still working. Some green lines were visible on the screen.","","","","",""
"""""","narrator_iWMf5wwL","The image became clearer, but someone's claws began to scratch the fragile screen at the same time. Some more pixels got damaged. Soon the whole screen was covered in cracks, and the glass crumbled to the ground.","","","","",""
"S """"","S_tsbrCKwD","Hmm, these were numbers, no doubt. But has this screen been here before?","","","","",""
"S """"","S_nAcDP7pX","The wires say so, hmm...","","","","",""
"S """"","S_ULr7buyr","I don't want to forget this place so much that I forget about something like this...","","","","",""
"""""","narrator_6qSPb7p9","Somewhere in the back of her mind there was a crunching sound. Sarah tried to focus on her memory, which felt so close that it could be grasped.","","","","",""
"""""","narrator_72Eu5ye7","Sarah was willing to bet that she had already seen this screen back when it was whole. But her head was splitting every time she tried to remember more.","","","","",""
"S """"","S_K5xTVKkb","Ah... damn, my head is splitting open...","","","","",""
"S """"","S_SyCX89GB","To hell with it!","","","","",""
"S """"","S_mP9ZKM3g","No... I don't want to know what happened here. The past remains in the past!","","","","",""
"centered """"","centered_SJxeXf3e","Sarah rushed out the door, fighting the last remnants of the desire to find out about what happened in her cell. Was she a participant? Or just an observer?","","","","",""
"centered """"","centered_Nt75eDT2","Everything will remain hidden behind these doors.","","","","",""
"S """"","S_KD3sXAgs","Phew... I think I got better. It was really a good idea to get distracted by something.","","","","",""
"S """"","S_TdzGoQAX","My vacation is over. I need to get back to work.","","","","",""
"""""","narrator_USdazeYF","Sarah was very turned on, imagining what was ahead of her. The obsessive compliments regarding her tits coming from Stukov, passed right by her mind.","","","","",""
"S """"","S_gEppVcev","My dear, if you stop your chatter right now and get busy, then I will, so be it, pay attention to you.","","","","",""
"A """"","A_YaEv6rfV","But that's not going to count...","","","","",""
"S """"","S_hEL9CULg","It doesn't matter! Today is a special day!","","","","",""
"""""","narrator_q6RhseEa","The girl laid down invitingly, waiting for the start of the marathon. Behind the doors, the hubbub of an eager crowd could be heard.","","","","",""
"S """"","S_L3R8NhcB","Ah... Can't it be faster!","","","","",""
"""""","narrator_fRmcYx88","Loud footsteps were heard, stopping only near the door. The hum immediately stopped.","","","","",""
"S """"","S_pAXPtCDb","It seems... you didn't have time, Stukov...","","","","",""
"S """"","S_bJ4ni7GT","After all, we have the first guest!!","","","","",""
"S """"","S_S4Sq3otu","Come here, quickly, I can't wait!! Mmm... Get him here!","","","","",""
"S """"","S_5LohD4Kq","Ah! Yes!","","","","",""
"""""","narrator_hKWxbZ4K","The massive zerg hovered over the girl, allowing her to wrap her arms and legs around himself. Sarah got a special pleasure when a dominant creature took her with no limits.","","","","",""
"S """"","S_RW3zDNTr","Now that's a beginning! If it continues like this...","","","","",""
"A """"","A_AGHGEnyL","Are you sure you can do this?","","","","",""
"S """"","S_BvdLh4hH","I CAN'T MISS THIS CHANCE!","","","","",""
"""""","narrator_SsCTBrmC","The massive zerg piled all his weight on Sarah, fueling the girl's feelings with the realization that she would not be able to get anywhere. The zerg did not spare the female's body, driving into it with all his strength. By his growls, the girl understood that he was getting a separate kind of pleasure from this.","","","","",""
"S """"","S_S3SYLgdR","Damn... The others will seem puny after you! You'll tear me apart!","","","","",""
"""""","narrator_auttfMMx","Something animal was awakening in Sarah from the realization that she had to satisfy hundreds of males who craved her body.","","","","",""
"""""","narrator_Dfk6XbZt","The Zerg caught the lustful thoughts of the female, adapting to her desires. Her vagina, oozing with lube, accepted the large penis with ease.","","","","",""
"S """"","S_PVoakBWM","MMMM!... So greedy you are! Do you want to fill me up faster so everyone knows who's been here?","","","","",""
"""""","narrator_KDYkVBeT","Sarah felt the penis stop more and more often, before fully entering her pussy. Her whole body shuddered, causing her chest to visibly shake. The girl couldn't get away from them.","","","","",""
"""""","narrator_cySpQoVT","R-r-r-r...","","","","",""
"S """"","S_rV7nbh2A","A-h-h-h... W-what are you doing to me! What a lustful zerg!","","","","",""
"""""","narrator_TGVFURxb","The girl could only feel the Zerg pressing her harder and harder against the bed. Its penis began to throb noticeably, and the zerg itself roared out in triumph.","","","","",""
"S """"","S_ovuNn8RK","Do you like it so much that you're ready to cum? Well yes... No one could resist me yet!","","","","",""
"""""","narrator_S9BQGGkZ","Sarah deliberately tightened her legs around the zerg, as well as her pussy aroudn the penis inside her. It now looked like Sarah didn't want to let him go, she wanted to feel the full power of the Zerg on herself. The male, in turn, felt that the female was ready. This brought him to a peak.","","","","",""
"S """"","S_79eDSWkv","Ah, that's it!","","","","",""
"""""","narrator_CE8nmVph","The girl's body went limp when the constant rough thrusts stopped. Her arms and legs ached unpleasantly from the pressing tension, but Sarah was pleased.","","","","",""
"""""","narrator_Kb8EYeko","The zerg jerked one last time, trying to penetrate as deep as possible. Thick whitish sperm gushed out, spreading over the stretched walls of the female's insides.","","","","",""
"S """"","S_nS8gN7y5","Fill me up! Let's start this festival with a bang!","","","","",""
"""""","narrator_7h4YEsKp","The body above Sarah tensed significantly, releasing an even more powerful flow. The seed did not linger in the girl for a long time, flowing out and soiling both.","","","","",""
"""""","narrator_4U78iNzB","The amount of sperm coming out of her was already ludicrous, and the marathon just started. The zerg leaned onto her even harder, stopping any attempt to escape, at the same time he felt the girl's body tremble.","","","","",""
"S """"","S_tQTWbYwx","Ah, this is a great start!","","","","",""
"""""","narrator_fxc6AzFg","The zerg pushed one last time, spilling a large portion of sperm out. Sarah heard a click indicating that the number on the scoreboard had changed. The penis immediately left her body, releasing out those small remnants of fluid that had accumulated.","","","","",""
"S """"","S_hTCRZ99d","And gone already... Didn't even say goodbye!","","","","",""
"S """"","S_BnEaFU9i","Oh, shit... how did he manage to cum so much. I feel like there's so much inside of me... Mmmm...","","","","",""
"S """"","S_EyDtPHBx","(Huh... it's just the first one, and I'm already literally crushed...)","","","","",""
"""""","narrator_33KCCStR","The next shadow appeared in the doorway.","","","","",""
"S """"","S_XupbV49A","Ooh... next, don't forget about the tickets...","","","","",""
"A """"","A_rWHBkkpt","It's finally my turn.","","","","",""
"S """"","S_FgCLCth9","Didn't I tell you you'd get it, too?","","","","",""
"A """"","A_UxxpFvcM","You better shut up and kiss me! I've been waiting forever for my turn to come.","","","","",""
"S """"","S_XVBg8uSv","Ah... No kissing, be grateful that I agreed to this at all!","","","","",""
"""""","narrator_pZfg7xae","Sarah was too wound up, forgetting everything she was hiding from Stukov. Right now, he was just a walking dick that she had to serve.","","","","",""
"A """"","A_tD7EaDuu","Ha-ha-ha, what, you still can't forget our kisses?","","","","",""
"S """"","S_osPq66SW","B-better hurry up before I change my mind!","","","","",""
"""""","narrator_7aWxJrcP","The girl sat down directly on top of the man, grabbing him with both hands. Sarah tried as best she could to avoid direct glances, not giving the pervert the opportunity to kiss her.","","","","",""
"S """"","S_RW9Ky2zV","(If this pervert thinks that he can keep his usual attitude right now, then he is very wrong!)","","","","",""
"""""","narrator_DUXbxYyA","Sarah abruptly sank onto the excited womb pecker, she could not control her emotions, because Stukov would not see anything anyway. He was completely focused on enjoying what was happening.","","","","",""
"A """"","A_cZY7ZQ9j","Is that why you chose this pose? So as not to lose your head again?","","","","",""
"A """"","A_XgxeU5tt","I've been waiting for this for so long... When I was training you, we saw each other more often one-on-one. We had more opportunities to be 'with each other'.","","","","",""
"A """"","A_jST4JVYh","You know what I mean?","","","","",""
"""""","narrator_BmhVyfTe","The old pervert winked, although he understood that they could not see each other's emotions.","","","","",""
"S """"","S_Xj6XT74P","So enjoy your moments of glory...","","","","",""
"A """"","A_959qmEkR","I'll do it!","","","","",""
"""""","narrator_5Yri3NLz","Sarah lifted herself up only to drop sharply. She fought his wandering hands away when he tried to put them on her waist, trying to guide her movements.","","","","",""
"A """"","A_FqFwVRKE","You can't stop me here anymore! We play by my rules!","","","","",""
"""""","narrator_fJEvWduL","The girl had to put a lot of effort to restrain her voice. New angle, new sensations. Sarah was ready to bite through her lips, just not to moan.","","","","",""
"A """"","A_JWB6JnWE","Don't hold back! Your pussy tells me everything you want to keep to yourself anyways, heh-heh-heh!","","","","",""
"A """"","A_ExnDv6Nz","Did you miss the good old dick of Stukov?","","","","",""
"S """"","S_tAVugs88","Well you've got a point, it is old...","","","","",""
"""""","narrator_YhVjKn3d","The Ghost began to accelerate, with each thrust plunging the penis deeper and deeper inside herself. It was already starting to reach her cervix, sending waves throughout her body.","","","","",""
"A """"","A_KozSkyQD","But who else will bring you to orgasm as quickly?","","","","",""
"S """"","S_BCrKexwU","Hm...","","","","",""
"""""","narrator_RhdkTPHm","The girl was in no hurry to agree with him, but inside she knew that Stukov was right. Little stars were already dancing in front of her eyes. Sarah had a revelation about their compatibility even during their trainings together.","","","","",""
"""""","narrator_rhGWhTbt","The man continued to guide her hips, their movements in perfect sync.","","","","",""
