location,source,target,ID,fuzzy,context,translator_comments,developer_comments,gametemplate
,C_8420f2ba,"(Согласно моим знаниям терранов это значит, что дальше будет разговор, который мне не понравится.)",,,,,,"C ""%%"""
,S_24423990,"(Ты правильно понимаешь. Я хотела, чтобы ты объяснил, что делаешь по ночам с моим телом.)",,,,,,"S ""%%"""
,C_62de3664,"(Учусь его контролировать более искусно, а не просто захватывать контроль. Я уже рассказывал.)",,,,,,"C ""%%"""
,S_d6823457,"(Я хочу знать, что ты делаешь, пока контролируешь мое тело ночью, когда я сплю...)",,,,,,"S ""%%"""
,C_ed0e75eb,"(Ничего такого, о чем ты подумала, я не делаю. Это мешало бы тебе спать и было бы плохо для тренировок. Почему ты сразу думаешь об интимном?)",,,,,,"C ""%%"""
,S_ba4c045f,"(Я не думаю! Это вы, зерги, извращенцы. Поэтому я тебя подозреваю...)",,,,,,"S ""%%"""
,C_8326c5a0,"(Да, конечно, а откуда ты знаешь, как мыслят извращенцы?)",,,,,,"C ""%%"""
,S_236570ca,(Я просто обладаю широким кругозором.),,,,,,"S ""%%"""
,C_d3c7e017,"(Хи-хи, а я думаю это потому, что ты сама извращенка. Как у вас говорят? Хочешь найти вора — найми вора?')",,,,,,"C ""%%"""
,S_a85fb316,"(Н-нет, все совсем не так! Дурак!)",,,,,,"S ""%%"""
,S_fc784b69,"(Эй, мне нужно узнать кое-что о зергах.)",,,,,,"S ""%%"""
,C_eb512b90,"(Хм, обычно ты спрашиваешь только в тот момент, когда видишь что-то новое. С чего такое любопытство?)",,,,,,"C ""%%"""
,S_c9756c94,"(Просто подумала, что стоит выяснить больше о зергах. И я хотела узнать подробности о ползучести.)",,,,,,"S ""%%"""
,C_22b340cf,"(Хорошо, слушай профессора Сай'мона и запоминай. Крип это...)",,,,,,"C ""%%"""
,S_c8c9b224,(Профессора?),,,,,,"S ""%%"""
,narrator_30b3fc8a,"Сара представила себе Сай'мона, паразита зергов в белом халате и с густой белой бородой, и в голос засмеялась.",,,,,,"""%%"""
,C_006aeaea,"(Эй, я пытаюсь читать лекцию!)",,,,,,"C ""%%"""
,S_801fbaf1,"(Хи-хи, прости, но ты не очень похож на профессора.)",,,,,,"S ""%%"""
,C_08c6c0c6,"(Знаете что, юная леди, это неуважение к науке!)",,,,,,"C ""%%"""
,S_df6a575c,"П-прекрати, ха-ха-ха.",,,,,,"S ""%%"""
,C_6160e689,"(И вообще, думаю, мне бы подошла густая бородка.)",,,,,,"C ""%%"""
,S_10c86be5,"(И что ты так всполошился, я же просто шучу, Хи-хи.)",,,,,,"S ""%%"""
,C_6e055162,"(Ну раз ты так неуважительно относишься к науке то, я тебе только краткую версию дам.)",,,,,,"C ""%%"""
,C_4d8f7714,"(Ползучесть это основа любого улья зергов. Она достигается благодаря использованию особой слизи. Та одновременно выполняет роль дорог, производства пищи для роя и добывает полезные ископаемые из почвы.)",,,,,,"C ""%%"""
,S_70280cf0,"(Подожди, я видела ее. Но зерги что, едят это? И добычей же занимаются дроны.)",,,,,,"S ""%%"""
,C_81e36722,"(Да, слизь это основная еда роя. И прежде чем ты спросишь — нет, ты ее есть не можешь. В лучшем случае тебя вырвет... А в худшем станешь обычной зараженной.)",,,,,,"C ""%%"""
,S_b5405e79_4,(...),,,,,,"S ""%%"""
,C_8a63cee5,"(Ага. Так что ешь то, к чему привыкла. А так крип добывает всякие вещи из почвы и, что самое важное, передает их зданиям.)",,,,,,"C ""%%"""
,C_672f6578,"(Дроны же, в свою очередь, занимаются добычей крупных пород, в частности, минералов. Для этого у них на передней части есть сильные клешни. Да, кстати, с их помощью они могут разрезать человека напополам, но не более того. Их силы недостаточно для того, чтобы пробить доспех.)",,,,,,"C ""%%"""
,C_5fd376ce,"(После чего они сбрасывают ресурсы в пищеварительные ямы инкубаторов. Это как твоя кровеносная система, только в тысячу раз больше и намного более эффективная!)",,,,,,"C ""%%"""
,S_bbecf585,"(То есть, если слизь будет уничтожена, то здания, растущие на ней, сдохнут с голоду?)",,,,,,"S ""%%"""
,C_04610e59,(Ага. Именно так.),,,,,,"C ""%%"""
,S_7e5de993,(Понятно. Это все так странно и далеко за пределами наших знаний. Мне надо подумать.),,,,,,"S ""%%"""
,C_34c102c4,(Поговорим в другой раз.),,,,,,"C ""%%"""
,S_0f7426ce,"(Сай'мон, у меня есть вопросы про тентакль, который я нашла.)",,,,,,"S ""%%"""
,C_26bd2d54,"(A что ты хочешь знать? По-моему, все и так понятно.)",,,,,,"C ""%%"""
,S_335303e3,(Зачем я вообще взяла это щупальце?!),,,,,,"S ""%%"""
,S_3146d571,(Сай'мон!),,,,,,"S ""%%"""
,C_eef54bcb,(Ааа? Что еще?),,,,,,"C ""%%"""
,S_8869d2c7,(Зачем ты сказал мне взять тот тентакль?),,,,,,"S ""%%"""
,C_09d8f6cc,"(Это была просто шутка. Но знаешь... Возможно, ты найдешь ему применение.)",,,,,,"C ""%%"""
,S_13f5e99b_3,...,,,,,,"S ""%%"""
,S_f7b003fe,(Ты и твои шуточки! Идиот...),,,,,,"S ""%%"""
,S_e10f46c8,"(Ну что, мы будем продолжать?)",,,,,,"S ""%%"""
,C_eff8daae,(Ты ведь еще не закончила с моим заданием.),,,,,,"C ""%%"""
,S_13f5e99b_4,...,,,,,,"S ""%%"""
,S_85426a6b,"Ладно, я завершу его...",,,,,,"S ""%%"""
,C_ad12dc02,"(Я понимаю, что ты хочешь как можно быстрее с этим покончить, но тебе нужно отдохнуть, так что продолжим завстра.)",,,,,,"C ""%%"""
,S_13f5e99b_5,...,,,,,,"S ""%%"""
,S_e1c40282,"Ладно, завтра так завтра.",,,,,,"S ""%%"""
,narrator_cdff0e62,"Вам не хватает уровня, займитесь другими сценами.",,,,,,"""%%"""
,S_18112550,"У меня нет сил еще заниматься, нужно отдохнуть.",,,,,,"S ""%%"""
,S_18112550_1,"У меня нет сил еще заниматься, нужно отдохнуть.",,,,,,"S ""%%"""
,S_d981f642,"Я... я... я не могу заниматься, когда на мне это белье...",,,,,,"S ""%%"""
,S_91662bb7,"Эм... возможно, мне стоит провести тренировку без одежды?",,,,,,"S ""%%"""
,S_54367a57,(О чем только я думаю.),,,,,,"S ""%%"""
,S_d4194274,Стоит повременить с этим и вернуться к обычным тренировкам.,,,,,,"S ""%%"""
,S_5a05b894,Я должна держать себя в отличной форме.,,,,,,"S ""%%"""
,S_9f213e87,"Я в отличной форме, но мне все равно стоит продолжать заниматься",,,,,,"S ""%%"""
,narrator_8c7fe560,Сара выполняет комплекс боевых упражнений.,,,,,,"""%%"""
,narrator_8c7fe560_1,Сара выполняет комплекс боевых упражнений.,,,,,,"""%%"""
,narrator_c300bf5e,Сара закончила тренировку. Она чувствует себя увереннее.,,,,,,"""%%"""
,narrator_5385255d,Ее энергия сильно понизилась. Саре нужен отдых.,,,,,,"""%%"""
,S_d49a5cdb,*Тяжело дышит* Отлично... это была хорошая тренировка. Но я не должна останавливаться на этом.,,,,,,"S ""%%"""
,narrator_cb83a788,Сара не пропускала свои ежедневные тренировки и теперь она чувствует себя сильнее.,,,,,,"""%%"""
,S_18112550_2,"У меня нет сил еще заниматься, нужно отдохнуть.",,,,,,"S ""%%"""
,S_4ab6a76e,!!!,,,,,,"S ""%%"""
,S_13f5e99b_6,...,,,,,,"S ""%%"""
,S_4ab6a76e_1,!!!,,,,,,"S ""%%"""
,S_13f5e99b_7,...,,,,,,"S ""%%"""
,S_4ab6a76e_2,!!!,,,,,,"S ""%%"""
,S_13f5e99b_8,...,,,,,,"S ""%%"""
,S_3a32f78d,Ахх... черт... я не могу сконцентрироваться из-за этого белья...,,,,,,"S ""%%"""
,S_16fa9890,"Я думаю, от таких тренировок никакой пользы...",,,,,,"S ""%%"""
,narrator_020cd06b,"Сара чувствует себя некомфортно в этом белье, попытка не дала результата, а Сара сильно устала.",,,,,,"""%%"""
,S_4ab6a76e_3,!!!,,,,,,"S ""%%"""
,S_13f5e99b_9,...,,,,,,"S ""%%"""
,S_4ab6a76e_4,!!!,,,,,,"S ""%%"""
,S_13f5e99b_10,...,,,,,,"S ""%%"""
,C_878348a0,(Что ты делаешь??!),,,,,,"C ""%%"""
,S_54f9cf59,"Пытаюсь пробудить свои пси-способности, не мешай.",,,,,,"S ""%%"""
,C_ee4bb7df,(Что за глупости?? Зачем?!),,,,,,"C ""%%"""
,S_0ba9a13c,Не твое дело!,,,,,,"S ""%%"""
,C_b3ff9919,"(Если у тебя получится, то мне придется тебя вырубить. Ты этого хочешь? Если ты не можешь уснуть - так и скажи, я тебе помогу, не надо так изощряться!)",,,,,,"C ""%%"""
,S_56ab486c,"Говорю, не мешай.",,,,,,"S ""%%"""
,C_cc749d69,"(Ну, как знаешь...)",,,,,,"C ""%%"""
,S_4ab6a76e_5,!!!,,,,,,"S ""%%"""
,S_13f5e99b_11,...,,,,,,"S ""%%"""
,narrator_85356154,Сара старается пробудить свои пси-способности.,,,,,,"""%%"""
,narrator_18077094,"Попытка не дала результата, а Сара сильно устала.",,,,,,"""%%"""
,S_4d71ffb8,"На сегодня хватит, сперва нужно востановить силы.",,,,,,"S ""%%"""
,S_e07e1e80,Мне нужно найти способ выбраться отсюда!,,,,,,"S ""%%"""
,C_5a3b9a93,(И что же ты предлагаешь?),,,,,,"C ""%%"""
,S_2249893b,Я не знаю... должно же быть хоть что-то тут.,,,,,,"S ""%%"""
,C_8f8ee895,(...),,,,,,"C ""%%"""
,narrator_f3fe2dcc,"Сара, уже в который раз, собирается с силами и продолжает рыскать по комнате в надежде найти еще чего-нибудь.",,,,,,"""%%"""
,narrator_c550dd1e,Сара начинает тщательно осматривать комнату.,,,,,,"""%%"""
,narrator_d97b856d,"Первым делом Сара решила осмотреть ее 'любимые' тентакли, к которым когда-то ее приковывали.",,,,,,"""%%"""
,narrator_cd6bf501,"Непонятно, что она хотела там найти, но, к сожалению, ничего не обнаружила.",,,,,,"""%%"""
,narrator_a281d5db,"Но она не падала духом, она решила осмотреть свою кровать.",,,,,,"""%%"""
,narrator_c0ac44d1,"Как ни пыталась она залезть под кровать или под подушки, у нее не получалось.",,,,,,"""%%"""
,narrator_65efb004,От безысходности Сара решила начать ползать по полу в поисках какого-нибудь прохода или какого-нибудь предмета.,,,,,,"""%%"""
,narrator_86a800a2,"Но полы были чисты, на них не было ни крошки.",,,,,,"""%%"""
,narrator_6d573238,Прошло некоторое время.,,,,,,"""%%"""
,narrator_1fe3058f,"Она тратит на это очень много времени, но, к сожалению, ей так и не удалось ничего найти.",,,,,,"""%%"""
,S_96bbad04,(Черт!),,,,,,"S ""%%"""
,S_7b756d74,(Я так просто не сдамся! Должно же тут быть хоть что-то! Я обязательно найду способ выбраться отсюда!),,,,,,"S ""%%"""
,narrator_410b2b56,"На поиски ушло слишком много сил, Сара устала и нуждается в отдыхе.",,,,,,"""%%"""
,S_8a3c9442,"Тут точно должно быть, что-то что поможет мне выбраться отсюда!",,,,,,"S ""%%"""
,S_d68ac252,"Я не сдамся, я обязательно выберусь!",,,,,,"S ""%%"""
,S_42a6853e,"Думаю, мне стоит повременить с этим.",,,,,,"S ""%%"""
,S_5d5e1ec4,"Похоже на кровать, но выглядит она весьма странно и пугающе. Я бы легла на такое только при очень сильном изнеможении.",,,,,,"S ""%%"""
,S_f94c48e9,Я-я уже сделала дело... нужно теперь сказать Стукову об этом...,,,,,,"S ""%%"""
,S_92cbd270,"Думаю на сегодня достаточно, займусь этим завтра.",,,,,,"S ""%%"""
,S_d84fb1b4,"Ну что, время рукоблудить, хи-хи-хи. Где там мой журнальчик...",,,,,,"S ""%%"""
,narrator_eaaf7d28,Дрочильник обновлен: осталось {color=#718c3e}[counter_fap_day_last]{/color} дней.,,,,,,"""%%"""
,S_8dabdf8d,Так... Стоит приступать.,,,,,,"S ""%%"""
,S_3541f257,Как же Стуков это делал?,,,,,,"S ""%%"""
,narrator_948576d0,"Сара пристально смотрела на свою руку, пытаясь повторить положение пальцев за Стуковым.",,,,,,"""%%"""
,C_db5b8a4e,Ты ничего не забыла?,,,,,,"C ""%%"""
,S_27e74af1,"Ах, точно. Журнал!",,,,,,"S ""%%"""
,S_1e2a1f12,"Мне кажется, что с каждым разом у меня получается все лучше, хи-хи.",,,,,,"S ""%%"""
,S_15df88ee,"Может быть, скоро я стану профи?",,,,,,"S ""%%"""
,C_6dea15df,Для этого тебе стоит больше практиковаться.,,,,,,"C ""%%"""
,S_23e4e671,Ты прав... Тогда сейчас и начну!,,,,,,"S ""%%"""
,narrator_2e1cf8fd,"Сара успешно завершила тренировку, достигнув нескольких оргазмов. Осталось [counter_fap_day_last] дней.",,,,,,"""%%"""
,narrator_0a73a297,"Сара завершила тренировку, кончив один раз. Осталось [counter_fap_day_last] дней.",,,,,,"""%%"""
,narrator_3effa241,"Сара смогла удовлетворить себя, но посчитала, что может достичь больших результатов. Возможно, она повторит тренировку перед сном. Осталось [counter_fap_day_last] дней.",,,,,,"""%%"""
,S_23fcb443,(Мне некуда так спешить... думаю лучше этим заняться завтра...),,,,,,"S ""%%"""
,narrator_a01b70ee,"Вам не хватает уровня, займитесь другими сценами.",,,,,,"""%%"""
,S_2e4db5b9,"Я не могу сейчас лечь спать, он ждет меня...",,,,,,"S ""%%"""
,S_ae89bc8b,"Еще слишком рано... интересно, чем бы мне сегодня заняться.",,,,,,"S ""%%"""
,S_90791809,Слишком рано ложиться спать.,,,,,,"S ""%%"""
,narrator_346fba95,"(Я не устала, у меня полно сил.)",,,,,,"""%%"""
,S_07475e80,"Я не могу лечь спать, я сильно голодна.",,,,,,"S ""%%"""
