"location","source","target","ID","fuzzy","context","translator_comments","developer_comments"
"SideS """"","SideS_27bf4590","П-плохо... Они реагируют, но не так, как нужно, ха-а-а.","","","","",""
"SideS """"","SideS_7f52e6bb","Должна ли я... Представить? Представить, как эти юркие малыши сковывают ошарашенного Стукова, хи-хи.","","","","",""
"""""","narrator_d2119f18","Сара прикрыла глаза, в красках представляя себя сцену пленения мужчины. Ее пробирала дрожь от ощущения величия, когда тентакли в ее фантазии схватили жертву, как только она указала на нее рукой.","","","","",""
"SideS """"","SideS_20e1c99d","Н-ничего не выходит, они не реагируют.","","","","",""
"SideS """"","SideS_cd5151ea","Они... Они просто пытаются насиловать мое тело!","","","","",""
"SideS """"","SideS_4f2a1df9","Мммм...","","","","",""
"SideS """"","SideS_5dbdfc83","Ах, кажется, они немного перестарались.","","","","",""
"SideS """"","SideS_278a6881","Моя киска так течет... А эти щупальца только и рады, ммм! Их только сильнее туда тянет...","","","","",""
"""""","narrator_ab188966","Сара сконцентрировалась не только на тентаклях, но и на ощущениях собственного тела. Она чувствовала, как влажно было между ее ног из-за всей этой тренировки. Тентакли так же ощущали ее пробудившееся желание, больше не ощущая препятствий.","","","","",""
"SideS """"","SideS_30294f2d","Я должна взять контроль над ними... я не смогу так долго их продержать... нужен всего один миг, не более...","","","","",""
"""""","narrator_22ecc51d","Сара снова закрыла глаза, пытаясь сконцентрироваться и поймать тот самый миг, когда они расслабятся и она сможет завладеть ими.","","","","",""
"SideS """"","SideS_24bfb351","Черт... это не так просто... концентрироваться и не терять контроль... грязные тентакли...","","","","",""
"""""","narrator_056767b1","Но она не сдавалась, она продолжала концентрироваться, по телу стало проходить все больше волн удовольствия, на лице все чаще появлялись нотки удовольствия, сменяя отрешенную гримасу.","","","","",""
"SideS """"","SideS_5a4d5092","Давайте же, я больше чем уверена, у вас должны быть слабости, да... мое тело и есть ваша слабость, пока вы с ним играетесь, я смогу взять над вами верх!","","","","",""
"SideS """"","SideS_fb3d03f0_1","!!!","","","","",""
"SideS """"","SideS_9e7b1f21","Вот она!!! Прямо сейчас!","","","","",""
"""""","narrator_fd5dd433","Девушка нашла брешь, которую искала. Тентакли ослабили бдительность, и Сара смогла подчинить их.","","","","",""
"SideS """"","SideS_45850e57","Ха?!","","","","",""
"SideS """"","SideS_01c54d72","Мммм... Моя киска!","","","","",""
"""""","narrator_fd3a85f9","*Хлюп* *Хлюп*","","","","",""
"""""","narrator_504dbed5","Сара не ожидала такого напора от щупалец, которым наконец выпал шанс проникнуть к самому чувствительному месту.","","","","",""
"""""","narrator_1c201f0a","*Хлюп* *Хлюп* *Хлюп*","","","","",""
"SideS """"","SideS_46ec7077","Э-это не совсем то, что я ожидала... н-неужели я попалась на их уловку???","","","","",""
"""""","narrator_cfa951f3","Сара с трудом могла игнорировать довольно большой тентакль, который сосредоточил свое внимание на ее промежности.","","","","",""
"SideS """"","SideS_459a640a","Ах... нет... перестань!!!","","","","",""
"""""","narrator_1c201f0a_1","*Хлюп* *Хлюп* *Хлюп*","","","","",""
"SideS """"","SideS_f7627cc3","Пока он трется медленно... Ааарг, но если он ускорится? У меня не будет и шанса... нужно быстрее что-то придумать!!!","","","","",""
"""""","narrator_7cedb372","Но тентакли не собирались щадить Сару, она продолжали с разных сторон атаковать ее тело, заставляя все чаще и чаще выдавать похабные стоны.","","","","",""
"""""","narrator_1c201f0a_2","*Хлюп* *Хлюп* *Хлюп*","","","","",""
"SideS """"","SideS_902ca8b1","Ммм.... Ах... Мммм... Все это приятно, но кончать не входило в мои планы, хах.","","","","",""
"""""","narrator_0651cda1","У девушки получалось себя отвлекать от действий проворных щупалец. На этом все и заканчивалось, но для завершения своей цели ей нужно было придумать новый план.","","","","",""
"SideS """"","SideS_22a07a03","Они определенно ослабляют бдительность, но этого мало... я должна застать их врасплох... сделать что-то, чего они не будут ожидать... и в этот самый момент завладеть ими!","","","","",""
"SideS """"","SideS_dc4101fd","У меня есть еще одна идея... а как вам такое!!!","","","","",""
"""""","narrator_3161cb52","Девушка подняла руки вверх, расставляя еще более развратно ноги и выставляя киску вперед, давая тентаклям еще больше пространства для их грязных делишек.","","","","",""
"SideS """"","SideS_76c68e13","Это оно! Прямо сейчас!!!","","","","",""
"""""","narrator_f3bcae5b","Вмиг тентакли попытались схватить пустоту, это было место, запланированное для Стукова. У нее все же получилось, хоть и на миг, но все же взять контроль над тентаклями.","","","","",""
"SideS """"","SideS_0b892111","Это... Ах, отлично! Они слушаются, если дать им дать немного больше... М-мне этого хватит, ах...","","","","",""
"SideS """"","SideS_da1934f5","Т-теперь я уверена... Мммг, это была не случайность. Я нашла к ним подход.","","","","",""
"SideS """"","SideS_e6731d37","Ах... мои соски, прекрати их сжи... ММММ...","","","","",""
"""""","narrator_39aa34b5","Сара забыла, как стояла в еще более развратной позе, позволяя им трогать все свое тело. Тентакли не прекращали свои грязные дела, позволяя себе все больше.","","","","",""
"SideS """"","SideS_40e17d27","(Тентакли на груди еще можно пережить... А-а-а-ах, мои соски еще не так чувствительны, хоть эти щупальца и очень упорно пытаются их зажать.)","","","","",""
"SideS """"","SideS_e8cc4783","Мммн, но эти щупальца внизу... Я чувствую собственную смазку на бедрах, ах!","","","","",""
"""""","narrator_635a9f08","Сара порывалась подойти ближе, но здравый смысл подсказывал ей, что это не закончится ничем хорошим.","","","","",""
"SideS """"","SideS_9db03bb6","С-стоит ли мне закончить на этом? Или еще потренироваться? Это был всего лишь один раз...","","","","",""
"SideS """"","SideS_8762d02e","Нет... мне определенно нужно больше практики, у меня будет всего один шанс!","","","","",""
"""""","narrator_8ef162f6","Девушка и сама понимала, ради чего продолжает это. Ее тело требовало все больше ласк, которые тентакли с удовольствием ей предоставляли.","","","","",""
"SideS """"","SideS_6c7bd7b8","Мммх, эти малыши знают, что нужно делать...","","","","",""
"SideS """"","SideS_9e27a6ae","(Отлично, теперь повторим...)","","","","",""
"centered """"","centered_ba478c60","Сара продолжала тренировки, не забывая повторять команду время от времени, добиваясь все большей четкости в выполнении. У нее стало лучше получаться контролировать тентакли, они все так же слушались ее команды лишь на мгновение.","","","","",""
"SideS """"","SideS_3c7a115c","Ха... ч-черт... м-моя киска... такая грязная... они ни на минуту не останавливались...","","","","",""
"SideS """"","SideS_14675883","Какие послушные, ах... Еще бы они не слушались после всего, что они со мной с-сделали....","","","","",""
"SideS """"","SideS_6e51d585","Но это еще не все... А-А-АХ!","","","","",""
"""""","narrator_e64ff06f","Тентакли ускорили свое движение, быстрее стимулируя эрогенные зоны.","","","","",""
"SideS """"","SideS_f77342b9","Хааа... Э-это не то, что я имела ввиду!!! Вы все не так поняли!! Нет, перестаньте, не так сильно... Моя киска, ах!","","","","",""
"""""","narrator_1c201f0a_3","*Хлюп* *Хлюп* *Хлюп*","","","","",""
"SideS """"","SideS_8a335de5","Это слишком! Хорошо... что я не так близко, ммм.","","","","",""
"SideS """"","SideS_8c1d10e3","(Черт... Еще немного и я снова кончу! Это удовольствие снесет мне голову!)","","","","",""
"""""","narrator_48ef1fad","Это был не первый раз, когда Саре не хватало концентрации и тентакли могли делать с ней все, что им вздумается.","","","","",""
"SideS """"","SideS_e308ae54","Мммм... Ахх... только не снова!!!","","","","",""
"""""","narrator_d846c1f6","Сара с трудом собиралась с силами, чтобы направить энергию щупалец на захват пустоты. По крайней мере, она так думала.","","","","",""
"SideS """"","SideS_62d5182c","Ааарг...","","","","",""
"""""","narrator_1c201f0a_4","*Хлюп* *Хлюп* *Хлюп*","","","","",""
"SideS """"","SideS_74919e7b","У-У-У-У-У-У-У-У!!!!","","","","",""
"SideS """"","SideS_d2bcbdc0","И если все хорошо... Я могу еще немного расслабиться, хи-хи.","","","","",""
"SideS """"","SideS_fb3d03f0_2","!!!","","","","",""
"""""","narrator_cbac4e2c","Тентакли не собирались давать девушке передышку, расширяя масштаб своих действий. Активные щупальца лапали все тело, не упуская возможности задержаться на самых горячих и привлекательных местах.","","","","",""
"SideS """"","SideS_3135e7f3","А-а-ах! Я-я чувствую свою смазку не только внизу...","","","","",""
"SideS """"","SideS_7a7ecbe0","Ха, эти малыши! Они сжимают и трогают меня... Повсюду, ах!","","","","",""
"SideS """"","SideS_c4f5a4a8","Мммг...","","","","",""
"""""","narrator_0ead5d2d","Мысли Сары путались, она не знала, стоит ли ей продолжать в таком состоянии или же прекратить попытки. Ведь она все больше понимала, что шанс на успех крайне мал.","","","","",""
"SideS """"","SideS_de1ca1f2","П-пора прекращать... В голове пустота из-за всего этого... трения, ха.","","","","",""
"SideS """"","SideS_e20fb541","(Моя киска... Было слишком много внимания к ней...)","","","","",""
"SideS """"","SideS_a029bb43_1","...","","","","",""
"SideS """"","SideS_cdd634cd","(Только подумать... им все мало... если бы они меня схватили...)","","","","",""
"SideS """"","SideS_fb3d03f0_3","!!!","","","","",""
"SideS """"","SideS_b36fe78e","Нет! Даже думать боюсь, чтобы они со мной сделали...","","","","",""
"""""","narrator_a55977ae","От невольного представления Сара рефлекторно сглотнула накопившуюся слюну в горле.","","","","",""
"S """"","S_b6663b62","Но... я считаю, что это настоящая победа! Они так хорошо меня слушали...","","","","",""
"C """"","C_1853f87c","(Да ладно тебе, они всего пару раз послушались тебя, остальные разы...)","","","","",""
"S """"","S_8222a4d8","Остальные разы были тоже удачными... я-я... просто пробовала разные способы.","","","","",""
"C """"","C_bafccd09","(Даааа.... разные способы...)","","","","",""
"S """"","S_d69ff974","!!!","","","","",""
"S """"","S_c55da7ef","Ты что, мне подмигнул?","","","","",""
"C """"","C_f22d3832","(Э??? Откуда ты знаешь?)","","","","",""
"S """"","S_4736462a","Я просто нутром чую, что ты издеваешься надо мной!","","","","",""
"C """"","C_f74b6846","(Даже не думал!)","","","","",""
"C """"","C_1d9d39ee","(*Подмигивание*)","","","","",""
"S """"","S_d97a9c9c","СЕЙЧАС ЖЕ ПРЕКРАТИ!","","","","",""
"C """"","C_b30d23ec","(Да что сразу я?)","","","","",""
"S """"","S_f1a7499c","(Я... я не знаю, как это передать, но ты определенно снова подмигиваешь!)","","","","",""
"C """"","C_ff62eb3f","(Постой, я чувствую между нами какую-то связь, что-то меняется, наши отношения выходят на новый уровень!)","","","","",""
"S """"","S_37a7ca88","Ты серьезно?","","","","",""
"C """"","C_5c7b5031","(Полностью, неужели... теперь мы стали нечто большим?!)","","","","",""
"C """"","C_219d86b8","(Мне кажется, я могу завершать за тобой фразы, даже не читая твои мысли. Давай попробуем!)","","","","",""
"S """"","S_2930f149","Прекрати... что за глупости? И какой в этом смыс? Ты и так все знаешь.","","","","",""
"C """"","C_d5fe78b8","(Ну перестань, давай же. Прямо сейчас начни фразу, а я ее закончу! Все, я перестал читать твои мысли. Давай же, мы как одно целое, я и ты, ты и я... мы сделаем это! Давай же, я готов!)","","","","",""
"C """"","C_53e7e327","(Фух!!! Я в таком предвкушении!)","","","","",""
"S """"","S_55eb3a58","Ты серьезно??? Это же звучит как бред, что это нам даст?..","","","","",""
"S """"","S_85410afb","Ладно... хорошо, только один раз...","","","","",""
"S """"","S_66830f4b","Я люблю больше всего на свете...","","","","",""
"C """"","C_3aff2fd1","(ЧЛЕНЫ!)","","","","",""
"S """"","S_363caabb","ТЫ ПРИДУРОК!","","","","",""
"S """"","S_0236550e","Нет никакой связи между нами, я так и знала, что это твой очередной бред!","","","","",""
"C """"","C_648b7315","(Да это определенно члены! Вот блин... видимо, показалось... эх... А я думал, мы перешли на новый уровень, вот скукотень...)","","","","",""
"S """"","S_b6b33bf9","Прекрати заниматься всякой фигней, у меня куча дел! Не отвлекай меня!","","","","",""
"C """"","C_f4f0edf8","Ладно-ладно. Ты хорошо постаралась сегодня. Может, позволишь себе то, что успела нафантазировать?)","","","","",""
"S """"","S_dd96c58b","Ты... Я и так позволила сегодня им слишком много. Мое тело горит!","","","","",""
"S """"","S_cba3b1b2","Они каждый раз норовили меня схватить, и с каждым разом становилось все сложнее им сопротивляться... Если бы я потеряла бдительность... весь мой план был бы обречен!","","","","",""
"C """"","C_6dc66cdd","(Какая ты скучная... Если уж ставить все на кон, так ставь до конца.)","","","","",""
"C """"","C_55ebfbeb","(Попробовала бы уже все, если выпала такая возможность. Может, открыла бы новые грани управления тентаклями. Наладила бы с ними особую связь...)","","","","",""
"S """"","S_ef75bb36","Ты несешь полный бред. Ничем хорошим бы это не закончилось.","","","","",""
"""""","narrator_d4db8199","Сара глубоко вздохнула, успокаивая свое тело после длительного напряжения.","","","","",""
"S """"","S_35167027","Неважно... Сегодня я сделала большой шаг вперед. Я должна быть уверена на сто процентов, что все пойдет нужным сценарием, прежде чем мне предстоит воплотить его в жизнь.","","","","",""
"S """"","S_a4822ee9","Мне необходимо еще пара пси-тренировок. Может, даже немного больше. Тогда я точно смогу полностью приступить и проучить одного зазнавшегося извращенца, хи-хи.","","","","",""
"S """"","S_05dad7b5","Отлично, пришло время воплотить мой план в реальность!","","","","",""
"""""","narrator_ce3e35ce","Сара без колебаний разделась, направляясь к тентаклям.","","","","",""
"S """"","S_d91f6ca0","Сегодня я обязательно выберусь отсюда! А этот извращенец... с ним тентакли поиграются как следует.","","","","",""
"""""","narrator_a933a42c","На лице Сары появилась ехидная ухмылка, она была довольна своим планом, осталось только реализовать его.","","","","",""
"C """"","C_89520269","(Слушай, я не хочу тебя, конечно же, перебивать, но... ты уже подумала о том, как будешь выбираться отсюда голой? Я думаю, у тебя не будет времени надевать всю свою броню... это же много времени!)","","","","",""
"S """"","S_d716cb0b","!!!","","","","",""
"C """"","C_0163da24","(Правда, вот бежать с твоими огромными титьками будет той еще задачкой... они же будут мешать.)","","","","",""
"S """"","S_3af01bfd","Ты просто дурак... вот что я могу сказать. Это все не важно, главное - что я выберусь. Дальше буду действовать по ситуации.","","","","",""
"S """"","S_50299b50","Я готова ко всему. Этот план просто не имеет права провалиться! Я потратила на него слишком много сил.","","","","",""
"C """"","C_137d5782","(Может, лучше ремень Стукова прихватить? Хоть титьки свои прижмешь.)","","","","",""
"S """"","S_e8cb53be","Ч-что за бред...","","","","",""
"C """"","C_f68c812e","(Ну это быстрее, нежели одеваться. А так хоба - титьки прижала и побежала. Ха-ха, даже в рифму получилось!)","","","","",""
"S """"","S_d4365af5","Только ты мог задуматься о таких вещах!","","","","",""
"C """"","C_01f0522f","(Я просто пытаюсь быть полезным!)","","","","",""
"S """"","S_98c4957c","У тебя же есть доступ к моим воспоминаниям, вот и посмотри!","","","","",""
"C """"","C_ff73627f","(Ого, а это будет интересное кинцо, как-нибудь обязательно гляну.)","","","","",""
"S """"","S_784dfa50","Н-никакого опыта у меня нет, дурак! Просто не мешай мне!","","","","",""
"S """"","S_c6dc954a","Призраку не важно, в чем ты. Нас невозможно остановить!","","","","",""
"C """"","C_2afbef9f","(Интересное убеждение, нужно будет записать, в будущем пригодится.)","","","","",""
"S """"","S_1ebbacf6","Нужно отрепетировать перед вызовом Стукова. У меня один шанс, глупо будет не подготовиться.","","","","",""
"SideS """"","SideS_13b73af1","Отлично. Похотливые тентакли, надеюсь, что вы тоже готовы выложиться на все сто. Не зря же я позволила вам играть со мной все эти дни...","","","","",""
"SideS """"","SideS_006ffd86","Не подведите меня...","","","","",""
"""""","narrator_09022a91","Сара только в этот момент поняла, что управлять тентаклями, когда они не играются с ее телом, становится практически невозможно. Она чувствовала, как много пси-силы ей нужно было использовать, чтобы немного подчинить их. Но как только она позволяла им коснуться своего тела, тентакли на время становились более податливыми.","","","","",""
"SideS """"","SideS_f722b494","А вы очень хотите мне все сорвать, верно? Но меня так просто не сломить. Каждый на этом корабле давно должен был это понять...","","","","",""
"""""","narrator_e8ec6493","К телу Сары еще не прикоснулись щупальца, но она уже ощущала дурманящее чувство возбуждения. Один только вид беснующихся тентаклей заводил ее.","","","","",""
"SideS """"","SideS_724427a7","Что ж, я скоро буду настолько возбуждена, что мне хватит сил не только на удержание Стукова, но и на что-то намного большее, хи-хи.","","","","",""
"SideS """"","SideS_6b65bc24","(Поиграться немного или не стоит? Все же... Больше возбуждения – больше сил. Нужно воспользоваться шансом.)","","","","",""
"SideS """"","SideS_cd841415","Ахх!~","","","","",""
