"location","source","target","ID","fuzzy","context","translator_comments","developer_comments"
"C """"","C_2dae5570","(Если выберешься, все же расскажи об этом побеге внукам. Они должны знать, какая же жестокая у них бабуля.)","","","","",""
"S """"","S_4b1c900f","Отнесись к этому серьезно! Я точно не решила, что буду делать со Стуковым. Может быть, взять его в заложники будет лучше, чем убить. Все же он часть Роя...","","","","",""
"C """"","C_484be2d5","(Я понял. Все действительно серьезно.)","","","","",""
"S """"","S_2a906c57","Ты думал, что я шучу?! Над такими вещами не смеются.. Я действительно хочу выбраться отсюда...","","","","",""
"C """"","C_dd94a8d5","(Ты все время прикрывалась тем, что хотела выбраться, пытаясь скрыть свое желание просто получить удовольствие и побыть извращенкой. Ты никогда не была настроена так серьезно, хотя даже сейчас ты все еще представляешь их ласки.)","","","","",""
"S """"","S_41a6f698","...","","","","",""
"S """"","S_f8256b91","Это происходит само собой. И совсем не отменяет то, что я решительно намерена выбраться!","","","","",""
"C """"","C_b5e7fc22","(Хорошо, может, у тебя и получится выбраться... Но ты подумала о том, что будет, когда ты выберешься в коридор? Думаешь, они отпустят тебя просто так?)","","","","",""
"S """"","S_52149e8f","Дальше действовать мы будем по обстоятельствам.","","","","",""
"S """"","S_90c61dac","Мы ничего не узнаем, пока не попробуем!","","","","",""
"C """"","C_faa78dcb","(Надеюсь, что у тебя ничего не получится... Для твоего же блага.)","","","","",""
"S """"","S_0fe2ad85","Бла-бла-бла, кому нужна твоя поддержка, Сай'мон? И без тебя справлюсь.","","","","",""
"""""","narrator_8fc51ddf","Сара уже более уверенно сделала пару шагов к тентаклям, с интересом наблюдая за их движением.","","","","",""
"S """"","S_cf208c88","Кто бы сомневался, что вы сразу активизируетесь. До сих пор трудно поверить, что все здесь живое и очень активное...","","","","",""
"S """"","S_34f19c12","Хм... Хотя в этом есть своя польза, хи-хи.","","","","",""
"S """"","S_83a24845","Давай, я жду твоих комментариев.","","","","",""
"C """"","C_47f5c290","(Зачем? Ты хорошо все комментируешь и без меня. Правда, фантазии с тобой наблюдать все же приятнее, чем со Стуковым.)","","","","",""
"S """"","S_4eb4da1e","Это ты мог и упустить... Я все же должна понимать, какие именно команды им давать.","","","","",""
"C """"","C_d33cbe29","(Мы могли бы обойтись простым удержанием.)","","","","",""
"S """"","S_4dd98019","Не-е-ет, так не интересно.","","","","",""
"C """"","C_064031d8","(Раз уж тебя так заботит интерес, то, может быть, снимешь броню? Тоже отличный эксперимент.)","","","","",""
"""""","narrator_26a90d50","Сара задумчиво посмотрела на свою броню и на тентакли, все же представляя себе, как они будут ласкать ее голую кожу.","","","","",""
"S """"","S_45212c4f","Ммм... Предложение очень заманчивое, но это будет слишком отвлекать от более важного процесса. Как-нибудь в другой раз.","","","","",""
"S """"","S_c02cd545","Пора проверить, насколько я стала сильнее.","","","","",""
"""""","narrator_92c8d507","Сара подошла достаточно, чтобы тентакли смогли дотянуться до нее. Как и ожидалось, они были очень заинтересованы ее грудью и промежностью.","","","","",""
"S """"","S_7be78f9a","Давайте хотя бы сейчас мы произведем честный, ах... обмен. Вы трогаете, а я контролирую.","","","","",""
"""""","narrator_e315ec1d","Сара старается полностью очистить свои мысли, оставляя на заднем плане даже самые интересные фантазии. Такая концентрация давалась ей с трудом, но Сара стала замечать, что ощущает контроль над тентаклями.","","","","",""
"S """"","S_83ab66aa","Ах... Не думать, просто не думать о том, что они меня трогают. Как бы они меня ни ласкали.","","","","",""
"S """"","S_9696f4b6","Мне не приятно. Да, мне абсолютно не... Приятно!","","","","",""
"""""","narrator_053cdce2","Чем больше Сара пыталась не думать об ощущениях своего тела, тем больше тентакли рвались напомнить о себе.","","","","",""
"S """"","S_4af3e51b","Ммм... Видимо, они не согласны на мои условия. Я так стараюсь взять их под контроль, но их интересует только одно, облапать мое тело!","","","","",""
"C """"","C_f70f0475","(Попробуй не думать о том, что у тебя не получается. Это только больше сбивает тебя с концентрации. Ты разве не заметила, что смогла взять их под контроль быстрее, чем в прошлый раз?)","","","","",""
"S """"","S_2d7b8f43","Хм, ты прав. Нужно не думать об этом, вообще ни о чем не думать, кроме как о контроле этих наглых щупалец.","","","","",""
"""""","narrator_91c3a463","Сара постепенно восстанавливала контроль, игнорируя любые неудачи. Девушка старалась не открывать глаза, чтобы увеличить свою концентрацию на связи с тентаклями.","","","","",""
"S """"","S_98e393e4","Как же это все утомительно... Но результат точно есть!","","","","",""
"C """"","C_82802fb7","(Главное не отвлекайся, а то верх одержишь не ты, а над тобой.)","","","","",""
"S """"","S_0d95e8d9","Пфф...","","","","",""
"S """"","S_78ff764c","Нужно продолжать... я не могу сейчас остановиться...","","","","",""
"""""","narrator_3c170dfe","Сара была возбуждена прикасаниями щупалец, что ласкали ее через броню, потому что даже через препятствия они очень настырно пытались залезть под одежду и обхватить соски.","","","","",""
"""""","narrator_e7b707f1","Перед ней стояла сложная ситуация. С одной стороны, тентакли сводили ее с ума. С другой стороны, невозможно закончить все это, ибо тогда все, что она делала, пойдет насмарку.","","","","",""
"""""","narrator_b900d8a7","В голову все чаще приходили мысли плюнуть на все и дать им то, что они хотят.","","","","",""
"""""","narrator_a8911bd1","Тентакли возле киски никак не улучшали ситуацию, гуляя от внутренней стороны бедра к низу живота. Они задевали все по пути, нажимая и лаская все участки, вызывающие табун мурашек по телу.","","","","",""
"S """"","S_8e51ea6b","Я могу... Только замедлить их, но не остановить полностью, ммм...","","","","",""
"S """"","S_3392342f","(Но я уже долго удерживаю их от более активных действий. Значит, все получается.)","","","","",""
"S """"","S_834ad7e6","(Ах... Но сдерживаться так тяжело. Желание позволить им делать все, что они хотят, только растет.)","","","","",""
"""""","narrator_66e9c470","Тело Сары принимало любые ласки, туманя мысли возбуждением. В голове все чаще стали мелькать самые откровенные фантазии, но Сара не собиралась сдаваться.","","","","",""
"""""","narrator_5c54db5b","Она постоянно боролась с мыслью все же позволить им поиграть с собой.","","","","",""
"S """"","S_9ea2bea5","Все под контролем! Хах... Нужно еще больше их замедлить.","","","","",""
"""""","narrator_174355d7","У Сары получилось почти полностью остановить движение щупалец, но тело только сильнее стало гореть от отсутствия необходимых ласк.","","","","",""
"S """"","S_0ae848e5","Черт... Стало только хуже. Мммх, я чувствую, как внизу мокро, но ничего не могу с этим сделать.","","","","",""
"S """"","S_dd97d536","!!!","","","","",""
"""""","narrator_b952e57d","Стоило Саре отвлечься, как тентакли возобновили свое движение, отреагировав на возбужденное тело.","","","","",""
"S """"","S_14f6277e","Ааах! Мое тело!!! Так приятно...","","","","",""
"C """"","C_3db74aca","(Кажется, все действительно выходит из-под контроля. Но твой мозг стал работать активнее. Так, может, попробуешь воспользоваться ситуацией и покажешь всю свою пси-силу?)","","","","",""
"S """"","S_1581f434","Это... Ммм! Не так просто. Голова... В ушах звенит от возбуждения.","","","","",""
"""""","narrator_d12e17ea","Сара пыталась ухватиться за какую-то определенную мысль, но именно тогда, когда думать было так необходимо, все мысли были непонятны и далеки.","","","","",""
"S """"","S_94300fc5","*Вздох*","","","","",""
"S """"","S_c712c5fa","Думай, Сара, будь выше этих чувств. Ммммг... Вам лучше прекратить!","","","","",""
"C """"","C_78bbb182","(Вот-вот, продолжай концентрироваться.)","","","","",""
"S """"","S_b9fb6472","(С каких... а-ахх... пор ты поддерживаешь меня?)","","","","",""
"C """"","C_7e13e280","(Я подумал, что это все очень хорошо развивает твою пси-силу, поэтому даже если у тебя ничего не получится с захватом Стукова, то это все равно будет хорошей тренировкой и поучительным уроком для тебя.)","","","","",""
"S """"","S_816d2c09","(Серьезно?! Почему ты додумался только сейчас?)","","","","",""
"C """"","C_1752b35a","(Лучше поздно, чем никогда.)","","","","",""
"S """"","S_432c3002","(Я... Ммм... Твоя помощь была бы кстати намного раньше, когда все было под контролем!)","","","","",""
"S """"","S_efb2ff0b","(Аххх... ммм...)","","","","",""
"""""","narrator_9ec76699","Сара, отвлеченная разговором с Сай'моном, смогла наконец поубавить пыл щупалец.","","","","",""
"S """"","S_0aa63e2e","(Хаа! Получается.)","","","","",""
"S """"","S_d5a06545","(Мое тело может отдохнуть...)","","","","",""
"C """"","C_2786ad0f","(Хм, ты действительно не зря тренировалась. Твои результаты улучшились. Может, если мы продолжим, то ты все же сможешь взять их под контроль.)","","","","",""
"S """"","S_db8e0e22","(Аххх... Нет! Я больше не могу!!!)","","","","",""
"""""","narrator_353b0c4c","Сара почувствовала, как ее тело, отдохнувшее от волн удовольствия, только сильнее стало возбуждаться от слабых ласк.","","","","",""
"S """"","S_caab6935","(Ммг, хватит, я так кончу только от трения тела об одежду...)","","","","",""
"""""","narrator_53170297","Сара на слабых ногах стала отходить от стены, все еще ощущая дикое желание кончить любым способом. Ходить было неудобно из-за невероятного количества смазки, которое не переставало выделяться из-за желания и неудовлетворенности.","","","","",""
"""""","narrator_6ac3fe81","Сара старалась не прикасаться к себе, потому что любое легкое прикосновение очень остро отдавалось внизу живота, где все горело.","","","","",""
"S """"","S_a17f33a0","Результат хороший, я смогла взять их под контроль даже в очень возбужденном состоянии. Но смогу ли выдержать больший напор?","","","","",""
"S """"","S_97e24c93","Если я кончу, то точно на время потеряю любое владение над ситуацией. А с этими проворными тентаклями нельзя себе такого позволить.","","","","",""
"C """"","C_07d4f417","(Если твое тело постоянно будет не удовлетворено после этих тренировок, то оно может привыкнуть к такому состоянию. Тем более твои результаты улучшаются в возбужденном состоянии...)","","","","",""
"C """"","C_5f146d88","(Хм, нужно подумать об этом и как-то использовать...)","","","","",""
"S """"","S_f356349c","Испытывать это каждый раз... Это издевательство.","","","","",""
"C """"","C_179697dd","(Но это твой план. Можешь отказаться от него.)","","","","",""
"S """"","S_c6a0221e","Нет, поздно отступать назад. Я ведь все равно успокоюсь и мое тело перестанет быть таких возбужденным. Так что можно и потерпеть.","","","","",""
"""""","narrator_69891b5c","Только от взгляда на тентакли тело Сары отозвалось приятным спазмом.","","","","",""
"S """"","S_383cafeb","Это будет не простым испытанием... Но они тоже привыкнут подчиняться! Да, дальше будет легче.","","","","",""
"S """"","S_4b1241f4","Но мне все еще нужно тренироваться... Этого уровня недостаточно, мне нужно стать сильнее!","","","","",""
"S """"","S_0d6396ff","Отлично, я чувствую, что готова. Все должно получиться наилучшим образом.","","","","",""
"S """"","S_6233ca90","Мы должны двигаться дальше, чтобы осуществить наш план. Я смогу еще дольше продержаться с этими тентаклями, чтобы научить их.","","","","",""
"""""","narrator_85137166","Сара пыталась прислушаться к своим ощущениям, но чувствовала только необъяснимое предвкушение.","","","","",""
"S """"","S_15132957","Чтобы выбраться, мне нужно, чтобы они слушались меня.","","","","",""
"S """"","S_a4439abb","Эти малыши не станут мне подыгрывать, если я просто попытаюсь ими управлять. Они реагируют, только когда играются с моим телом... Это все усложняет...","","","","",""
"S """"","S_c73db44b","Мне придется пойти на это.","","","","",""
"""""","narrator_d66ce1ad","Девушка без стеснения скинула свою броню, полностью оголяя тело. Предвкушение в ней только росло.","","","","",""
"C """"","C_fd1715b8","(Ого, ставки возросли!)","","","","",""
"S """"","S_d78fda3b","Все верно, была не была! Я дам им то, чего они хотят, но взамен им придется слушаться меня!","","","","",""
"S """"","S_b5c9ebda","Да и проводимость будет куда лучше, это определенно мне поможет.","","","","",""
"SideS """"","SideS_bd009bf3","Ч-что?!","","","","",""
"""""","narrator_b1955dff","На удивление девушки, тентакли мгновенно оживились, будто они только и ждали, чтобы поиграться с ее сочным телом.","","","","",""
"SideS """"","SideS_7620c26c","Даже на расстоянии они среагировали на мое голое тело...","","","","",""
"SideS """"","SideS_f9c8891d","Хех, видимо, не я одна ждала этого, вы же тоже хотите этого, правда? Мерзкие тентакли!","","","","",""
"""""","narrator_a243f7a2","Это было правдой: чем ближе Сара подходила к ним, тем активнее они начинали двигаться и тянуться к ее телу. Но достать они до девушки еще не могли, между ними была непреодолимая дистанция.","","","","",""
"SideS """"","SideS_9054184a","Да... я чувствую, как вы жаждете моего тела. Сегодня нам предстоит кое-что особенное. Все, что вам нужно, это слушаться меня! И вы получите то, что желаете.","","","","",""
"""""","narrator_086f64b8","Сара догадывалась, что тентакли вряд ли могут услышать ее, но самой девушке это придавало некую уверенность в своем тяжелом деле.","","","","",""
"C """"","C_2a982d6f","(Ты та-а-ак сильно хочешь выбраться? Я поражен во всех смыслах этого слова, Сара.)","","","","",""
"SideS """"","SideS_d01b89b4","Ты думал, я тут шутки шутить буду? Да, я хочу выбраться даже больше, чем ты сейчас попытался выразить. Я готова на все!","","","","",""
"C """"","C_470fc8cc","(Что же я слышу. Кажется, ты только и ждала этого, чтобы добраться до самого интересного...)","","","","",""
"SideS """"","SideS_69ee60b5","Я ждала, потому что это приближает меня к победе. Я даю им свое тело, а они меня слушают. Это всего-то небольшая, но приятная сделка.","","","","",""
"""""","narrator_38f2016c","Сара посмотрела на свое тело, уже представляя, как смогла выбраться отсюда, заставляя пожалеть каждого, кто в ней сомневался.","","","","",""
"C """"","C_4348396e","(Ты еле сдерживалась, когда они лапали тебя через броню... Как рискованно давать им доступ к голой коже.)","","","","",""
"SideS """"","SideS_6c9c7f17","Мне предстоит огромная работа... мне нужно выдрессировать их...","","","","",""
"C """"","C_d2ee1ba1","(Ну да, это тебе не кошку приучить ходить в лоток...)","","","","",""
"SideS """"","SideS_4af305ad","Я... Я думаю, что справлюсь с этим. Это будет хорошим шансом полностью подчинить их себе.","","","","",""
"""""","narrator_2ae4c031","Сара была готова к пошлым шуткам, потому что и сама ощущала, насколько тело хотело предстоящих ласк.","","","","",""
"SideS """"","SideS_3291fcbe","(Тут и отрицать не получится... Хм, могут ли тентакли вызывать привыкание? Я же не могу оказаться на крючке...)","","","","",""
"SideS """"","SideS_fd857e6a","(Надеюсь, нет... Хотя это значения совершенно не имеет. В любом случае нужно скорее покончить с этим. Быстрее начнем - быстрее закончим.)","","","","",""
"C """"","C_8889ec2b","(Ты хотела сказать ‘кончим’.)","","","","",""
"SideS """"","SideS_a029bb43","...","","","","",""
"SideS """"","SideS_433bd574","Сделаем это!","","","","",""
"SideS """"","SideS_86294d6a","Ммм... аххх... как быстро...","","","","",""
"""""","narrator_19e08555","Как только Сара сократила дистанцию, тентакли принялись делать свои грязные делишки.","","","","",""
"SideS """"","SideS_93a3def1","Это... Совсем по-другому, хах.","","","","",""
"SideS """"","SideS_f22b5969","(Эти ощущения такие сильные! Ха, кажется, что они касаются меня везде...)","","","","",""
"""""","narrator_7800a9bf","Сара опустила взгляд вниз, смотря на то, как тентакли ласкали ее тело.","","","","",""
"SideS """"","SideS_fb3d03f0","!!!","","","","",""
"""""","narrator_c8e2ce20","Девушка резко подняла взгляд, ощущая сильную волну возбуждения из-за увиденного.","","","","",""
"SideS """"","SideS_ab5e3ca0","Л-лучше не смотреть вниз...","","","","",""
"SideS """"","SideS_9b9f772f","Пока я не смотрю, ощущения вполне терпимые. Да, я вполне смогу выдержать, ах.","","","","",""
"SideS """"","SideS_483c7880","Я могу совладать с этими ощущениями... Если постараюсь как следует, хи-хи.","","","","",""
"""""","narrator_88ee2e73","Сара позволила себе немного расслабиться и привыкнуть к новому напору щупалец.","","","","",""
"SideS """"","SideS_e68877e4","Все! Мммм, нужно начинать, пока я совсем не потеряла голову...","","","","",""
"SideS """"","SideS_6b4b1518","Думай о захвате Стукова, Сара. Мммм, захват Стукова.","","","","",""
"""""","narrator_eb9b594e","Девушка внимательно наблюдала за реакцией тентаклей на ее требования, но они только более хаотично двигались, пытаясь завладеть телом Сары.","","","","",""
