"location","source","target","ID","fuzzy","context","translator_comments","developer_comments"
"S """"","S_ce46f2b4","А если все же...","","","","",""
"S """"","S_c211d0e1","Это кажется не такой уж и плохой идеей.","","","","",""
"C """"","C_ab7999b3","(А у тебя в мыслях снова только все о побеге...)","","","","",""
"S """"","S_c1969b03","С чего бы тебе ожидать чего-то другого?","","","","",""
"S """"","S_dd0c5c4e","Я все еще не собираюсь оставаться тут.","","","","",""
"C """"","C_9aafd837","(Я должен хотя бы надеяться на то, что когда-то ты остановишься.)","","","","",""
"S """"","S_55d741ff","Я остановлюсь только тогда, когда выберусь отсюда. И у меня появился прекрасный шанс. ","","","","",""
"S """"","S_28a13cca","Все складывается именно так, что я наконец смогу выбраться.","","","","",""
"C """"","C_0133bdae","(Что пришло в твою голову на этот раз?)","","","","",""
"S """"","S_78f41f1a","Ты ведь и так все прекрасно знаешь. Зачем спрашиваешь?","","","","",""
"C """"","C_b5f099dc","(Может быть, я надеюсь, что ты скажешь это вслух и сама поймешь глупость своей идеи.)","","","","",""
"S """"","S_22c542db","Эта идея вовсе не глупая!","","","","",""
"C """"","C_05e0a29a","(Почему бы тебе не оставить свои попытки сбежать? Мне казалось, что ты начала привыкать. Признайся, что тебе тут не так уж и плохо, и мы спокойно пройдем этот путь до конца.)","","","","",""
"S """"","S_a0589725","Мне незачем ждать так долго. Я в любом случае не прекращу свои попытки выбраться отсюда. Никто в здравом уме не будет добровольно оставаться в месте своего заключения.","","","","",""
"C """"","C_d24af550","(То есть ты все же решила попробовать воспользоваться теми тентаклями?)","","","","",""
"S """"","S_458fd6f1","А почему нет? Не вижу ни единой причины отказываться от этой идеи.","","","","",""
"S """"","S_a22caf15","Они реагируют на меня, на мое движение. Если ими можно управлять, то я обязана попробовать!","","","","",""
"C """"","C_10e1046e","(И как же именно ты собираешься сбежать с их помощью?)","","","","",""
"S """"","S_9f341cbd","Ну... Я собираюсь позвать Стукова и приказать тентаклям схватить его. Таким образом я смогу сбежать.","","","","",""
"C """"","C_9c9a2472","(Подчинить тентакли не так уж и легко, но мне интересно, что у тебя может получится.)","","","","",""
"S """"","S_534012eb","Все у меня получится!","","","","",""
"S """"","S_5f6c106f","Пора попробовать, что же мы можем на этом этапе.","","","","",""
"C """"","C_a0dc26f8","(Ага, только не подходи к ним слишком близко.)","","","","",""
"S """"","S_c69851ab","Я и сама все прекрасно знаю. У меня есть план и я его придерживаюсь.","","","","",""
"""""","narrator_1aee571a","Сара сделала пару шагов навстречу щупальцам, наблюдая за их реакцией.","","","","",""
"S """"","S_c8be1fc6","Чего и следовало ожидать... Они снова начали свое движение. Не так активно, потому что я в одежде и достаточно далеко, но это уже хороший результат.","","","","",""
"S """"","S_ebd72d2b","Если бы их направить в нужное русло... Их же так много и они все хаотично двигаются. Ах...","","","","",""
"C """"","C_ddca2c69","(Извращенка...)","","","","",""
"S """"","S_30e46d57","С чего бы это?!","","","","",""
"C """"","C_b044b4a0","(Ты не можешь спрятать от меня ни одну свою мысль. Говоришь, что хочешь поймать Стукова? Скорее ты бы использовала их по совсе-е-е-ем другому назначению. Да, Сара?)","","","","",""
"S """"","S_62c8f5b1","...","","","","",""
"S """"","S_c741687f","В этом нет ничего такого!","","","","",""
"S """"","S_76ac349b","Время, проведенное здесь, все же не прошло бесследно.","","","","",""
"C """"","C_41249fe2","(Конечно, как скажешь. У каждого свои предпочтения... Только не увлекайся сильно, а то о плане забудешь.)","","","","",""
"""""","narrator_669a1be9","Сара проигнорировала сказанные в ее адрес слова, сосредотачиваясь на своих мыслях. Но каждый раз в ее мысли настырно вклинивалась картинка, как тентакли ласкают ее тело. Как они медленно и послушно касаются только тех участков, которые разрешает трогать сама Сара.","","","","",""
"S """"","S_fe57f2b9","Надо сосредоточиться! И проверить, будут ли они снова пытаться схватить меня, как делали это раньше.","","","","",""
"""""","narrator_274dffe6","Сара подошла еще ближе, продолжая наблюдать за реакцией. Тентакли стали двигаться активнее, но они не проявляли желания схватит Сару за руки или ноги. Они скорее стремились к совсем другим частям ее тела, что только сильнее вгоняло Сару в краску.","","","","",""
"S """"","S_21f1bcdc","(Извращенные тентакли... как и все на этом корабле...)","","","","",""
"S """"","S_229178dc","Но... мне все же нужно попытаться контролировать их... Не физически, но хотя бы ментально.","","","","",""
"S """"","S_19b78ced","Не представляю, сколько нужно приложить для этого усилий... Но нам стоит постараться.","","","","",""
"""""","narrator_3a61971d","Закрывая глаза, Сара всеми силами пыталась сосредоточиться на тентаклях и хоть немного управлять ими, но в реальности они так и продолжали хаотично двигаться, игнорируя все попытки Сары.","","","","",""
"S """"","S_75f46a77","Почему это так сложно?! Арх...","","","","",""
"S """"","S_7e765412","Ладно, спокойно. Все нормально... ничего не получается с первого раза. Нужно попробовать еще раз.","","","","",""
"""""","narrator_e5b0150d","Нарастающее напряжение очень утомляло Сару, но она отчаянно продолжала направлять всю свою силу на контроль щупальцев.","","","","",""
"S """"","S_8fad836f","Это несправедливо!","","","","",""
"S """"","S_640e91ce","Каждый раз, когда мне кажется, что они вот уже под моим контролем, все срывается...","","","","",""
"C """"","C_b54bd9f8","(Собираешься все бросить?)","","","","",""
"S """"","S_0a5ab80c","Ни за что!","","","","",""
"S """"","S_2543a1a5","Я собираюсь немного поменять тактику.","","","","",""
"S """"","S_5339c338","Я уверена, что эти тентакли такие же развращенные, как и все, что здесь шевелиться. Значит, мне нужно еще и физически контролировать их.","","","","",""
"S """"","S_9b4777c2","Если ты собираешься спросить меня, решилась ли я использовать для физического контроля свое тело, то мой ответ – да. Ради этого дела не жалко и пойти на такое...","","","","",""
"C """"","C_79701469","(А я ведь даже ничего не спрашивал об этом...)","","","","",""
"S """"","S_8eebbdb0","Пфф...","","","","",""
"""""","narrator_eda7cb26","Сара, убежденная в правильности своего решения, уверенно подошла к тентаклям, находясь от них на безопасном расстоянии. Они могли касаться ее, но не настолько, чтобы схватить или сделать что-то серьезное.","","","","",""
"S """"","S_c19ee220","О-они меня лапают... везде, где только можно... ах... проклятье...","","","","",""
"S """"","S_54e63d43","Но нужно продолжать пытаться брать их под контроль...","","","","",""
"""""","narrator_4c2eb168","Пока Сара отчаянно пыталась воплотить свой план в жизнь, несколько самых активных тентаклей решили облапать грудь девушки, отвлекая ее от важного процесса.","","","","",""
"""""","narrator_cbe5b3c4","Следом за ними один тентакль начал ласкать ее киску. Через броню всю чувствовалось не так сильно, но щупальцы упорно старались принести удовольствие, несмотря на какие-либо препятствия.","","","","",""
"S """"","S_505184ad","Я... кхм... не должна реагировать на всякие провокации. Это только для налаживания связи и ничего более.","","","","",""
"S """"","S_d4228356","(Нужно переключить свое внимание. Не думай о том, что они трогают тебя...)","","","","",""
"S """"","S_72b042f4","(Не думай, что они мнут мою грудь... нет... ах... не нужно думать об этом!)","","","","",""
"S """"","S_3bc94827","(Ммм... это не так уж и легко.)","","","","",""
"""""","narrator_1391b416","Сара пыталась замедлить движения тентаклей и постепенно их активность действительно стала замедляться.","","","","",""
"S """"","S_d9cc0ab9","!!!","","","","",""
"S """"","S_753879fc","Получается?","","","","",""
"S """"","S_055d6e16","Хах... А кто сомневался? Я ни на секунду не сомневалась.","","","","",""
"C """"","C_7a8ac4f6","(Тебе и незачем было сомневаться. Удовольствие слишком сильно туманило твою голову.)","","","","",""
"S """"","S_a5f58150","(Это просто физическая реакция на ласку. Любому было бы немного приятно от этого.)","","","","",""
"C """"","C_f67fe8cf","(Еще немного и ты бы точно кончила.)","","","","",""
"S """"","S_7a1b99fe","(!!!)","","","","",""
"""""","narrator_698c2bb9","Поддерживая слова Сай'мона, тентакли снова стали активно извиваться на груди, пытаясь закрутиться вокруг нее, но у них ничего не выходило.","","","","",""
"S """"","S_83d8983b","(Этого слишком мало, чтобы заставить меня кончить...)","","","","",""
"C """"","C_5d87a09c","(Но теоретически это возможно? Я думаю, они вполне способны довести тебя далеко не до одного оргазма.)","","","","",""
"S """"","S_ef7ad3dd","(Это будет возможно, только если этого будет требовать план!)","","","","",""
"C """"","C_eee64a3d","(Ха-ха, а твое тело явно не согласно с планом.)","","","","",""
"S """"","S_d27c2f49","(Они начинают слушаться меня, значит, все идет хорошо.)","","","","",""
"""""","narrator_08fc3d54","Мысли Сары прервали тентакли, которые все это время не прекращали свои манипуляции. Один из них нашел особо чувствительное место, вызывая табун мурашек по коже у Сары.","","","","",""
"S """"","S_6cdda6eb","Ахх... нет...","","","","",""
"S """"","S_3e1d4d5c","(У меня все еще все под контролем!)","","","","",""
"""""","narrator_2469d59d","Сара продолжала пытаться сдерживать их активность, но нарастающее удовольствие постоянно отвлекало ее.","","","","",""
"S """"","S_35ff4dbd","Аххх... Как же вас успокоить?","","","","",""
"C """"","C_88718960","(У тебя красивое и сексуальное тело. Не думаю, что они захотят остановиться, если ты в поле их досягаемости.)","","","","",""
"S """"","S_1c8314af","Ммм... Н-но так ничего не получится.","","","","",""
"C """"","C_30d6c2ec","(Просто отдайся этому чувству. Настрой физический контакт на все 100 процентов.)","","","","",""
"""""","narrator_5501b8e4","Сара уже не была уверена. Предложение было заманчивым, но она все еще понимала, что эти тентакли могут сделать с ней, если она потеряет любой контроль над ситуацией.","","","","",""
"S """"","S_a0ba642c","Ты... Пытаешься сбить меня с настроя. Но у тебя ничего не получится!","","","","",""
"C """"","C_ba7889a1","(Ты чего? Я на твоей стороне. Да и они без меня прекрасно справляются не только со сбиванием тебя с толку. Они бы с удовольствием сбили тебя еще и с ног.)","","","","",""
"S """"","S_27c99e97","(Дура-а-а-ак! Ты только этого и... хочешь, ах.)","","","","",""
"C """"","C_f0aec115","(Я лишь хочу, чтобы с тобой все было хорошо.)","","","","",""
"S """"","S_63517391","(Со мной все будет прекрасно и вне этого места, но побегом занимаюсь тут только я.)","","","","",""
"C """"","C_37063dcf","(Лучше бы ты оставила свою гневные порывы вырваться отсюда и подумала трезвой головой. Мы бы нашли выгоду из всей этой ситуации и придумали, что нам делать в дальнейшем.)","","","","",""
"S """"","S_e2e3615b","(Я... ммм... не хочу тут находиться.)","","","","",""
"S """"","S_de98c112","(Именно поэтому... я делаю все это.)","","","","",""
"S """"","S_e63df44c","(Именно поэтому даю этим тентаклям лапать свое тело? Ах...)","","","","",""
"S """"","S_4964e51a","(Аххх... ммм...)","","","","",""
"""""","narrator_7edc4f4a","С каждым разом Сара понимала то, что пытался до нее донести Сай'мон, все хуже и хуже. Ее мысли начали заполнять только тентакли.","","","","",""
"""""","narrator_cdcc95c8","Периодически Саре удавалось успокоить тентакли, давая себе небольшую передышку. Но как только возбуждение немного спадало, тентакли с большим рвением продолжали свои ласки.","","","","",""
"S """"","S_07086b68","(Они только трогают... А мне так тяжело стоять... Хотя я даже не подошла достаточно близко.)","","","","",""
"S """"","S_b9bba416","(Аххх...)","","","","",""
"S """"","S_72deba51","(Страшно представить... Ммммн... Что было бы, если бы на мне не было брони.)","","","","",""
"C """"","C_7bb6ed53","(Ты всегда можешь это проверить.)","","","","",""
"S """"","S_da2e24da","(Аххх... Не дождутся!... Это точно...)","","","","",""
"S """"","S_fe5a66d2","(Ммммн... Ах... К-контроль. Ммм... Нужно помнить о контроле.)","","","","",""
"""""","narrator_73021d72","Сара металась между мыслями подойти ближе и отойти без шанса решиться. Ей было слишком приятно, чтобы останавливать это, но она не могла в этой признаться.","","","","",""
"""""","narrator_7d65cc86","Но Сара давно потеряла контроль над тентаклями, которые спокойно блуждали по ее груди и промежности. Щупальце пыталось войти в девушку, но броня и расстояние не позволяли.","","","","",""
"C """"","C_02c12cab","(Может, все же поиграешься с ними раз или два и закончим? Тебе будет приятно, они тоже наиграются. Все в плюсе.)","","","","",""
"S """"","S_f1c3141b","Я... кхм... не понимаю, о чем ты...","","","","",""
"S """"","S_afc7850e","Мммнннпх!!!","","","","",""
"""""","narrator_e4e72e77","Первый приятный спазм настиг Сару врасплох, вызывая звон в ушах. На секунду она забыла, что и зачем делает. Было только дикое желание получить так необходимую разрядку, но осознание быстро отрезвило ее.","","","","",""
"S """"","S_076595f8","(Аххх... Все. Х-хватит...)","","","","",""
"""""","narrator_32ce713b","Сара постепенно стала отходить от тентаклей, разочарованно вздыхая. Ее тело все еще было напряжено, но она ничего не могла с этим сделать.","","","","",""
"S """"","S_b786830c","Это было не зря... Все же постепенно я научилась брать их под контроль. Хоть и не всегда, но это тоже хороший результат.","","","","",""
"S """"","S_59cf492f","Мне просто нужно больше практики и тренировок. У этого плана есть огромный потенциал.","","","","",""
"C """"","C_81e30e2d","(Но это было только начало. Они даже толком не касались тебя, так как ты была слишком далеко. Сможешь сдержать их, если подойдешь ближе?)","","","","",""
"""""","narrator_3a019fc0","Сара пыталась представить себе, что бы с ней было, подойди ближе. И в какой-то мере эти картинки ей не нравились.","","","","",""
"S """"","S_ef1c4a7d","Они бы, конечно, не отпустили меня так просто... Но если я потренируюсь!","","","","",""
"C """"","C_6e26e70d","(Они все равно не откажутся взять тебя, даже силой. У них очень много напористости, как ты могла заметить.)","","","","",""
"S """"","S_56502fdc","Это да...","","","","",""
"""""","narrator_dcda5eac","Сара до сих пор чувствовала на себе их прикосновения. От этих ощущений по ее телу снова прошли мурашки.","","","","",""
"S """"","S_5efdb698","Мне точно нужно больше тренировок. Если я проведу 2-3 тренировки пси-силы, то снова смогу заняться с тентаклями. Снова к ним подходить без подготовки бесполезно.","","","","",""
"S """"","S_80c3ddf4","Я не уверена, что подходить к ним является хорошей идеей. Это просто будет повторение уже пройденного этапа.","","","","",""
"C """"","C_4ac73fdd","(Но ты всегда можешь укрепить вашу физическую связь и вы перейдете на новый уровень ласк.)","","","","",""
"S """"","S_8516ea10","Тебя специально подселили, чтобы подавать мне плохие идеи?","","","","",""
"S """"","S_e538cdea","Я слишком мало тренировалась, чтобы укреплять нашу физическую связь.","","","","",""
"""""","narrator_e0e45b60","Продолжайте заниматься пси-тренировками для активации данной сцены.","","","","",""
"S """"","S_b7bc6155","Я почти уверена, что это получится!","","","","",""
"C """"","C_11ee95c8","(Почему ‘почти’?)","","","","",""
"S """"","S_243afa7f","С одной стороны, я могла бы потратить больше времени на тренировки, но что-то мне подсказывает, что это никак не продвинет меня в реализации этого плана...","","","","",""
"C """"","C_e2d3c62a","(А с другой?)","","","","",""
"S """"","S_fa984517","А с другой стороны, я не хочу с этим затягивать. Мне нужно выбраться как можно скорее, да и я не могу приручать их вечно.","","","","",""
"S """"","S_8474af17","Я отдохнувшая, подготовившаяся и достаточно сильная!","","","","",""
"C """"","C_fdabba25","(Самомотивация – хорошая вещь, но ты все же не хочешь поделиться со мной твоим планом подробнее?)","","","","",""
"C """"","C_2156583b","(Не то чтобы я хотел рассказать его кому-то еще, например Стукову. Хотя он бы посмеялся и захотел посмотреть... Но я спрашиваю только из любопытства и благих намерений.)","","","","",""
"S """"","S_099750ec","Зачем мне тебе рассказывать, если ты заведомо не веришь в этот план?","","","","",""
"C """"","C_9410ad44","(Возможно, ты расскажешь и я тут же пойму, что очень ошибался. И даже поспособствую реализации твоего плана.)","","","","",""
"S """"","S_f68a6eee","У меня есть причины не доверяться тебе...","","","","",""
"S """"","S_61b40c82","Но ладно... Это не какой-то великий план побега, о котором бы я рассказывала своим внукам.","","","","",""
"S """"","S_f984138c","По задумке я должна была выдрессировать тентакли и взять под свой полный контроль. И когда в мою комнату зайдет Стуков, я приказала бы им схватить его.","","","","",""
"S """"","S_eb67cbc6","Раздеть... И сделать все, что я прикажу! Возможно, даже трахнуть... До смерти!","","","","",""
