location,source,target,ID,fuzzy,context,translator_comments,developer_comments,gametemplate
,S_852771bb,"Фуу, что это за мерзкая хрень?!! Какой ужас, она еще и пульсирует!",,,,,,"S ""%%"""
,S_5477b212,Я даже близко не подойду к этому.,,,,,,"S ""%%"""
,S_3c051d1e,А эта еда не такая уж плохая.,,,,,,"S ""%%"""
,S_4917f72b,Хи-хи-хи,,,,,,"S ""%%"""
,S_7e3f4d7b,Правда ведь?,,,,,,"S ""%%"""
,S_925cb416,Мне нужно продолжать её есть...,,,,,,"S ""%%"""
,S_cdd5ba4e,Я не приближусь к этой штуковине!,,,,,,"S ""%%"""
,narrator_89f91884,Я уже принимала сегодня пищу.,,,,,,"""%%"""
,S_cdd5ba4e_1,Я не приближусь к этой штуковине!,,,,,,"S ""%%"""
,S_852771bb_1,"Фуу, что это за мерзкая хрень?!! Какой ужас, она еще и пульсирует!",,,,,,"S ""%%"""
,S_5477b212_1,Я даже близко не подойду к этому.,,,,,,"S ""%%"""
,narrator_631162b1,Готово,,,,,,"""%%"""
,narrator_7d869b9e,Готово,,,,,,"""%%"""
,narrator_7abc3db7,"Саре на глаза попались уже знакомые тентакли, она задумчиво уставилась на них.",,,,,,"""%%"""
,S_b78759b7,(Это было совсем недавно... паршивцы...),,,,,,"S ""%%"""
,S_65e7440e,"Хм... можно попробовать еще раз. Все же много воды утекло с тех времен. Может, сейчас у меня даже получится воплотить мой план.",,,,,,"S ""%%"""
,S_c5835510,Да вот только толку с этого... хотя ради забавы можно было бы проучить Стукова.,,,,,,"S ""%%"""
,S_d059ace7,Но от них у меня есть вот это.,,,,,,"S ""%%"""
,S_0cf94554,"Правда, что оно мне дает... я до сих пор не знаю...",,,,,,"S ""%%"""
,S_7318e564,"Ха-ха-ха, ладно, у меня нет времени на глупые игры, нужно сконцентрироваться на текущих задачах.",,,,,,"S ""%%"""
,S_c2ced3f0,"Ну уж нет... чтобы я прикоснулась к ним... я им доверила свое тело, а они... им нужно только одно.",,,,,,"S ""%%"""
,S_87b11d2c,Предатели!,,,,,,"S ""%%"""
,S_84838904,"Это место, где Стуков несколько раз 'приковывал' меня. Не хочу вспоминать об этом...",,,,,,"S ""%%"""
,S_658e9166,Думаю на сегодня достаточно...,,,,,,"S ""%%"""
,S_563714ef,Я...,,,,,,"S ""%%"""
,S_fbb1f136,Пожалуй повременю с этим тентаклем... ради своей же безопастности...,,,,,,"S ""%%"""
,S_7d4bbae0,"Кнопка, вызывающая Стукова. Даже эта кнопка выглядит как-то странно!",,,,,,"S ""%%"""
,A_427eb046,"Ха-ха-ха, а вот и она, ха-ха. Сара, повелительница тентаклей.",,,,,,"A ""%%"""
,S_b32e31f6,З-заткнись...,,,,,,"S ""%%"""
,A_b75dfd6d,Ха-ха-ха!,,,,,,"A ""%%"""
,A_0060f04c,"Черт, за такое и правда нужно давать ачивки.",,,,,,"A ""%%"""
,S_8d552cc6,"Какие еще ачивки, грязный извращенец?",,,,,,"S ""%%"""
,A_8089bd18,А вот такие.,,,,,,"A ""%%"""
,S_49ae82a9,!!!,,,,,,"S ""%%"""
,S_882e633b,К-как ты это сделал???,,,,,,"S ""%%"""
,A_491ac6a7,"Ха-ха-ха, сам не знаю. Даже не спрашивай.",,,,,,"A ""%%"""
,S_ee2fde1a,"Ч-что за, странное чувство...",,,,,,"S ""%%"""
,A_cce36f11,За-то теперь тебе доступен новый титул.,,,,,,"A ""%%"""
,S_1cf196d9,Даже не смей меня так называть!,,,,,,"S ""%%"""
,A_b6147530,Как так?,,,,,,"A ""%%"""
,S_470958ae,"Ты знаешь, не придуривайся.",,,,,,"S ""%%"""
,A_6fc6df10,"Ладно-ладно, так чего ты меня звала?",,,,,,"A ""%%"""
,S_799d9a8c,"Я не могу это сейчас сделать, мне нужно надеть белье сначала...",,,,,,"S ""%%"""
,S_1d0a6776,...,,,,,,"S ""%%"""
,S_08712495,"Думаю, ничего плохого не будет, если мы и сегодня прогуляемся.",,,,,,"S ""%%"""
,S_c929907e,Да и тренировка пройдет эффективнее.,,,,,,"S ""%%"""
,S_6c374a85,"Только этого извращенца тут не хватало, он последний кому я бы хотела показаться в таком виде.",,,,,,"S ""%%"""
,S_2dc1f4e5,Я весьма устала за сегодня...,,,,,,"S ""%%"""
,S_1d0a6776_1,...,,,,,,"S ""%%"""
,S_8edec579,Сперва мне нужно надеть то развратное белье...,,,,,,"S ""%%"""
,S_1d0a6776_2,...,,,,,,"S ""%%"""
,S_557c017d,(Должна ли я это делать...),,,,,,"S ""%%"""
,C_50eac14c,"(Если хочешь скорее выбраться, то да.)",,,,,,"C ""%%"""
,S_1d0a6776_3,...,,,,,,"S ""%%"""
,C_0eb929cf,"(Хотя знаешь, меня все устраивает: отличная компания, хорошая еда. Можно тут задержаться!)",,,,,,"C ""%%"""
,S_49ae82a9_1,!!!,,,,,,"S ""%%"""
,S_f36dabee,"(Ты издеваешься, да?)",,,,,,"S ""%%"""
,C_d9d3ce23,"(Нет, ты что.)",,,,,,"C ""%%"""
,S_277c24ed,(Ах ты маленький...),,,,,,"S ""%%"""
,narrator_bd20daf1,"Сара нажимает на кнопку вызова, но ничего не происходит.",,,,,,"""%%"""
,S_4065bc22,Стукова сейчас нет. Остается ждать его возвращения.,,,,,,"S ""%%"""
,narrator_bd20daf1_1,"Сара нажимает на кнопку вызова, но ничего не происходит.",,,,,,"""%%"""
,S_c5d99ba1,"Вот гад, он видимо специально это все запланировал.",,,,,,"S ""%%"""
,A_31bd8cee,"Ооо, я вижу ты нашла мой любимый плакат.",,,,,,"A ""%%"""
,A_2b8172de,"Видно он тебе тоже понравился, раз ты его повесила на стену.",,,,,,"A ""%%"""
,A_ffe39226,"Хех, у меня с ним столько воспоминаний.",,,,,,"A ""%%"""
,A_2b96a630,Ты что-то хотела?,,,,,,"A ""%%"""
,A_7bf7b01d,Ты соскучилась по мне?,,,,,,"A ""%%"""
,S_6c598abd,Отведи меня к Абатуру.,,,,,,"S ""%%"""
,A_feca4e7f,"Мы же только от него пришли, тебе стоит как следует отдохнуть.",,,,,,"A ""%%"""
,narrator_6476baa4,"Вам не хватает уровня, займитесь другими сценами.",,,,,,"""%%"""
,A_de4401bc,"Хватит разговоров, на сегодня достаточно. Поговорим об этом завтра.",,,,,,"A ""%%"""
,A_1b17e9ac,Ты что-то хотела?,,,,,,"A ""%%"""
,S_2ae48edf,Да... Я хотела спросить: ты и при жизни был таким гадом и извращенцем?,,,,,,"S ""%%"""
,A_bb912820,Ээээ...,,,,,,"A ""%%"""
,A_6c1c9f49,('Таким'? Да она и понятия не имеет насколько я извращенец!),,,,,,"A ""%%"""
,A_312cba36,"Эм, да. Всегда!",,,,,,"A ""%%"""
,S_474c438b,"Я так и знала! Ты просто больной извращенец! А может, ты все эти испытания сам придумал? Может, ты заставляешь меня это делать только потому, что тебе это приносит удовольствие?!",,,,,,"S ""%%"""
,S_dc797266,Меня это все достало! Выпусти меня отсюда!,,,,,,"S ""%%"""
,A_f207d0d4,"Воу, воу, ты что-то сильно разошлась, девочка. Думаю, тебе надо дать время побыть одной. Я пойду.",,,,,,"A ""%%"""
,S_99cca41f,"Нет! А ну стой, мерзавец! Не смей уходить, я не закончила!",,,,,,"S ""%%"""
,narrator_16bfaff6,"Стуков выбегает из комнаты, дверь закрывается.",,,,,,"""%%"""
,narrator_4da74ac1,"После его ухода Сара какое-то время напористо колотила в дверь, но это ни к чему не привело.",,,,,,"""%%"""
,A_0af3228f,Да? Снова будешь кричать?,,,,,,"A ""%%"""
,S_bb1ed975,"Нет, больше не буду.",,,,,,"S ""%%"""
,A_6e090b18,Рад это слышать. Так что там у тебя?,,,,,,"A ""%%"""
,S_5e4f73ca,Я хотела кое-что узнать.,,,,,,"S ""%%"""
,A_7f4abe8b,Я слушаю.,,,,,,"A ""%%"""
,S_2f958db3,"Мне интересно: ты говорил, что тут нет другой еды, кроме этой субстанции. Ты тоже ее ешь?",,,,,,"S ""%%"""
,A_d2053fe6,...,,,,,,"A ""%%"""
,A_d2053fe6_1,...,,,,,,"A ""%%"""
,S_f421f718,??,,,,,,"S ""%%"""
,A_87ad5682,Другие вопросы есть?,,,,,,"A ""%%"""
,S_f8d7b0b9,"Эй, что не так? Обычный же вопрос!",,,,,,"S ""%%"""
,A_8790f301,Я не хочу отвечать...,,,,,,"A ""%%"""
,S_1ffd4e7c,...,,,,,,"S ""%%"""
,A_8f8d4446,"Поговорим в другой раз, я пойду.",,,,,,"A ""%%"""
,S_a7f88017,(И что это с ним?),,,,,,"S ""%%"""
,S_2d8778fb,Я хотела спросить. До меня тут еще были такие же захваченные люди?,,,,,,"S ""%%"""
,A_8ea29100,"Да, конечно. Через меня прошло много людей.",,,,,,"A ""%%"""
,S_217a5c2e,И что с ними случилось? Где они сейчас?,,,,,,"S ""%%"""
,A_40c973f9,Сложный вопрос...,,,,,,"A ""%%"""
,A_283272fc,"Я точно не знаю, они проходят мою часть испытания, а потом я отправляю их дальше к владычице. Что происходит с ними дальше - я не имею ни малейшего понятия.",,,,,,"A ""%%"""
,A_36f122c2,"(На самом деле я знаю. То, что я делаю с заключенными, это просто цветочки по сравнение с тем, что ожидает испытуемых в дальнейшем!)",,,,,,"A ""%%"""
,S_6be55446,"Но это может означать, что их дальше убивали или еще что!",,,,,,"S ""%%"""
,A_baf19de8,"Нет, нет, не волнуйся. Ее словам можно верить, в конце испытаний всех точно отпускают. Это точно.",,,,,,"A ""%%"""
,A_48b58fc4,(Ахаха!),,,,,,"A ""%%"""
,S_08acd895,Ладно...,,,,,,"S ""%%"""
,A_20210e14,Да?,,,,,,"A ""%%"""
,S_caba9b11,"Мне тут очень скучно, просто хотела поговорить с кем-то помимо Сай'мона.",,,,,,"S ""%%"""
,A_312f5fa0,"Оу, хорошо. Я расскажу тебе шутку!",,,,,,"A ""%%"""
,S_79cc70c5,???,,,,,,"S ""%%"""
,S_038a9f0f,Давай!,,,,,,"S ""%%"""
,A_ace0399a,"Так, так...",,,,,,"A ""%%"""
,A_00f92511,Как же там было?,,,,,,"A ""%%"""
,A_42be79bf,"Ага, вот!",,,,,,"A ""%%"""
,A_bf397f3a,Перед атакой на базу Зергов.,,,,,,"A ""%%"""
,A_36c1abec,"Сержант, обеда хватит только на полроты.",,,,,,"A ""%%"""
,A_fd65172f,"Отлично, пообедаем после атаки, как раз на всех хватит...",,,,,,"A ""%%"""
,S_1ffd4e7c_1,...,,,,,,"S ""%%"""
,A_4e1acd43,Ахаха!,,,,,,"A ""%%"""
,S_1ffd4e7c_2,...,,,,,,"S ""%%"""
,A_d96617aa,"Ну смешно же, нет?",,,,,,"A ""%%"""
,S_352efd7b,Спасибо за разговор...,,,,,,"S ""%%"""
,A_b36891ad,Обращайся! Ахаха!,,,,,,"A ""%%"""
,A_6a46a566,Слушаю тебя.,,,,,,"A ""%%"""
,S_60ab6621,А я... я хорошо справляюсь?,,,,,,"S ""%%"""
,A_e21dcd63,А? О чем ты?,,,,,,"A ""%%"""
,S_caceed92,Ну у тебя же уже были на испытании люди. Я хорошо справляюсь? ,,,,,,"S ""%%"""
,A_55c6707e,"Ну были и те, кто был в разы податливее тебя...",,,,,,"A ""%%"""
,A_ec3e771b,"Но у тебя очень хороший потенциал! Я уверен, что при должном старании ты можешь стать моей лучшей работой.",,,,,,"A ""%%"""
,S_1eda4cbb,Правда??,,,,,,"S ""%%"""
,A_9b00b8be,"Конечно, ты очень перспективная!",,,,,,"A ""%%"""
,S_b0c46045,Спасибо!,,,,,,"S ""%%"""
,S_79a62c84,Я хотела поговорить.,,,,,,"S ""%%"""
,A_a330f5a7,У меня есть лучше идея: давай я расскажу тебе хорошую шутку!,,,,,,"A ""%%"""
,S_6bff196e,(Снова его дурацкие шутки...),,,,,,"S ""%%"""
,A_89e74de6,"Так вот, патруль из четырех морпехов идет по лесу. Туман, ни черта не видно...{w} Вдруг в тумане появляется какой-то силуэт.",,,,,,"A ""%%"""
,A_33731fa0,Командир кричит: 'Немедленно определите себя!',,,,,,"A ""%%"""
,A_a9101880,Но в ответ только молчание.,,,,,,"A ""%%"""
,A_fe771622,"Я сказал, немедленно определите себя, иначе я вас в щепки разнесу!",,,,,,"A ""%%"""
,A_522b536f,Опять командир услышал только молчание.,,,,,,"A ""%%"""
,A_72e139d6,Еще тридцать секунд — и я открываю огонь!,,,,,,"A ""%%"""
,A_5cbc89d6,"Ленивый голос из тумана: 'Открывайте огонь, когда будете готовы. Перед вами танковая батарея.'",,,,,,"A ""%%"""
,A_d897f4c5,Ха-ха-ха-ха!,,,,,,"A ""%%"""
,S_1ffd4e7c_3,...,,,,,,"S ""%%"""
,A_3aaea0ba,"Ха-ха-ха. Не, ну ты поняла, танковая батарея! Ха-ха-ха, как же это смешно!",,,,,,"A ""%%"""
,S_e2aaf4c4,Не особо...,,,,,,"S ""%%"""
,A_d2053fe6_2,...,,,,,,"A ""%%"""
,A_e6cf960d,Ну ты зануда.,,,,,,"A ""%%"""
,S_25571fa6,Давай впредь обойдемся без твоих шуток...,,,,,,"S ""%%"""
,A_54f467f7,Ну и что сегодня?,,,,,,"A ""%%"""
,S_09da4abc,Просто я давно хотела спросить: ты ведь с Земли?,,,,,,"S ""%%"""
,A_a262d379,"Да, родина-мать всего человечества, прекрасные зеленые холмы. Эх, я уже скучаю по дому.",,,,,,"A ""%%"""
,S_3ec61595,А что такое Алабама?,,,,,,"S ""%%"""
,A_d2053fe6_3,...,,,,,,"A ""%%"""
,A_7aff70f7,Это название одного штата на Земле. Откуда ты вообще о нем знаешь?,,,,,,"A ""%%"""
,S_3c777731,"Есть популярна песня 'Sweet home Alabama'. Говорят, что она с Земли. Ее во всех барах играют.",,,,,,"S ""%%"""
,A_939bd3c2,(Откуда эта песня вообще взялась на колониальных кораблях?),,,,,,"A ""%%"""
,S_5cf7670c,У меня еще один вопрос.,,,,,,"S ""%%"""
,A_93f3bc1c,Валяй.,,,,,,"A ""%%"""
,S_da612562,А почему ваш флот направили в сектор Копрулу? По урокам истории наших предков на Земле не очень любили.,,,,,,"S ""%%"""
,A_d2053fe6_4,...,,,,,,"A ""%%"""
,A_10a42446,Я не хочу об этом говорить.,,,,,,"A ""%%"""
,narrator_77d24a6d,Стуков выходит из комнаты.,,,,,,"""%%"""
,S_580999b4,И чего он так...,,,,,,"S ""%%"""
,S_79b6a84f,"(Наверное, это какой-то секрет. Ничего, я еще узнаю, с чего это Земля про нас вспомнила.)",,,,,,"S ""%%"""
,S_6d60bce5,"Я хотела поговорить, у меня есть вопросы.",,,,,,"S ""%%"""
,A_a4f2d3fd,"Хе-хе, у меня тоже вопросы.",,,,,,"A ""%%"""
,S_b112bab5,(Наверняка он опять будет говорить про всякие извращения.),,,,,,"S ""%%"""
,A_0c09cef4,"Ты знаешь, где достать нормальную выпивку?",,,,,,"A ""%%"""
,S_1ffd4e7c_4,...,,,,,,"S ""%%"""
,S_66e37cdf,"Я сама в этом не разбираюсь. Но слышала, что Умоджанский Протекторат производит лучшее пиво в секторе.",,,,,,"S ""%%"""
,A_602e069c,"Пффф, пиво, к черту эту мочу. Лучше расскажи о чем покрепче.",,,,,,"A ""%%"""
,S_b84db1d2,"Бронтезианский бренди это лучшее, о чем я слышала. Это все?",,,,,,"S ""%%"""
,A_b50715e5,"Нет, скажи мне, а ты знаешь какой-то хороший бордель?",,,,,,"A ""%%"""
,S_1ffd4e7c_5,...,,,,,,"S ""%%"""
,S_9198b1c7,Нет! Откуда мне знать про такие места...,,,,,,"S ""%%"""
,A_44113284,"Ага, я так и думал. Ну, тогда я пойду. А я так на тебя рассчитывал...",,,,,,"A ""%%"""
,S_39711361,"Эй, а мой вопрос?",,,,,,"S ""%%"""
,narrator_05c4ffbd,"Стуков выходит из комнаты, не оборачиваясь и не реагируя на вопрос Сары.",,,,,,"""%%"""
,S_c1469fe7,Алкоголик чертов.,,,,,,"S ""%%"""
,A_3929f3ce,"Что, уже соскучилась?",,,,,,"A ""%%"""
,S_725f62ac,"Нет, конечно! У меня вопрос есть.",,,,,,"S ""%%"""
,A_9f8bc148,"Не тяни кота за яйца тогда. У меня, знаешь ли, важные дела есть.",,,,,,"A ""%%"""
,S_1dddae76,(Знаю я его дела. Наверняка опять какие-то извращения.),,,,,,"S ""%%"""
,S_92324b98,Хотела спросить про ванну.,,,,,,"S ""%%"""
,A_36ab3b99,Наконец-то... я же тебе сказал: в любое время я готов потереть тебе спинку.,,,,,,"A ""%%"""
,S_427442df,!!!,,,,,,"S ""%%"""
,S_64e17915,Я уже говорила тебе — нет!.,,,,,,"S ""%%"""
,S_1d2e062a,Я хотела спросить о другом. Где ты моешься?,,,,,,"S ""%%"""
,A_f1f3a261,"А, понял, ты сама хочешь потереть мне спинку. Знаешь, я совсем не против. Возможно, и не только спинку, если ты понимаешь о чем я, хе-хе-хе.",,,,,,"A ""%%"""
,S_371d04a7,"Нет, конечно!",,,,,,"S ""%%"""
,S_5a54517c,(Грр... я не об этом хотела спросить...),,,,,,"S ""%%"""
,S_3ce6aaf5,"Я думала, что, может, тут есть обычная ванная.",,,,,,"S ""%%"""
,A_94b66993,"А если бы у меня была обычная ванная, ты бы присоединилась ко мне?",,,,,,"A ""%%"""
,S_ee18767c,Нет!,,,,,,"S ""%%"""
,A_d948be72,Какая же ты нудная...,,,,,,"A ""%%"""
,A_5bdeaba9,У тебя еще остались вопросы?,,,,,,"A ""%%"""
,S_88cfc2dc,На сегодня вопросов больше нет...,,,,,,"S ""%%"""
,A_e58e832e,Ну тогда мы закончили.,,,,,,"A ""%%"""
,S_e8dbc685,Привет.,,,,,,"S ""%%"""
,A_9ffe8cb9,Ты сегодня на удивление вежлива.,,,,,,"A ""%%"""
,S_9634cac3,"Мне просто скучно, а Cай'мон продолжает бурчать про тренировки связи с Роем.",,,,,,"S ""%%"""
,C_16bb48dd,"(И продолжу, тебе нужно тренироваться!)",,,,,,"C ""%%"""
,S_7a5c8472,"Я стараюсь быть вежливой. И мне просто скучно тут, нечем заняться.",,,,,,"S ""%%"""
,A_94607ffc,"Тренируйся, тренируйся и еще раз тренируйся. Мы тут с определенной целью, и это не отдыхать.",,,,,,"A ""%%"""
,S_85cb2d67,Я и так выполняю максимум по тренировкам. Будто ты каждую секунду занят делом.,,,,,,"S ""%%"""
,A_57f9ec5a,"Да, я занят очень важными делами.",,,,,,"A ""%%"""
,S_19046c2f,"Если ты говоришь о мастурбации, это не считается важным делом...",,,,,,"S ""%%"""
,A_e4faf5be,"Аха-ха-ха, это очень важно и ты просто не понимаешь, насколько. Но *кхм*, к делу, я занят много чем.",,,,,,"A ""%%"""
,A_f9c4e6fc,"К примеру у меня есть полный доступ ко всему левиафану. Я изучаю органы, которые отвечают за естественный гипер-привод этого существа...",,,,,,"A ""%%"""
,narrator_113d8ed2,Далее последовала глубоко научная лекция от Стукова касательно его теорий о левиафанах.,,,,,,"""%%"""
,S_12d30b72,"Невероятно, я не думала, что можно столько узнать. Тебе, кажется, нравится тут.",,,,,,"S ""%%"""
,A_d2053fe6_5,...,,,,,,"A ""%%"""
,A_18c9effc,"Да, мне нравится, сколько тут возможностей для исследования. К примеру, исследования твоего тела....",,,,,,"A ""%%"""
,S_b55abb0a,Ты все такой же извращенец. Хотя и умный...,,,,,,"S ""%%"""
,A_1deaa41e,"Не суди книгу по обложке, детка. Ладно, хватит мне тебя развлекать. У меня есть важные дела.",,,,,,"A ""%%"""
,narrator_06cc8861,Стуков уходит.,,,,,,"""%%"""
,A_f20cfa16,"Хах, уже хочешь меня видеть или у тебя опять вопросы?.",,,,,,"A ""%%"""
,S_bfea50d8,"Да, я хотела узнать, почему ты так любишь порно.",,,,,,"S ""%%"""
,A_d2053fe6_6,...,,,,,,"A ""%%"""
,A_6fee5508,"Аха-ха-ха-ха, ты серьезно спрашиваешь меня об этом?!",,,,,,"A ""%%"""
,S_8f8d3a0f,"Я просто не понимаю, почему ты так одержим порно. И еще гордишься этим.",,,,,,"S ""%%"""
,A_ef94d950,"Ага, еще скажи, что ты порно никогда не видела.",,,,,,"A ""%%"""
,S_0eb0126c,"Я-я видела п-порно, но ты уходишь от вопроса!",,,,,,"S ""%%"""
,A_01014611,"Аха-ха-ха-ха, хорошо. Раз ты просишь, я отвечу...",,,,,,"A ""%%"""
,A_98aa7faf,Хм...,,,,,,"A ""%%"""
,narrator_ecf21c04,Стуков делает паузу,,,,,,"""%%"""
,S_1ffd4e7c_6,...,,,,,,"S ""%%"""
,A_fd088b36,Хм-хм...,,,,,,"A ""%%"""
,S_1ffd4e7c_7,...,,,,,,"S ""%%"""
,A_f3600491,ХММММ...,,,,,,"A ""%%"""
,S_1ffd4e7c_8,...,,,,,,"S ""%%"""
,S_5a06994e,Что 'хм' ??? Почему ты молчишь?!,,,,,,"S ""%%"""
,A_826e7c2d,"Я думал, как лучше ответить.",,,,,,"A ""%%"""
,A_cef498e5,"А ответ прост на деле. Я люблю порно, потому что люблю, дрочить. Вот и все.",,,,,,"A ""%%"""
,S_0648200e,Это в-все?!.,,,,,,"S ""%%"""
,A_a3589088,"Аха-ха-ха-ха, ты хотела ответ, я тебе его дал.",,,,,,"A ""%%"""
,S_1d1e32d8,"Даже не знаю, чего я ожидала.",,,,,,"S ""%%"""
,A_0295eb71,Что я могу? Задай глупый вопрос — и получи глупый ответ..,,,,,,"A ""%%"""
,S_1ffd4e7c_9,...,,,,,,"S ""%%"""
,narrator_f08ad23b,"Стуков уходит из комнаты, думая при этом.",,,,,,"""%%"""
,Aside7_84e0a473,"(Не стоить ей знать, что все не так просто.)",,,,,,"Aside7 ""%%"""
,S_9b0d16c4,"Почему ты так не любишь одежду? Ты уже несколько раз говорил, что тебе она не нравится.",,,,,,"S ""%%"""
,A_a055f765,"Хех, заметила все же. Я знал, что рано или поздно этот разговор произойдет.",,,,,,"A ""%%"""
,A_2b0cf9c7,"Ну что же, *кхм*.",,,,,,"A ""%%"""
,A_79e19e9d,"Я не люблю одежду попросту потому, что она мешает всему! Двигаться, комфортно чувствовать себя, мастурбировать, в конце концов! Вот у себя я всегда хожу голый!",,,,,,"A ""%%"""
,S_075ea30b,Опять все сводится к извращениям.,,,,,,"S ""%%"""
