location,source,target,ID,fuzzy,context,translator_comments,developer_comments
"A """"",A_93254430,Настоящий призрак! Тренировка до упора! Хе-хе!,,,,,
"S """"",S_1464b357,Я...,,,,,
"S """"",S_a66506bc,Должна...,,,,,
"S """"",S_3a8ee9c6,Покончить с...,,,,,
"S """"",S_da47d215,Этим...,,,,,
"S """"",S_c15146ab,Скорее,,,,,
"S """"",S_28d09eaa,*Слю-ю-ю-ю-ю-ю-ю-ю-юрп* ~♥,,,,,
"A """"",A_e3ee15e7,"Хех, кажется, только что парочка капель твоего пота попали мне на лицо. Но не переживай, это то, через что проходил каждый тренер. Я отдаю себе отчет в том, что ты выкладываешься на 110 процентов, так что я тоже постараюсь, не бойся залить меня всего.",,,,,
"A """"",A_4d4698a3,"Ведь в спорте нет никаких Я, есть только МЫ.",,,,,
"S """"",S_62812034,(Аааххх... это ведь не пот...он наверняка знает об этом... моя киска уже проиграла... но я еще кажется держусь...),,,,,
"C """"",C_d77cb973,"(База, прием. Киска призрака пробита! У нас утечка жидкости.)",,,,,
"S """"",S_8f9e30b0,"(Заткнись, ты как всегда не вовремя...)",,,,,
"""""",narrator_7b714280,Сара опускалась на дрожащих руках и старательно причмокивала.,,,,,
"S """"",S_ff0efc69,*Мф* *Чмок* *Слурп* *Чмок*,,,,,
"A """"",A_f165c17f,"И вот как у тебя вообще язык поворачивается сказать, что тебе не нравится мой подход к тренировкам?! Я не припомню такой отдачи ни от одной портовой шлюхи!",,,,,
"S """"",S_4c844c6c,*Мф* *Чмок* *Мф* *Слурп* *Мф* *Чмок*!!!,,,,,
"A """"",A_f8d20c6d,Я тоже без ума от твоих дырочек. Но не забывай про упражнение. Мы здесь вообще-то спортом занимаемся! Хе-хе!,,,,,
"S """"",S_2c741d6c,"(Черт! Если бы не мое 'питание', я бы никогда не смогла сделать то, что сейчас делаю! Но даже так... в этой позе он заходит под таким углом...)",,,,,
"S """"",S_077d8241,"(Блин! Я хочу, чтобы он достал до моего желудка!)",,,,,
"S """"",S_7d043744,(Какое-то безумие! Но это так здорово и приятно!),,,,,
"A """"",A_75ed442d,"Отлично, просто замечательно. На Земле мы бы с тобой взяли все золотые медали за такое исполнение.",,,,,
"S """"",S_99571692,(О каких медалях речь идет? Он там совсем тю-тю?),,,,,
"""""",narrator_06fa5018,"Девушка опустилась без сил, не забывая, впрочем, активно вылизывать член.",,,,,
"S """"",S_0eda57a4,(Сил становится все меньше... все же я могу продолжать... Но он уже дрожит! У меня получится...!),,,,,
"A """"",A_63c98cee,"Ты, наверное, слышала про так называемые Конфедеративные игры? Это место, куда съезжаются спортсмены с разных уголков мира.",,,,,
"S """"",S_862035d8_2,*Мф* *Чмок* *Слурп*,,,,,
"S """"",S_7e3b80ee,"(К чему он вообще это говорит? Только отвлекает меня... Он вообще не понимает, что это сейчас неуместно?..)",,,,,
"A """"",A_0f78cbcc,"Так вот, я думаю, мы определенно должны устроить что-то такое тут, хе-хе-хе.",,,,,
"A """"",A_87ca1d8e,"Только представь:, трибуны полны, и все выкрикивают твое имя, говоря 'глубже!', хе-хе-хе.",,,,,
"S """"",S_67076b1d,(Он точно кукушкой поехал...),,,,,
"A """"",A_996eccca,"Черт, это было бы определенно круто!",,,,,
"S """"",S_4c844c6c_1,*Мф* *Чмок* *Мф* *Слурп* *Мф* *Чмок*!!!,,,,,
"A """"",A_ea628a93,"Хотя ты, конечно же, права - это было бы не так просто. Кто знает, какие еще спортсмены стояли бы у нас на пути?",,,,,
"S """"",S_f6aeb0fc,(Я... вообще молчала!...),,,,,
"A """"",A_116401a4,"Но одно я знаю наверняка:, на тренировке к этому соревнованию я бы тебе не давал спуска.",,,,,
"S """"",S_3a27df39,(П-прекрати такое говорить...),,,,,
"""""",narrator_dbd18275,"Совершив невероятное усилие, девушка поднялась на слегка дрожащих руках.",,,,,
"A """"",A_a55059ae,"Эх, это были бы отменные деньки... Ну что, еще подход?",,,,,
"S """"",S_39107c2d,"(Ахх... ну все, шутки в сторону, пора кончать.)",,,,,
"A """"",A_60cb2d8c,За свободу!!!,,,,,
"S """"",S_267ecb73,*Слурп-слурп-слурп-слурп-слурп-слурп-слурп-слурп!*,,,,,
"A """"",A_962b2057,"Вот это да! Вижу, ты управилась с темпом и перешла к пампингу, это похвально!",,,,,
"""""",narrator_768e068b,"Девушка значительно ускорила движения. Видимо, она была намерена как можно скорее покончить со всем.",,,,,
"S """"",S_0e8ac5aa,"(Я сделаю это... еще чуть-чуть... я чувствую, он уже рядом.)",,,,,
"""""",narrator_c20cc197,"Она была права, член Стукова уже был готов поделиться начинкой с ней.",,,,,
"S """"",S_7aa77848,"(Аххх, сохранять спокойствие, я справлюсь!)",,,,,
"A """"",A_be6a2081,"Ха-ха-ха, пот хлещет прямо ручьем.",,,,,
"A """"",A_89d14885,"Раз есть такая возможность, может, мне голову заодно помыть?",,,,,
"S """"",S_8bf5b594,"(Действительно, лучше бы он рот не открывал...)",,,,,
"S """"",S_f1239977,(А что ты скажешь на это?!),,,,,
"""""",narrator_c1b182b1,"Девушка почти рухнула на член, который довольно невежливо проник в ее горло.",,,,,
"A """"",A_ccbff032,Оооо дааа! Превосходная техника!!!,,,,,
"A """"",A_71a0e276,Еще чуть-чуть и мы кончили!,,,,,
"S """"",S_4c844c6c_2,*Мф* *Чмок* *Мф* *Слурп* *Мф* *Чмок*!!!,,,,,
"A """"",A_a46dba5b,"ДААААА!!! Я больше не могу терпеть, дело сделано!",,,,,
"S """"",S_c34fb524,"(Отлично, у меня получилось. Пора убираться отсюда.)",,,,,
"C """"",C_022a873e,"(Миссия выполнена, запрашиваю эвакуацию!)",,,,,
"S """"",S_d1dc82f2_2,!!!,,,,,
"S """"",S_1296a645,"(Черт! Только не это: силы кончились. У меня же было все под контролем! Я не могу просто так тут остаться, я обязательно поднимусь!!!)",,,,,
"A """"",A_bd5caeba,Ты решила изменить сценарий?,,,,,
"S """"",S_fcf4f801,"(Мои руки не слушаются. Ну же, идиот, подними меня!!!)",,,,,
"A """"",A_eb8f04bc,"Черт, твои движения делают только хуже!",,,,,
"S """"",S_54991bf2,(Нет-нет-нет-нет!!! Мы так не договаривались!),,,,,
"A """"",A_f6c6d276,"Арррг, я больше не могу терпеть, я свою часть договора выполнил! А теперь приготовься!",,,,,
"""""",narrator_bd34b6bb,*Взрыв*,,,,,
"extend """"",extend_f41c6a14, *Взрыв*,,,,,
"extend """"",extend_f41c6a14_1, *Взрыв*,,,,,
"""""",narrator_33854909,"Стуков вздрогнул в короткой, но очень выразительной судороге, и начал извергать начинку.",,,,,
"S """"",S_05db2825,{size=+15}М-м-м-м-нг!!!{/size},,,,,
"A """"",A_2d257676,Даааааааа!!!,,,,,
"""""",narrator_a2c6e292,В пищевод девушке хлынул поток горячей спермы. Стуков содрогался в разрядах наслаждения и инстинктивно вгонял член глубже.,,,,,
"S """"",S_98b1fb21,"(Он как тот тентакль! Только приятнее... И, кажется, льет больше!)",,,,,
"A """"",A_63dd3409,"Вот так!!! Просто здорово! Так даже лучше, чем мы договаривались! Твой ротик определенно первоклассный! Хотя не хватает некоторого умения... но практика и мое тренерство все поправяит! Ха-ха-ха!!!",,,,,
"A """"",A_97cba04a,Это определенно уровень кандидата в мастера спорта!,,,,,
"A """"",A_9ab041dc,Нет! Мастер спорта!,,,,,
"S """"",S_b451a635,*Мф* *Гулп* *Мф* *Чмок* *Мф* *Гулп*!!!,,,,,
"A """"",A_654c7874,"Да-да-да, твои развратные звуки так заводят меня, что... Да!!!",,,,,
"""""",narrator_dd998269,Горячий поток хлынул в горло девушки с новой силой.,,,,,
"S """"",S_42d93ff6,"(Да как такое вообще возможно?! Он кончает, как из шланга! В меня столько не влезет, я уже и так полная!!!)",,,,,
"""""",narrator_541323cd,"Стуков с наслаждением мял попку Сары и кончал, стараясь протолкнуть член как можно глубже.",,,,,
"A """"",A_294e425e,"Шикарно! Ты просто чудо! Твой ротик - это мечта любого мужчины! А жадные звуки, которые ты издаешь, просто бальзам на душу.",,,,,
"S """"",S_31104e0b,*Мф* *Слурп* *Мф* *Гулп* *Мф* *Гулп*!!!,,,,,
"S """"",S_89ab3017,(Прекрати заливать меня!!!),,,,,
"A """"",A_22fc9168,"Конечно, конечно. Продолжай... Да!!!",,,,,
"A """"",A_44980281,"*Кхм* Я, как твой тренер, рекомендую эту тренировку сделать ежедневной... {size=-5}Я бы назначил ее ежечасной, но у меня много других дел!{/size}",,,,,
"""""",narrator_07041470,Новый выстрел из члена поверг Сару в панику.,,,,,
"S """"",S_b25ec0e9,(Она не кончается!!! Я же лопну!!!),,,,,
"""""",narrator_43d3943a,"Щеки девушки напряглись, стараясь сдержать богатырский отстрел Стукова.",,,,,
"S """"",S_b9c68244,"(Черт! Черт! Черт! Во рту места нет, в голове так туманно!!!)",,,,,
"""""",narrator_d8a6a3d1,Горячая сперма нашла дырочки и весело потекла через нос Сары.,,,,,
"S """"",S_90ca931d,"(Вот черт, она идет наружу!!! Еще и через нос!!!)",,,,,
"C """"",C_fc85a14e,"(Ну, это свойственно жидкости. Она идет путем наименьшего сопротивления, а так как у тебя огромный член блокирует доступ...)",,,,,
"S """"",S_a875b386,"(Я не спрашивала, почему!!!)",,,,,
"C """"",C_92f5c53a,"(Ну, мне показалось, тебе было бы интересно узнать... а еще ты снова еду упускаешь.)",,,,,
"S """"",S_cddd8127,(Это не еда!),,,,,
"C """"",C_9b8186ab,"(Все равно перевод продукта... а, плевать.)",,,,,
"A """"",A_42d386fd,"Ооо! Кажется, я слегка тебя переполнил! Ха-ха-ха!",,,,,
"""""",narrator_6c83c457,Горячая сперма начала прорываться изо рта девушки и стекать по члену.,,,,,
"A """"",A_1aa44f7f,"Возможно, это было рекордный выстрел. Не помню, чтобы я так много кончал за один подход... вот что ты с членами делаешь! Хе-хе...",,,,,
"S """"",S_557cd8ca,(М-меня это мало волнует... у меня тут другие проблемы...),,,,,
"""""",narrator_3e016393,"Наконец член Стукова перестал извергать сперму. И Сара нашла в себе силы, чтобы чуть-чуть приподняться. На большее сил не хватило. Держа член во рту, она продолжала поглощать оставшуюся сперму.",,,,,
"A """"",A_4baa2cb2,Ух! Это было замечательно.,,,,,
"S """"",S_99e18db6,*Гулп-гулп*,,,,,
"S """"",S_e0f01f8a,"(Хаааааа... черт, она такая питательная... главное, чтобы она обратно не пошла...)",,,,,
"A """"",A_d4add4a6,"Ну что, как ты себя чувствуешь? Я вот чувствую себя обновленным.",,,,,
"S """"",S_d6d7b293,Ммнп-мммм...,,,,,
"A """"",A_6fab3a35,"А ты без сил, но все равно не выпускаешь инвентарь изо рта. Вот это я называю отдачей!",,,,,
"S """"",S_69b5f978,"(Никакая это не отдача, м-мои руки меня не слушаются...)",,,,,
"A """"",A_152ece41,"Может, раз такое дело, то на посошок?",,,,,
"S """"",S_d1dc82f2_3,!!!,,,,,
"""""",narrator_a6ccdc75,"Сара начала пытаться брыкаться, подавая хоть какой-то знак протеста.",,,,,
"A """"",A_0e0f4073,"Ха-ха-ха, значит, силы все еще остались. Но ладно. Дело сделано, и ты сдержала свое слово. Сейчас я помогу тебе.",,,,,
"A """"",A_b9e9bab7,"Ну вот и все, отлично провели тренировку. И... хорошее исполнение, ты делаешь огромные успехи. В общем, твой тренер гордится тобой.",,,,,
"S """"",S_af40a696,Я и не сомневаюсь...,,,,,
"A """"",A_eea54360,"А знаешь, самое похвальное то, что ты сама изменила правила. Честно говоря, я был весьма удивлен, когда ты после моего предупреждения продолжала выполнять упражнение.",,,,,
"A """"",A_90aa937a,"Ведь это было твоим условием, ты так об долго этого добивалась при нашем обсуждении. А потом взяла и все изменила. Неужели тебе было так любопытно? Или, может, это рефлекст на еду какой-то выработался?",,,,,
"S """"",S_ae61c6ff,"Нет, и никакой это не рефлекс... просто все пошло не по плану...",,,,,
"A """"",A_2c5520d0,"Знаешь, ведь призраки очень хитрые. Вас же учат всегда скрывать ваш истинный замысел. Так что я ничему не удивлюсь, хе-хе-хе.",,,,,
"A """"",A_a4f1d24a,"Ну тогда отлично. Костюмчик можешь оставить у себя, он нам еще пригодится.",,,,,
"S """"",S_45d67006,Ладно.,,,,,
"S """"",S_68a2371b,"(В какой-то степени мне нравится то, как я выгляжу в нем, да и моя новая прическа, хи-хи.)",,,,,
"A """"",A_864e7f4c,"А, ну и мой тебе совет: лучше вещи свои клади повыше, а то... Тут такое дело: этот малый, ты знаешь, как только учует на вещах твой запах, тут же осеменит на шип их... Ха-ха-ха!",,,,,
"A """"",A_5c93648c,"А, ну и мой тебе совет: лучше вещи свои клади повыше, а то... Тут такое дело: этот малый, ты знаешь, как только учует на вещах твой запах, тут же посадит на шип их... Ха-ха-ха!",,,,,
"S """"",S_d1dc82f2_4,!!!,,,,,
"S """"",S_11b0a447,"(А вот это действительно дельный совет. Он зальет их полностью, а мне потом ходи в них...)",,,,,
"S """"",S_01415869,Что-то ты уж разошелся и советы мне даешь...,,,,,
"A """"",A_03cfa7d5,"Хех, денек просто сегодня замечательный.",,,,,
"S """"",S_c5681504,"Ага, денек...",,,,,
"S """"",S_8ea977f1,"Думаю, это точно пойдет мне на пользу. Да и поможет в будущих тренировках с этим извращенцем.",,,,,
"S """"",S_855f8f4d,"Отлично, теперь я готова и могу приступать.",,,,,
"S """"",S_c1816ca4,"Наконец-то я смогу сконцентрироваться на упражнениях, и этот извращенец не будет меня отвлекать.",,,,,
"""""",narrator_fc280004,"Сара начала делать упражнения все так же, как и при тренировках со Стуковым.",,,,,
"""""",narrator_a3352c6b,"Это было не так легко, как казалось. Тело рефлекторно реагировало на развратные приседания и становилось горячим.",,,,,
"S """"",S_ba905401,Этот извращенец... ч-что он сделал с моим телом... мне нужно продолжать.,,,,,
"S """"",S_ad285325,"*Тяжело дышит* Хах... отлично, теперь я чувствую, как хорошо работают мои мышцы.",,,,,
"S """"",S_7307f727,"(Но также... когда я делаю эти упражнения, мое тело становится таким горячим, а киска вся сочится... Это все из-за него. Мое тело хорошенько запомнило то, как он лапал меня.)",,,,,
"S """"",S_8813eac6,"Ахх... но этого недостаточно, я хочу больше...",,,,,
"S """"",S_75ab7c27,Аххх... даа...,,,,,
"S """"",S_679865cc,Мммм!!!,,,,,
"S """"",S_4f6630ab,!!!,,,,,
"S """"",S_4cb01eb4,"Мне стоит заканчивать, а то я так совсем голову потеряю...",,,,,
"""""",narrator_a2ba16f7,"Сара закончила комплексную тренировку призрака, а также тренировку Стукова. Сара стала сильнее.",,,,,
"S """"",S_36b3e437,"Первая тренировка завершена, осталось еще две.",,,,,
"S """"",S_544a3fbb,"Это была вторая тренировка, еще одна и все.",,,,,
"S """"",S_52e6abd8,"Дело сделано, это была последняя тренировка. Теперь мы сможем продолжить.",,,,,
"""""",narrator_f2a235ff,"Вы уже видели данную сцену, хотите ли ее пропустить?",,,,,
"A """"",A_bd07052f,"Пришло время покорять новые вершины, Сара!",,,,,
"S """"",S_f3094d60,Вершины?,,,,,
"A """"",A_bc296da0,"Да. В прошлый раз ты отлично справилась со своей тренировкой, поэтому я решил повторить отжимания, чтобы закрепить результат.",,,,,
"S """"",S_a1be0478,Тебе просто понравилось заполнять мой рот...,,,,,
"A """"",A_daa10fc9,"Нет-нет, о чем ты говоришь? Только благие цели, Сара!",,,,,
"S """"",S_f9752257,"Я всем своим нутром, к сожалению, чувствовала, как тебе нравилось толкаться в мое горло...",,,,,
"A """"",A_d7470111,"Кто знает, что могло казаться твоему нутру. Моему вот казалось, что ты отлично проработала группу мышц рук, спины и особенно горла, хе-хе. Поэтому используй спортивный костюм по назначению и начнем.",,,,,
"S """"",S_d0c62081,"(Я не могу позволить этому безобразию повториться снова! Если меня снова переполнит его сперма, то это будет полный провал.)",,,,,
"C """"",C_ccf5e0ef,(Тебе противна его сперма?),,,,,
"S """"",S_a140021d,"(Не то чтобы... Почему ты вообще спрашиваешь меня о таком?! Пф, мне вполне хватает кормежки!)",,,,,
"C """"",C_4dcbae32,"(Значит, нравится?)",,,,,
"S """"",S_c1c18326,(Да какая разница? Нравится или не нравится... Мне не нравится его самодовольное лицо! Вот возьму и не позволю ему кончить внутрь.),,,,,
"C """"",C_555b594a,"(Ему в любом случае придется куда-то кончить. Тебе больше льстит ходить с маской из спермы на лице? Хм, может быть, ты так найдешь новый вид косметических процедур...)",,,,,
"S """"",S_bbb0056e,"(Арх... Похоже, действительно придется позволить ему кончить себе на лицо. Но в этом случае этот извращенец будет не таким довольным, а значит, я в какой-то мере выиграю!)",,,,,
"A """"",A_c8b2b862,"Ты специально переодевалась так долго, чтобы разогреть мой аппетит? Ну у тебя получилось, поэтому у меня нет желания больше ждать.",,,,,
"S """"",S_2a6af37d,"Как у тебя получается каждый раз быть таким же возбужденным, учитывая, чем ты занимаешься по вечерам?",,,,,
"A """"",A_d93babf0,"Тренерами могут стать только лучшие. Годы практики и тонны использованного крема для рук. Вот закончишь тренировку и приблизишься к пониманию этой прекрасной истины, хе-хе.",,,,,
"""""",narrator_de78a62e,"Стуков сжал грудь Сары, с удовольствием слушая ахи девушки.",,,,,
"S """"",S_b83819fd,Ах! Разве тренеры отвлекают своих учеников от тренировки? Лапай мою грудь не так откровенно!,,,,,
"A """"",A_e6310223,"Я тренирую твою выдержку. Твоя фантазия такая пошлая, что всюду ищет другой контекст...",,,,,
"S """"",S_505f44ed,Ч-что? Я...Все нормально с моей фантазией.,,,,,
"S """"",S_f627f1ba,"(Как у него удается все так переиначивать?... Черт, как же стыдно.)",,,,,
"C """"",C_36cd1446,"(Разве тебе должно быть стыдно, если он говорит неправду?)",,,,,
"S """"",S_ddaf336e,(Ммммм... Когда же ты перестанешь влезать со своими неуместными комментариями?),,,,,
"C """"",C_b651730c,(Как всегда грубо... Тогда развлекайся тут сама.),,,,,
"S """"",S_2529fa05,(Да как ты! Какие еще развлечения? Эй! Ну и черт с тобой... Меньше отвлекать будешь.),,,,,
"A """"",A_d93b962d,"Теперь у тебя есть опыт в этой сфере, так что ты сама должна понимать когда тебе следует отдохнуть, а когда делать сами отжимания.",,,,,
