location,source,target,ID,fuzzy,context,translator_comments,developer_comments
"S """"",S_3ddc364a,"Думаю, самое время начать физическую тренировку.",,,,,
"A """"",A_2ec6b9b4,"Хорошо, для начала нам нужно проверить твой текущий уровень физической формы.",,,,,
"""""",narrator_cca8752a,"Стуков начал ходить вокруг Сары, разглядывая ее тело.",,,,,
"S """"",S_52317230,(...),,,,,
"Aside8 """"",Aside8_72731c7b,Хм...,,,,,
"S """"",S_b6ad03a4,"Может, ты прекратишь вот так пялиться на меня и мы перейдем к делу?",,,,,
"Aside3 """"",Aside3_6bd138c9,"Ха-ха-ха, а ты думаешь я чем занимаюсь? Это часть тренировки. Да и я люблю твое шикарное тельце.",,,,,
"S """"",S_75cc25af,...,,,,,
"S """"",S_d10af909,(Он просто невыносим...),,,,,
"A """"",A_986111f5,"Хорошо, вижу, ты тут без дела не сидела. Мы можем начинать.",,,,,
"S """"",S_781fd6db,Наконец-то... и что мне нужно будет делать?,,,,,
"A """"",A_0df8d721,Ничего сложного. Просто мы с тобой займемся некоторыми упражнениями для улучшения твоего тела.,,,,,
"S """"",S_934f44a6,"Что ты там уже задумал, а?",,,,,
"A """"",A_7a5bf057,"Хе-хе-хе, ничего такого.",,,,,
"S """"",S_792d00eb,(Снова это его извращенное выражения лица...),,,,,
"A """"",A_452b3ff6,"Итак, давай начнем. Покажи мне, как ты занимаешься.",,,,,
"S """"",S_91d4fb95,Поняла.,,,,,
"A """"",A_db4a9f40,"Хм, этого недостаточно. Сперва тебе нужно привести свое тело в порядок, и только потом мы сможем продолжить.",,,,,
"S """"",S_23a3130b,"(Черт... а он прав, я уже давно не делала физические упражнения.)",,,,,
"S """"",S_a62fc576,"Хорошо, я позову тебя, как только сделаю это...",,,,,
"""""",narrator_90b3e6cf,"Сара приняла позу, в которой она выполняла упражнения. Ее руки были у нее за головой, а ноги на ширине плеч.",,,,,
"Aside8 """"",Aside8_d9b85a6c,"Ты что, собралась выполнять упражнения вот в этой броне? Тебе не кажется это немного странным?",,,,,
"S """"",S_3f32666e,"Нет, я всегда занималась в этой броне!",,,,,
"Aside8 """"",Aside8_8f82ac3c,...,,,,,
"Aside9 """"",Aside9_b792ae4c,"Ладно, в этот раз я закрою на это глаза, продолжай.",,,,,
"""""",narrator_74a84bf2,"Она начала выполнять упражнения, в точности как делала это все время.",,,,,
"Aside10 """"",Aside10_275f7454,"Ага. Да, весьма неплохо. Возможно, чуть-чуть хромает техника, но это вполне нормально.",,,,,
"S """"",S_7a3be9d6,(Техника хромает? Ты свой монокль случайно не забыл...),,,,,
"S """"",S_059460ca,"Конечно, неплохо, ты за кого меня держишь?",,,,,
"Aside3 """"",Aside3_5cbafa16,"Ха-ха-ха, но сейчас я научу тебя немного другому упражнению. Подожди немного.",,,,,
"S """"",S_7d97a6e9,Ч-что ты задумал???,,,,,
"""""",narrator_d9e99ce2,"Через мгновение, Стуков начал снимать одежду, оставив на себе только брюки.",,,,,
"A1side11 """"",A1side11_99ec7b08,Правило номер один: одежда — враг спорта.,,,,,
"S """"",S_bbd0523b,У тебя и тут есть какие-то извращенные... правила?,,,,,
"A1side4 """"",A1side4_0c36c87c,"Ха-ха-ха, давай уже начнем.",,,,,
"""""",narrator_e8587a19,"Стуков приблизился к Саре и встал сразу же за ней. Саре было немного не по себе из-за того, что он находился сразу позади.",,,,,
"""""",narrator_678a70f4,Стуков начал вдыхать исходящий от Сары запах.,,,,,
"A """"",A_807c00be,"Ммм, от тебя исходит такой аромат... Особенно после приседаний.",,,,,
"S """"",S_68d189cc,!!!,,,,,
"S """"",S_9f407277,"Прекрати, это ужасно!",,,,,
"A """"",A_e7789a4c,"Ха-ха-ха-ха, нет ничего прекрасней, чем твой запах.",,,,,
"S """"",S_92c9bbb9,Заткнись...,,,,,
"A """"",A_ffb16e9f,"Хорошо, теперь давай я начну. Для начала попробуй расставить ноги вот так.",,,,,
"A """"",A_c982790d,Таким образом будут задействованы совершенно другие мышцы.,,,,,
"S """"",S_ccc5f243,В-вот так?,,,,,
"S """"",S_9a800a2b,(Это какая-то странная поза...),,,,,
"A """"",A_371f0a5b,"Да, все верно. Вот теперь в такой позиции попробуй присесть. Ты почувствуешь, как будут задействованы другие мышцы.",,,,,
"S """"",S_d9763815,Х-хорошо...,,,,,
"A """"",A_55cacc91,"Не переживай ты так, я тебя подстрахую, хе-хе-хе.",,,,,
"""""",narrator_8b62a8b8,Стуков положил свою руку на бедро Сары.,,,,,
"S """"",S_b5623092,(Вот из-за этого я и переживаю больше всего...),,,,,
"A """"",A_5fccca73,"Молодец, у тебя все хорошо получается.",,,,,
"S """"",S_514f4f6c,Но это выглядит как-то нелепо...,,,,,
"A """"",A_a57e44d1,"Не выдумывай, это очень хорошее и эффективное упражнение, о которым ты не знала.",,,,,
"S """"",S_95b54bba,Я бы сказала извращенное...,,,,,
"A """"",A_f14f2615,"Ты можешь его называть как тебе угодно, а теперь давай вернемся к приседаниям.",,,,,
"S """"",S_5f968664,Это весьма тяжело...,,,,,
"A """"",A_50ccda27,"А я тебе о чем говорю? Теперь в нижней позиции сделай небольшую паузу, почувствуй, как напряжены все твои мышцы.",,,,,
"S """"",S_6cb0d88e,Хорошо...,,,,,
"S """"",S_a2c4011c,(Аххх... ч-что не так... мое тело становится таким горячим...),,,,,
"A """"",A_a153c84a,Все в порядке?,,,,,
"S """"",S_ef6f3de3,"Д-да, вполне...",,,,,
"A """"",A_bbfbc92d,"Отлично, тогда еще немного.",,,,,
"S """"",S_53d978f4,!!!,,,,,
"S """"",S_36ba2c7e,Ч-что ты делаешь?,,,,,
"A """"",A_d6785ef8,"Не переживай, просто страхую тебя. Я же хочу, чтобы ты была в порядке.",,,,,
"S """"",S_24de1798,Э-это не похоже на страховку...,,,,,
"S """"",S_3514580d,"(Чертов извращенец, но мое тело... ахх... эти приседания... мне так приятно там внизу...)",,,,,
"A """"",A_8d8b12b2,"Лучше сконцентрируйся на мышцах, а безопасность твоих гру...{w} кхм, свою безопасность предоставь мне.",,,,,
"""""",narrator_2b870e1b,"Стуков начал сжимать грудь Сары, эти действия усложняли упражнения.",,,,,
"S """"",S_7fe22934,"(Аххх... когда он сжимает грудь, мне становится так приятно...)",,,,,
"S """"",S_0fda8ccb,Т-ты только делаешь хуже...,,,,,
"A """"",A_3b7af723,"Не может быть. Я чувствую, как хорошо прорабатываются твои мышцы.",,,,,
"A """"",A_33e10cd0,Просто не обращай внимания и продолжай.,,,,,
"S """"",S_75cc25af_1,...,,,,,
"S """"",S_09e1a848,(Ахх... ведь при обычных приседаниях такого со мной не было... это все его извращенная техника... или же это из-за него самого?),,,,,
"A """"",A_685f9036,"Отлично-отлично, просто прекрасно. Ты чувствуешь то, как растут твои мышцы?",,,,,
"S """"",S_2664ae29,"Д-да, чувствую...",,,,,
"S """"",S_710dfa8e,"Но я также чувствую, что кое-что еще выросло... и это не мои мышцы...",,,,,
"A """"",A_9f12dd52,Заметила все же. Хе-хе-хе.,,,,,
"S """"",S_beaf0cfc,"К-конечно, заметила. Он уперся мне прямиком между ягодиц...",,,,,
"S """"",S_3a86c42f,"(Аххх... и он твердый, как камень...)",,,,,
"A """"",A_a1a2abd6,"Ну ты сама виновата, нечего так постанывать во время приседаний.",,,,,
"S """"",S_a5099feb,Я-я виновата??? Ахх...,,,,,
"A """"",A_91d30cb4,"Хе-хе-хе, лучше сконцентрируйся на упражнениях.",,,,,
"S """"",S_20c3824c,"(Легко ему говорить, когда эта штуковина не давит между ягодиц... черт....)",,,,,
"S """"",S_c62b5b2b,(Аххх... п-прекрати играться с моей грудью...),,,,,
"A """"",A_8d447b75,"Хватит, теперь давай в исходную позицию.",,,,,
"S """"",S_56211103,"(Ахх... черт, я уже мокрая там внизу... если бы не моя броня он бы это увидел...)",,,,,
"A """"",A_341acc35,"Отлично, у нас есть немного времени отдохнуть, сделай пару глубоких вдохов и выдохов.",,,,,
"S """"",S_75cc25af_2,...,,,,,
"S """"",S_71a89ce0,А сейчас... ты меня тоже страхуешь???,,,,,
"A """"",A_011e8fcd,"Хех, конечно, безопасность прежде всего, да и мы еще не закончили упражнение.",,,,,
"S """"",S_75cc25af_3,...,,,,,
"S """"",S_aaf9ddca,(Он просто нашел еще один повод лапать меня...),,,,,
"""""",narrator_135b4902,"Сара попыталась перевести дыхание, но у нее это с трудом получалось, поскольку Стуков продолжал играться с ее грудью, а твердый член упирался прямиком ей между ягодиц.",,,,,
"A """"",A_7e4ce84d,"Отлично, дыхание перевели и теперь можем продолжать. Только на этот раз без остановки в нижней позиции.",,,,,
"S """"",S_105f16ef,"(Э-это только начало, но я должна выдержать...)",,,,,
"""""",narrator_36b2c3bc,"Сара продолжала выполнять упражнения, конечно же вместе со страховкой Стукова.",,,,,
"""""",narrator_ee159570,Прошло некоторое время.,,,,,
"S """"",S_635d87bc,У-у меня уже нет сил...,,,,,
"A """"",A_d751d871,"Это говорит о том, что мы с тобой сегодня отлично провели тренировку.",,,,,
"S """"",S_07444e52,Мы? Да ты просто все время игрался с моей грудью!,,,,,
"A """"",A_d7272c0f,"Деточка, ты просто слишком неопытна в этом деле. Знаешь, насколько важна страховка?{w} Это же основы основ...",,,,,
"S """"",S_75cc25af_4,...,,,,,
"S """"",S_580594a3,"Может, ты хоть сейчас отпустишь мою грудь? Мы вроде бы закончили...",,,,,
"A """"",A_5d486560,"Ах да, точно. Извини, профессиональная привычка...",,,,,
"A1side2 """"",A1side2_5a732295,"Тогда на сегодня все. Не забудь хорошенько отдохнуть, а завтра мы продолжим.",,,,,
"A1side8 """"",A1side8_d3d96420,"Думаю, мне не нужно тебе напоминать, насколько важен отдых после тренировки?",,,,,
"S """"",S_82bbf14f,"Нет, не нужно.",,,,,
"A1side11 """"",A1side11_1b0bde7c,"Ну вот и ладненько, да и у меня появились некоторые дела после нашей тренировки. Если ты понимаешь, о чем я. Ха-ха-ха-ха-ха!",,,,,
"S """"",S_68d189cc_1,!!!,,,,,
"""""",narrator_5c6a72be,"Сара, сама не замечая того, машинально направила взгляд на стояк Стукова, который чувствовала всю тренировку.",,,,,
"S """"",S_09bf91d0,"Н-не понимаю, о чем ты говоришь...",,,,,
"A1side4 """"",A1side4_4fbe7ab3,"Ха-ха-ха, будто я поверю в это.",,,,,
"""""",narrator_eb38f8fe,Стуков направился к выходу.,,,,,
"S """"",S_10d9fddd,"Фух... эта тренировка... она выбила меня из сил. Но скорей не она сама, а этот извращуга со своими приставаниями... Но я справилась и это главное.",,,,,
"S """"",S_eb899309,А еще... ,,,,,
"S """"",S_cc2181e8,*Нюх-нюх*,,,,,
"S """"",S_53d978f4_1,!!!,,,,,
"S """"",S_e6972423,"Яйкс... думаю, мне стоит сходить помыться.",,,,,
"""""",narrator_cb1a68f7,"Физическая тренировка завершена. Мышцы Сары стали тверже, но им еще далеко до стояка Стукова.",,,,,
"""""",narrator_d5635fee,Физическая тренировка со Стуковым завершена. Сара стала сильнее.,,,,,
"A """"",A_30dd53b8,"Ну что, ты хорошенько отдохнула? Нас сегодня ждет очень плодотворная тренировка.",,,,,
"S """"",S_c871be2d,"Да, я готова. У меня полно сил.",,,,,
"A """"",A_cb821c61,"Тогда давай, раздевайся и мы начнем тренировку.",,,,,
"S """"",S_21e324d6,Р-раздеваться?,,,,,
"A """"",A_aa57140b,"Да. В прошлый раз я закрыл на это глаза, но теперь не потерплю одежды на моих тренировках. Эта броня очень неудобна и сковывает движения.",,,,,
"S """"",S_c2a9bec4,...,,,,,
"S """"",S_151f7bb7,"Ладно, как скажешь. Тебе виднее, извращенец.",,,,,
"S """"",S_d30315d9,Можем начинать...,,,,,
"A """"",A_2f51de15,Белье также нужно снять.,,,,,
"S """"",S_7cf15767,"Конечно, как же иначе...",,,,,
"A """"",A_40d6ff8e,"Если хочешь, я также могу раз...{w=0.7}{nw}",,,,,
"S """"",S_1656ff10,Ну уж нет! Даже не начинай...,,,,,
"S """"",S_c2a9bec4_1,...,,,,,
"S """"",S_290e7b52,{size=-5}Извращенец...{/size},,,,,
"Aside11 """"",Aside11_28314f4c,"Хе-хе-хе, отлично.",,,,,
"""""",narrator_e0e66bb6,Стуков сразу же принялся вдыхать аромат Сары.,,,,,
"S """"",S_cdf467b8,(Х-хватит нюхать меня...),,,,,
"A """"",A_55ce3d11,От тебя исходит такой легкий аромат.,,,,,
"A """"",A_7d937ca3,"Знаешь, я совсем не против, если от тебя будет пахнуть чуть сильнее во время тренировков, да и вообще.",,,,,
"S """"",S_f614ea53,!!!,,,,,
"S """"",S_f3c22bfe,Х-хватит мне такое предлагать... я не буду это делать...,,,,,
"S """"",S_a38ca518,(Э-это так ужасно!),,,,,
"A """"",A_fd4fcc4c,"Ммм, от тебя сегодня исходит хороший запах... Я не могу насытиться им.",,,,,
"S """"",S_ec7c450c,П-прекрати...,,,,,
"A """"",A_606c718f,Даже не подумаю.,,,,,
"S """"",S_5c7badf7,(Ахх... черт...),,,,,
"S """"",S_77f8f469,Я просто не успела еще сходить помыться...,,,,,
"A """"",A_fad39fc2,"Ты же знаешь, я совсем не против этого.",,,,,
"S """"",S_c2a9bec4_2,...,,,,,
"A """"",A_76a16924,"Ммм, этот сильный запах, как же я его люблю... Я просто без ума от него!",,,,,
"S """"",S_f614ea53_1,!!!,,,,,
"A """"",A_f375e68f,"Ты специально не ходила в душ перед тренировкой только потому, что знаешь, как я люблю этот аромат?",,,,,
"S """"",S_25b50561,Не выдумывай... просто я была занята...,,,,,
"S """"",S_7418972d,(Я... специально... р-ради него??? Э-это не так!),,,,,
"A """"",A_98956a69,"Ничего, я совсем не против, я обожаю этот запах!",,,,,
"S """"",S_d2e214cd,Давай вернемся к упражнениям...,,,,,
"A """"",A_8a39cba1,"Хорошо, давай. Ты все помнишь? Я страхую тебя, ты выполняешь упражнения.",,,,,
"S """"",S_47136cab,"Может, лучше без твоей 'страховки'?",,,,,
"A """"",A_f3f94482,...,,,,,
"A """"",A_de8a7869,Мне прочитать лекцию о важности страховки при проведении упражнений?,,,,,
"A """"",A_6c1732ee,Чему вас только учат в академии призраков...,,,,,
"S """"",S_39e0d06e,"Но от нее же нет толку, ты просто лапаешь мою грудь.",,,,,
"A """"",A_4436bcf9,"Ха-ха-ха-ха, это ты со стороны простого обывателя видишь это как 'лапанье груди'. Но это называется профессиональной страховкой.",,,,,
"S """"",S_c2a9bec4_3,...,,,,,
"S """"",S_00d7113e,Со мной ничего не случилось же...,,,,,
"A """"",A_c2fab967,Это все благодаря моим навыкам!,,,,,
"S """"",S_fb7ad78e,(С ним спорить нет смысла...),,,,,
"""""",narrator_e6f9dc1e,Сразу после этого Стуков схватил Сару за грудь.,,,,,
"S """"",S_86a46a5e,Ахх!!!,,,,,
"A """"",A_5480c3dc,"Хорошая реакция, хе-хе. Я вижу, твое тело уже привыкло.",,,,,
"S """"",S_11be27ae,Т-ты просто неожиданно это сделал...,,,,,
"A """"",A_d5c16345,"Ха-ха, как скажешь.",,,,,
"A """"",A_850153ab,"Ладно, теперь ты можешь начинать. Сперва начнем с задержки в нижнем положении.",,,,,
"""""",narrator_871e178b,"Сара приступила к выполнению упражнений и сделала в точности, как велел Стуков.",,,,,
"A """"",A_07cd64b9,"Да, отлично. В этот раз ты уже лучше справляешься.",,,,,
"S """"",S_c36ef815,"(Я бы еще лучше справлялась, если бы не было твоей страховки...)",,,,,
"A """"",A_166e6c86,"Вот видишь, мы с тобой отличная команда. Такими темпами в скором будущем твое тело станет очень сильным.",,,,,
"S """"",S_c2a9bec4_4,...,,,,,
"S """"",S_db165e6d,(Ты вообще ничего не делаешь!),,,,,
"A """"",A_d49c6b6b,"Ммм, а я тебе говорил, что твоя кожа такая нежная?",,,,,
"S """"",S_a3da12ce,"Н-нет, не говорил...",,,,,
"A """"",A_af28c305,Особенно вот тут.,,,,,
"S """"",S_7b75288b,Айй... ммм...,,,,,
"A """"",A_e2b9a47c,"Хе-хе, я чувствую, как твое тело чуть-чуть содрогается, когда я начинаю сжимать твою грудь..",,,,,
"S """"",S_cd12edb4,Э-это из-за упражнений... ахх... п-просто мои мышцы напряжены...,,,,,
"S """"",S_9569eadf,(З-зачем он мне это говорит... он только отвлекает меня...),,,,,
"S """"",S_b1fe8502,"Я бы хотела, чтобы ты в дальнейшем воздержался от таких высказываний.",,,,,
"A """"",A_9ad85fc8,"Ты же знаешь, я не смогу это сделать.",,,,,
"S """"",S_4036bb73,"(К-конечно, знаю... ты еще тот извращуга, который любит лапать мою грудь...)",,,,,
"A """"",A_10da9803,"Отлично, теперь возвращаемся в исходное положение.",,,,,
"A """"",A_98242ede,"А я вижу, кому-то эти упражнения очень сильно пришлись по вкусу, да?",,,,,
"A """"",A_7c2694ad,Ха-ха-ха-ха.,,,,,
"S """"",S_a8983b7d,Э-это все из-за тебя... и твоих извращенных приседаний...,,,,,
"A """"",A_7b46a9b9,"Я, конечно, польщен, хмм... а знаешь у меня есть идея. Если тебе нравится это название, то мы можем его использовать в дальнейшем.",,,,,
"S """"",S_a2215220,"Ч-что значит 'нравится'? Ты перевираешь мои слова, я не говорила, что оно мне нравится... Я просто констатирую факты...",,,,,
"S """"",S_3f13266e,После этих упражнений мое тело становится таким горячим... {w}{size=-5}особенно там внизу...{/size},,,,,
"A """"",A_723bea21,"Ничего, это вполне нормально. В таком положении задействуются мышцы нижнего таза, при напряжении которых люди могут испытывать...",,,,,
"A """"",A_f3f94482_1,...,,,,,
"A """"",A_40a0483f,"В общем, не стоит забивать голову этим. Просто доверься и, если будешь чувствовать себя странно, то скажи мне.",,,,,
"A """"",A_b431cbc5,А теперь давай продолжим. Сделай несколько приседаний.,,,,,
"S """"",S_99e4f7c6,(Ахх... я должна справиться с этим удовольствием...),,,,,
"S """"",S_542e7125,Аххх...,,,,,
"A """"",A_40e239e0,"Не забывай дышать, это очень важно.",,,,,
"S """"",S_6521dfca,Ммм... ахх... х-хорошо...,,,,,
"""""",narrator_89b1fe26,"Сара продолжила упражнение. Чем больше она занималась, тем больше удовольствия получала от тренировки.",,,,,
"A """"",A_3141dbc7,"Отлично-отлично, только посмотри, как хорошо твое тело реагирует на упражнения, ты вся сочишься.",,,,,
"S """"",S_89f1c3e8,"П-прекрати... это совсем не так... это все из-за того, что ты играешься с моей грудью.",,,,,
"A """"",A_4cdaad04,Да? А это ведь просто страховка. Твое тело уже реагирует на каждое мое прикосновение.,,,,,
"S """"",S_77fd368d,(Ахх... просто перестань играться с моей грудью...),,,,,
"A """"",A_dd8cb291,"Эй-эй-эй, даже не думай останавливаться. Сейчас не время отдыхать, продолжай делать упражнения.",,,,,
"S """"",S_c64d99a2,Я знаю...,,,,,
"S """"",S_f614ea53_2,!!!,,,,,
"S """"",S_f186424b,(Еще этого не хватало... снова это чувство... его штуковина снова упирается мне между ягодиц...),,,,,
"A """"",A_9eb9c8f1,"Я думаю, ты уже успела заметить.",,,,,
"S """"",S_d2579e8d,Еще бы... тут попробуй не заметить...,,,,,
"A """"",A_731fb228,"Просто постарайся не обращать на это внимание. Если, конечно, сможешь. Ха-ха-ха.",,,,,
"S """"",S_9dfebf53,"(Это ужасно, но... от этого чувства мне так приятно...)",,,,,
