location,source,target,ID,fuzzy,context,translator_comments,developer_comments
"S """"",S_75d97699,"(Черт... Я, кажется, хочу его! Я хочу лизнуть его, почувствовать его вкус!)",,,,,
"A """"",A_c600ff26,"Ты чего там задумалась, инвентарь сам себя не подготовит.",,,,,
"S """"",S_fa222c93,Да знаю я...,,,,,
"S """"",S_bfe59127,(Блин! И его тело такое крепкое... А этот член...),,,,,
"""""",narrator_3dd10c8c,"Девушка осторожно и незаметно втянула запах. От члена Стукова, пахло самцом, от этого запаха Сара разгоралась все сильнее.",,,,,
"A """"",A_09700cee,"Ты знаешь, что от тебя требуется. Начинай подготовку, хе-хе!",,,,,
"S """"",S_677248c4,Да... Чего от тебя можно ожидать! Ты так и норовишь пихнуть в меня... это!,,,,,
"A """"",A_428a0d23,Сила приходит через преодоление себя!,,,,,
"""""",narrator_c99ac1f8,"Болт Стукова покачался перед лицом призрака, распространяя его аромат все больше.",,,,,
"S """"",S_54f2c82b,Не дергай... им!,,,,,
"S """"",S_5feaad9e,(Такой большой... Сейчас я буду вылизывать здоровенный член чужого мужика! Это так непривычно... и так заводит!),,,,,
"A """"",A_c70eefe8,"Хе-хе... Медленно и плавно, чтобы мышцы все запомнили.",,,,,
"S """"",S_42e763f1,*Лизь* *лизь*,,,,,
"""""",narrator_b3f92812,"Сара плавно опускалась к члену, вдыхая его запах.",,,,,
"""""",narrator_c6438d25,Губы девушки коснулись головки неожиданно нежно.,,,,,
"A """"",A_f19e70ed,Ооо даа!!! Вот это подход к вопросу! Твои губки просто прелесть!,,,,,
"S """"",S_988c3128,Пфросто заткнифь...,,,,,
"A """"",A_3243c7b7,"Да, да. Я все понимаю. Ты очень давно этого ждала и не хочешь упустить ни сантиметра моего классного члена.",,,,,
"S """"",S_0b035311,Я профто *лизь* хочу по-быфрее *чмок* с этим кончить!,,,,,
"A """"",A_64a813ea,"Дааа... вот это класс! Говорить с членом во рту... этомуго я тебя точно не учил. Но это супер приятно, продолжай так делать.",,,,,
"""""",narrator_c97b6b3c,Сара оторвалась от члена.,,,,,
"S """"",S_ad137c8f,Ты все не так понял!,,,,,
"A """"",A_ce100aa5,"Ха-ха-ха! Так, не так - это не важно, продолжай!",,,,,
"S """"",S_de12bb0c,*Слурп-лизь*,,,,,
"""""",narrator_85961f80,Сара принялась осторожно вылизывать член.,,,,,
"A """"",A_bb7bb8da,"Смелее! Облизывай головку, и не бойся пускать слюни! Не сдерживай их, пусть мой член будет мокрый от твоих слюней!",,,,,
"S """"",S_c0b4db85,Грефаный изфрасенец!,,,,,
"S """"",S_8823a0d3,(Но этот извращенец прав - я должна смочить его как следует...),,,,,
"S """"",S_2607d34f,*Лизь* *Лизь* *Слурп*,,,,,
"""""",narrator_03618930,Ловкий язычоек Сары начал еще старательней вылизыватьл инвентарь Стукова. Но теперь его движения были более хаотичны.,,,,,
"S """"",S_2607d34f_1,*Лизь* *Лизь* *Слурп*,,,,,
"S """"",S_c1c97f7d,"(Черт... их становится все больше... но ведь он и хотел, чтобы я их не сдерживала...)",,,,,
"A """"",A_c4e773ed,"Да, больше слюней... А теперь еще добавь грязных звуков, да так, чтобы заполнить ими всю комнату.",,,,,
"S """"",S_193487b1,Ч-что ты имеешь...,,,,,
"A """"",A_5d5d72eb,"Эй, я же говорил не останавливаться!",,,,,
"S """"",S_fa5efb5a,"Фто, ты имеешь ввиду?",,,,,
"A """"",A_9b99b1c1,"Представь, будто это конфетка с сюрпризом внутри. Ты же любишь сюрпризы?",,,,,
"""""",narrator_5cc06633,ВНИМАНИЕ! Вы действительно хотите это сделать?,,,,,
"S """"",S_1f6768d7,"Да, я люблю начинку. И сейчас ты узнаешь, как я обычно это делаю...",,,,,
"S """"",S_5e5e3444,"Только вот, думаю, тебе не очень это понравится, так как я всегда жульничаю...",,,,,
"A """"",A_d77a8d35,"Эй, стой, что ты задумала? Даже не пытайся!",,,,,
"S """"",S_7fc0ef7a,*Кусь*,,,,,
"A """"",A_83a7afe5,{size=+10}Ааааааааааааааааааааа!!! МОЙ ЧЛЕН!!!{/size},,,,,
"S """"",S_8ef252ee,Ха-ха-ха-ха!,,,,,
"S """"",S_11e17a4a,"Поплатился, мерзкий ублюдок! Будешь знать, как конфетки дамам в рот засовывать!",,,,,
"S """"",S_5392183e,Всегда мечтала откусить член извращенцу...,,,,,
"centered """"",centered_19e03029,"После того, как Сара откусила Стукову член, он отказался тренировать ее дальше, сочтя слишком дикой, и Владычица взяла дело в свои руки. Она жестко тренировала Сару и без Стукова (чтобы остановить наиболее неразумные инициативы) сломала призрака. И настолько велик был ущерб, что даже Абатур не смог создать из тела Сары что-то полезное, навсегда оставив ее безмозглым и вечно жаждущим секса животным. Однако ее жизнь в этом состоянии длилась недолго., Сверхразум в гневе приказал Даготу уничтожить Владычицу за то, что та сломала его будущее совершенное оружие. Владычица, Стуков и Сара погибли в тот день. Нить судьбы была прервана и без Керриган, вселенная была обречена пасть перед властью Темного Зел'Нага.",,,,,
"S """"",S_364d6d4a,Не *лизь* люблю *лизь*.,,,,,
"A """"",A_45cfcf20,Я хочу слышать твои грязные и пошлые чмоки.,,,,,
"S """"",S_9800adad,...,,,,,
"S """"",S_c2642a01,{size=+5}*Слурп* *Слурп* *Слурп* *Слурп*{/size},,,,,
"A """"",A_a01b0522,"Да-да-да, то, что нужно. Можешь импровизировать. Представь, будто ты пьешь сок через трубочку, или ешь длинную макаронину.",,,,,
"S """"",S_012e1f08,(Откуда у этого извращенца столько пошлятины в голове...),,,,,
"S """"",S_9800adad_1,...,,,,,
"S """"",S_9800adad_2,...,,,,,
"S """"",S_3c646faa,(Я должна покончить с этим поскорее...),,,,,
"S """"",S_15128dfe,{size=+10}*Слу-у-у-у-у-у-у-у-у-у-у-у-у--у-у-у-у-рп*{/size},,,,,
"""""",narrator_4b406848,"Сара делала в точности, как говорил ей Стуков. Она начала издавать все более грязные звуки, которые эхом раздавались по всей комнате.",,,,,
"S """"",S_b776badd,*Слю-ю-ю-юрп* Дофолен... *Слю-ю-ююрп* *Слурп* изфрасенец *Слурп*,,,,,
"A """"",A_1786601e,"Да, это то, что нужно! Вот так и должна проходить подготовка инвентаря. Ты моя лучшая ученица! Чувствуешь, как он пульсирует во рту???",,,,,
"S """"",S_519285f9,Нет.,,,,,
"S """"",S_61582ed1,*Слю-ю-ю-ю-юрп*,,,,,
"A """"",A_e4439c7c,"Отлично! Продолжай вылизывать его, периодически издавая похотливые звуки! Вылизывать члены - твое призвание!",,,,,
"S """"",S_be33f621,*Слю-ю-ю-юрп* Это только для упражнения! {size=+10}*Слу-у-у-у-у-у-у-у-у-у-у-у-у--у-у-у-у-рп*{/size},,,,,
"A """"",A_869e32e1,"Черт, да как же ты насилуешь своим языком мою головку!. Где ты такому научилась, сколько же членов тебе пришлось отработать?",,,,,
"S """"",S_ea6329b9,Это тебя не касается!,,,,,
"A """"",A_05303ef4,"Ха-ха-ха!!! Касается, еще как касается.",,,,,
"S """"",S_a8de0bac,"Ты сказал так делать - я так делаю, вот и вся правда.",,,,,
"A """"",A_69aa3691,"Ну уж нет. Я тебя, можно сказать, только направил в нужное направление, а уже двигаешься ты сама. Так скажи, скольким счастливчикам повезло?",,,,,
"S """"",S_1b4f7e0c,"Ни одному. Я впервые делаю такие грязные вещи, нормальным парням это не понравилось бы!",,,,,
"A """"",A_14978daa,А вот тут ты ошибаешься. Но я доволен твоим профессиональным и ответственным подходом... Хе-хе-хе.,,,,,
"S """"",S_400b0064,*Лизь-лизь*,,,,,
"S """"",S_2f1d48a2,"(Научный руководитель, блин!)",,,,,
"S """"",S_ca75b6a7,"(Черт, но в чем-то он прав. Кажись, я втягиваюсь быстрее, чем ожидала. Мне самой становится все интересней издавать различного рода странные звуки... и все время попробовать что-то новое... хи-хи.)",,,,,
"S """"",S_96248d77,*Лизь-лизь-лизь-лизь-лизь-лизь-лизь-лизь-лизь-лизь* {size=+10}*Сл-у-у-у-у-у-у-у-у-у-у-у-у-у--урп*{/size},,,,,
"""""",narrator_82152266,Наконец инвентарь блестел от слюны призрака.,,,,,
"A """"",A_8e29b3a7,"Отлично! Я готов, он готов, ты призрак и готова вообще ко всему, хе-хе. Мы можем переходить к отжиманиям.",,,,,
"S """"",S_7e36d0ca,Ну наконец-то...,,,,,
"S """"",S_677e5b98,А зачем ты меня за задницу щупаешь?! Эту мышцы мы сегодня не задействуем!,,,,,
"""""",narrator_b3465adf,"Стуков крепко сжал аппетитную булку Сары, вызвав у девушки сладкие искры по всему телу.",,,,,
"S """"",S_13e49f14,"(Ммммм, даа... сожми ее...)",,,,,
"A """"",A_a7679625,"Мне просто нравится сжимать твою задницу! И я чувствую, что тебе тоже нравится, когда так делаю, хе-хе! Ты становишься более активной!",,,,,
"S """"",S_7601aeff,(Черт! Я завожусь! Мое сердце бешено ускоряется... *проглотила слюну* Это будет интересно!),,,,,
"S """"",S_1c891966,Таким образом я отвожу себя от мысли откусить твой член!,,,,,
"A """"",A_9a54bff0,"Хватит говорить глупости, лучше примись за работу!",,,,,
"S """"",S_ee95a680,Я просто хочу покончить с этим и все!,,,,,
"A """"",A_7ab8c62e,"Тогда опускайся, сгибая руки в локтях. Чувствуй каждую мышцу, хе-хе!",,,,,
"S """"",S_a2e33958,"(Я сейчас чувствую только одну мышцу - ту, что лезет мне в глотку!)",,,,,
"S """"",S_05ff17dc,Мммнн...,,,,,
"""""",narrator_96005739,"С нетерпением сгибая руки, Сара насаживалась горлом на член.",,,,,
"A """"",A_2cd1288f,"Твоя глотка... то есть, твоя подготовка - просто супер!",,,,,
"S """"",S_2717f1f9,(Он раздвигает мое горло! Это так... Почти как во время кормления!.. ~♥),,,,,
"A """"",A_abc5ec7c,"Черт! Ты делаешь это, как настоящая шлюха!..",,,,,
"S """"",S_642abd7c,(З-заткнись... если бы к этому члену не крепился Стуков - все было бы просто здорово...),,,,,
"""""",narrator_8412d304,"Сара все лучше чувствовала головку, стремящуюся в ее горло.",,,,,
"A """"",A_f546fcab,"Отлично! Твоя техника прекрасна! Я чувствую, как напряжены твои мышцы!",,,,,
"A """"",A_66d149a7,"Ты же тоже это чувствуешь, верно?!",,,,,
"S """"",S_5867e4d8,"(Я чувствую только крепкий член, что елозит по моей глотке! И, кажется, мне это нравится!)",,,,,
"""""",narrator_83d5bce2,Девушка уже отчетливо чувствовала возбуждение.,,,,,
"A """"",A_d2fdb5ba,Да! Да! Да! Вот об этом я и говорю! Ты просто прекрасна! Я чувствую твой... энтузиазм! Хе-хе!,,,,,
"A """"",A_759671f8,"Кто бы мог подумать: ты насаживаешься горлом на мой член и твой развратный ротик сочится, будто увидел огромный сочный стейк!",,,,,
"A """"",A_1b04bb65,Или мой член лучше любого стейка?,,,,,
"S """"",S_db77ace9,(Я не могу это контролировать! Слюна заполняет мой рот! Я хочу его!),,,,,
"""""",narrator_e07cc24b,"Из-под смыкающихся на члене губ выступила слюна. Сара отрабатывала языком по члену, но слюны становилось все больше.",,,,,
"A """"",A_3f103290,"Отменно! Просто отменно! Ты успеваешь заботиться об инвентаре, поддерживая его в рабочем состоянии.",,,,,
"S """"",S_1be45f68,"(Ты самый большой извращенец в галактике... И, кажется, заразный! Как еще можно объяснить то, что меня заводит твой член?!)",,,,,
"A """"",A_da2683f1,"Ты настолько увлеклась членом, что совсем забыла, для чего мы здесь, хе-хе. Думаю, тебе стоит начать отжиматься.",,,,,
"A """"",A_33e9991a,"Не забудь, что выполнять упражнение нужно строго с членом во рту! Если выпустишь его - повторение не засчитывается.",,,,,
"S """"",S_1da3daf1,"(Помню, извращенец... кому вообще в голову придет такое условие...)",,,,,
"S """"",S_db0cc2af,ГА-А-АГ!,,,,,
"S """"",S_d1dc82f2,!!!,,,,,
"""""",narrator_8ca0f345,"Здоровенный болт плотно влез в горло Сары. Стуков немного помогал, Саре работая своими бедрами, пытаясь протолкнуть член глубже.",,,,,
"A """"",A_430f5d91,"Ооо да! Это здорово, я хотел бы испытывать это чувство вечно! Она такая тугая!",,,,,
"S """"",S_94b84fb1,(Его член весь в моем пищеводе! ЕГО ЗДОРОВЕННЫЙ ЧЛЕН ВО МНЕ!!!),,,,,
"A """"",A_9f06b330,"Отменно, просто отменно! Ты по-настоящему великолепна! Так туго сдавила мою головку.",,,,,
"S """"",S_c1dea845,(Это так... грязно и... дико!!! Это так запретно! Это так сладко!!!),,,,,
"A """"",A_81ae6c33,"Я чувствую твой язык, ты все правильно делаешь!",,,,,
"S """"",S_5ac8e20a,"(Жаль только, что это ты, а не Джим! Ему я проглотила бы с яйцами!!!)",,,,,
"C """"",C_714119a2,(Это ты так восхищаешься его размером?),,,,,
"S """"",S_448c4fe0,(Конечно же нет...),,,,,
"S """"",S_91e37209,(Это всего лишь упражнения... теперь обратно... мне нельзя расслабляться...),,,,,
"""""",narrator_0e39cf6e,"Девушка стала подниматься, понемногу сползая с члена, но все еще очень активно обрабатывая его языком.",,,,,
"S """"",S_182924c7,*Мф* Чмок* *Слурп*,,,,,
"""""",narrator_a890d639,"Сара остановилась в верхней точке, но продолжала сосать член.",,,,,
"A """"",A_7954d631,"Молодец, с фиксацией в верхнем положении в академии вас хорошо обучили, похвально!",,,,,
"S """"",S_862035d8,*Мф* *Чмок* *Слурп*,,,,,
"S """"",S_0d8e289c,"(Это так... приятно, но терять голову нельзя!)",,,,,
"""""",narrator_5ed6fede,"Призрак плавно опустилась на члене, почти уперевшись носом в яйца Стукова.",,,,,
"""""",narrator_32981ebb,"Горло сжалось, доставляя мужчине наслаждение, язык красавицы продолжал полировать ствол.",,,,,
"S """"",S_672e5ca3,*Мф* *Слурп* *Чмок*,,,,,
"A """"",A_05bb86fd,"Сара, ты так развратно виляешь задницей. Дорвалась до моего члена и теперь наслаждаешься?",,,,,
"S """"",S_d1dc82f2_1,!!!,,,,,
"S """"",S_5a1fc15c,*Попытки поговорить с членом в горле*,,,,,
"A """"",A_a7b161ac,"Да-да-да, я знаю, что ты немного занята. Но попытка неплохая, ха-ха-ха. Давай просто продолжим.",,,,,
"S """"",S_2399fbf6,"(Блин, вот бы ему рот заклеить и руки связать! Тогда я могла бы наслаждаться в полной мере!)",,,,,
"""""",narrator_e521290a,"Руки Сары напряглись, поднимая тело. Девушка сжала губы на члене.",,,,,
"S """"",S_21967719,"(Его член... он чуть набух... наверняка хочет кончить внутрь, хоть мы об этом и не договаривались... Но при первой возможности обязательно кончит в меня, если я не буду внимательной!)",,,,,
"S """"",S_1db5b8c5,"(Обойдется! Я просто поднимусь и выплюну его член! Пока я сохраняю концентрацию, мне ничего не угрожает. С отжиманиями-то уж справлюсь.)",,,,,
"A """"",A_0f63a9dc,Очень хорошо. Твоя техника практически безупречна. Немного практики и твоя подготовка будет выше всяких похвал!,,,,,
"S """"",S_6c11902e,*Слюююрп*,,,,,
"""""",narrator_2390b79a,"Опускаясь, девушка старательно втягивала в себя член. И движение вышло несколько жадным.",,,,,
"A """"",A_4d1ecc13,"Да, Сара, я тоже долго ждал, когда же мой член окажется в твоей глотке, но не торопись. Помни, что техника в нашем деле это все. Нужно делать упражнение правильно!",,,,,
"S """"",S_ccaec503,*Мф* *Слурп* *Мф* *Чмок* *Мф*,,,,,
"S """"",S_45e82803,"(Идиот, с моей техникой все в порядке. Это все из-за твоего члена!)",,,,,
"A """"",A_68239581,"Ты знаешь, что если привыкнуть к неправильной технике, то потом будет еще сложнее? А еще придется потратить много времени, которого у нас и так мало.",,,,,
"S """"",S_bfcb675b,(!!!),,,,,
"S """"",S_862035d8_1,*Мф* *Чмок* *Слурп*,,,,,
"A """"",A_0420e19f,Не забывай про дыхание! Выдох - на усилие!,,,,,
"S """"",S_821581f2,(Про дыхание он вспомнил... лучше бы думал об этом раньше.),,,,,
"S """"",S_8176bceb,(А что дальше? Завяжет мне глаза и скажет 'смотри в оба'?),,,,,
"C """"",C_f91cde09,"(А что? Неплохая мысль. Нужно будет сказать Стукову, пусть что-нибудь придумает с завязыванием глаз.)",,,,,
"S """"",S_ed549aef,(Ты ничего не слышал!),,,,,
"C """"",C_58a89ffd,(Злая ты...),,,,,
"""""",narrator_08700a64,"Девушка быстро опустилась на член, ловко вылизывая его по всей длине.",,,,,
"A """"",A_38ca9af3,Отлично!,,,,,
"S """"",S_c989cf3b,"(Он так скользит во мне, и все благодаря моей слюне, хи-хи!!! Я точно стала извращенкой, раз я считаю это забавным!)",,,,,
"A """"",A_890dd058,"Знаешь, твоя киска перед моим лицом - это страшное искушение! Такой манящий вид, а аромат, ммм!",,,,,
"A """"",A_4bfba81b,"Если бы я проник в нее языком, это наверняка придало бы тебе сил!",,,,,
"S """"",S_59aa04e6,"(Это тебе придало бы сил... ах, мы это уже проходили, он специально это все готовит... нужно пропускать мимо ушей...)",,,,,
"S """"",S_5386c680,(Если бы это было так просто...),,,,,
"""""",narrator_3c035894,"Сара опустилась и почувствовала, как начинают гореть мышцы.",,,,,
"A """"",A_4f2df423,"Отлично, не забывай держать темп, это весьма важно для нас, хе-хе-хе.",,,,,
"S """"",S_5652da94,"(Ага, важно... Все, что тебя беспокоит, так это то, чтобы я не останавливалась и продолжала насаживаться на него...)",,,,,
"S """"",S_b71529a2,*Слурп* *Мф* *Чмок*,,,,,
"A """"",A_53d65b34,"Да, правильно. Ты все верно делаешь. Просто слушай то, что я говорю, и все будет отлично.",,,,,
"A """"",A_88715c71,Вот это воля! Ты просто молодец.,,,,,
"A """"",A_02ab6056,Однако быстро ты намокла!,,,,,
"S """"",S_126b1f58,(П-прекрати рассматривать...),,,,,
"A """"",A_62d98c0f,"Это ведь пот, да? Ты же не могла возбудиться, заглатывая мой член, правда? Хе-хе-хе.",,,,,
"S """"",S_804f4189,"Дааа, по-о-от... ~♥",,,,,
"A """"",A_a81f741a,"Вспотеть во время тренировки это обычное дело, и даже похвальное. Только увидев пот на кис... теле, можно сказать что тренировка не прошла зря.",,,,,
"S """"",S_a9d6dfad,(Как же он издевается надо мной... мне нужно скорее покончить с этим.),,,,,
"S """"",S_42f42c44,(Блин! Он набухает! Если я не буду внимательной - он кончит мне в рот!),,,,,
"S """"",S_b7f68c8c,"(Хотя, возможно... самую чуточку... это будет интересно!)",,,,,
"S """"",S_bfcb675b_1,(!!!),,,,,
"S """"",S_fc791771,(Ну уж нет!),,,,,
"S """"",S_de192b8b,(Он такой классный! Я готова скользить по нему целый день!),,,,,
"S """"",S_629eefb9,(Его головка! Я чувствую ее!!!),,,,,
