location,source,target,ID,fuzzy,context,translator_comments,developer_comments
"S ""%%""",S_1cf3a5b0,"(Он точно приближается прямиком сюда, ему плевать на мои движения, будто чувствует. Но я же скрыта... Или он ищет меня не по псионике? Феромон все же не выветрился?)",,,,,
"S ""%%""",S_6691c167,(Он стал еще быстрее приближаться?! Плохо... Очень плохо.),,,,,
"S ""%%""",S_1fdff7bc,"(Черт, неужели он окончательно выследил меня? Другого варианта быть не может.)",,,,,
"S ""%%""",S_1e6b05b5,"(Держался же на расстоянии, вот и держался бы.)",,,,,
"S ""%%""",S_51a74905,"Мне нужен другой план, он вот-вот меня найдет. Думай, Сара... думай.",,,,,
"""%%""",narrator_40c69ba5,"Саре пришлось снова бежать, бросив на это все свои силы и пытаясь придумать новый план на ходу.",,,,,
"S ""%%""",S_c7dd9658,"Нужно найти такое место, куда бы он не смог пролезть... Если нельзя скрыться так, то нужно просто стать недоступной.",,,,,
"S ""%%""",S_1dc55aa2,"На таком расстоянии я не могу определить его размеры. Но, думаю, он весьма массивный, а значит не пролезет туда, куда пролезу я.",,,,,
"S ""%%""",S_dabe8ba6,Но где мне найти такое узкое и маленькое место? Нужно искать свысока... Так я и до завтра не найду.,,,,,
"""%%""",narrator_96d8852b,"Сара совершила рывок вверх, ища глазами что-то подходящее под определение узкого и маленького места.",,,,,
"S ""%%""",S_79459b62,"(Может, это отверстие? Выглядит подходяще... Да и нет других вариантов. Нужно торопиться.)",,,,,
"S ""%%""",S_1790600f,"(Этой твари точно там не протиснуться. И останется только смириться со своей участью, ха-ха-ха.)",,,,,
"S ""%%""",S_a267a82e,(Решено!),,,,,
"""%%""",narrator_6a8426e3,"Девушка сгруппировалась, меняя траекторию своего полета прямиком в цель. Ее не смутило наличие какой-то странной трубы в пустыне и ее очень малый диаметр. На посторонние мысли просто не было времени.",,,,,
"S ""%%""",S_42bc2eed,"(Даже если ему удастся пролезть, то это займет уйму времени, что мне только на руку.)",,,,,
"S ""%%""",S_478efa11,"(Я идеально все продумала, я должно залететь прямо в эту дыру.)",,,,,
"S ""%%""",S_58803bb9,(Еще немного. И...),,,,,
"S ""%%""",S_924b766a,!!!,,,,,
"""%%""",narrator_dd77ed6c,"Саре не смогла полностью пройти в дыру, застревая на полпути.",,,,,
"S ""%%""",S_1b52b88d,Этого просто не может быть! Все было так хорошо...,,,,,
"S ""%%""",S_1f64752b,Я не могла застрять. ОПЯТЬ! Просто не могла!,,,,,
"S ""%%""",S_aacf38af,"Пожалуйста, скажите, что это злая шутка и я сейчас продвинусь дальше!",,,,,
"""%%""",narrator_ebb1c9a4,"Девушка попыталась продвигаться дальше, но у нее не получилось.",,,,,
"S ""%%""",S_325ded40,Арх... Черт! А если назад?,,,,,
"""%%""",narrator_88a192e8,"Сара двинулась навстречу выходу, но тело плотно застряло, не давая ей сдвинуться ни в какую сторону.",,,,,
"S ""%%""",S_fba9994b,Чуда не произошло...,,,,,
"C ""%%""",C_d154e615,(А ты себе не изменяешь.),,,,,
"S ""%%""",S_9e39c7cd,У меня даже в мыслях не было!,,,,,
"C ""%%""",C_ec1c0729,"(Значит, эти грязные делишки сами тебя находят. Ты для них как магнит.)",,,,,
"S ""%%""",S_e80565b9,Сейчас вообще не вовремя! Вдруг это существо агрессивное и попытается мне навредить?,,,,,
"S ""%%""",S_8112785b,"Это тебе не Стуков, от которого знаешь чего ожидать.",,,,,
"S ""%%""",S_bd8cdf44,"Это дикая тварь, на уме которой непонятно что.",,,,,
"C ""%%""",C_ca44e608,(Ты в такой удобной позе. Его животные инстинкты точно возьмут вверх.),,,,,
"S ""%%""",S_6238e23a,Такой исход меня что-то тоже не очень радует...,,,,,
"S ""%%""",S_a1bdb76f,(Ну же! ДВИГАЙСЯ! ДАВАЙ!),,,,,
"S ""%%""",S_d1c9d42b,"Черт, ничего не выходит... м-мне не выбраться... Ничего хорошего не выйдет, если я не выберусь сейчас же!",,,,,
"""%%""",narrator_63e06df5,"Девушка не теряла надежд выбраться, но все было безнадежно.",,,,,
"S ""%%""",S_8fbb96a5,"Нужен новый план... Скрываться. Все, что мне остается.",,,,,
"S ""%%""",S_3fc861c8,"Может, он меня не найдет и все пройдет гладко.",,,,,
"S ""%%""",S_2f6aa4db,"Глупо... он и до этого знал, где я. И направлялся прямиком ко мне, несмотря на то, что я заметала свои следы...",,,,,
"S ""%%""",S_d9277fdc,"Ммм... С помощью пси-силы я бы выбралась, но он так близко.",,,,,
"""%%""",narrator_b7f6b641,"Сара мучительно застонала, понимая всю безысходность своего положения.",,,,,
"S ""%%""",S_96af3aa4,"Черт, неужели я боюсь... страх это плохо. Он чует его лучше всего остального.",,,,,
"S ""%%""",S_0fb5561a,"Нет-нет-нет, я веду себя как жертва, загнанная в угол. А значит, ему ничего не стоит найти меня.",,,,,
"S ""%%""",S_a1e6d5e0,"Сейчас же, Сара, успокойся... не нужно паниковать. Я не жертва, это не так!",,,,,
"S ""%%""",S_6e8a163a,"У меня все под контролем, я вот-вот уже почти выбралась.",,,,,
"S ""%%""",S_24ca587d,Он же... Он так только быстрее меня заметит. Нужно успокоиться.,,,,,
"""%%""",narrator_6ad40b0b,"Сара была полностью погружена в свои мысли, не замечая того, как чудище стояло уже возле нее.",,,,,
"S ""%%""",S_67c59a4f,Он уже здесь?! Когда он успел?,,,,,
"S ""%%""",S_09775a49,"Неужели подыграть не мог, безжалостная ты тварь...",,,,,
"S ""%%""",S_e3f9a34e,Нужно отогнать его! И... я не могу.,,,,,
"S ""%%""",S_169096da,"Пользоваться пси-силой небезопасно. Ситуация слишком стрессовая, я не смогу сдержать себя.",,,,,
"S ""%%""",S_9e46cde1,"Какая паршивая судьба... Я не могу торчать тут, сложа руки, когда почти за спиной у меня стоит враг.",,,,,
"""%%""",narrator_d9e6a350,"Чудовище не разделяло мнение Сары. Девушка могла слышать, оно приближалось все ближе и ближе без намерения менять маршрут.",,,,,
"S ""%%""",S_1b289d81,"Какой он громкий... Какого же он размера? Черт, эта ситуация...",,,,,
"S ""%%""",S_086e60c5,!!!,,,,,
"S ""%%""",S_1c914cf5,Ч-что ты делаешь?!,,,,,
"S ""%%""",S_5523c1d2,Не нужно лизать мою броню! Она невкусная!,,,,,
"S ""%%""",S_34120ee5,Зачем ты?...,,,,,
"""%%""",narrator_c5562761,"Спустя пару секунд Сара услышала странный звук, после которого она поняла, от слюны чудовища ее броня начала расползаться.",,,,,
"S ""%%""",S_26938b47,Этого не может быть...,,,,,
"S ""%%""",S_f75e59d1,Почему его слюна разъедает мой костюм?,,,,,
"S ""%%""",S_089a748d,Я в глубокой дыре...,,,,,
"C ""%%""",C_c28e02f5,"(Иронично, я бы даже сказал, в трубе! Игра слов!)",,,,,
"S ""%%""",S_42a1366e,Явился... Лучше помоги мне справиться со всем этим.,,,,,
"S ""%%""",S_d2edf53e,Я чувствую прохладу... Он так быстро расправился с моей броней.,,,,,
"C ""%%""",C_f03303d8,"(А у него хорошие способности. Точнее, удобные и многогранные. Конечно, вполне вероятно, что это и есть задача его слюны – добраться до цели. Он все же боевая единица.)",,,,,
"S ""%%""",S_6b1a6b40,Ты сейчас на чьей стороне? Тебе бы стоило больше переживать за мою сохранность.,,,,,
"C ""%%""",C_c38833c6,"(Не переживай, твоя киска весьма хорошо натренирована, что с ней может случится-то?)",,,,,
"S ""%%""",S_5c0c3dc7,...,,,,,
"C ""%%""",C_d2f445e9,"(Расслабься и получай удовольствие, он определенно надолго тут не задержится.)",,,,,
"S ""%%""",S_6626fa14,У тебя всегда все так просто...,,,,,
"C ""%%""",C_0e222b2b,"(Ты хотела больше о нем узнать, поэтому я тебя информирую. Его мутация очень интересная, потому что он пользуется своей слюной на новом уровне. Тебе стоит взять это на заметку. Вот тебе и полезная инфа.)",,,,,
"S ""%%""",S_f71a7a8f,"Обязательно подумаю об этом, но явно не сейчас!",,,,,
"S ""%%""",S_00696c2c,"Сейчас я бы с удовольствием послушала твои варианты отступления, а не про мутацию того, кто разъел мою броню!",,,,,
"C ""%%""",C_117c1b06,"(Эх, что-то меняется, а что-то остается вечным. Сара любительница везде застревать, хе-хе)",,,,,
"S ""%%""",S_6ebff52f,"Кто бы жаловался! Ты только и делаешь, что обрабатываешь информацию. А мне приходится со всем этим справляться! Думаешь, это приятно? Черта с два.",,,,,
"""%%""",narrator_4c9d55ff,*Лизь* *Сюрп* *Лизь*,,,,,
"S ""%%""",S_9e67428e,Ммм!,,,,,
"S ""%%""",S_6ebad023,Он... Он продолжает лизать меня!,,,,,
"S ""%%""",S_9113a26e,Х-хватит пытаться меня съесть...,,,,,
"S ""%%""",S_5ecb6a9f,Нет-нет-нет! Он почти разъел нижнюю часть моей брони!,,,,,
"""%%""",narrator_02b36492,"На удивление Сара была действительно права, ее нижняя часть брони полностью расплавилась, открывая беззащитную промежность напоказ монстру.",,,,,
"S ""%%""",S_23d5623a,Аххх... Прекрати!!!,,,,,
"""%%""",narrator_f25294b5,"Сара заметила, что чудовище настырно раздевает ее. Девушка почувствовала влажный язык на оголенных частях ее ягодиц.",,,,,
"S ""%%""",S_87d1f199,Тебе лучше перестать немедленно! Иначе я... Я точно не сдержусь!,,,,,
"S ""%%""",S_e43c385d,Ммм... Я использую пси-силу и ты пожалеешь!,,,,,
"S ""%%""",S_8e2abca1,"(Черт, только подумала, что все так отлично складывается, как на тебе...)",,,,,
"""%%""",narrator_f06de53f,"Чудовище никак не реагировало на ее крики, преследуя свои цели.",,,,,
"S ""%%""",S_640b6072,Ну все!,,,,,
"S ""%%""",S_6f2c12cd,Готовься!...,,,,,
"""%%""",narrator_cf77e960,...,,,,,
"S ""%%""",S_df9e3559,ААаахх!!!,,,,,
"S ""%%""",S_9d7fc988,С-сейчас же прекрати! Н-нет! Ты не можешь воспользоваться этой всей ситуацией вот так!,,,,,
"S ""%%""",S_3dc15bae,(Я не могу... Не могу сконцентрироваться!!!),,,,,
"S ""%%""",S_109e0078,Он... Он такой большой! Его член такой большой!!!,,,,,
"S ""%%""",S_cecb6768,Ему совсем не место в моей заднице!,,,,,
"S ""%%""",S_4f035b05,"(Я должна срочно сосредоточиться на пси-силе или он разорвет меня своим огромным членом, ммм...)",,,,,
"S ""%%""",S_cb433351,О БОЖЕ!!!,,,,,
"""%%""",narrator_b5c2bb93,"Зверь наращивал темп, показывая, кто главный в этой ситуации, и Сара ничего не могла с этим сделать. Она не могла сопротивляться, но и действие не было так уж не приятно.",,,,,
"S ""%%""",S_a1897230,Т-ты разорвешь мою попку! С-сейчас же вытащи его оттуда!,,,,,
"""%%""",narrator_df83beb5,"Девушке не оставалось ничего, кроме как начать получать удовольствие от происходящего, пока здоровый монстр нагибал ее в удобных для него позах.",,,,,
"S ""%%""",S_442f0623,"АААРХ! Остановись, похотливое животное!!!",,,,,
"S ""%%""",S_792e0c02,(Мой анус... Это такие смешанные чувства! Я была не готова.),,,,,
"C ""%%""",C_66116cc9,"(Я так и знал, что этим все закончиться.)",,,,,
"S ""%%""",S_389c4c12,"Ты мелкий! Мне хватило прошлого раза, когда ты уговорил меня согласиться на просьбу Стукова...",,,,,
"S ""%%""",S_53ee670a,Мой анус был не готов переживать это еще раз... Но его член еще больше! Он порвет меня!!!,,,,,
"S ""%%""",S_2cb39fd9,"Аааах, почему он не мог войти в киску?",,,,,
"S ""%%""",S_1a18781e,"Ммммх, он толкается все глубже. И глубже!",,,,,
"C ""%%""",C_920848b8,(Он уже не отстанет от тебя. Так что...),,,,,
"S ""%%""",S_c746a2d3,"Ааааарх, легко сказать... Как чувствовала, что без этого не обойдется!",,,,,
"S ""%%""",S_42b91bae,У него такая странная форма члена... Ощущения совершенно нереальные.,,,,,
"S ""%%""",S_55a33948,КТО ВООБЩЕ ПРИДУМАЛ ТАКОЙ ЧЛЕН?,,,,,
"""%%""",narrator_374e3653,"Сара не была уверена, что чувствует по отношению к этому. С одной стороны, изогнутый и бугристый член отлично подходил для ее ануса, а с другой она проклинала этот день.",,,,,
"S ""%%""",S_cc751a38,ММММММ!!!,,,,,
"S ""%%""",S_bc227f40,П-почему ты вообще пошел за мной?,,,,,
"S ""%%""",S_2f7dca75,Так хотелось индивидуального обслуживания?,,,,,
"S ""%%""",S_9e4c7273,ПОЛУЧИЛ?!,,,,,
"""%%""",narrator_be5768aa,"Девушка все больше заводилась, провоцируя зверя на активные действия.",,,,,
"S ""%%""",S_7105fa40,"Я... Я не выдержу так долго, мммх!",,,,,
"S ""%%""",S_dd112d41,К-кончай уже и отстань от меня!,,,,,
"S ""%%""",S_69f18dda,"Нужно было использовать пси-силу раньше, черт...",,,,,
"S ""%%""",S_1fe0c122,"Он так туго входит... Я чувствую его целиком, ах.",,,,,
"""%%""",narrator_dfbd22d9,"Чудовище ускорило темп, когда Сара только-только начала привыкать к его размерам.",,,,,
"S ""%%""",S_634fbcef,ААААХХХ! Я начинаю жалеть о своих словах...,,,,,
"S ""%%""",S_cc0feda4,Он входит с таким бешеным темпом...,,,,,
"S ""%%""",S_92398631,"Отсюда я-я могу слышать только его вопли... Похоже, ему там очень приятно.",,,,,
"S ""%%""",S_0765c36e,Но моя задница... Она просто не создана для таких размеров!,,,,,
"S ""%%""",S_d3d39e24,ММмм... А он даже не собирается останавливаться!,,,,,
"""%%""",narrator_5fb4949b,"Сара принимала член чудовища полностью, удивляясь собственным возможностям.",,,,,
"S ""%%""",S_54cfdd32,Голова кругом... Он такой быстрый и большой... Мммм...,,,,,
"S ""%%""",S_855b6ab8,"(Лиззара была права о его скорости, теперь он решил обрушить ее целиком на меня!)",,,,,
"S ""%%""",S_e836d371,"Сколько же спермы будет в таком здоровяке... Он переполнит меня, ахх.",,,,,
"S ""%%""",S_00eb8d3c,Я лопну от переизбытка спермы?,,,,,
"S ""%%""",S_7eeadb5e,Еще бы!,,,,,
"S ""%%""",S_c4490f40,"Во сколько раз он больше, чем я?",,,,,
"""%%""",narrator_dd13f005,"Монстр выбивал из Сары каждое слово, приближая ее к оргазму. В какой-то момент девушка стала терять сознание от бешеного темпа.",,,,,
"S ""%%""",S_955a23ff,С-стой же ты... ТЫ! АХ!,,,,,
"""%%""",narrator_9ccbf477,Труба была отличной опорой для Сары и помогала ей держаться в этой заранее проигранной битве.,,,,,
"S ""%%""",S_ab24e68a,ТЫ РАЗДАВИШЬ МЕНЯ! П-прекрати!,,,,,
"S ""%%""",S_73574529,(М-Моя киска... Она этого не переживет! Мои внутренности... Он превратит их в месиво из плоти!),,,,,
"""%%""",narrator_1b433144,"Девушка ощутила дискомфорт, когда зверь вбивался в нее без подготовки, но от представления огромного члена в себе Сара начала течь.",,,,,
"""%%""",narrator_5acc8e2c,*Хлюп* *Чвак* *Хлюп*,,,,,
"S ""%%""",S_7a5e87a6,Аа-ах...,,,,,
"""%%""",narrator_afe15ec2,"Сара завела свою руку как можно дальше, чтобы отодвинуть ягодицу и облегчить движение монстра.",,,,,
"S ""%%""",S_77a7933a,В-вот так лучше... Теперь как по маслу...,,,,,
"""%%""",narrator_aef3e523,"Девушка закатывала глаза от удовольствия, ни один член не доставлял ей столько удовольствия и не доводил ее до пика так быстро.",,,,,
"S ""%%""",S_738ef734,Т-ты явно... М-мутировал в лучшую СТОРОНУ!!!,,,,,
"S ""%%""",S_a5c43829,ММММММ!!!!,,,,,
"""%%""",narrator_709c85b2,*Хлюп* *Хлюп* *Чвак*,,,,,
"""%%""",narrator_bb9e33eb,"Сара больше не хотела ни о чем думать. Член зверя вытеснял из нее любые мысли, желая быть насаженной на него и только на него. У девушки даже не всегда хватало сил стонать вслух, она просто открывала рот, глотая большие порции воздуха.",,,,,
"S ""%%""",S_f796e72f,Ч-что ты со мной делаешь...,,,,,
"""%%""",narrator_940074d4,"Сара сильнее прижалась к прохладной трубе, пытаясь хоть немного остудить свое пылающее тело. Девушка еще больше возбуждалась, ерзая сосками о холодный металл.",,,,,
"S ""%%""",S_35968cf1,ПРОСТО КОНЧИ В МЕНЯ УЖЕ И ОТПУСТИ!!!,,,,,
"""%%""",narrator_37183f21,"Сара сжала свои стеночки, не позволяя зверю ни выйти, не войти в глубже. Он был плотно зафиксирован, рыча от приятных ощущений.",,,,,
"S ""%%""",S_b13c0a7a,"Отдай мне свою сперму и закончим на этом, мммм!!!",,,,,
"""%%""",narrator_12d373b1,"Рефлекторно существо попыталось толкнуться еще пару раз, перед тем как его член характерно налился, еще сильнее фиксируясь в девушке.",,,,,
"S ""%%""",S_5999e641,Черт... Этот член так плотно засел... Он будет как настоящая пробка!,,,,,
"S ""%%""",S_c338160e,"Ах, ни одна капля из меня не выйдет...",,,,,
"""%%""",narrator_8d36510a,"Сара не понимала, пугает ли ее этот факт или радует. Она просто держала свои бедра открытыми, пока в ней находился пульсирующий половой орган.",,,,,
"S ""%%""",S_195b1f79,"Давай же... Закончим уже это, ах!",,,,,
"""%%""",narrator_214be867,ГР-А-А-А!,,,,,
"S ""%%""",S_872d7717,{size=+4}БО-ОООЖЕ!!!{/size},,,,,
"""%%""",narrator_53dac707,"Зверь ответно завыл, напрягаясь и пуская первый поток спермы. У Сары перехватило дыхание от такого напора, ее матка наполнялась и надувалась, как воздушный шарик.",,,,,
"S ""%%""",S_aff204ec,(К-КАК ЭТО ПРИЯТНО!),,,,,
"S ""%%""",S_b7c79739,"П-почему это... ТАК ПРИЯТНО, ММММ!!!",,,,,
"S ""%%""",S_9e522955,Черт... ЧЕРТ!!!,,,,,
"""%%""",narrator_51382a7e,"Сара кричала от удовольствия, чувствуя как все больше застревает в трубе от раздувшегося живота. Только после того, как член немного обмяк, сперма небольшими порциями выходила.",,,,,
"S ""%%""",S_961109c5,Ах! Н-нет!!!,,,,,
"S ""%%""",S_960c6cd6,Все не должно было так закончиться! ЧЕРТ!!,,,,,
"""%%""",narrator_a90545ad,"Обильные жидкости задевали чувствительный клитор, продлевая спазмы оргазма. Сара не могла почувствовать легкость, после вытекания спермы. Ее стеночки постоянно сжимались, продолжая быть наполненными до краев, сколько бы жидкости не вышло.",,,,,
"S ""%%""",S_d3d5953e,Я... Больше... Не могу...,,,,,
"""%%""",narrator_410a5152,Каждая пульсация отдавала звоном в ушах. Звон становился все громче до наступления поглощающей тишины.,,,,,
"S ""%%""",S_f77d0f82,"Ха-ах... черт, и как мне выбираться с таким разбухшим животом...",,,,,
"""%%""",narrator_72f9181d,*Хлюп* *Хлюп*,,,,,
"S ""%%""",S_1e2f2567,АХ!,,,,,
"""%%""",narrator_dcfb79d7,"Сара резко открыла глаза, снова ощущая толчки.",,,,,
"S ""%%""",S_482f9ae4,Т-ты... ТЫ ТОЛЬКО НЕДАВНО КОНЧИЛ В МЕНЯ!,,,,,
