location,source,target,ID,fuzzy,context,translator_comments,developer_comments
"""%%""",narrator_14180050,"Королева Клинков начала заметно сдавать позиции, полностью испачкавшись в чужой крови.",,,,,
"S1 ""%%""",S1_73523e26,(Что?),,,,,
"centered ""%%""",centered_2ce87381,ХВАТИТ!,,,,,
"""%%""",narrator_bda49906,"Ее аппетит не угасал, но сил становилось все меньше. Она чувствовала, как эти силы утекают сквозь ее пальцы, будто мелкий песок.",,,,,
"S1 ""%%""",S1_bc50b997,Нет! ,,,,,
"S1 ""%%""",S1_22e960b8,Нет... Нет! НЕТ!,,,,,
"S1 ""%%""",S1_f42b28ef,НЕ-Е-Е-Е-Е-Е-ЕТ!,,,,,
"""%%""",narrator_10547b66,"Девушка остервенело продолжала драться, разрывая зерглингов на части. Она черпала остатки сил из ненависти, но все ощущали, что что-то пошло не так.",,,,,
"Q ""%%""",Q_9a31a051,А??? Что-то пошло не по плану?,,,,,
"centered ""%%""",centered_fda29f04,ОСТАНОВИСЬ!,,,,,
"Q ""%%""",Q_7fbce5fb,"Вот оно что, теперь мне стало все ясно!",,,,,
"Q ""%%""",Q_3076be86,"Ха-ха-ха-ха! Это прекрасно, ты великолепна, Сара, ты еще здесь!",,,,,
"""%%""",narrator_b6e0a7dc,Королева Клинков озлобленно посмотрела на Владычицу.,,,,,
"S1 ""%%""",S1_73900c8d,"Злорадствуешь, псина?",,,,,
"S1 ""%%""",S1_93a18ac2,Я не собираюсь сдаваться. НЕ СЕЙЧАС! ДАЖЕ НЕ ДУМАЙ!,,,,,
"S1 ""%%""",S1_aa10fc4c,"Я...{w} могу продолжать...{w} тело меня еще слушается...{w} Это лишь временные трудности, так что не думай расслабляться.",,,,,
"""%%""",narrator_79e12648,"Огромный столп силы прекратил препятствовать Рою, армия зергов начинала окружать Королеву Клинков, уменьшая ее уверенность в том, что ей удастся пережить это все так просто.",,,,,
"S1 ""%%""",S1_e8ebbe9c,Даже не думайте...{w} вам меня даже так не одолеть!,,,,,
"S1 ""%%""",S1_1432d16b,"(Все же было так хорошо... Почему сейчас? Неужели нельзя было подождать до тех пор, пока я не поставлю их всех на колени?!)",,,,,
"""%%""",narrator_1f4775b7,"Девушка продолжала схватку. Как внешнюю, так и внутреннюю. Она остро ощущала потерю контроля. Острее, чем кто-либо другой мог это сделать.",,,,,
"S1 ""%%""",S1_4941c8aa,Спустя все попытки я должна сдаться вот так?,,,,,
"S1 ""%%""",S1_b1ea3bf8,Отвратительно...,,,,,
"S1 ""%%""",S1_514d96ad,АААААААААААААА!!!,,,,,
"S1 ""%%""",S1_2e4b9de1,"Думаешь, что ты победила, Владычица? Но тебе просто в очередной раз повезло. Я еще найду возможность уничтожить вас всех!",,,,,
"S1 ""%%""",S1_3e13b0af,"Слышишь меня?! Я найду каждого и уничтожу. Это неизбежно! Мне все равно, сколько времени пройдет, но я вернусь!",,,,,
"S1 ""%%""",S1_f4af0589,Я ВЕРНУСЬ! ЭТО МОЕ ТЕЛО! НЕ-Е-Е-Е-Е-Е-Т,,,,,
"S1 ""%%""",S1_0ce81581,{size=-2}Просто{/size} проживайте остаток своих дней и ждите...{w}{size=-1} ждите меня...{/size}{w}{size=-2} я...{/size}{w}{size=-3} вас...{/size},,,,,
"""%%""",narrator_a7b32edb,"Королева Клинков резко замолчала, будто совсем исчезнув из зала. Владычица перестала ощущать ее. Неподвижное тело находилось в центре зала, вокруг которого замерли толпы зергов.",,,,,
"""%%""",narrator_650979cd,"Владычица понимала, что происходит, и с еще большим любопытством стояла и наблюдала за происходящим.",,,,,
"Q ""%%""",Q_592f67f8,"Я знала это, я была больше чем уверена, что ты не сдашься так просто.",,,,,
"""%%""",narrator_d09f6c22,"Все в зале было испачканным, измазанным в крови. Тяжелый металлический запах оседал в легких.",,,,,
"""%%""",narrator_8a94788f,Никто не мог увидеть всего происходящего в центре из-за плотного клуба дыма.,,,,,
"A ""%%""",A_1b56f384,"(Это то самое время, время уходить?)",,,,,
"A ""%%""",A_b421937b,"(Это какая-то уловка? Она специально делает вид, что ослабла? Или она действительно сдалась?)",,,,,
"A ""%%""",A_521ce9fc,Вы чувствуете ее?,,,,,
"Q ""%%""",Q_dbc66739,"Нет... Она ушла, просто смотри.",,,,,
"A ""%%""",A_cfb8f250,Телепортация? Могла ли она получить эту способность в ходе мутации? Неужели она настолько сильна?,,,,,
"""%%""",narrator_fa7c860f,"Стуков пытался воспользоваться своей пси-силой, чтобы найти источник силы похожий на то, что он чувствовал от Королевы Клинков.",,,,,
"A ""%%""",A_0ad3051e,Безуспешно. На корабле нет ничего похожего.,,,,,
"A ""%%""",A_51e51843,И куда она тогда могла телепортироваться?,,,,,
"Q ""%%""",Q_51ee80e8,"Она никуда не пропала, она ослабла, поэтому не смогла бы покинуть границы корабля. Продолжай смотреть прямо туда.",,,,,
"""%%""",narrator_2917ab21,"Владычица вытянула свою руку, указывая на сгусток дыма, который начал рассеиваться. Стуков последовал примеру Владычицы и внимательно смотрел в центр.",,,,,
"A ""%%""",A_a5e32b15,Я вижу! Она там. Но это...,,,,,
"""%%""",narrator_cecb952b,"Мужчина указал на силуэт девушки. Он больше не был похож на силуэт Королевы Клинков. Тело все еще было знакомо, но некоторые детали очень отличались.",,,,,
"A ""%%""",A_8732e916,"Думаете, это она?",,,,,
"Q ""%%""",Q_b55a89b1,Это она! ДА!!!,,,,,
"""%%""",narrator_fc4f9fe1,"Фигура девушки не шевелилась. Казалось, что это лишь статуя, просто очень похожая на террана.",,,,,
"""%%""",narrator_0a96b3f9,"Но это уже не был простой терран. Даже издалека были видны следы мутации. Волосы больше не напоминали копну мягких волос. Это были твердые отростки, сформированные в длинный хвост.",,,,,
"S ""%%""",S_60764793,Ммм...,,,,,
"""%%""",narrator_e1112df9,"Кожа местами запечатлела на себе оттенок новой, пытаясь перебороть старый пигмент. Но прошлое было слишком сильное, чтобы стереть его бесследно.",,,,,
"""%%""",narrator_d4f0195c,"Тело совершенно не беспокоило ни грязная кровь повсюду, ни толпы глазеющих. Девушка была полностью обнажена, будто заново переродилась.",,,,,
"""%%""",narrator_863812f7,"На ее лице застыли безмятежность и блаженство. Ничего не могло ее потревожить, потому что мыслями она была где-то не здесь.",,,,,
"""%%""",narrator_52db2f18,"Владычица ощущала присутствие девушки здесь очень слабо, почти неощутимо. Как если бы она только собиралась возвращаться в сознание, но еще не получила над ним полный контроль.",,,,,
"""%%""",narrator_f40cfdf6,"Девушка не открывала глаза, но взглянув на нее всего один раз, каждый бы понял куда она смотрит. Все ее нутро было направлено куда-то намного дальше, чем ее тело могло находиться.",,,,,
"A ""%%""",A_f74db3a1,"Неужели это еще не конец? Если она смогла ее ослабить, то должна успеть прийти в себя.",,,,,
"""%%""",narrator_fc2c6857,"Стуков настороженно наблюдал за происходящим, готовый в любую минуту встретить Королеву Клинков. Но он искренне надеялся, что этого не произойдет.",,,,,
"""%%""",narrator_d86a8466,"Прохладный поток воздуха прошелся по мутированному телу, пробуждая его рецепторы",,,,,
"S ""%%""",S_1d9d6503,Я...,,,,,
"Q ""%%""",Q_44f780fb,Ну же!,,,,,
"S ""%%""",S_52de4c89,(Где я?),,,,,
"""%%""",narrator_13b9cacc,"Девушка пыталась открыть глаза, но у нее ничего не получалось. В ее голове настойчиво звучало 'Быстрее!', только она не понимала, куда ей торопиться. Она не чувствовала свое тело и твердую почву под ногами.",,,,,
"A ""%%""",A_102e252c,"Может, нам оставить ее одну? Мы не сможем сейчас ничего для нее сделать.",,,,,
"Q ""%%""",Q_8a6ccbba,"Исключено: если исход будет отрицательным, то мы должна быть готовы не упустить ее.",,,,,
"A ""%%""",A_a0ac69f4,"Но что, если это продлится так же долго, как мутация?",,,,,
"Q ""%%""",Q_59150acf,"Значит мы прождем столько, сколько нужно.",,,,,
"A ""%%""",A_dae322f9,Она всегда демонстрировала хорошие результаты.,,,,,
"""%%""",narrator_21b02093,"Владычица сконцентрировалась на фигуре, чтобы замечать любые изменения. На лице больше не было таких безмятежности и спокойствия.",,,,,
"Q ""%%""",Q_0b25b08b,"Стоит учитывать, что и ее противник достаточно силен. У нее есть шансы справиться, но если нет, то потери будут слишком велики.",,,,,
"A ""%%""",A_21b824e9,Никто не хочет остаться в проигрыше. Хотя Сара иногда очень активно продолжала показательно проигрывать...,,,,,
"S ""%%""",S_5ec56a26,(Я слышу чье-то имя... Это зовут меня? Я должна последовать?),,,,,
"S ""%%""",S_54cc6742,(Я не хочу больше тонуть в этой темноте. Я хочу проснуться!),,,,,
"""%%""",narrator_aed65818,"Сара нашла в себе силы открыть глаза, видя перед собой только белую дымку...",,,,,
"S ""%%""",S_be22cf19,Что случилось?,,,,,
"A ""%%""",A_f8d87e61,Получилось?,,,,,
"Q ""%%""",Q_872fd4fb,Да... Неужели ей действительно удалось?,,,,,
"""%%""",narrator_bdfecab5,"Когда Сара смогла сфокусировать свой взгляд, ее ждала не самая приятная картина. Куда бы она ни посмотрела, отовсюду на нее глазели тысячи зергов. Они достаточно увидели, чтобы изнывать от желания заполучить девичье тело.",,,,,
"S ""%%""",S_7694e4c7,Это сон?,,,,,
"S ""%%""",S_433b1432,Пускай это будет сон! Я сейчас закрою глаза и всех их не будет. Мне просто приснилась очередная грязная фантазия...,,,,,
"Q ""%%""",Q_4ca65dba,"Это реальность, Сара, где ты оказалась сильнее, чем сама могла о себе подумать.",,,,,
"""%%""",narrator_6c5871e1,"Владычица предстала перед девушкой, прорвавшись сквозь ряды зергов. Ее тело трепетало от мысли о том, сколько же силы было спрятано в этом ранее слабом теле.",,,,,
"Q ""%%""",Q_0439d291,Даже против такой силы... Ты все равно с честью выстояла эту нелегкую битву.,,,,,
"""%%""",narrator_2caba5ca,"Сара пыталась прикрыть все интимные места руками, с непониманием наблюдая за Владычицей.",,,,,
"S ""%%""",S_06b07453,О чем Вы говорите? Какая еще битва?,,,,,
"Q ""%%""",Q_4330055a,"Ты, Сара, далеко не обычный терран. Больше никто не смеет называть тебя подобным низким образом. Но все, что с тобой произошло – очень длинная история.",,,,,
"S ""%%""",S_d1725fad,"У меня, вроде как, больше нет никаких планов на сегодня.",,,,,
"S ""%%""",S_b1a4f996,"Значит, это был не сон... все было как в тумане, но так же наяву... Это такое странное чувство.",,,,,
"S ""%%""",S_b17c0d19,Поверить не могу... Я серьезно могла потерять себя после этой мутации и никто... Никто! Даже Сай'мон не предупредил меня.,,,,,
"S ""%%""",S_c7130531,"(А я ведь спрашивала тебя, паршивец!)",,,,,
"C ""%%""",C_e877039a,"(Я даже не задумывался, что ты можешь обладать ТАКОЙ силой. А вообще ты бы могла предупредить, что мы тут живем втроем, а не вдвоем!)",,,,,
"S ""%%""",S_8ba1a7bb,"(Как будто если бы знал, то смог меня хоть о чем-то предупредить... Даже если бы я знала, что от количества силы будет зависеть шанс моего забвения, то это никак бы мне не помогло в борьбе с ней.)",,,,,
"S ""%%""",S_41fa772a,"Но что будет, если она захочет вернуться, как сделала это сейчас? Она полна злобы и ее невозможно контролировать...",,,,,
"""%%""",narrator_d95a7182,"Сару передернуло от воспоминаний о первой встрече с Королевой Клинков. Она все еще помнила то количество испорченности, пошлости, которое копилось в ней.",,,,,
"Q ""%%""",Q_fbe8db76,"Она не оставит это просто так. Это только дело времени, когда она объявится. Но ты все еще хозяйка в этом теле и снова это доказала.",,,,,
"Q ""%%""",Q_494aa78e,"Тебе уже повезло обладать такой силой, что ты можешь соперничать за место у руля.",,,,,
"S ""%%""",S_e89bad1e,"(Интересно, как долго еще у меня будет хватать сил бороться... Она тоже не стоит на месте...)",,,,,
"S ""%%""",S_33671767,"Но... Вы же не предлагаете мне просто сидеть и ждать, когда она попытается снова?",,,,,
"S ""%%""",S_f57e040c,"Если она вырвется, то я даже не смогу этого почувствовать! Я словно исчезаю на это время без знания, что вытворяет с моим телом мое альтер эго.",,,,,
"Q ""%%""",Q_61daf7c1,"Хах, если у тебя есть способность, даже самая маленькая, то ее всегда можно развить. Великие древа не с самого зарождения были великими.",,,,,
"Q ""%%""",Q_448200e6,"Возможно, ты даже сумеешь контролировать ее... Даже не так - подчинить ее. Никогда не знаешь, во что выльются задатки.",,,,,
"Q ""%%""",Q_bd0bc3f8,"Но одно я знаю точно. Я хочу, чтобы в этом теле правила ты! И ЕМУ тоже будет выгоднее, если видеть мы будем только тебя.",,,,,
"S ""%%""",S_8da4b496,"Но дайте угадаю, Вы не знаете, как это сделать?",,,,,
"Q ""%%""",Q_97778d0c,Ты меня расстраиваешь. Ответ на этот закономерный вопрос у меня есть. Но тебе он точно не понравится.,,,,,
"Q ""%%""",Q_4a5126e7,"Твоя вторая сущность все же была права, когда говорила, что выживает сильнейший. Тебе предстоит искать новую силу, которая до этих пор была тебе неизвестна.",,,,,
"Q ""%%""",Q_9e0cadc1,"Это будет намного сложнее, чем те тренировки. Развивать то, что у тебя уже было – реально. Сейчас тебе предстоит сделать нечто очень трудное, я бы даже сказала, нереальное.",,,,,
"Q ""%%""",Q_17e41c4e,"Чтобы заполучить власть над всей своей силой, тебе предстоит стать сильнее, чем твой внутренний враг. Тогда ты станешь безгранично могущественной, но останешься верной себе.",,,,,
"Q ""%%""",Q_573e01e0,"Она сейчас слаба и дремлет, но времени у нас не так много.",,,,,
"S ""%%""",S_02edf363,Хм...,,,,,
"S ""%%""",S_de1226c9,"Но если она берет верх сейчас, хоть и не навсегда, то моих сил недостаточно.",,,,,
"Q ""%%""",Q_ebc09826,"Да, тебе вновь предстоит преодолеть свои внутренние барьеры.",,,,,
"Q ""%%""",Q_1f2d448a,"Ты уже доказала и самой себе, что можешь преодолеть любые препятствия. Даже если тебе это дается не сразу.",,,,,
"Q ""%%""",Q_e0153cb8,"В погоне за отмщением сейчас у тебя только один враг и он сидит глубоко внутри, питаясь твоими похотью и жаждой мести.",,,,,
"Q ""%%""",Q_bf2008c8,"Но это в прошлом! Ты больше не та Сара, которую я видела впервые и захотела избавиться. Теперь ты вселяешь восхищение и обожание.",,,,,
"""%%""",narrator_bfdfdbd1,"Глаза Владычицы горели желанием завладеть кем-то здесь и сейчас, когда она представляла ту силу, которую Сара может заполучить.",,,,,
"Q ""%%""",Q_038109fd,Да-а-а-а...,,,,,
"Q ""%%""",Q_87f75dc7,"Ты лучшее творение, Сара, которое мне удавалось видеть своими глазами.",,,,,
"""%%""",narrator_3864f665,"Сара смутилась от такой похвалы в свой адрес. Она никогда не ждала, что Владычица так сильно будет довольна ее достижениями и заслугами. Тем более в таком ключе.",,,,,
"Q ""%%""",Q_b2d696cc,"И твоих собственных ресурсов могло бы хватить, но я не уверена, что у нас достаточно времени для такого способа. Мы можем потерять тебя, а это слишком значимые потери.",,,,,
"""%%""",narrator_7cd0332d,"Владычица успокоила свое возбуждение, концентрируясь на решении поставленной задачи.",,,,,
"Q ""%%""",Q_4820145f,"Но у нас есть решение. Эссенция! Много эссенции! Достаточно сильной и редкой, чтобы сделать тебя неуязвимой в борьбе за первенство.",,,,,
"S ""%%""",S_ca28bd3e,Эссенция?,,,,,
"Q ""%%""",Q_17dcf9fd,"Да, именно она, но ее не так просто получить, ты и сама должна это понимать. Не в каждом углу можно найти что-то, что делает тебя великим.",,,,,
"Q ""%%""",Q_4d6f272b,"Не все существа обладают сильной эссенцией. А нам не нужно что угодно. Нам нужна та самая жизненно важная силы, которая вознесет тебя на пик твоих возможностей.",,,,,
"Q ""%%""",Q_a53a9d71,"И тебе повезло, потому что я знаю, где ее достать.",,,,,
"Q ""%%""",Q_7f074773,Тебе стоит только согласиться и я открою перед тобой эту дверь новых границ. Даже если их достижение будет тяжелым... Так же интереснее?,,,,,
"Q ""%%""",Q_d7b426f8,"Ты можешь рассчитывать на мою поддержку, потому что у нас очень близкие цели. Стуков проведет тебя к нужному месту, так что у тебя будет возможность сориентироваться.",,,,,
"Q ""%%""",Q_9e570c2b,Это был прекрасный день... Я до сих пор чувствую порыв уничтожить все вокруг! Это словесная схватка здорово раззадорила меня и одновременно оставила неудовлетворенной.,,,,,
"Q ""%%""",Q_ab0e598e,А теперь иди...,,,,,
"Q ""%%""",Q_fb1e9df1,"Я буду ждать тебя в следующий раз, чтобы убедиться в твоей уникальной силе духа. Я надеюсь, что увижу тебя, Сара, в следующий раз, а не ее.",,,,,
"S ""%%""",S_479a2c94,"(Я тоже надеюсь на то, что в следующий раз буду именно я...)",,,,,
"Q ""%%""",Q_87b8ba94,"Но увидимся мы только в том случае, если ты будешь обладать той силой, о которой мы говорили. Иначе... Эта сила овладеет тобой без возможности потребовать реванш.",,,,,
"Q ""%%""",Q_d26ddf4d,"Я поделилась с тобой всем, что знаю сама. Я не смогу победить за тебя, поэтому дело за тобой, моя прекрасная Сара.",,,,,
"Q ""%%""",Q_b2ccd6ee,"Мне радостно видеть то, как уверенно ты держишься. В тебе больше не осталось ничего от мерзкого прошлого террана.",,,,,
"Q ""%%""",Q_0d64bc31,"Но моя похвала не должна расслаблять тебя. У тебя не так много времени, потому что твой монстр захочет воспользоваться любой твоей минутой слабости. Теперь ты не имеешь права быть уязвимой.",,,,,
"Q ""%%""",Q_0d0c3c62,Следующая наша встреча будет решающей.,,,,,
