location,source,target,ID,fuzzy,context,translator_comments,developer_comments
"L """"",L_674d028f,"(Если судьба послала мне это испытание.... Мммм, то я приму его с высоко поднятой головой. Судьба посылает только то... Что мы можем пройти. Ради Света, ради Сары... И нашего спасения.)",L_674d028f,,,,
"S1 """"",S1_99fd30ed,"(Ха-ха, только ты лежишь сейчас лицом в пол...)",S1_99fd30ed,,,,
"S1 """"",S1_425a9850,(Давай попробуем так.),S1_425a9850,,,,
"""""",narrator_da53707e,"Королева Клинков закончила приготовления. Она была готова продолжать, приближаясь к Лиззаре.",narrator_da53707e,,,,
"L """"",L_10a9b5a6,"(Это не сможет длиться вечно... Кхала даст мне сил, чтобы пережить это. А-а-ах, чтобы справиться с моими врагами и самыми ужасными страхами. Я не сойду с пути истинного.)",L_10a9b5a6,,,,
"""""",narrator_4a5d262d,"Королеве в свое время хотелось смеяться от того, что она слышала. Возможно, она бы посмеялась от пуза, если бы у нее не был бы занят рот.",narrator_4a5d262d,,,,
"L """"",L_5563c80c,"(Кхала, дай мне...)",L_5563c80c,,,,
"L """"",L_a9655730,(А-а-а-а-а-ах!!!!),L_a9655730,,,,
"L """"",L_13beb66e,"(Ч-что это... А-А-А-х, что-то заполняет меня! Нет, оно лезет в меня!)",L_13beb66e,,,,
"""""",narrator_39720ca6,"Королева Клинков открыла свой прелестный ротик, выпуская свое творение, это был некий паразит. Он быстро выскользнул, попадая прямо в киску Лиззары, из-за чего та ахнула от неожиданности.",narrator_39720ca6,,,,
"""""",narrator_aa3da853,"Лиззара могла только чувствовать, как что-то ей неизвестное двигалось в ней, заставляя ее испытывать ураган чувств. Протосс не могла противиться чувствам, теряя голову от того, что с ней происходило. Это не было похоже на простые прикосновения или ощущения чужого дыхания, это было что-то новое.",narrator_aa3da853,,,,
"S1 """"",S1_54cd3dd4,Отличная реакция!,S1_54cd3dd4,,,,
"L """"",L_88a8badc,"(Ммммм... О-оно разорвет меня, м-м-м-ф!)",L_88a8badc,,,,
"S1 """"",S1_1a4ba0d5,"Перестань, тебе так кажется с непривычки. Твое тело способно на большее, чем ты думаешь. ",S1_1a4ba0d5,,,,
"S1 """"",S1_bfabc616,"Только подумать, этот малыш еще ничего не сделал, хи-хи. А тебе та-а-ак приятно, что ты не можешь перестать стонать, ну и недотрога ты.",S1_bfabc616,,,,
"S1 """"",S1_d6027845,"Подожди-подожди, этот малыш знает, что ему нужно делать.",S1_d6027845,,,,
"L """"",L_f1620de8,(А-а-ах! М-малыш?),L_f1620de8,,,,
"S1 """"",S1_0c03cda6,"Ну он не совсем малыш, я думаю он весьма большой для такой тугой кисочки. Но ты так течешь, чт-о-о-о, думаю, он пролезет",S1_0c03cda6,,,,
"L """"",L_45b21899,"(Но что он... Х-а-а-а-!!! Нет, перестань!)",L_45b21899,,,,
"""""",narrator_917dc5cb,"Малыш начал активнее пробираться в киску, нагло перебивая Лиззару, вызывая у нее мурашки по всему телу. Протосс совершенно забыла о том, что она хотела спросить.",narrator_917dc5cb,,,,
"L """"",L_d6e57c42,(Нет... Н-не лезь туда! А-а-ах! Нельзя... Тебе туда нельзя!),L_d6e57c42,,,,
"S1 """"",S1_191f49bb,"Ого, как сильно он хочет попасть в тебя...",S1_191f49bb,,,,
"L """"",L_6a81052b,(О-останови его!! Ммм...),L_6a81052b,,,,
"L """"",L_94f4eda1,"(П-пожалуйста... М-м-м-мф! Это слишком, ха-а-а...)",L_94f4eda1,,,,
"""""",narrator_e5562076,"Несмотря на активно движение паразита, он смог продвинуться только на пару миллиметров и застрял.",narrator_e5562076,,,,
"S1 """"",S1_03a10974,"Ммм, кажется, твоя киска еще туже, чем я ожидала. Видимо, кожа протоссов недостаточно эластична.",S1_03a10974,,,,
"S1 """"",S1_190a9299,{size=+8}*Облизнулась* Как же мне хочется как следует растянуть тебя своим членом!!!{/size},S1_190a9299,,,,
"S1 """"",S1_0009cc4e,{size=+8}ХА-ХА-ХА-ХА!!!!{/size},S1_0009cc4e,,,,
"S1 """"",S1_80438b7b,{size=+8}КАК ЖЕ СИЛЬНО Я ХОЧУ ВОЙТИ В ТЕБЯ!!!{/size},S1_80438b7b,,,,
"""""",narrator_1522db0c,"Королева Клинков безумно улыбнулась собственным мыслям, но ее лицо тут же стало серьезным, когда она вспомнила о том, где и зачем находится.",narrator_1522db0c,,,,
"S1 """"",S1_ba7dd778,"Нет-нет-нет, так нельзя, нельзя и точка. Всему свое время, ты же знаешь, так будет лучше.",S1_ba7dd778,,,,
"S1 """"",S1_9e325a03,Фух... это было сложно...,S1_9e325a03,,,,
"L """"",L_94197980,"(М-м-м-мф! З-зачем ты играешь со мной... Так! Э-это жестоко... Ты жестокая, Королева Клинков! Ха... Кхала, помоги мне вынести это!)",L_94197980,,,,
"S1 """"",S1_9151b95a,"Только подумать, такой маленький и все равно не может пролезть. Но я этого ожидала, так что не переживай. Он определенно влезет, в скором времени в тебя поместятся и предметы куда больше, хе-хе.",S1_9151b95a,,,,
"S1 """"",S1_640e8694,Стоит только потерпеть и тебе откроется настоящее удовольствие.,S1_640e8694,,,,
"""""",narrator_b46fce9b,"Лиззаре уже было все равно. Паразит очень активно двигался, пытаясь пробраться как можно дальше, что доводило протосса до необъяснимых ощущений. Каждое движение этого малыша отзывалось по всему ее телу, не давая ни минуты отдыха.",narrator_b46fce9b,,,,
"""""",narrator_5eb2f4f3,"От этих манипуляций Лиззара приблизилась к оргазму, сжимая паразита в себе только сильнее.",narrator_5eb2f4f3,,,,
"L """"",L_18e50a13,"(Н-не двигайся, перестань, з-замри, ты делаешь только хуже!)",L_18e50a13,,,,
"L """"",L_5ee249a2,(Х-а-а-а! Я чувствую его так сильно... Моя промежность! Она вся вибрирует! М-м-м-мф!),L_5ee249a2,,,,
"S1 """"",S1_0a2878c6,"Ну же, Лиззара, пусти малыша внутрь. Он же так старается, ради тебя.",S1_0a2878c6,,,,
"L """"",L_5e2765f1,"(Я-я не хочу! М-мое тело... Его нельзя менять... Ах, я не хочу, чтобы он менял его.)",L_5e2765f1,,,,
"S1 """"",S1_43aa1bd9,"Но твое тело так не думает, Лиззара. Ты не понимаешь о чем говоришь. Ты не можешь даже осознать, от чего пытаешься отказаться! Твоя киска сочится все больше, этот малыш скоро войдет в тебя целиком.",S1_43aa1bd9,,,,
"L """"",L_9901c90a,"(Нет! Э-это все твоя слюна! Моя к... Ах, это не я!)",L_9901c90a,,,,
"S1 """"",S1_3f9f80f2,"Даже не пытайся себя оправдать! Это твоя киска истекает соками от получаемого удовольствия. Ты течешь как самая похотливая шлюшка, Лиззара.",S1_3f9f80f2,,,,
"L """"",L_334db79d,"(Н-нет! Это... Все он! Он так двигается, ммммф! И вибрирует... Я не могу устоять!)",L_334db79d,,,,
"S1 """"",S1_664b98be,"Ооо нет, она сочится так сочится... тут можно прямо ведрами выгружать.... Я же говорила, тебе понравится.",S1_664b98be,,,,
"S1 """"",S1_032b742b,"Ха-ха-ха, это так забавно, он так отчаянно пытается пролезть в твою норку, это просто нечто, а ты его не пускаешь.",S1_032b742b,,,,
"S1 """"",S1_b03cf03d,Давай пока поиграем в игру?,S1_b03cf03d,,,,
"L """"",L_f77a970e,"(К-какие игры, мне сейчас совсем не до игр!)",L_f77a970e,,,,
"S1 """"",S1_2bed8d75,"Это будет весело, поверь мне.",S1_2bed8d75,,,,
"S1 """"",S1_f3248740,Тук-тук.,S1_f3248740,,,,
"L """"",L_878271dc,(Ах... п-прекрати! Нет...),L_878271dc,,,,
"S1 """"",S1_576b2372,"Ну же, давай, спроси кто там.",S1_576b2372,,,,
"L """"",L_2acf5f29,(Ахх... н-нет...),L_2acf5f29,,,,
"S1 """"",S1_18f93366,"Мы же договаривались, что ты будешь паинькой! Давай еще один раз.",S1_18f93366,,,,
"S1 """"",S1_f3248740_1,Тук-тук.,S1_f3248740_1,,,,
"L """"",L_405102b1,(Аххх... к-к.... кто там...?),L_405102b1,,,,
"S1 """"",S1_3a51125d,Твой Анус!,S1_3a51125d,,,,
"S1 """"",S1_ddbd15fa,Ха-ха-ха-ха!!!,S1_ddbd15fa,,,,
"L """"",L_cab0b389,{size=+8}ММММММММММ!!!{/size},L_cab0b389,,,,
"""""",narrator_58f3cad9,"От пошлых разговоров Лиззара была на пределе, расслабляя свое тело. Это дало зеленый свет малышу, позволяя ему проскользнуть внутрь.",narrator_58f3cad9,,,,
"S1 """"",S1_1986fd3e,"Вау! Чувствуешь, Лиззара, он все равно смог пролезть. Ты была не в силах его остановить... Твои попытки его только подтолкнули.",S1_1986fd3e,,,,
"L """"",L_8ce2dd7a,"(Не... Не лезь! Ему там не место! Х-хватит, ха-а-а-а!)",L_8ce2dd7a,,,,
"""""",narrator_2631109c,"Лиззара пыталась сжать свою вагину еще сильнее, чтобы помешать паразиту, но это лишь подтолкнуло его еще сильнее.",narrator_2631109c,,,,
"L """"",L_1af0f69f,(З-зачем он лезет так глубоко... Ч-что он собирается делать?),L_1af0f69f,,,,
"S1 """"",S1_7354c223,Он?,S1_7354c223,,,,
"S1 """"",S1_fb7017a5,"Ну-у-у-у-у-у... сначала залезет так глубоко, как сможет. Ну а потом начнет самое интересное. То, ради чего его туда запустили, хи-хи.",S1_fb7017a5,,,,
"L """"",L_402d9ac3,"(Я... Я могу чувствовать, насколько он глубоко! Внутри все горит от его движений, ах! Это должно быть больно... Но почему мне приятно? Неужели мне это нравится???)",L_402d9ac3,,,,
"S1 """"",S1_bcdefced,Думаю... сейчас он уже достигает своей точки назначения. Чувствуешь? Сейчас может быть немного дискомфортно... Но он все сделает в лучшем виде и ты ничего не должна почувствовать!,S1_bcdefced,,,,
"L """"",L_ebf4000e,{size=+8}А-а-а-а-а-а-а-а-а!!!{/size},L_ebf4000e,,,,
"""""",narrator_8616b16a,"Королева Клинков сразу поняла, что процесс начался, потому что из киски виднелось голубоватое свечение. Реакция протосса не заставила себя ждать, Лиззара не понимала, что за ощущения ее переполняло. Ее пугало то, что она не понимает происходящего, но новые эмоции перекрывали переживания.",narrator_8616b16a,,,,
"S1 """"",S1_b1fd3f1a,"Вот-вот! Он уже приступает, начинается самое интересное! Как ты себя чувствуешь, Лиззара?",S1_b1fd3f1a,,,,
"L """"",L_203234ea,"(А-а-а-аххх!!! К-когда это закончится... Все горит, ах. Я чувствую себя так странно... Я никогда такого не ощущала! Все внутри меня горит, м-м-м-г... Я не знаю, что мне делать!)",L_203234ea,,,,
"S1 """"",S1_68b57710,"А тебе ничего не нужно делать, просто наслаждайся, милашка. Скоро мы закончим.",S1_68b57710,,,,
"""""",narrator_cfa7181b,"Ощущение сильного тепла внутри сменилось на непонятное желание потрогать себя внутри. Вагина Лиззары начала невероятно чесаться изнутри, требуя прикоснуться к себе и сделать что-то, но тело протосса было намертво зафиксировано.",narrator_cfa7181b,,,,
"L """"",L_accfcded,(А-а-а-ах! Все чешется! Чешется! Это невыносимо...),L_accfcded,,,,
"S1 """"",S1_9acbc3a6,"Это, наверное, сейчас он покрывает все жидкостью.",S1_9acbc3a6,,,,
"L """"",L_dd84a4d8,(Ж-жидкостью? Что это за жидкость?),L_dd84a4d8,,,,
"S1 """"",S1_a212bbea,"Да, эта жидкость нужна для проникновение в твое тело, это необходимый следующий шаг.",S1_a212bbea,,,,
"S1 """"",S1_53c53ba9,Тебе нужно потерпеть совсем немного,S1_53c53ba9,,,,
"L """"",L_d6511731,"(Ты говорила, что я ничего не почувствую! Но мое тело горит и чешется... Еще и эта жидкость!)",L_d6511731,,,,
"S1 """"",S1_c0449054,"Ну дорогуша, это необходимые жертвы. Да и, согласись, это весьма приятные чувства, я ощущаю, как все твое тело дрожит.",S1_c0449054,,,,
"S1 """"",S1_94981e86,А сейчас этот малыш распадется на более мелкие части и попадет в каждый уголок твоего тела.,S1_94981e86,,,,
"L """"",L_f49ba2b3,(М-мы так не договаривались! Ах... нет... ),L_f49ba2b3,,,,
"S1 """"",S1_07430e33,"Ну мы вообще ни о чем не договаривались, если что. Так что не вредничай, просто еще чуть-чуть подожди",S1_07430e33,,,,
"S1 """"",S1_0cdb9e91,Это будет не долго...,S1_0cdb9e91,,,,
"L """"",L_ea046f25,"(Я... Я чувствую, как он распространяется! О-они повсюду! Моя голова... Ах-х-х, он проникает в мой мозг!)",L_ea046f25,,,,
"L """"",L_76b94546,(М-м-м-м-мг! Н-нет...),L_76b94546,,,,
"S1 """"",S1_a7548cbf,"Ммм, заметила все же. Это мой небольшой подарочек тебе. Я подумала, ты будешь не против, если я поделюсь кое-чем с тобой.",S1_a7548cbf,,,,
"L """"",L_8827c877,(Мне от тебя ничего не нужно!),L_8827c877,,,,
"L """"",L_b3fa32d2,(Я-я не хочу ничего от тебя принимать!),L_b3fa32d2,,,,
"S1 """"",S1_402ec5a7,"Ну уже все равно поздно, не за что, моя милая.",S1_402ec5a7,,,,
"""""",narrator_e5219176,"Лиззара неожиданно громко застонала, сильнее прогибаясь в пояснице.",narrator_e5219176,,,,
"L """"",L_3b789d1c,"(ХА-А-А-А! Аххх... а-а что теперь? Нет, быть такого не может.)",L_3b789d1c,,,,
"S1 """"",S1_dcde50f3,"Ооо, неужели мы дошли до самого интересного?",S1_dcde50f3,,,,
"L """"",L_5365e4e7,"(У меня что-то меняется, ахххх... я-я... не знаю, что это...)",L_5365e4e7,,,,
"L """"",L_775c38dc,"(Аххх... нет, ч-что это внутри... Оно меняется... Почему я ощущаю это так сильно? Ч-что со мной, м-м-м-мф...)",L_775c38dc,,,,
"S1 """"",S1_01b7f74e,"Ха-ха-ха, я и подумать не могла, что это будет так весело! В тебе все так интересно, каждая реакция...",S1_01b7f74e,,,,
"S1 """"",S1_683d18c3,Ты определенно становишься моей самой любимой игрушкой! ,S1_683d18c3,,,,
"L """"",L_cfe78419,(Никогда! Я-я живая... Я не могу быть игрушкой! А-а-а-ах! Нет... ч-что это!!!),L_cfe78419,,,,
"S1 """"",S1_8a6c0693,"Я и не отрицаю, что ты живая. Игрушки могут быть разными, так даже интересней.",S1_8a6c0693,,,,
"L """"",L_c9249034,"(Ч-что-то приближается, я чувствую это! Э-это и есть то, что ты задумала? ХА-А-А...)",L_c9249034,,,,
"""""",narrator_282ec40f,"Лиззара с трудом могла следить за собственным телом из-за постоянных вспышек удовольствия. Она все меньше ощущала тепло в киске, потому что оно распространилось по всему телу. Протосс не могла понять, что в ней меняется.",narrator_282ec40f,,,,
"L """"",L_0aec7456,(Я этого не выдержу...),L_0aec7456,,,,
"""""",narrator_2046e462,"Вспышки становились все сильнее, вырывая Лиззару из реальности. Она почти не отдавала своим действиям отчета. Ее просто несло по волнам удовольствия.",narrator_2046e462,,,,
"S1 """"",S1_5a05bccf,"Отлично-отлично, он почти готов! А теперь нужно, чтобы ты как следует постаралась.",S1_5a05bccf,,,,
"L """"",L_54d96e0b,(!!!),L_54d96e0b,,,,
"L """"",L_2819e7e1,(Что? Я... Что я?),L_2819e7e1,,,,
"S1 """"",S1_8b722998,Нет времени на разжевывания. Просто представь свой анус!,S1_8b722998,,,,
"L """"",L_991b3ab9,{size=+4}Э-Э-Э???{/size},L_991b3ab9,,,,
"S1 """"",S1_3a502289,"Я не закладывала в паразита знания о том, каким он должен быть. Ни форм, ни размеров, поэтому тебе нужно сделать это самой.",S1_3a502289,,,,
"L """"",L_1eb73f27,{size=+8}(Ч-что????){/size},L_1eb73f27,,,,
"L """"",L_7ed20377,(П-почему я должна делать это?! Ах... О чем ты таком говоришь?),L_7ed20377,,,,
"S1 """"",S1_695f5993,"Вообще сложно объяснить, как это работает... да и нет времени все это разжевывать. Просто представь, как бы выглядел твой анус. Все в твоих руках.",S1_695f5993,,,,
"L """"",L_a78b8de7,(Ты не можешь просить меня о подобном... Ч-что это вообще значит?!),L_a78b8de7,,,,
"L """"",L_860776e4,"(М-м-м-м, я не собираюсь ничего такого выбирать. О чем ты вообще думала?! Э-это отвратительно, ставить меня в такое положение!)",L_860776e4,,,,
"S1 """"",S1_be16b6a3,"Ну же не вредничай. Хочу тебя предупредить: если ты это не сделаешь, то может случиться все что угодно. Твой анус может стать размером с арбуз!",S1_be16b6a3,,,,
"S1 """"",S1_e90e2840,"Хочу сказать, это тоже интересно, ха-ха.",S1_e90e2840,,,,
"S1 """"",S1_2cab92bf,Ха-ха-ха.,S1_2cab92bf,,,,
"L """"",L_1eb73f27_1,{size=+8}(Ч-что????){/size},L_1eb73f27_1,,,,
"L """"",L_62be48e0,"(М-м-м-г, т-ты издеваешься надо мной! Это очередная, ах... шутка? Т-ты ужасна! Ты... Не можешь сделать со мной такие ужасные вещи! Я-я не хочу принимать такие решения! Но ты заставляешь меня...)",L_62be48e0,,,,
"L """"",L_daed016f,(Ты хочешь свести меня с ума? Тебе недостаточно того... что ты уже сделала?),L_daed016f,,,,
"S1 """"",S1_e4b5f388,"Ну же давай просто представь, какой ты хочешь анус, представь какой бы он был, твой собственный анус, неужели ты никогда о таком не думала. Время на исходе. ",S1_e4b5f388,,,,
"""""",narrator_689535ef,"Лиззара ощущала изменения в своем теле. C каждым мгновением сила увеличивалась, что подтверждало слова Королевы Клинков, у нее не было много времени на раздумья.",narrator_689535ef,,,,
"L """"",L_cf6a2893,"(Аххх... м-мой анус... я должна выбрать. Но какой он должен быть? Почему я должна думать о таком? У нас никогда такого не было... я не хочу м-м-м-м-г, выбирать... Но если у меня нет выбора, то лучше сделать этот выбор самой, чем он станет как АРБУЗ!)",L_cf6a2893,,,,
"L """"",L_2a57c69d,"{size=+8}(А-а-а-ах! АНУС... НЕТ, не хочу... АНУС, НЕТ!!! КХАЛА, СПАСИ МЕНЯ! ММММММ!!!){/size}",L_2a57c69d,,,,
"L """"",L_22fb0cd7,{size=+8}(АНУСИ-И-И-И-ИК!!!){/size},L_22fb0cd7,,,,
"L """"",L_2e7da301,{size=+12}(М-м-м-м-м-м-м-!!!){/size},L_2e7da301,,,,
"""""",narrator_8668cae7,"На Лиззару накатила огромная волна удовольствия, куда больше, чем раньше. Она закатывала глаза от удовольствия, пытаясь не потерять из мысли то, что она хочет.",narrator_8668cae7,,,,
"L """"",L_56e59fe7,(Я кончаю! Кончаю от мысли о своем анусе! М-м--м-мг...),L_56e59fe7,,,,
"L """"",L_28806d80,"(Как низко я пала! Я не могу перестать о нем думать! Кончать, пока думаешь о анусе, так приятно...)",L_28806d80,,,,
"L """"",L_5fd9cb3f,(ААХХХ!!~ Мое тело... Оно не выдержит!),L_5fd9cb3f,,,,
"L """"",L_ed074d7f,(Аххх... ААХХХХ!),L_ed074d7f,,,,
"L """"",L_9e2eed62,"(Ч-черт... Н-нужно быть... тише. Я должна, м-м-м-ф, себя сдерживать.)",L_9e2eed62,,,,
"L """"",L_1591cfba,"(Но внутри так приятно, ха-а-а...)",L_1591cfba,,,,
"S1 """"",S1_701b92ca,"О-о-о-о, ты все же сделала это, молодец! Давай теперь посмотрим, что же у нас получилось.",S1_701b92ca,,,,
"""""",narrator_44fa2ad8,"Королева Клинков нетерпеливо раздвинула ягодицы, чтобы увидеть новообретенный анус Лиззары.",narrator_44fa2ad8,,,,
"S1 """"",S1_f149cd5e,"Вау, ничего себе, а ты отлично постаралась, мне нравится твой выбор! Он такой развратный!",S1_f149cd5e,,,,
"S1 """"",S1_6cc29b05,"Для существа, который никогда не имел ничего подобного, у тебя получилось просто отлично!",S1_6cc29b05,,,,
