location,source,target,ID,fuzzy,context,translator_comments,developer_comments
"S ""%%""",S_d96560f3,"(Я... Я оставила ее возле себя, чтобы защитить от зергов, но теперь сама ей пользуюсь. Нет, ‘пользуюсь’ не то слово... Подставляю под такую опасность...)",,,,,
"Gside1 ""%%""",Gside1_1f026d42,(Все прошло гладко? Она была напугана?),,,,,
"S ""%%""",S_9879350e,"(Эм... ну тут небольшие неполадки были. Но по поводу ‘напугана’ это сто процентов, можешь даже не сомневаться, ха-ха.)",,,,,
"""%%""",narrator_b1625082,"Сара решила не вдаваться в подробности, рассказывая стражу лишь часть истории, параллельно рассуждая о случившемся.",,,,,
"S ""%%""",S_5223b98c,(Я ведь действительно немного попала на себя. Но это точно подпитало чувство страха у Лиззары.),,,,,
"S ""%%""",S_36c107ab,(Он не может не клюнуть.),,,,,
"Gside1 ""%%""",Gside1_5416853b,"(Это замечательно. Если все так, то план точно увенчается успехом!)",,,,,
"Gside1 ""%%""",Gside1_28d1db59,(А чего ты такая запыхавшаяся? Тебя заметили?),,,,,
"""%%""",narrator_2cd1a1a7,Страж звучал настороженно.,,,,,
"S ""%%""",S_def10d24,"(Не переживай. Все хорошо. Просто возникла непредвиденная ситуация, но из-за этого не стоит прерывать задание! Я все решу.)",,,,,
"Gside1 ""%%""",Gside1_e40a00e2,"(Точно? Не хочешь рассказать, что случилось?)",,,,,
"S ""%%""",S_8085d4dd,"(Лучше сфокусируйся, чтобы мигом туда добраться! И просто делай свое дело. Все будет как и задумывали.)",,,,,
"S ""%%""",S_543911b4,(Я... все... решу...),,,,,
"""%%""",narrator_f1c78578,"Девушка еще сильнее сконцентрировалась, высвобождая больше мощи. Ее скорость стремительно стала увеличиваться.",,,,,
"Gside1 ""%%""",Gside1_408ea3a5,"(Я сделаю все, что в моих силах. Знаешь, если я полностью сфокусируюсь, то смогу еще сильнее ускориться!)",,,,,
"S ""%%""",S_ea95fe27,"(Это то, что нам нужно. Так что сделай это, не буду больше отвлекать тебя своей болтовней.)",,,,,
"S ""%%""",S_7773751d,(Конец связи.),,,,,
"""%%""",narrator_aab8eefe,"Сара прервала связь, оборачиваясь за спину. Она пыталась убежать от Лиззары настолько далеко, насколько это возможно. Протосс уже давно скрылась за горизонтом, но девушка продолжала бежать и бежать, убегая все дальше и дальше.",,,,,
"S ""%%""",S_71103a77,"(Я обещала, что буду защищать ее... Но вернуться назад не могу. Страж начал свой путь оттуда и если чудище пошло за Лиззарой, то я приведу его прямиком к стражу.)",,,,,
"S ""%%""",S_12e58ddf,"(Это очень плохо... Рисковать нельзя, значит, мне нужно уходить в другом направлении дальше.)",,,,,
"S ""%%""",S_6f25e2b4,"(Это все, что мне остается.)",,,,,
"""%%""",narrator_befa28bc,"Сара очень внимательно осматривала ландшафт, пытаясь найти укромный уголок для того, чтобы скрыться с поля зрения невиданного ею чудовища.",,,,,
"S ""%%""",S_a4d87de2,"И почему нет ничего подходящего... Поверить не могу, что я... Ха?",,,,,
"S ""%%""",S_ae54f208,Нашла!,,,,,
"S ""%%""",S_8f89e8a7,Это точно должно сгодиться.,,,,,
"S ""%%""",S_f2e60535,"Он еще далеко, у меня есть время.",,,,,
"""%%""",narrator_7fe1d82b,"Впереди Сары находилась гора мусора, она стала старательно преодолевать ее, чтобы максимально скрыться от твари, которая не собиралась отставать.",,,,,
"L ""%%""",L_3b41ac56,(Сара... Сара!),,,,,
"S ""%%""",S_5f2d0936,(Лиззара? Неужели они уже пришли? Так быстро?),,,,,
"L ""%%""",L_3a615a3c,"(Нет-нет, их еще не видно. Я просто хотела еще раз сказать, что все в порядке. Ты не виновата, у нас все равно все получится!)",,,,,
"""%%""",narrator_ba1bf38d,"Слова Лиззары на секунду выбили Сару из равновесия, напоминая, что она поставила весь их план под угрозу, но слова протосса звучали очень приятно и ласково.",,,,,
"S ""%%""",S_c37ec708,"(Почему же, Лиззара... ты продолжаешь так относиться ко мне... я поставила под угрозу весь наш план...)",,,,,
"L ""%%""",L_be20af60,"(Видела бы ты свое лицо, когда заметила, что облила и себя тоже! Это было забавно.)",,,,,
"""%%""",narrator_f7f85653,"Сара отдаленно слышала смех Лиззары, которая будто и забыла, что ее ожидает. Ее приятный голос продолжал успокаивать девушку.",,,,,
"S ""%%""",S_7a8be6e4,(Нашла что вспомнить...),,,,,
"S ""%%""",S_2826f960,"(Это... Вообще-то, я просто немного удивилась!)",,,,,
"""%%""",narrator_558dbebd,"Сара действительно пыталась представить свое удивленное и испуганное лицо одновременно. Это получалось с трудом, но девушке казалось, что она выглядела смешно.",,,,,
"L ""%%""",L_e1bf973a,"(Знаешь... Я была рада, когда ты пришла и попросила о помощи... быть рядом и помогать в твоих делах, это честь для меня!)",,,,,
"S ""%%""",S_b78ca3fc,!!!,,,,,
"L ""%%""",L_b3c58452,"(Когда я сижу и смотрю, как ты ходишь и решаешь свои проблемы, то чувствую себя бесполезной.)",,,,,
"L ""%%""",L_4f0f0b5c,(Это как свежий глоток воздуха.),,,,,
"L ""%%""",L_8e3253cf,"(С тобой рядом спокойнее на душе. Я чувствую, как твоя сила растет, так что бояться нечего. Я всегда знаю, что ты справишься с любыми трудностями!)",,,,,
"S ""%%""",S_6589f703,"(Хах, мне приятно это слышать. Но тебе сейчас не должно быть спокойно.)",,,,,
"S ""%%""",S_1ab0d25b,"(Помни, что ты жертва!)",,,,,
"L ""%%""",L_abf075e2,"(Я... Ах... точно! Действительно забылась немного... Да-да, точно. Страшно... Мне так страшно...)",,,,,
"L ""%%""",L_6adf9790,(Спасите меня кто-то!!!),,,,,
"""%%""",narrator_be6188a8,"Связь резко прервалась, что заставило Сару улыбнуться.",,,,,
"S ""%%""",S_3346d7aa,"(Я оставляю тебя одну... Но как только все закончится, я вернусь за тобой! Просто продержись до этого момента!)",,,,,
"S ""%%""",S_7f20563a,"(Спасибо, что помогаешь...)",,,,,
"S ""%%""",S_e01251de,"(Ты права, у нас определенно все получится!)",,,,,
"""%%""",narrator_6d19a27b,"Лиззара больше не выглядела спокойной, когда закончила разговор с Сарой. Кто-то на связи хоть немного успокаивал протосса, но находиться в таком месте в одиночку было невыносимо.",,,,,
"L ""%%""",L_a273d343,(Тут и без кандалов было-то страшно... Они только сбежать мешают.),,,,,
"L ""%%""",L_6b9354bf,(Но ведь так и должно быть... Я должна так себя чувствовать. В этом смысл этих кандалов!),,,,,
"L ""%%""",L_abed871a,"(И эта, ауч! Игрушка... Я все понимаю, но... Можно было бы и поаккуратнее! Моя попка и так слишком чувствительная...)",,,,,
"L ""%%""",L_534107a7,"(Только подумать, я всего ничего тут, а столько всего произошло... И плохого, и хорошего... Ужас!)",,,,,
"""%%""",narrator_904f6378,"Лиззара осмотрелась, пытаясь увидеть или почувствовать того, от кого так старательно убегала Сара. Но ее встречала только голая пустыня, где не было и намека на живых существ.",,,,,
"""%%""",narrator_fc01bd74,"Однако страх делал свое дело, казалось, кто-то дышит ей в спину. Феромон, которым ее облили, и общая атмосфера начинали давить на разум протосса, создавая причудливые иллюзии.",,,,,
"L ""%%""",L_f234272f,Правильно ли мы поступили...,,,,,
"L ""%%""",L_19239a12,"Вот и пришла моя погибель, хотя я не собиралась умирать!",,,,,
"L ""%%""",L_96c3d97b,А кто будет помогать Саре? Я не могу умереть! НЕ МОГУ!,,,,,
"""%%""",narrator_f44783f0,"Лиззара все больше хотела сбежать, но железные цепи продолжали сдерживать ее попытки, громко звеня от каждого движения. Она была готова биться в истерике от беспомощности, страх беспощадно бил ей в голову.",,,,,
"""%%""",narrator_f578a8de,"Протосс не реагировала на приглушенный шум, пытаясь убедить себя, что она не сошла с ума и не умрет в этом месте. Просто иллюзии медленно перетекли в реальность в виде огромного хищника, который пришел за своей добычей.",,,,,
"""%%""",narrator_2558d229,"Он постепенно приближался к протоссу, почти полностью покрывая ее своей тенью. В один момент Лиззара замерла, замечая реалии происходящего. Она не могла сбежать или дать отпор, а что-то громоздкое уже стояло над ней и капало на нее слюной.",,,,,
"L ""%%""",L_3cad4d44,"(Я не хочу... Не хочу смотреть на то, что там стоит... Н-не хочу...)",,,,,
"L ""%%""",L_d75d9239,(НО Я ДОЛЖНА!),,,,,
"""%%""",narrator_09a9dd7d,"Через силу протосс повернула голову, встречаясь с горящими глазами напротив.",,,,,
"L ""%%""",L_6f485d10,АААА!,,,,,
"""%%""",narrator_9e260c20,"Лиззара хотела отвести взгляд или смотреть в пол, лишь бы не ощущать на себе испепеляющий взгляд. Зверь всеми силами давил на нее, заставляя подчиниться.",,,,,
"L ""%%""",L_563a35c6,Ч-что... Пришел за своей жертвой? Ты ведь хочешь меня? Да... Я знаю... Я очень аппетитно пахну! Ты не можешь удержаться.,,,,,
"""%%""",narrator_eaa12747,"Лиззара привлекала к себе все больше внимания, но зверь не собирался сразу подходить, делая только небольшие шажки и принюхиваясь.",,,,,
"L ""%%""",L_04408f7a,Н-нет...,,,,,
"""%%""",narrator_22853715,"Лиззара с ужасом посмотрела дальше, замечая то, чего не хотела бы видеть никогда в жизни.",,,,,
"L ""%%""",L_b89c20de,К-ак такое...,,,,,
"L ""%%""",L_81944c52,Может быть?,,,,,
"""%%""",narrator_4110044c,"Вся смелость быстро улетучилась, когда протосс увидела еще одну тень. Она казалась даже больше, чем первая.",,,,,
"L ""%%""",L_61dbfad3,(Они ошиблись... Как они ошиблись!) ,,,,,
"L ""%%""",L_65c6af64,(Их не должно быть двое! Тогда почему я вижу? Вижу это!),,,,,
"""%%""",narrator_8b344377,"Протосс в панике даже не сразу сообразила, что ей нужно сообщить об этой находке остальным, пока у нее была такая возможность.",,,,,
"L ""%%""",L_a96e42c4,(Сара...),,,,,
"L ""%%""",L_6074687e,(Я должна сказать Саре!),,,,,
"L ""%%""",L_dffe8ca6,(ИХ НЕСКОЛЬКО! Слышишь?! НЕСКОЛЬКО!),,,,,
"""%%""",narrator_945b529e,"Сара резко остановилась, не сразу понимая, о чем идет речь. В ее голове громко циркулировала кровь от быстрого бега, что затрудняло понимание того, кто и о чем пытается ей сказать.",,,,,
"S ""%%""",S_71e20f14,(ЧТО?),,,,,
"L ""%%""",L_69f2b2ad,(МОНСТРОВ НЕСКОЛЬКО!!!),,,,,
"""%%""",narrator_ef2fdcd6,"Сара нахмурилась, переваривая то, что услышала. Ее лицо стремительно приобрело выражение ужаса и удивления.",,,,,
"S ""%%""",S_5fe476f2,(Быть такого не может! Откуда там еще один?!),,,,,
"L ""%%""",L_8127bd2d,(Еще один! Их тут много! ОН НЕ ОДИН!),,,,,
"""%%""",narrator_9ce75966,"Девушка слышала, как обреченно звучала Лиззара. Ее сердце болело от того, что она оставила ее одну и в такой ситуации. Решение закончить все приходило само по себе.",,,,,
"S ""%%""",S_18b25ccb,(Я скоро буду у тебя.),,,,,
"L ""%%""",L_fcea795d,"(Н-нет! Я знаю, что ты не хочешь рисковать, но мы должны продолжить! Я с-смогу выдержать! Все будет хорошо...)",,,,,
"Gside1 ""%%""",Gside1_c2b05a79,(Знаете...),,,,,
"Gside1 ""%%""",Gside1_0b725a81,(Хм... Действительно. Они очень быстро размножаются.),,,,,
"Gside1 ""%%""",Gside1_20c46b8a,"(Такое возможно, ведь в последний раз мы делали разведку несколько лет назад.)",,,,,
"S ""%%""",S_898e64da,(НЕСКОЛЬКО ЛЕТ???),,,,,
"""%%""",narrator_9abc3394,"Сара начинала кипеть от злости, понимая, что где-то в начале ей забыли сказать такую важную деталь.",,,,,
"S ""%%""",S_06494926,"(Ты совсем с ума сошел?! А ты что, даже не подумал, что за это время могло что-то измениться?)",,,,,
"""%%""",narrator_df427d43,"Девушка сама одернула себя, вспоминая о супермедленной природе стражей.",,,,,
"S ""%%""",S_ecb59498,(Действительно... О чем я говорю. Для него эта пара лет длилась всего ничего.),,,,,
"Gside1 ""%%""",Gside1_8029bd7a,"(Есть и хорошие новости! Мы почти у цели. Я вижу вдалеке их логово, так что осталось совсем чуть-чуть и мы будем там.)",,,,,
"S ""%%""",S_fb6b6f9f,"(Ага... Скоро... Да тебе, чтобы 100 метров пролететь, нужна вечность... А ведь еще обратно нужно будет возвращаться!)",,,,,
"""%%""",narrator_63d7b64f,"Сара не решилась говорить это в общий эфир, чтобы не сорвать все окончательно. Она была зла, но не настолько, чтобы наказать стража за его оплошность.",,,,,
"L ""%%""",L_7797124c,"(Вот видишь, все хорошо. У нас п-получится! Все, что мне нужно, это просто задержать их на достаточное время.)",,,,,
"L ""%%""",L_822a698f,"(Думаю, у меня точно это получится! Они весьма заинтересованы мной...)",,,,,
"S ""%%""",S_c30c002f,(Хорошо... Мы не сворачиваем операцию. Продолжаем заниматься своими делами.),,,,,
"L ""%%""",L_b97d31d1,(Х-хи???),,,,,
"""%%""",narrator_1523cdca,"Лиззара почувствовала себя странно, когда звери стали обходить ее со всех сторон и принюхиваться в самых интимных местах. Но один привлекал особое внимание, потому что стоял вдалеке и не был совсем заинтересован в своей жертве. Его сородичи постоянно отвлекали протосса попытками лизнуть подмышки или возле бедер.",,,,,
"""%%""",narrator_11a0893e,"Лиззара старалась не сводить глаз с отшельника, но остальные все активнее подбирались к промежности. Протосс не могла поверить в странность происходящего, когда она таращилась на одного единственного зверя, который смотрел куда-то в другую сторону, а в этом время ее домогались его собратья.",,,,,
"L ""%%""",L_2089fc12,"Ну же, иди сюда! Тебе не должно ничто другое быть интересно, только я... Мое тело...",,,,,
"L ""%%""",L_1f36bd30,А?,,,,,
"""%%""",narrator_271b6c20,"Протосс активно мотала головой, пытаясь понять, куда пропал монстр, который только что был перед ее глазами. Зверь с неимоверной скоростью двинулся от Лиззары, вздымая за собой клубы дыма. Лиззара даже удивилась такой скорости и начала догадываться, куда он идет.",,,,,
"L ""%%""",L_3a12bd06,"(С-сара! Сара, прием! Один пропал!)",,,,,
"L ""%%""",L_7d2f202c,(Он не клюнул на ловушку.),,,,,
"S ""%%""",S_42efed5b,(Да что такое! Как такое может быть...),,,,,
"L ""%%""",L_ab030fd4,"(Он очень быстрый! Быстрее даже, чем мы думали!)",,,,,
"S ""%%""",S_2caaecae,"(Страж, тебе нужно срочно убегать обратно! Насколько это возможно, конечно... Тебе конец, если он поймает тебя.)",,,,,
"L ""%%""",L_e047fe1a,"(Нет, Сара... Он пошел в твою сторону... Кажется, он унюхал!)",,,,,
"S ""%%""",S_598f3ef1,(Черт!),,,,,
"Gside1 ""%%""",Gside1_541434ea,"(Унюхал... о чем речь? Неужели это то, о чем ты говорила?)",,,,,
"S ""%%""",S_88f9df97,"(Все нормально, мы решили продолжать операцию. А значит, все остается в силе. Все продолжают делать то, что должны!)",,,,,
"L ""%%""",L_68c97b4a,"(Сара, он неимоверно быстрый! Я никогда ничего столь быстрого не видела! Он будет у тебя с минуты на минуту...)",,,,,
"S ""%%""",S_9c435f45,(Как? Между нами же очень большое расстояние! Неужели и тут разведка подвела...),,,,,
"L ""%%""",L_e08eb82d,"(Возможно, некоторые особи эволюционируют куда быстрее и могут улучшать свои характеристики.)",,,,,
"S ""%%""",S_9f72d0d1,(Черт! Из-за этого у него могло сильнее развиться обоняние и он учуял мой след... Чертов ублюдок!),,,,,
"L ""%%""",L_3fbfb07a,"(Лучшим способом будет спрятаться где-то там, где он тебя не достанет.)",,,,,
"Gside1 ""%%""",Gside1_174ed072,(Верно. Сколько ты опрокинула на себя феромона?),,,,,
"S ""%%""",S_3f6a3979,(Каплю... Максимум две.),,,,,
"Gside1 ""%%""",Gside1_b756243b,(Скорее всего они уже выветрились.),,,,,
"Gside1 ""%%""",Gside1_d6979fe5,"(Протосс права, если он действительно настолько быстр, тебе не убежать от него. А в момент погони он будет чувствовать твой страх и ни за что не упустит след.)",,,,,
"Gside1 ""%%""",Gside1_fb2c99be,"(А вот если ты спрячешься где-то и попробуешь успокоиться, то все должно обойтись.)",,,,,
"S ""%%""",S_572be643,(Легко же вам говорить...),,,,,
"""%%""",narrator_aa438fad,"Сара осмотрелась, стараясь увидеть хоть что-то, отдаленно напоминающее пещеру или дыру.",,,,,
"S ""%%""",S_764932f3,"(Просто нужно спрятаться где-нибудь... в этой богом забытой пустыне, верно?)",,,,,
"""%%""",narrator_06edb41b,"Сара понимала, что это единственной вариант, который действительно может сработать. Найти место было не так легко, но не невозможно.",,,,,
"S ""%%""",S_fd2019a1,"(Ладно, я так и сделаю.)",,,,,
"S ""%%""",S_8637a452,"(Спасибо за информацию, Лиззара.)",,,,,
"""%%""",narrator_3777f87a,"Протосс не могла отвечать сразу, ощущая множество языков на своей коже. Ее активно домогались сразу несколько монстров, не давая момента прийти в себя.",,,,,
"L ""%%""",L_274ec9ef,"(У-удачи... Я д-действительно продержусь. Они не такие страшные, как кажутся. У нас в-все... Получится!)",,,,,
"L ""%%""",L_731ba82a,(Аххх...),,,,,
"Gside1 ""%%""",Gside1_0fe3922a,"(Девчонки, вы заряжаете меня своим позитивом. После ваших пламенных речей я чувствую прилив сил!)",,,,,
"Gside1 ""%%""",Gside1_22c747f0,"(Я теперь не молния, я теперь РАКЕТА! МЕНЯ НЕ ОСТАНОВИТЬ! ВИЖУ ЦЕЛЬ, НЕ ВИЖУ ПРЕПЯТСТВИЙ! КОНЕЦ СВЯЗИ.)",,,,,
"""%%""",narrator_611a0cc2,"Лиззарой вовсю были заинтересованы оставшиеся монстры. Некоторые продолжали обнюхивать, пока один из них уже пытался пристроиться сзади. Его массивное тело с трудом устраивалось над таким маленьким протоссом, но это его нисколько не останавливало.",,,,,
