location,source,target,ID,fuzzy,context,translator_comments,developer_comments
"S1 """"",S1_a7029631,Ах... Какое прекрасное чувство сытости!,,,,,
"S1 """"",S1_cae73ecc,"Теперь есть немного времени пошалить, хи-хи-хи. Моя любимая часть досуга!",,,,,
"""""",narrator_5134c52c,"Вальяжно сидя на троне, Королева Клинков азартно потирала руки, выбирая свою новую жертву.",,,,,
"S1 """"",S1_cc342ebc,"Чем же я хочу заняться сегодня? Снова переманить кого-то? Не-е-ет... Это весело, но быстро надоедает.",,,,,
"S1 """"",S1_e751d712,Лиззара...,,,,,
"S1 """"",S1_09c68c91,"Как я могла забыть про свою любимую малышку, хи-хи.",,,,,
"S1 """"",S1_41b8a964,Как подло с моей стороны оставлять ее так надолго одну. Нужно исправлять!,,,,,
"S1 """"",S1_fed2e387,"Ах, какая встреча! Я как раз тебя ищу...",,,,,
"""""",narrator_50496baf,"Лиззара оцепенела, услышав ненавистный голос.",,,,,
"L """"",L_23001024,"Я думала, что ты уже не придешь...",,,,,
"S1 """"",S1_fc179685,Соскучилась?,,,,,
"L """"",L_6ddbb60b,(Ни капли...),,,,,
"L """"",L_3b388732,"(Я надеялась, что никогда не вернусь к этому! Тут мало существ? Я не готова к этой пытке снова!)",,,,,
"L """"",L_ae7e4793,"(Но она ведь не будет здесь вечно... Если она утолила голод, то сейчас у нее осталось не так много времени...)",,,,,
"L """"",L_1de5bcde,"(А это значит, что Сара скоро выйдет наружу! Я спасена! Нужно только потянуть время...)",,,,,
"L """"",L_362b1401,(!!!),,,,,
"L """"",L_e60f9953,"(Вот черт, неужели она все это слышит, как же я могла забыть...!)",,,,,
"S1 """"",S1_95148b67,"Ха-ха-ха, неплохой план. Я не ошиблась, выбрав тебя.",,,,,
"S1 """"",S1_712ca2bd,Что-то в тебе неисправимо. Но мы все же попробуем.,,,,,
"L """"",L_d26264f1,(Нет!),,,,,
"S1 """"",S1_89db6a74,Да-ат!!,,,,,
"S1 """"",S1_63260932,"Сегодня продолжение нашего обучения! Я знаю, как ты этому рада. Тем более сегодня будет нечто незабываемое.!",,,,,
"L """"",L_a3cbfd35,(Что опять...),,,,,
"S1 """"",S1_989a7865,"А тебе все скажи да покажи... Нужно сохранять хоть немного интриги, Лиззара.",,,,,
"S1 """"",S1_d3bfe8e4,"То, что я оставила тебя так надолго, не значит, что нужно раскрывать все карты.",,,,,
"L """"",L_712b6453,(Какой ужас... мне снова предстоит выдержать испытание судьбы.),,,,,
"S1 """"",S1_01d9534e,"Не расстраивайся, если будешь хорошо себя вести – быстро все узнаешь, хи-хи-хи.",,,,,
"S1 """"",S1_41e77f4b,Ты же будешь вести себя хорошо?,,,,,
"""""",narrator_5ffb317d,"Игривый тон Королевы Клинков быстро сменился на угнетающий, бросая протосса в холодный пот.",,,,,
"S1 """"",S1_4ec45e92,Мне же не придется применять силу снова?,,,,,
"L """"",L_67723834,Я-я... Сделала как ты хочешь. Но эта поза... Неужели ты...?,,,,,
"S1 """"",S1_41436179,"О-о-о... Ты даже не представляешь, что тебя ждет.",,,,,
"""""",narrator_2ad19dd6,"Королева Клинков не давала Лиззаре опомниться, переводя весь фокус внимания на себя. Девушка выглядела по-театральному величественно, чтобы окончательно вовлечь протосса в свои шалости.",,,,,
"S1 """"",S1_2f2b7488,"Это будет нечто новое... Хм, ну как ‘новое’. Для меня, возможно, и не настолько новое... Но вот для тебя!",,,,,
"S1 """"",S1_df89656e,"Бьюсь об заклад, ты никогда не испытывала ничего подобного!",,,,,
"L """"",L_4fd69542,(Н-новое? Не нравится мне ничего новое... Особенно от тебя!),,,,,
"""""",narrator_c8d9bc1a,"Тело Лиззары немного подрагивало от переполняющей ее тревоги. Протосс уже знала, что может преподнести ей Королева Клинков, и относилась к каждому ее слову с особой опаской.",,,,,
"S1 """"",S1_c3ef44af,Давай сыграем в викторину?,,,,,
"L """"",L_9ce9b9ff,Не самое удачное вре...,,,,,
"S1 """"",S1_b4ed82d5,"Тссс, не думай, а угадывай!",,,,,
"S1 """"",S1_4cba52d2,Что я буду с тобой делать?,,,,,
"L """"",L_2e485f5d,Ах... Я не знаю!,,,,,
"S1 """"",S1_7e1f2e9e,"Ну же, давай попробуй.",,,,,
"L """"",L_54d63e9b,(Н-нет...),,,,,
"S1 """"",S1_f85f70a4,"Ты же согласилась на добровольную игру, так что угадывай.",,,,,
"S1 """"",S1_4cba52d2_1,Что я буду с тобой делать?,,,,,
"L """"",L_f5f44c80,Т-ты... Снова хочешь изменить мое тело?,,,,,
"L """"",L_a40f5af8,"Неужели этого мало? Мало того, что ты уже сделала со мной? ",,,,,
"S1 """"",S1_df2c5661,Ха-ха-ха-ха!!!,,,,,
"S1 """"",S1_1c03245e,"Не-ет, у меня весьма другие планы.",,,,,
"""""",narrator_50411762,"Девушка медленно вела пальцем к виску, чтобы Лиззара точно заметила ее действие.",,,,,
"S1 """"",S1_94a5d4e0,Сегодня мы займемся твоим мозгом.,,,,,
"L """"",L_a35daa4e,М-МОЗГОМ?!,,,,,
"S1 """"",S1_fa1a0729,"Не прямо мозгом, просто откроем для тебя новые чувства... Перед этим никто не останется равнодушным!",,,,,
"S1 """"",S1_d71fbcab,"Никто не оставался, по крайней мере.",,,,,
"L """"",L_fb89989e,И-и-ик!,,,,,
"""""",narrator_fc6f95b4,"Королеву Клинков забавляла такая реакция. Ее смех заполнял всю комнату, громко отдаваясь в голове напуганной Лиззары.",,,,,
"""""",narrator_19d1d713,"Каждое слово, каждый смешок девушки усугублял положение протосса. Ее фантазия заходила куда дальше под давление страха и неведения. Лиззара не заметила, как Королева Клинков обошла ее и села перед ней на корточки. Она видела только горящие похотливые глаза напротив, которые заглядывали в самую душу.",,,,,
"S1 """"",S1_1a69c654,Твоя голова уже забита всякими дурными фантазиями? Все еще помнишь наши старые игры? Это были такие мелочи... Вся твоя жизнь разделится на до и после сегодняшнего дня.,,,,,
"S1 """"",S1_04a6f37e,Ты готова к этому?,,,,,
"L """"",L_66fa6e82,Н-нет...,,,,,
"S1 """"",S1_4d0aa872,"Конечно нет, никто и никогда не будет готов к такому... Тебе придется готовиться на ходу, ха-ха-ха!",,,,,
"""""",narrator_30f1fa2e,"Королева Клинков положила руку на спину протосса, ведя ей по всему телу и останавливая на лице.",,,,,
"S1 """"",S1_d7f19184,"Твое тело стало так остро реагирует на мое присутствие... Кажется, оно соскучилось по мне еще больше, чем ты, хи-хи.",,,,,
"""""",narrator_12e44fd2,"Тишина казалась для протосса мучительной. Взгляд девушки давил на нее невыносимым грузом, убивая остатки разума. Но тишина была недолгой.",,,,,
"S1 """"",S1_b4f76aa1,Посмотрим...,,,,,
"""""",narrator_75ecad71,"В поле зрения Лиззары появилось новое сияние. Протосс машинально подняла взгляд на указательный палец Королевы Клинков, который сиял тем же цветом, что и ее глаза. Незамедлительно сзади послышались знакомые чавкающие звуки.",,,,,
"L """"",L_4c391307,Только не это...,,,,,
"S1 """"",S1_5e127b8a,Именно это...,,,,,
"L """"",L_5bdc7b75,{size=+4}А-а-а-а-а-а-а-а!!!{/size},,,,,
"""""",narrator_da1d4ae8,"Королева Клинков с нетерпением заглядывала назад, ожидая, когда тентакли начнут свое наступление. Реакция протосса не заставила себя ждать, Лиззара не могла сдерживать свои стоны, даже не ощущая прикосновения.",,,,,
"S1 """"",S1_9407b6b8,Обожаю это зрелище! Каждый раз как первый...,,,,,
"L """"",L_f1a6467b,А-а-а-аххх!!! П-почему всегда... Страдает моя промежность...,,,,,
"S1 """"",S1_35709c8d,"Это слишком сладкое место, чтобы его пропустить!",,,,,
"""""",narrator_6c86dcc9,"Склизкие тентакли тянулись к киске Лиззары и она это отчетливо ощущала. Ее тело было слишком сковано страхом и возбуждением, чтобы что-то с этим сделать. Количество щупалец возле бедер протосса только ухудшало дело. Они были тонкие сами по себе, но, пытаясь дотянуться до желанной щели, сплетались между собой во внушительный тентакль.",,,,,
"S1 """"",S1_227690e2,"Ах, сегодня я уже немного устала... Так что мне потребуется помощь моих небольших друзей!",,,,,
"S1 """"",S1_5c0cff12,"Хи-хи-хи, но не стоит расстраиваться. Поверь, моему умению управления может позавидовать даже Сара.",,,,,
"""""",narrator_c07df945,"Тентакли стали шевелиться активнее, как будто подтверждая ее слова. Они пошло хлюпали и дотрагивались до кожи протосса, кружа в опасной близости от ее вагины. Лиззара чувствовала, как низ ее живота начинал тянуть от того, как сильно ее заводили такие прикосновения.",,,,,
"L """"",L_794da208,Ах... Ты будешь насиловать меня этими тентаклями?,,,,,
"""""",narrator_7838cae2,Королева Клинков улыбалась таким предположениям.,,,,,
"S1 """"",S1_52beb633,"Почему сразу насиловать, милашка. Неужели я у тебя ассоциируюсь исключительно с такими ужасными вещами?",,,,,
"L """"",L_5b761b2e,АА-А-АХХХХ!!!,,,,,
"""""",narrator_4b3ffcfc,"Пока девушка говорила, ее лицо выражало умиротворение и спокойствие. Лиззара почти поверила в искренность слов, если бы Королева Клинков после не показала свою истинную злобную натуру.",,,,,
"""""",narrator_842eca96,"Тентакли без предупреждения вошли в киску протосса, извиваясь и скручиваясь внутри. Уже разгоряченная Лиззара с легкостью принимала их внутрь, теряя голову от движения внутри.",,,,,
"S1 """"",S1_bdd4b9df,"Черт, это прям мед для моих ушей. Я бы слушала твои стоны каждый день, Лиззара. Стони громче!",,,,,
"""""",narrator_c5542e01,"Движения тентаклей стали хаотичнее, лишая протосса возможности сдерживать себя. Она ни о чем больше не думала, исполняя желание своего мучителя.",,,,,
"S1 """"",S1_14c317fc,"Прогресс идет... Твое тело все лучше реагирует на любые мои действия! А значит, направление задано хорошо. Молодец, Лиззара.",,,,,
"L """"",L_f2dc54c0,МММММ!!!,,,,,
"""""",narrator_6e6a2324,"Королева Клинков еще немного наслаждалась происходящим, перед тем как стала водить пальцем по кругу. Щупальца подчинялись ее команде, меняя свое действие. Теперь они переплетались друг с другом, задевая новые чувствительные точки и продвигаясь глубже.",,,,,
"L """"",L_328be854,Я-Я... НЕ... АХ-ХХХХ!!!,,,,,
"S1 """"",S1_e7a2c908,"Кажется, кто-то уже на пределе. Довольно быстро...",,,,,
"""""",narrator_31ca4de8,"Лиззара не реагировала на слова девушки, выгибаясь в пояснице до предела. Все ее тело постоянно пробирало волнами удовольствия, от чего она не могла ни на что больше реагировать.",,,,,
"L """"",L_0d521e21,"(Она оказалась права, эти тентакли действительно ничуть не уступают ее движениям.)",,,,,
"L """"",L_162a0d22,(Она сильна... не соврала... Такими темпами мне не продержаться до прибытия Сары.),,,,,
"S1 """"",S1_ad4a6973,"Эти тентакли действительно ничуть не уступают моим движениям... Видела бы ты себя со стороны, хи-хи.",,,,,
"L """"",L_196eae04,(Сильна... Она очень сильна! Не соврала...),,,,,
"L """"",L_2134f093,(М-мне не продержаться... До прибытия Сары...),,,,,
"""""",narrator_8b6c4002,"Лиззара сдалась под давлением своего возбуждения, расслабляя тело. Тентакли делали свое дело, пролезая в самые потаенные места и даря приятные ощущения протоссу.",,,,,
"S1 """"",S1_04e73864,"Чувствуешь, Лиззара, как твое тело любит тентакли и то, что они с ним делают? Оно так изголодалось... Тебе нужно тренироваться с ними чаще!",,,,,
"L """"",L_58a73b48,"(Х-хватит, хаа-а-а! Говорить такие вещи!)",,,,,
"""""",narrator_136fe414,"Лиззара сжимала свои стеночки, сгорая от возбуждения, но это приносило ей только больше удовольствия. ",,,,,
"L """"",L_8f10fa4f,(ОХ!!!),,,,,
"S1 """"",S1_e215bda9,"Мне нравится, как ты делаешь только хуже и получаешь от этого кайф. Может, ты специально так поступаешь?",,,,,
"S1 """"",S1_0b0dc9ce,А твое лицо... Это истинное изображение извращенки!,,,,,
"L """"",L_a4dc78cd,"(Я... Я чувствую! Как глубоко они вошли! Внутри так мокро, ах! Все так хлюпает...)",,,,,
"S1 """"",S1_5b70e46b,"Еще бы... Твое тело начало откликаться, как только ты их услышала. Мы явно нашли твой кинк.",,,,,
"""""",narrator_1b45db39,"Лиззара хотела верить, что Королева Клинков больше не может зайти дальше и хуже не будет, но ее тело выходило из-под контроля из-за игр девушки. Ей казалось, что это максимум, который она сможет выдержать. Но она бы сразу в этом усомнилось, если бы смогла увидеть ехидную улыбку Королевы Клинков.",,,,,
"S1 """"",S1_6fbab771,"Как мило, ты скоро заплачешь от перевозбуждения. А кончить не можешь.",,,,,
"L """"",L_07a00fb7,(Ах...! Н-нет! Не так быстро!),,,,,
"""""",narrator_1861f506,"Тентакли грубее входили в киску протосса, от чего она закатывала глаза, откидывая голову.",,,,,
"S1 """"",S1_533dcae5,Прекрасно...,,,,,
"L """"",L_434ef04f,!!!,,,,,
"""""",narrator_ad42bbfb,"Лиззара с удивление смотрела на девушку слегка помутневшим взглядом. Рука с силой сдавливала шею, причиняя саднящую боль.",,,,,
"L """"",L_bba96906,(М-мое горло... Она схватила меня за горло... ч-что она собирается делать...),,,,,
"""""",narrator_32bf5633,"Лиззара хрипела, пытаясь что-то сказать. Внезапно хватка немного убавила напор и протосс закашляла.",,,,,
"L """"",L_324e9d19,Ч-что... ты собираешься делать?!,,,,,
"S1 """"",S1_a63d72b3,"Ох... прошу меня простить, это просто моя привычка...",,,,,
"""""",narrator_9d9a9759,"Королева Клинков пожала плечами, кивая в сторону своей руки.",,,,,
"L """"",L_96f14b65,П-ПРИВЫЧКА?!,,,,,
"S1 """"",S1_c1e26040,"Профессиональная деформация, ничего больше. Терраны получают удовольствие от этого.",,,,,
"L """"",L_6f63ae1e,Но... Они же не смогут дышать?,,,,,
"S1 """"",S1_0339ecc5,"Браво, капитан. Это накаляет ощущение, особенно во время оргазма. Даже существует практика, чтобы привнести в свою сексуальную жизнь, ммм... более острые ощущения.",,,,,
"S1 """"",S1_8fd74c8d,"Думаю, ты уже начала догадываться, чем мы тут собираемся заняться...",,,,,
"""""",narrator_10ba0941,"Лиззара не успела увидеть хитрое выражение девушки, которое она тут же скрыла.",,,,,
"""""",narrator_872af6d8,"Королева Клинков даже не дала Лиззаре возможность отвлечься, резко сильнее сжимая ее шею. Вместе с этим тентакли стали усерднее доводить протосса до пика. Лиззара начала чувствовать, о чем говорила девушка. Ее тело необычно концентрировалось на движениях тентаклей. Они ощущались совершенно по-другому, что не укладывалось в голове Лиззары.",,,,,
"""""",narrator_bd2c077e,"Ощущения от движений обострились в разы, Лиззара ощущала, как рельефная поверхность задевает ее чувствительные стеночки. Вагина протосса начала сильнее сжиматься, требуя большего трения, но этого все равно было недостаточно.",,,,,
"L """"",L_855739d4,(А-Аа-ах! Это невыносимо... Я НЕ МОГУ!!!),,,,,
"S1 """"",S1_9b32ebdc,"Вау... Я слышу, как хлюпанье тентаклей в твоей киске усилилось. Да ты вся течешь...",,,,,
"L """"",L_c8a6defa,(Теку... Н-нет!),,,,,
"S1 """"",S1_e3e8665e,"Да-да, представляю, как эти тентакли обмазывают твои бедра выделениями. Интересно, они затронут анус?",,,,,
"S1 """"",S1_a71b9eda,Тогда все твои дырочки станут такими грязными...,,,,,
"L """"",L_504d7906,(Н-НЕТ!!! Т-ТЫ ИХ КОНТРОЛИРУЕШЬ! ОСТАНОВИ!),,,,,
"S1 """"",S1_68bbad80,"Как я могу остановить, если мне самой нравится?",,,,,
"S1 """"",S1_afebde5e,"Особенно нравится, как ты реагируешь на это. Пока это просто слова, а ты уже возбуждаешься.",,,,,
"L """"",L_94c2da4a,(Я этого не хочу!),,,,,
"S1 """"",S1_526efc7b,А твое тело очень даже хочет. Я послушаю его.,,,,,
"S1 """"",S1_47496fa3,Это будет прекрасно.,,,,,
"L """"",L_6c9570e6,(Я... Они скоро проткнут меня! М-мое голова... Ч-что происходит?),,,,,
"L """"",L_6602a90a,(М-м-м-м-мг! Н-нет...),,,,,
"S1 """"",S1_777e0709,Что? Заметила все же...,,,,,
"L """"",L_9b1461ce,(ХА-А-А-А! МММм... Ч-что ты делаешь со мной?),,,,,
"L """"",L_d69969f7,"(Аххх... Я не понимаю... Почему я ощущаю все так сильно? Ч-что со мной, м-ммммг...)",,,,,
"S1 """"",S1_223b3426,Мне так нравится за всем этим наблюдать. Я бы сделала тебя своей рабыней и заставила кончать целыми днями...,,,,,
"""""",narrator_4522bd1e,"Лиззару потрясали неконтролируемые вспышки удовольствия и что-то еще, что пока не доходило до нее. Она все больше ощущала тепло в киске, распространившееся по всему низу живота.",,,,,
"L """"",L_9266b4ae,(П-почему так... моя голова... все как в тумане.),,,,,
"""""",narrator_0224f251,"Тепло становилось все горячее, от чего протосс громко стонала. Она пыталась понять, что вызывало у нее такие усиленные чувства, но терялась в догадках. Лиззара могла только получать удовольствие от процесса.",,,,,
"L """"",L_2b9ec655,(Н-НЕТ! АХ...),,,,,
"""""",narrator_f5088505,"Протосс перестала слышать собственный голос в голове. Что-то болезненно звенело в ушах, а тело невыносимо горело и пульсировало. Каждое прикосновение отдавалось по всему телу, еще больше туманя разум.",,,,,
"L """"",L_351ef4b4,(П-почему я... Не могу дышать? Моя кожа... Ее как будто что-то сдавливает!),,,,,
"""""",narrator_50b379d5,"Лиззара хотела кричать, но могла только открывать рот, словно рыба на суше, и умоляюще смотреть на Королеву Клинков.",,,,,
"L """"",L_e66bb3e0,(А-а-ах! Т-ты хочешь... меня убить?),,,,,
"S1 """"",S1_78efb844,"Ха-ха, нет... Ты, наверное, совсем не понимаешь, что с тобой происходит? Почему твое тело начинает так гореть? И в голове все звенит?",,,,,
"L """"",L_90a66001,(Ч-что это за чувство...),,,,,
