location,source,target,ID,fuzzy,context,translator_comments,developer_comments
"S1 """"",S1_43c48ba7,"Он как раз под стать тебе... Сразу видно, что его делали для пошлых делишек, хи-хи.",S1_43c48ba7,,,,
"L """"",L_1de0fbe1,(М-м... М-м-мг...),L_1de0fbe1,,,,
"""""",narrator_d1ab8ae3,"Лиззара слышала все, что говорила ей Королева Клинков, но она не могла ответить, потому что ее тело все еще было поглощено удовольствием. Волны продолжали накатывать, а новые чувства сводить с ума.",narrator_d1ab8ae3,,,,
"S1 """"",S1_9bc3ddeb,"Мы с тобой настоящая команда. Я же говорила, что у тебя все получится, ни разу не сомневалась в тебе. Ты, конечно, его не видишь, но он, такой... развратный, ха-ха-ха!",S1_9bc3ddeb,,,,
"L """"",L_ef3c6e66,(Аахх...),L_ef3c6e66,,,,
"""""",narrator_ea4c5729,"Девушка еле-еле понимала, что происходит. Но знала наверняка: у нее теперь есть новая дырочка, да и не обычная, а полноценный половой орган.",narrator_ea4c5729,,,,
"S1 """"",S1_6c6b7c41,"Какой же развратной нужно быть, чтобы потерять голову во время своего анального просветления, а ведь мы еще даже ничего в него не засунули...",S1_6c6b7c41,,,,
"L """"",L_f9520efc,"М-м-мг, Я-я... не могу... ничего... поделать с этим, ха-а-а...",L_f9520efc,,,,
"S1 """"",S1_a1fdf597,"Знаешь, он прямо был создан для тебя! Он так хорошо сочетается с твоей киской... Твой анус такой милый и развратный одновременно, что в него однозначно хочется что-то запихнуть, хи-хи.",S1_a1fdf597,,,,
"L """"",L_dcf82a9a,(Н-не-е-ет!),L_dcf82a9a,,,,
"L """"",L_68200e75,"(Не нужно... В него ничего запихивать, ах.)",L_68200e75,,,,
"S1 """"",S1_e2479da8,"Хочешь первой что-то в него засунуть? Верно. Мммм, я не могу забрать у тебя эту привилегию!",S1_e2479da8,,,,
"L """"",L_0b312abc,(Аххх... н-не говори так... я-я...),L_0b312abc,,,,
"S1 """"",S1_dda68a53,"Черт, к-кажется... я потратила слишком много сил...",S1_dda68a53,,,,
"L """"",L_c39c19b0,(С-сара... Я чувствую ее! Она борется...),L_c39c19b0,,,,
"S1 """"",S1_700740e9,"Видимо, на это уходит слишком много сил... Но, думаю, мы сегодня достаточно повеселились. Мы еще с тобой увидимся. А пока у тебя будет время освоиться и привыкнуть к своей новой дырочке...",S1_700740e9,,,,
"""""",narrator_d2e11ec3,"В этот раз Королева Клинков не стала сопротивляться, она просто дожидалась, пока Сара возьмет вверх. Даже в последний миг, она с улыбкой продолжала смотреть на плоды своих трудов.",narrator_d2e11ec3,,,,
