location,source,target,ID,fuzzy,context,translator_comments,developer_comments
"SO """"",SO_13e1e4a7,Хозяйка! Ты его разозлила! Очень разозлила! В этом состоянии он КРАЙНЕ ОПАСЕН!,,,,,
"SO """"",SO_e887e6d6,Нужно бежать... БЕЖАТЬ!,,,,,
"SO """"",SO_39cdfd38,"Хотя... Сможем ли мы убежать? Хозяйка, пожалуйста, потрогайте мой член, тогда я смогу умереть спокойным!",,,,,
"S """"",S_9c756088,Заткнись... Я не собираюсь здесь умирать.,,,,,
"U """"",U_26967d39,"Убью... растопчу, мокрого места не оставлю, буду продолжать убивать, пока не утолю жажду крови!",,,,,
"U """"",U_b26411f4,ЧТОБЫ КАКАЯ-ТО БУКАШКА СМЕЛА МЕШАТЬ МНЕ?! УНИЧТОЖУ!,,,,,
"U """"",U_1c59971a,"{size=+8}Убью... Сотру в порошок! В кровавую лужу! БУДУ ТОПТАТЬ, ПОКА ТЫ НЕ ИЗДАШЬ ПОСЛЕДНИЙ ВЗДОХ!!! МЕЛКАЯ БУКАШКА, КОТОРАЯ МЕШАЕТСЯ НА МОЕМ ПУТИ!!!{/size}",,,,,
"U """"",U_705fc4c7,{size=+12}Уничтожу! Уничтожу!!! УНИЧТОЖУ!!!{/size},,,,,
"S """"",S_df32756b,(Он весьма здоровый... с ним разобраться так просто не получится... Он на совершенно другом уровне.),,,,,
"S """"",S_a1c36709,(Смогу ли я остановить его?),,,,,
"S """"",S_cab4598d,"(Я определенно стала сильнее, но достаточно ли?)",,,,,
"""""",narrator_9818c059,"Некоторые вопросы прямо въелись в сознание Сары и проигрывались постоянно. Да, она немного сомневалась, но это лишь из-за того, что изменилась. Она не знала, на что еще может быть способна.",,,,,
"S """"",S_55cce1e8,У меня еще не было возможности это проверить...,,,,,
"S """"",S_703d35a2,"Хех, это же прекрасная возможность узнать! Неужели это не есть прекрасный момент!",,,,,
"S """"",S_42a2938f,"Когда твое тело находится на волоске от смерти, когда ничего вокруг не важно, кроме одного момента. И единственное желание, которое звучит внутри меня, это...",,,,,
"S """"",S_02e748d1,Выжить!,,,,,
"""""",narrator_3a185bf3,"От одной мысли мурашки прошлись по всей коже, заставляя ее еще сильнее жаждать битвы.",,,,,
"""""",narrator_08883573,"Со стороны наблюдающие лидеры не понимали, почему девушка стоит на месте и усмехается. Сара не сдвинулась с места, сохраняя сохраняя свое положение, повергая остальных лидеров в шок.",,,,,
"H """"",H_a56ff745,Она улыбается? Она точно поехавшая!,,,,,
"M """"",M_b80394f4,"А как же твое желание, посмотреть на битву?",,,,,
"H """"",H_a3889153,"Я говорил про драки, где у обоих сторон есть шансы на победу, а не избиение. Она уже мертвец!",,,,,
"M """"",M_f42a0787,"(Хм... да, я тоже так думаю... Но с ней явно что-то не так, она не такая, как все другие. Что же это за чувство, почему я не верю в ее поражение? Возможно, мои инстинкты подводят меня?)",,,,,
"""""",narrator_e74da2b8,"Девушка только сильнее растянула губы в улыбке, чувствуя покалывания в кончиках пальцев от предвкушения битвы.",,,,,
"U """"",U_39ea13aa,"УБЬЮ, РАСТОПЧУ, ПЕРЕЛОМАЮ КАЖДУЮ ТВОЮ КОСТОЧКУ, БУДУ ИХ ЛОМАТЬ, ПОКА НЕ ПЕРЕСТАНУТ ХРУСТЕТЬ, А КОГДА ПЕРЕСТАНУТ, БУДУ ИХ ПЕРЕМАЛЫВАТЬ В ПЕСОК!",,,,,
"""""",narrator_4a818ed9,"С каждой секундой он становился все безумнее и безумней. Сара больше не видела перед собой разумное существо. Перед ней стояла машина для убийств, которая пылала адским гневом. Все мышцы на теле ультралиска были напряжены до предела.",,,,,
"U """"",U_5f1ca918,"{size=+8}Я убью сначала тебя, а потом разнесу все это место!!!{/size}",,,,,
"""""",narrator_6541b347,"Ультралиск издал зверский рык, с огромной скоростью срываясь с места, полностью противореча своим огромной массе.",,,,,
"S """"",S_700d65b8,!!!,,,,,
"S """"",S_6925df37,"(Ого, как быстро! Подумать только, такой огромный и такой проворный! Видимо, он игрался с осквернителем, не показывая свою истинную мощь.)",,,,,
"S """"",S_61034256,"(Но так даже интересней, у меня будет всего один шанс.)",,,,,
"""""",narrator_d1ab2bfd,"Девушка приняла устойчивую позу, поднимая свою руку, начиная еще сильнее концентрироваться.",,,,,
"H """"",H_4cae52cd,Он же снова будет всю неделю крушить без остановки!,,,,,
"M """"",M_eae4b969,(А его жажду убивать не унять!),,,,,
"M """"",M_a5b724c5,"(Он сначала прикончит ее, а потом и возьмется за всех нас... В прошлый раз нам всем чудом удалось уцелеть! Потери были колоссальные...)",,,,,
"M """"",M_f25068e2,(Но даже тогда он не был настолько свирепым!),,,,,
"H """"",H_200f99b3,Что она делает? П-почему она не двигается? Он скоро настигнет ее и ей конец!,,,,,
"M """"",M_77130fb4,(Что у нее в голове? Разве терраны такие безбашенные?),,,,,
"M """"",M_fb109027,"(Нет... Точно нет! Мне встречались множество терранов. Они не такие, они бегут при первой же возможности! Без своих металлических панцирей и когтей они не в силах собладать с обычным зерглингом...)",,,,,
"M """"",M_dcc272d7,(Тогда почему она продолжает стоять? Почему не убегает? Она приняла свою погибель? Или она оцепенела от страха? Это вполне вероятно...),,,,,
"M """"",M_dc64c6c4,"(Определенно страх! Такой маленький человек точно проникнется чистейшим ужасом перед агрессивным ультралиском. Вся ее жизнь сейчас проходит у нее перед глазами... Да, у нее нет ни малейшего шанса.)",,,,,
"SO """"",SO_49154df5,"Хозяйка, мы умрем! Он мчится прямо на нас, он раздавит нас и даже не заметит! А ты все еще не потрогала даже один мой член!!!",,,,,
"SO """"",SO_1addb49f,Я не хочу так умирать! Если ты так его потрогаешь... я смогу...,,,,,
"S """"",S_44072f35,"Заткнись! Если так боишься за свою жалкую жизнь, то беги!",,,,,
"SO """"",SO_fd4c11a5,"Я... Я не могу бросить тебя тут, хозяйка!",,,,,
"SO """"",SO_d217925e,"Если я его одолею, то хозяйка обязательно потрогает мои члены! Хе-хи-хо!",,,,,
"S """"",S_052f73a2,(Ты хочешь одолеть его?),,,,,
"S """"",S_1974c06a_1,(...),,,,,
"S """"",S_b8df99fa,(Какой же он дурак...),,,,,
"S """"",S_93070138,Я не держу тебя.,,,,,
"SO """"",SO_e449ac65,"Нет, я принял решение! Я одолею его! Мои члены будут потроганы! Готовь свои гладкие ладошки!",,,,,
"S """"",S_1847a1ef,(Точно придурок...),,,,,
"S """"",S_620fd859,"(Отлично, если я его одолею, то остальные определенно выслушают меня!",,,,,
"S """"",S_2c77d3e2,(Осталось только одолеть...),,,,,
"S """"",S_e402066b,"(Хах, легче легкого! Я не собираюсь так умирать!)",,,,,
"""""",narrator_ded81ce0,"Вокруг Сары продолжала накапливаться ее сила. Напряжение могли чувствовать все присутствующие, наблюдая за событиями с замиранием духа.",,,,,
"SO """"",SO_e358a351,ТЫ НЕ ПРОЙДЕШЬ!!!,,,,,
"intro """"",intro_376aa141,,,,,,
"""""",narrator_f20207d0,"Сара направила свою силу на ультралиска, заставив того почувствовать на себе всю ее мощь. Его тело стало очень тяжелым, он моментально замер на месте без возможности пошевелиться. Огромная туша просто замерла на пути к Саре.",,,,,
"U """"",U_ddc52d78,Ч-ЧТО-О-О-О???,,,,,
"U """"",U_cee5f92f,Что за уловки?,,,,,
"U """"",U_c4c35b2a,Почему я не могу пошевелиться?!,,,,,
"U """"",U_24166571,"КАК ТЫ ЭТО СДЕЛАЛА, МАЛЯВКА?! ЭТО ТЕБЕ ВСЕ РАВНО НЕ ПОМОЖЕТ!",,,,,
"""""",narrator_50fa3e0e,"Взгляды всех были сосредоточены на ультралиске, который прилагал все свои силы, но все равно не мог сдвинуться с места.",,,,,
"M """"",M_981a85f0,(Ч-что??? ОНА ЕГО...???),,,,,
"""""",narrator_69f18a96,Увиденное муталиском заставило ее еще больше оживиться.,,,,,
"Ze """"",Ze_cdd137eb,"Почему он остановился? Раньше такого не было? Он же не мог просто так успокоиться??? Нет, его глаза до сих пор пылают!",,,,,
"M """"",M_6387e950,(Она... Что?! Он поддался ей? Что тут вообще происходит? Или она... Кто она вообще?!,,,,,
"M """"",M_4f9e2eec,"Расступитесь, не мешайте!",,,,,
"H """"",H_8d815ad9,"А ты чего так оживилась? Тебе всегда не было дел до драк, почему ты так с любопытством наблюдаешь? Может, ты нам хочешь что-то рассказать???",,,,,
"M """"",M_40ba2a81,"Я так и думала, что вы ничего не заметите.",,,,,
"H """"",H_536bc775,Ты снова ставишь себя выше нас?,,,,,
"G """"",G_d1fb4665,"Сейчас не время для разборок. Она права, этот терран не такой, как все из ее вида, она совершенно иная, ничего такого я прежде не видел!",,,,,
"M """"",M_5ec53778,"Хехе, это не ультралиск замер, а она смогла остановить его.",,,,,
"Ze """"",Ze_1b97ca6e,Что??? Да быть такого не может.,,,,,
"Ze """"",Ze_56102db7,Как вообще такое возможно? Эта девчонка остановила его?!,,,,,
"""""",narrator_f1236623,"На удивление для Сары это оказалось куда проще, ей даже не приходилось прилагать силу как следует, чтобы сдержать здоровяка.",,,,,
"""""",narrator_c6f5dbeb,"На ее лице появилась довольная улыбка. То, что она стала сильнее, пьянило ее и она была этим довольна. Она всегда хотела получить силу, с помощью которой сможет отомстить и вернуть все то, что у нее забрал Менгск.",,,,,
"""""",narrator_b82717ef,"И вот ее сила возросла, все ее труды не пошли насмарку. И теперь, когда она понимала, что может стать еще сильнее, в голове стали звучать слова Владычицы о ‘еще большей силе с помощью эссенции', а на лице появлялась улыбка, которую она была не в силах утаить.",,,,,
"""""",narrator_b3c5bea7,"Она была опьянена силой, которую получила, силой, с помощью которой сможет отомстить и вернуть себе все то, что у нее забрал Менгск. Мысли, что все ее труды не пошли коту под хвост, и то, что она может стать еще сильнее, приносили ей блаженство.",,,,,
"""""",narrator_3318fc43,"Слова Владычицы 'ты можешь стать еще сильнее, собрав эссенцию' стали прокручиваться в голове все чаще, ей было просто невероятно интересно, какую силу она может обрести.",,,,,
"""""",narrator_ed1c1052,"На лице появлялась еще довольней улыбка, которая выбила ее из времени, заставив забыть обо всем, что происходит сейчас. Даже если бы она хотела, у нее бы не получилось ее спрятать.",,,,,
"S """"",S_eb9ba9a7,"(Эта сила... Невероятна! Это именно то, что я хотела! С этими возможностями я могу отомстить... И не только! Я могу так много с этими возможностями! Да!!!)",,,,,
"S """"",S_2fa4ecc1,(Но эссенция... Она даст мне еще больше силы! Никакой Менгск больше не станет на моем пути!),,,,,
"""""",narrator_dca243c0,"Девушка уже не замечала все напряжение, которое ощущала из-за сдерживания ультралиска. По всему ее телу разливалось пьянящее удовольствие от ощущаемой мощи. Она безумно улыбалась, не имея возможности сдерживать свои чувства.",,,,,
"S """"",S_82377f96,"(Я хочу отдать ему должное, он силен... Это еще не конец нашего представления!)",,,,,
"SO """"",SO_b442244c,Остановился... ОСТАНОВИЛСЯ!,,,,,
"SO """"",SO_9d6db7a0,"Н-неужели я остановил его??? ТОЧНО, ЭТО Я!",,,,,
"SO """"",SO_2bc81e9a,"Мы будем жить! Мы не умрем! И хозяйка сможет потрогать мои члены, хе-хи-хи! ЭТО БУДЕТ ВОЗМОЖНО!",,,,,
"S """"",S_614922a0_2,...,,,,,
"S """"",S_6392738c,"Ты неисправим, Сосш.",,,,,
"""""",narrator_af80f907,"В такой эйфории даже назойливые шутки от Сошса Саре не доставили дискомфорта и даже не казались такими абсурдными или неуместными, и она просто продолжала со все той же улыбкой на лице непоколебимо стоять.",,,,,
"S """"",S_f447ed0b,"Ну что, ультралиск, теперь ты готов меня выслушать? Этого достаточно?!",,,,,
"U """"",U_e3bfe70f,"УБИТЬ!!! УБИВАТЬ! КРОШИТЬ! РАЗРУШАТЬ, ВОТ ДЛЯ ЧЕГО Я БЫЛ СОЗДАН!",,,,,
"U """"",U_75635dc2,"Я УБЬЮ ТЕБЯ, ДАЖЕ ЕСЛИ МНЕ ПРИДЕТСЯ САМОМУ ПОПРОЩАТЬСЯ С ЖИЗНЬЮ!!!",,,,,
"U """"",U_570ee940,"ДАЖЕ ЕСЛИ НЕ СМОГУ ДВИГАТЬСЯ, Я БУДУ ПРОДОЛЖАТЬ УБИВАТЬ!",,,,,
"U """"",U_c89ab58a,"ДВИГАЙСЯ! ДАЖЕ ЕСЛИ МОЕ ТЕЛО МЕНЯ ПЕРЕСТАНЕТ СЛУШАТЬСЯ, Я НЕ МОГУ ОСТАНОВИТЬСЯ! Я СИЛЬНЕЙШИЙ, НИКТО НЕ МОЖЕТ ОСТАНОВИТЬ МЕНЯ, УБЬЮ!!!",,,,,
"U """"",U_a7627c0f,УБИТЬ! УНИЧТОЖИТЬ! РАСТОПТАТЬ!!!,,,,,
"S """"",S_df3992a8,Бесполезно... Он ничего не слышит.,,,,,
"H """"",H_aa39affa,"Эй, ты куда летишь, там же опасно! Жить надоело?",,,,,
"M """"",M_ff08539e,"Послушай, тебе его так просто не одолеть. В этом состоянии ультралиск никого не слышит и ничего не понимает, только поддается гневу. Это будет длиться, пока он не выпустит всю злость, которая в нем накопилась.",,,,,
"S """"",S_b8b97c19,Ааа??? Говоришь на моем языке? Кто ты еще такая?,,,,,
"SO """"",SO_f430ebf1,"Да все верно, хозяйка, она говорит правду!",,,,,
"SO """"",SO_8ea053ce,В прошлый раз он разрушил все... И нам пришлось отстраивать! Он камня на камне не оставил!!! И все может повториться снова... Бедный-бедный Сосш! Столько работы...,,,,,
"SO """"",SO_24f223b7,Опять работать...,,,,,
"S """"",S_b6c05b93,"Хм... а что, если... нужно попробовать. У меня есть одна идея, а с тобой мы разберемся позже.",,,,,
"""""",narrator_9249b9ee,"Сара закрыла глаза, пытаясь быстро импровизировать по ситуации. Она до конца не понимала, получится ли что-то из этого или нет, но стоит попробовать. Окружающие также были в недоумении от происходящего, но в этот раз стали наблюдать с большим интересном.",,,,,
"""""",narrator_6b1505fd,"У зрителей появилось все больше вопросов. Кто она такая, откуда взялась, что здесь делает и, конечно же, почему? И на каждый из них было все сложнее найти логичный ответ.",,,,,
"Ze """"",Ze_6d741000,Неужели она действительно сможет справиться с ним?,,,,,
"H """"",H_4de88324,"Не смеши меня. Ну и остановила и че толку? Он все равно безумен. Говорил, нужно было объединиться и разобраться с ним.",,,,,
"G """"",G_7b43d5bd,"У нас нет шансов, даже если мы все набросимся на него. Он один доставит кучу проблем, а что будет с его стаей? Ты подумал об этом? Мы понесем колоссальные потери в битве с ним одним, а что ты будешь делать с остальными?",,,,,
"G """"",G_106fb371,"Сотни обезумевших ультралисков, которые только и хотят крушить. Только ему по силам сдерживать и направлять их гнев.",,,,,
"H """"",H_4a215b9b,"Тсс... ты как всегда слишком много думаешь, не попробуем - не узнаем!",,,,,
"Ze """"",Ze_64c5e53a,"Поддерживаю, нужно было уже давно с ним разобраться!",,,,,
"H """"",H_4b174cd3,"Эй ты, зачем ты решила помогать этому террану? Помогать кому-то на тебя не похоже.",,,,,
"M """"",M_f2ebc204,"Это была лишь мимолетная слабость, ничего большего.",,,,,
"Ze """"",Ze_83eabaeb,"Без разницы, я все равно уверен, что он рано или поздно вырвется и уничтожит ее. И нам нужно готовиться к схватке с ним. Ну остановила она его и что? Он все равно безумен!",,,,,
"M """"",M_347519ff,"Тебе нужно чаще пользоваться мозгами. Раньше его даже так никто остановить не мог, а она это сделала, не двинув пальцем.",,,,,
"H """"",H_c01d8f09,"Чем дольше она его держит, тем больше он будет крушить!",,,,,
"G """"",G_06970f95,"Он прав, его безумству нет предела, он становится только сильнее.",,,,,
"U """"",U_5af3ce3c,УБИВАТЬ!!!,,,,,
"""""",narrator_47fc1a92,"Все ждали продолжения, пытаясь понять, что у нее на уме. Но девушка просто смиренно стояла, полностью погрузившись в свои размышления. Вопросов с обеих сторон становилось только больше.",,,,,
"S """"",S_3c21e315,(Я должна взять его под контроль... Нужно избавиться от ярости...),,,,,
"""""",narrator_eb037116,"Идея была неплохая, но реализовать ее было куда сложнее. Ей нужно было не только попытаться войти в его сознание, но и, конечно же, сдерживать его, ведь он все не бросал попыток освободиться. Даже наоборот, стал еще более яростно сопротивляться.",,,,,
"""""",narrator_6309dd1b,"Он хотел убивать, он хотел крушить, он хотел уничтожать. Он хотел сеять ХАОС!",,,,,
"S """"",S_1c5521fa,"(Он не так прост как я думала... Он не только силен, но и ментально защищен! Я только чувствовала желание творить хаос, будто сама этого хотела! Вот это барьер... Ну что же, придется немного приструнить его, ведь любую защиту можно сломать!)",,,,,
"""""",narrator_565c491d,"Напряжение возрастало, Сара высвободила еще больше силы и давление на ультралиска возросло. Его тело стало еще тяжелей, настолько тяжелым, что его еще сильнее начало придавливать к земле Казалось, будто он преклонил колени перед Сарой.",,,,,
"""""",narrator_ce873a70,"Сара продолжала давить на великана телекинезом, было сложно представить, что он сейчас ощущает. Это будто огромная скала весом сотни тысяч тонн давит на тебя, заставляя припасть к земле, стискивая зубы. Но даже так ультралиск до последнего боролся, пытался остаться на ногах, он не хотел проигрывать, он не мог проиграть. Казалось бы, откуда только сопротивления, откуда столько ненависти, откуда столько злости? Поражение для него было равносильно смерти, он боролся до конца своей жизни.",,,,,
"S """"",S_4c967c9d,"Не сопротивляйся, малыш, так быстрее покончим с этим.",,,,,
