location,source,target,ID,fuzzy,context,translator_comments,developer_comments
"""%%""",narrator_03504faf,"Королева Клинков медленно вошла в тронный зал, следуя за Стуковым.",,,,,
"A ""%%""",A_42f384d9,"Может быть, ты поторопишься?",,,,,
"""%%""",narrator_b1d7e9bd,"Девушка брезгливо осмотрела его, демонстрируя все свое пренебрежение.",,,,,
"S1 ""%%""",S1_f7ea6b08,"Как ты не понимаешь... Я хочу выжечь это событие на подкорке своего сознания. Запомнить все мельчайшие детали этого дня. Прокручивать их каждый раз, упиваясь моментом, когда я заняла свое истинное место.",,,,,
"S1 ""%%""",S1_bde3b4df,Но тебе этого не понять.,,,,,
"""%%""",narrator_be96f1fd,"Королева Клинков отмахнулась от него, проходя вперед и опережая.",,,,,
"S1 ""%%""",S1_b9a3c8a7,"Ты всего лишь пешка, которая никогда не познает истинную силу. А даже если познаешь, она сведет тебя с ума быстрее, чем ты сможешь подумать о голой женщине.",,,,,
"S1 ""%%""",S1_0829bf39,"Ты даже не представляешь, насколько слаб и жалок. Если бы не возможность пользоваться тобой, я бы без сожалений стерла тебя в порошок и забыла бы об этом.",,,,,
"S1 ""%%""",S1_eef219b5,"Но сейчас я не хочу думать о чем-то таком, как ты. Меня интересует рыба покрупнее, хи-хи.",,,,,
"""%%""",narrator_15361b75,"Девушка четко знала цель своего визита. Она не сомневалась в своих способностях, но ей все еще хотелось проверить, насколько долго продержится Владычица перед ней.",,,,,
"""%%""",narrator_00f1e567,"Королева Клинков предстала прямо перед Владычицей, демонстрируя все свое великолепие.",,,,,
"S1 ""%%""",S1_ed9f6893,"Неплохое местечко ты себе выбрала. Хм, я могла бы даже оставить его в первозданном виде для себя... Но нет, не хочу опускаться до твоего уровня.",,,,,
"""%%""",narrator_9f3219c6,"Владычица вышла из тени, возвышаясь над девушкой.",,,,,
"Q ""%%""",Q_d0d84f09,"Хах, я ожидала, что скоро ты решишь навестить меня. Но ты продолжаешь удивлять меня своими изменениями каждый раз, когда я вижу тебя.",,,,,
"""%%""",narrator_9b2a9638,"Владычица осмотрела ее со всех сторон, не скрывая своего восторга в глазах.",,,,,
"Q ""%%""",Q_cc165f49,"Твоя новая форма... Восхитительна! Крепкое тело и новые возможности. Ах, хотела бы я снова пережить тот момент, когда ты чувствуешь свою новую силу.",,,,,
"Q ""%%""",Q_322f8d53,"Это превращение сделала тебя еще сексуальнее... Кто бы мог подумать, что ты станешь такой сильной.",,,,,
"Q ""%%""",Q_31870112,"ОН точно будет рад такому повороту. Я буду рада, да, черт возьми, все будут рады этому! А еще я буду больше рада, что мы его не разочаруем, ведь он верил в тебя.",,,,,
"S1 ""%%""",S1_389c8c7d,А ведь для умной особи тебе бы следовало просчитать все варианты исхода события... Неужели я тебя переоценила? Полагаешься на чью-то веру? Чушь...,,,,,
"""%%""",narrator_d5b4a96d,"Королева Клинков посмотрела Владычице прямо в глаза, начиная закипать.",,,,,
"S1 ""%%""",S1_beb75d1e,"Хвалить меня? Я из без твоего никому не нужного мнения знаю, что я великолепна и сильна. Ты серьезно думаешь, что я должна быть благодарна хорошим словам от такой, как ты, в мою сторону?",,,,,
"S1 ""%%""",S1_f6d7775e,"Думаешь, что у тебя или того, кого ты так громко называешь ОН, хватит силенок управлять мной? Ха! Это просто смехотворно!",,,,,
"""%%""",narrator_ee000350,"Девушка начала движение в сторону Владычицы, внушая своей аурой опасение за ее целостность.",,,,,
"S1 ""%%""",S1_bc5e620c,"Посмотри на себя, а потом на меня. И пойми, какая ты ничтожная на моем фоне. Тебе просто повезло получить хоть немного власти только потому, что я готовилась занять положенное мне место. Но твоя минута славы окончена, я наконец на свободе.",,,,,
"S1 ""%%""",S1_1c6552a2,А ты...,,,,,
"S1 ""%%""",S1_98a97124,"Чтобы не горевать от ненадобности, можешь стать моим верным псом и доедать объедки.",,,,,
"S1 ""%%""",S1_3a6f9689,"А если не хочешь... У тебя никто не спрашивал, глупая псинка. Я заставлю. Даже если для этого мне придется убить тебя, а потом вернуть к жизни.",,,,,
"""%%""",narrator_02e3589c,"Королева Клинков хищно улыбнулась, уже представляя свою победу.",,,,,
"S1 ""%%""",S1_cc147078,"Я была рождена достигать всего, чего пожелаю. Поэтому просто смирись и закончим все малой кровью.",,,,,
"Q ""%%""",Q_3380629b,"Я понимаю тебя, хотя и надеялась, что мы пропустим этот прекрасный этап поучительного урока... С такой силой хочется править. И не просто править... а повелевать, управлять чем-то намного большим. Может быть, даже вселенной.",,,,,
"Q ""%%""",Q_eca5b468,"Но не заигрывайся и не пытайся проглотить больше, чем поместится в твоем маленьком желудке, даже если аппетит у тебя зверский.",,,,,
"""%%""",narrator_abdbfeb9,"Владычица развеяла всю нагнетающую ауру Королевы Клинков, как дымку.",,,,,
"Q ""%%""",Q_8b8128f5,"И я не осуждаю тебя за твое желание. Оно даже похвально в какой-то степени, потому что позволяет тебе стремиться к большему.",,,,,
"Q ""%%""",Q_5523b44a,"Но знай свое место. Тебя готовили не для того, чтобы править. ЕМУ может не понравиться этот побочный эффект твоего развития. Запомни, что покорный теленок всегда получает больше.",,,,,
"S1 ""%%""",S1_dc381174,"(Ха, слова того, кто всегда остается позади. То, что она получила какую-никакую власть – всего лишь печальная ошибка.)",,,,,
"Q ""%%""",Q_1abf6c39,"Но я не откажу себе в радости преподать тебе важный жизненный урок, ха-ха.",,,,,
"""%%""",narrator_c56dba18,"Королева Клинков почувствовала, как Владычица активировала свою пси-силу. У нее был шанс остановиться сейчас, на ее лице гуляла озорная улыбка. Девушка только и ждала шанса показать всем, что они даже не догадывались, с кем связались. И что все, абсолютно все они пожалеют, что сдерживали ее так долго.",,,,,
"S1 ""%%""",S1_082d782d,"(А начну я с таких жалких тараканов, как вы!)",,,,,
"""%%""",narrator_6c7e36b7,"Девушка чувствовала, что зерги были готовы появиться в любую минуту из любой щели. Они появлялись один за другим, собираясь в хаотичном порядке. Кто-то появлялся совсем рядом, кто-то таился в темной дали зала. Некоторые появлялись прямо в воздухе. Они не спешили нападать, собираясь в многочисленную армию.",,,,,
"S1 ""%%""",S1_9f163d05,"Рада, что ты позволяешь мне так поразвлечься. Если бы их было меньше, было бы не так весело. Но ты действительно думаешь, что этого достаточно?",,,,,
"Q ""%%""",Q_3f34b1e4,"Этого более чем достаточно, чтобы дать тебе понять, что ты не так сильна, как хочешь об этом думать.",,,,,
"S1 ""%%""",S1_7e805395,"Здесь только ты выдаешь желаемое за действительное. Я паду только в твоих влажных снах, которые ты будешь видеть, засыпая у моих ног.",,,,,
"A ""%%""",A_d0f5abdb,(А фантазия неплохая... Нужно запомнить.),,,,,
"""%%""",narrator_ccfe4be2,"С каждой стороны Королеву Клинков окружали сотни зерглингов, которые были готовы напасть в любой момент. Но девушка и сама была не против напасть. Осматривая эти толпы, Королева Клинков бурлила изнутри от жажды уничтожить каждое живое существо в этом зале. А на лице время от времени появлялась игривая улыбка, которую она пыталась сдерживать.",,,,,
"S1 ""%%""",S1_fcd16600,"(Мммм... Я уже вижу эти груды бесполезного мяса. Какая жалкая трата ресурсов, хах.)",,,,,
"S1 ""%%""",S1_bf1fcb51,(Но ведь это так мелочно... Переживать из-за этих биоотходов. Главное – веселье!),,,,,
"""%%""",narrator_fa5e4b32,"Королева Клинков сделала шаг к Владычице, ставя себя выше и тысячи зергов, и самой Владычицы. С ее лица не исчезало удовлетворенное выражение.",,,,,
"S1 ""%%""",S1_df9b1916,"Как хорошо, что мне не приходится выслушивать весь этот бред о 'У тебя есть шанс передумать и покаяться'. Люблю переходить к активным действиям.",,,,,
"Q ""%%""",Q_138a9b8c,"Ох, не волнуйся. Ты будешь достаточно активно двигаться, когда они овладеют тобой. Будет хоть что-то хорошее в этом дне.",,,,,
"S1 ""%%""",S1_2e9547d9,Эти жалкие подобие твоей недоармии? Не смеши меня еще больше. Что-то настолько мелкое не сможет остановить меня. Они не подходят даже на роль милого животного.,,,,,
"Q ""%%""",Q_f68d402f,"Ох, не будь столь категорична. Не ты ли говорила, что умное существо должно просчитать все варианты? Даже если их будут миллиарды, одного твоего поражения уже окажется достаточно, чтобы воспользоваться шансом сломить тебя.",,,,,
"S1 ""%%""",S1_6014897a,Ха-ха-ха. Не будь такой наивной...,,,,,
"S1 ""%%""",S1_6e0ae222,"Если такой шанс и существует, то в этом исходе точно нет тебя. Потому что среди нас есть только одна королева. И перед собой я ее не вижу.",,,,,
"""%%""",narrator_09e77e9c,"Владычица пыталась скрыть свое недовольство тем, что Королева Клинков ее сильно недооценивает. Но от зоркого глаза девушки ничего невозможно было скрыть. Она умело играла на эмоциях, подрывая веру Владычицы в саму себя.",,,,,
"S1 ""%%""",S1_2d79fa98,"(Это было даже легче, чем я думала...)",,,,,
"""%%""",narrator_9802ee09,"Но это было временное помешательство, которое не смогло сбить с толку Владычицу.",,,,,
"Q ""%%""",Q_92ccdc3c,Самоуверенные всегда получают по заслугам.,,,,,
"""%%""",narrator_04b165cc,"Владычица лишь слабо махнула рукой, обозначая начало битвы.",,,,,
"""%%""",narrator_2505cf78,"Королева Клинков даже глазом не моргнула, стирая в пыль первый десяток, который пытался напасть на нее толпой.",,,,,
"S1 ""%%""",S1_e91cba7e,"Для такого важного события могла вызвать кого-то и посильнее. Какой от них толк, Владычица? Ломаются, как ветки на молодом деревце...",,,,,
"Q ""%%""",Q_e398888a,"(Эта девчонка... Воспринимает все как забаву. Посмотрим, сколько еще продержится твой игривый настрой.)",,,,,
"""%%""",narrator_5cedea6f,"Постепенно на девушку стали нападать толпы все больше и больше. Это никак не сказывалось на усилиях, которые она прилагала к убийству этих слабых зерглингов. Но ей было интересно, когда же она перейдет тот рубеж, когда она почувствует хоть какую-то сложность в победе над армией Владычицы.",,,,,
"S1 ""%%""",S1_12623ed1,"Это серьезно все, чем ты мне грозилась? Вздор! Я не могу поверить, что это действительно все!",,,,,
"S1 ""%%""",S1_b7d8a88d,"Ты ведь просто шутишь, правда? Если нет, то это меня очень расстраивает!",,,,,
"""%%""",narrator_639f83ed,"Королева Клинков ощущала, как эта злоба и разочарование приятно накаляют ее тело, позволяя желать большего зрелища. Ее битва становилась все более кровавой, чтобы доказать всю серьезность своих намерений.",,,,,
"S1 ""%%""",S1_c497e8c3,"И это все твое пушечное мясо? У меня есть лишь одна армия, состоящая из меня одной. Но даже соединив все свои силы разом, тебе все еще не превзойти меня! НИКОГДА!",,,,,
"""%%""",narrator_bfff91e1,"Все возбуждение и желание, копившиеся в девушке за время ее заточения, вырывались наружу. Королева Клинков и все в тронном зале могли почувствовать едва уловимое ощущение силы, которая порывалась вырваться из девушки мощным потоком.",,,,,
"S1 ""%%""",S1_3c687d76,Чувствуешь это?,,,,,
"""%%""",narrator_73f1eb66,"Кровь врагов хлюпала под ногами Королевы Клинков, возбуждая ее тело приятными уху звуками.",,,,,
"S1 ""%%""",S1_2108d64a,"Каково это, взрастить собственную погибель? Разве это не обидно?",,,,,
"Q ""%%""",Q_55b30e47,Тц... От тебя слишком много шума.,,,,,
"""%%""",narrator_52af8b3c,"Владычица спокойно наблюдала, как Королева Клинков продолжала уничтожать новоприбывших зергов. Она чувствовала, что девушке еще есть, что показать, но она почему-то медлила.",,,,,
"""%%""",narrator_b7485663,"Но на место умерших приходило еще больше. Казалось, что им нет конца, они все прибывали и прибывали.",,,,,
"S1 ""%%""",S1_05117be7,"Может быть, для запуганного террана ты и представляла какую-то угрозу, но гордиться превосходством над слабым – не благородное занятие.",,,,,
"S1 ""%%""",S1_1b1b3cb6,"Давай! Продолжай призывать своих слуг, пока я буду кромсать их на мелкие кусочки! Чего мелочиться?",,,,,
"S1 ""%%""",S1_9b633d87,"Ты несомненно потешишь мое эго, если потратишь на меня все свои запасы сил! Особенно своих собственных.",,,,,
"""%%""",narrator_9448ea0c,"Девушка с садистским азартом вырывала клыки тех зерглингов, которым не повезло попасть ей под руку.",,,,,
"Q ""%%""",Q_f4ed416a,"Хах, тешить твое и так раздутое эго... Но я сегодня щедрая, так что можешь рассчитывать на то, что я тоже поучаствую в этом банкете плоти и крови.",,,,,
"S1 ""%%""",S1_ce0fdb0c,Ох! Какая честь! Особенно для меня. Конечно же нет!,,,,,
"""%%""",narrator_f0494dac,"Аппетит Королевы Клинков нарастал, заставляя убивать все больше и больше зергов без разбору. Девушка даже перестала добивать некоторых, оставляя полуживых особей под грудами своих мертвых собратьев.",,,,,
"S1 ""%%""",S1_cc8c84ba,"Только какая ирония, что то, как тебя зовут, всего лишь пустой звук, не имеющий за собой никакой власти!",,,,,
"""%%""",narrator_0b14b56b,"Девушка играла с огнем, прорубая себе путь к Владычице. Она насытилась кровью обычного скота на убой. Ей требовалось нечто больше. Что-то, на что она готова была потратить всю свою силу.",,,,,
"S1 ""%%""",S1_ce70df02,"Давай же! Сделай что-то, чтобы я поверила, что ты не просто жалкий червяк на моем пути!",,,,,
"S1 ""%%""",S1_d1b946f0,Усиль этот тупой мусор! Сделай эту битву хоть немного зрелищней! Простые горы трупов и реки крови уже не впечатляют мой развращенный ум...,,,,,
"Q ""%%""",Q_287ced35,"Пытаешься показаться зверем, но мне достаточно опыта увидеть, что ты просто щенок. Очень громко лаешь, но зубы слабы укусить.",,,,,
"S1 ""%%""",S1_e809017d,Ха-ха-ха! Так покажи мне силу! Укуси! Перегрызи мне горло! Накажи!,,,,,
"S1 ""%%""",S1_d0ff3746,"Или ты выше этого? Не кидаешься на всяких дворняжек? Ха-ха, черт, это так смешно.",,,,,
"Q ""%%""",Q_d4e0320c,Что она...,,,,,
"S1 ""%%""",S1_16dffe11,"Потому что пока ты медлишь, я вгрызусь в твою прекрасную шею и вырву твой позвоночник, как трофей!",,,,,
"""%%""",narrator_a7b63ae4,"Королева Клинков от души расхохоталась, когда почувствовала, что время пришло. Сила была готова вырваться наружу.",,,,,
"S1 ""%%""",S1_d2757dff,Шутки в сторону...,,,,,
"S1 ""%%""",S1_dcde60d8,"Ха! Ха! Ха! Время настоящего веселья, Владычица. Почувствуй вкус своей погибели!!!",,,,,
"""%%""",narrator_351f9c63,"Присутствие девушки ощущалось в любом уголке тронного зала. Ее жажда крови и власти давила на головы все присутствующим, подавляя их силу и концентрацию. Королева Клинков упивалась этой болью и страхом перед ней, потому что она сама ощущала весь ужас собственной силы.",,,,,
"""%%""",narrator_75987739,"Ее можно было не только почувствовать, но и увидеть. Владычица давно не имела дела ни с чем настолько же завораживающим, как и пугающим.",,,,,
"S1 ""%%""",S1_99462adb,"Теперь-то ты сможешь побороться за место под светом, но только на том свете! Или станешь очередным кормом таким же псам, как и ты... Какая незадача, что в аду выживает сильнейший.",,,,,
"Q ""%%""",Q_9f4e1732,Тебе бы тоже не помешало навестить родину.,,,,,
"A ""%%""",A_2f1627fc,(Это все только набирает обороты...),,,,,
"""%%""",narrator_9664fee4,"Стуков незаметно отходил на безопасное расстояние, желая остаться в живых после этой бурной дискуссии.",,,,,
"A ""%%""",A_4635ae51,"Вот черт... кажется, мне не стоит тут находиться...",,,,,
"A ""%%""",A_0227a3c2,(Это переходит все разумные границы... Они ведь в своем безумии зацепят и даже не заметят.),,,,,
"A ""%%""",A_7d24afbb,"(А лучше вообще исчезнуть отсюда, и желательно как можно быстрее. Новая форма Сары, кажется, совершенно сошла с ума. Ее неутолимая жажда крови может закончиться очень плохими последствиями.)",,,,,
"A ""%%""",A_2e83b50d,"(А я только подумал, что нашел отличное место...)",,,,,
"Q ""%%""",Q_d236563c,"(Все удастся не так легко и быстро, как мне бы того хотелось.)",,,,,
"Q ""%%""",Q_5d805bf4,"(Шансы все еще велики, но это форма... действительно очень сильна. Это глупо отрицать. Мне придется выложиться на полную. Но выживет ли она? Нет времени думать о таком, потому что на кону и моя жизнь.)",,,,,
"Q ""%%""",Q_a58cf65d,"(Но и я не вчера родилась... Мы еще посмотрим, кто у кого будет на коротком поводке!)",,,,,
"S1 ""%%""",S1_5fed702e,Следи за языком! Здесь я отвечаю за колкие фразочки.,,,,,
