location,source,target,ID,fuzzy,context,translator_comments,developer_comments
"S ""%%""",S_999bd62b,(Это меня и пугает...),,,,,
"Q ""%%""",Q_60e93bc7,"А теперь иди и заполучи эту силу, чего бы тебе это ни стоило. Я уже с нетерпением ожидаю увидеть тебя снова.",,,,,
"S ""%%""",S_884b7790,"(Сейчас не время сомневаться... Я не дам ей заполучить меня. Это я заполучу ее в свое пользование. Мы еще посмотрим, кто по итогу останется королевой.)",,,,,
"A ""%%""",A_280e9c18,"Ты не представляешь, как я рад снова тебя видеть, Сара. Как будто не видел твое голое тело вечность... Пойдем.",,,,,
"S ""%%""",S_860bf13a,"Мне еще нужно подумать, насколько сильно я соскучилась по тебе, Стуков... Веди.",,,,,
