location,source,target,ID,fuzzy,context,translator_comments,developer_comments
"SO """"",SO_bbc675d7,Все готово... Лидеры в сборе.,,,,,
"S """"",S_300727a2,Отлично. Иди... Я подойду позже.,,,,,
"""""",narrator_918b9db4,"Сара находилась недалеко от места, в котором должны были собраться все лидеры по ее приказу, но оттуда раздавались странные звуки.",,,,,
"U """"",U_c5eab20e,ГА-А-А-А-А!,,,,,
"Os """"",Os_7c91d0ed,Ме-е-дленно!,,,,,
"S """"",S_e2742005,!!!,,,,,
"S """"",S_d3c4572c,З-землетрясение???,,,,,
"""""",narrator_918b9db4_1,"Сара находилась недалеко от места, в котором должны были собраться все лидеры по ее приказу, но оттуда раздавались странные звуки.",,,,,
"S """"",S_3c2a4c6c,"Это определенно исходит оттуда, неужели это они?",,,,,
"Os """"",Os_232797af,Что ты можешь мне сде-елать? Снова попробуешь раздавить?!,,,,,
"U """"",U_dbeac97a,Именно это я и сделаю! Как ты вообще посмел сюда явиться?!,,,,,
"U """"",U_12b89cef,Сколько раз я тебе говорил? Тебе здесь не место!,,,,,
"U """"",U_480af677,РАЗДАВЛЮ!!!,,,,,
"""""",narrator_5d0d2701,"Здоровенного вида существо снова попыталось нанести сокрушительный удар, из-за которого сотрясались не только стены.",,,,,
"S """"",S_b3d72936,(Так вот что это было...),,,,,
"S """"",S_1974c06a,(...),,,,,
"""""",narrator_3aef211f,"Сара с недоумением смотрела на бардак, который тут творился. Она ожидала чего угодно, но точно не этого.",,,,,
"Os """"",Os_f109abd5,"Позвали все-ех. Может, я и сам не хочу быть рядом с таким болваном, но я вынужден.",,,,,
"U """"",U_9dfcff05,Я могу помочь тебе больше никогда меня не видеть... Я тебя раздавлю!,,,,,
"""""",narrator_04ab023d,"Ультралиск создавал оглушающий грохот, пытаясь задавить проворного осквернителя.",,,,,
"Os """"",Os_627e2964,Ничего большего от тебя ожидать и не сто-о-оило!,,,,,
"U """"",U_2d1e8b9b,Давно пора было задавить такое мерзкое существо! Убью!,,,,,
"S """"",S_2d17e463,(Куда я попала...),,,,,
"S """"",S_717aa0cc,(Они могли хотя бы сейчас сдерживать себя?),,,,,
"""""",narrator_ce73d6d3,"Помимо драки Сара заметила еще нескольких существ, которые находились чуть в стороне от драки, внимательно наблюдая за происходящим.",,,,,
"""""",narrator_c81c33a6,"Одним из них было существо с крыльями, напоминающее муталисков, второе было более знакомым Саре. Она уже не раз сталкивалась с гидралисками, но этот был другой, от него исходила куда более зловещая аура.",,,,,
"M """"",M_decb41e8,"Мда... Что-то меняется, а что-то останется вечным. Может, не стоило приходить?",,,,,
"H """"",H_9bd0bbfb,"Ха-ха-ха, да ладно, еще скажи, что тебя это не забавляет!",,,,,
"M """"",M_23f1b32c,(Раньше забавляло... а теперь это скука ужасная...),,,,,
"""""",narrator_0b11b693,"Муталиск перевернулась на спину и стала смотреть куда-то вверх, игнорируя происходящее снизу.",,,,,
"H """"",H_64c8e53a,"Ха-ха-ха, я сколько раз ни смотрю, всегда как первый!",,,,,
"M """"",M_c8731247,{size=-6}(Вот поэтому ты и не такой умный...){/size},,,,,
"H """"",H_1ae85d91,Ты что-то сказала???,,,,,
"H """"",H_fb80f153,"Ай, не важно!",,,,,
"H """"",H_4fdfe33a,Да! Убей его! Убей! Покажи ему кто тут главный!,,,,,
"M """"",M_da006fb6,*Вздох* когда же это закончится...,,,,,
"""""",narrator_c6d221f0,"Гневные выкрики только больше раздражали ультралиска, от чего он бил по земле еще сильнее. Но это все равно не помогало ему даже зацепить слизкого осквернителя.",,,,,
"Os """"",Os_a32d7fed,"Что, здоровяк? Я сли-ишком быстрый для тебя?",,,,,
"U """"",U_d6272864,Убью! Уничтожу!!! МЕСТА ЖИВОГО НЕ ОСТАВЛЮ!,,,,,
"G """"",G_4c1b8fb6,И сколько еще это будет длиться? Быстрее бы они уже успокоились.,,,,,
"Ze """"",Ze_0c5d64d1,"Пусть сражаются! Кто-то должен выйти победителем! Ну же старик, как думаешь, кто кого победит???",,,,,
"G """"",G_3ba1d4bf,Я не хочу в этом участвовать.,,,,,
"Ze """"",Ze_315d912c,Осквернитель... У него нет даже шансов!,,,,,
"S """"",S_ea1260ba,Ч-что тут вообще происходит...,,,,,
"""""",narrator_15332d22,"Все были очень заинтересованы дракой или ее обсуждением, чтобы заметить наблюдающего террана.",,,,,
"S """"",S_972c3bd1,"Тц, серьезно? Да им вообще плевать на меня!",,,,,
"SO """"",SO_eb97efa7,"Хозяйка, ты наконец-то прибыла! Я... я сделал все так, как ты сказала. Они все в сборе!",,,,,
"S """"",S_94141daa,*Грустный вздох*,,,,,
"S """"",S_99eca60c,(Я до последнего не хотела в это верить...),,,,,
"S """"",S_30555016,И это те самые... лидеры?,,,,,
"SO """"",SO_1693dac1,"Да, именно так! Тут все семь лидеров, которых ты хотела видеть. Но что ты собираешься делать? Они же сейчас перебьют друг друга!",,,,,
"U """"",U_ff9e6ef8,"Ты после этого не то что ползать не сможешь, я тебя сотру в порошок!",,,,,
"""""",narrator_6dc60d7c,"Сара подошла чуть ближе, внимательнее присматриваясь к драке. Теперь было видно, что осквернитель не просто уворачивался, но и цеплялся за ноги ультралиска, мешая ему и затрудняя передвижение.",,,,,
"U """"",U_7094ac85,"Ты думаешь, это меня остановит? Не смеши меня!",,,,,
"U """"",U_a6ebf833,ГР-А-А-А-А!!!,,,,,
"S """"",S_5bc0fbff,"(Размеры ультралиска играют против него, он не может зацепить проворливого противника. А осквернитель в свою очередь не может победить, так как его оппонент слишком прочный.)",,,,,
"Os """"",Os_03476570,Получай!,,,,,
"""""",narrator_0b430ec6,"Осквернитель пытался нанести урон ультралиску, но его удары не наносили особого урона, он был слишком слаб в сравнении с громилой. Он пытался взять ультралиска на износ, что у него пока получалось.",,,,,
"S """"",S_f864e78a,(Что за бессмысленная драка...),,,,,
"Os """"",Os_03ff4eab,А что ты скажешь теперь???,,,,,
"""""",narrator_a2d6988b,"Неожиданно для всех осквернитель воспользовался своей способностью, выпуская рой насекомых. Которые стали окружать ультру. Конечно, их не хватило, чтобы пробить прочный хитин, но задача была совершенно другой, а именно перекрыть видимость, делая его почти беспомощным.",,,,,
"U """"",U_c35643db," Ар-р-рг!!! Мерзкий! Хитрый! Я доберусь до тебя! Это все, что ты можешь!",,,,,
"""""",narrator_dbbe8bd6,"Ослепленный ультралиск отступил немного назад, пытаясь избавиться от назойливых мошек, но они также последовали за ним, продолжая мешать ему.",,,,,
"Ze """"",Ze_5c46f446,"Давай, ультралиск! Это не может тебя сломить! Разорви его!",,,,,
"U """"",U_77cf24cd,Заткнись или ты будешь следующим!,,,,,
"M """"",M_b5b2c3c7,"Опять двадцать пять... черт, совсем ничего не меняется!",,,,,
"H """"",H_6de845e6,Я могу наблюдать за этим вечно!,,,,,
"M """"",M_2a6648a8,"Я даже не знаю, что более уныло: заниматься рутиной или же наблюдать за этим...",,,,,
"Os """"",Os_263a3952,Хе-хе-хе-хе-хе! Как же легко было выбить по-о-очву из-под твоих ног. Уже не такой могущественный! Я никогда тебя не боялся! Сейчас ты у меня попла-а-а-а-атишься!,,,,,
"U """"",U_cb7533b9,Я ненавижу когда в моем присутствии находятся мурашки вроде тебя!!!,,,,,
"U """"",U_a622407e,"Какого черта мы вообще здесь собрались??? Это ты, Сошс! Если это твои проделки, ты будешь следующим!",,,,,
"M """"",M_c87f677f,"Да, кстати! Почему мы все здесь? Где тот, кто собирал нас?",,,,,
"G """"",G_03e97733,Верно... Я только ради этого и пришел.,,,,,
"H """"",H_06518371,Да какая разница! Что может быть лучше отменной драки?!,,,,,
"S """"",S_460f7f7f,Хах.,,,,,
"""""",narrator_0088a422,"Сара довольно улыбнулась, радуясь, что о ней наконец вспомнили.",,,,,
"S """"",S_6e6b6a95,Это я собрала вас всех!,,,,,
"""""",narrator_5427cef2,"Казалось, что все в мире замолчало в этот момент. Все повернулись к Саре. Даже ультралиск и осквернитель на миг забыли о своей вражде, чтобы взглянуть на того, кто посмел собрать их.",,,,,
"""""",narrator_f3e6955e,"Никто из лидеров не ожидал такого: перед ними стоял терран. Хрупкий, беззащитный, который никак не вписывался в данную обстановку. Кто бы мог подумать, что столь могущественные существа будут уделять так много внимания маленькому существу.",,,,,
"U """"",U_d9a12d8b,Терран????,,,,,
"S """"",S_fe12fd60,А кого ты еще тут ожидал увидеть? Снежного человека?,,,,,
"U """"",U_2a01c32d,"Терран возомнил себя тем, кто может разговаривать с нами???",,,,,
"U """"",U_dcb0bc03,Что это за шутки??? Ты кто еще такая???,,,,,
"S """"",S_a21759d5,"На роль клоуна тут больше походите вы, постоянно пытаясь самоутвердиться за чужой счет.",,,,,
"S """"",S_af7f78ac,"Я здесь, чтобы навести порядок!",,,,,
"U """"",U_42cb984e,Порядок???,,,,,
"U """"",U_7f5b939e,Ха-ха-ха-ха-ха-ха-ха-ха!,,,,,
"""""",narrator_51d8c41c,"Слышать подобное было одновременно и страшно, и необычно. Редко можно услышать столь угрожающий смех, от которого многие существа сразу же падут в бегство.",,,,,
"U """"",U_aba35598,"Порядок? *Смех* Жалкий терран хочет навести порядок? Тебе не кажется это смешным? Я могу раздавить тебя, даже не напрягаясь, малявка.",,,,,
"U """"",U_29f65e11,Как ты вообще попала сюда? Кто ее впустил??? Чьих это рук дело???,,,,,
"S """"",S_614922a0,...,,,,,
"S """"",S_3a5816e3,"Через дверь, как и все остальные. Что за глупые вопросы?",,,,,
"""""",narrator_dd299b1e,"Все присутствующие были в небольшом шоке от происходящего, им ранее не приходилось видеть, как столь маленькое существо позволяло себе столько вольностей.",,,,,
"M """"",M_5d722853,(Вот блин... а она не знает об инстинкте самосохранения... плюс один труп.),,,,,
"U """"",U_ce3c0b16,Ха-ха-ха-ха-ха...,,,,,
"U """"",U_61915868,"Меня это немного даже позабавило. Ты меня не боишься, вижу это в твоем взгляде. Это заставляет меня жаждать твоей смерти еще сильнее, но сейчас я не стану этого делать!",,,,,
"U """"",U_a0bb1f16,"Я покажу, что тебе здесь не место, человечишка!",,,,,
"S """"",S_e291cd71,"Ооо, даже так?",,,,,
"U """"",U_1b065e8c,"Как только я разберусь с этим ничтожеством, настанет твоя очередь! Ты можешь попробовать бежать, но я найду тебя. Ты можешь попробовать скрыться, НО Я ВЫСЛЕЖУ ТЕБЯ!",,,,,
"""""",narrator_ed6cba17,"Ультралиск продолжал смотреть на Сару своим безумным взглядом, после чего стал обращаться к остальным присутствующим.",,,,,
"U """"",U_10d67c50,"Если это ваши проделки, я узнаю об этом и вы поплатитесь. Как кто-то мог сделать подобное без моего ведома?! Вы должны все зарубить себе на носу, что со мной шутки плохи!",,,,,
"U """"",U_7aa68cb5,Время тебя уничтожить!,,,,,
"U """"",U_346546b1,Получай!!!,,,,,
"""""",narrator_c2f2f558,"Ультралиск не терял времени, заставая осквернителя врасплох. Нога громилы приземлилась в опасной близости к телу меньшего лидера.",,,,,
"S """"",S_614922a0_1,...,,,,,
"S """"",S_c704ee55,"(А кто говорил, что это будет легко?)",,,,,
"S """"",S_1cd2ae3f,"(Нужно разбираться с этим, иначе это затянется очень надолго...)",,,,,
"""""",narrator_e0d2382e,"Сара больше не пыталась поговорить с лидерами. Ультралиск был полностью поглощен битвой, а остальные не решались встревать.",,,,,
"S """"",S_e962b4dc,У меня нет времени на все эти игры...,,,,,
"S """"",S_a57be329,"Если вы не понимаете по-хорошему, то придется опуститься до вашего уровня... Поговорим на вашем языке, языке боли!",,,,,
"""""",narrator_de871a88,"Сара решила не терять драгоценное время, ведь если лидеры привыкли жить по законам сильнейших, то другого способа привлечь ее внимание просто-напросто не существовало.",,,,,
"""""",narrator_4646576d,"Новое тело, вот что интересовало Сару. Это, возможно, первый раз, когда ей предстоит использовать свои силы. Она была немного обеспокоена неизвестностью, но ее хладный ум помог отогнать эти мысли сконцентрироваться на происходящем.",,,,,
"Os """"",Os_c19ca641,(Ч-что с моим телом? Я не могу двинуться?),,,,,
"""""",narrator_40309264,"Осквернитель в недоумении замер, сам не понимая того, что происходило, его тело начало светиться.",,,,,
"U """"",U_d35661eb,Что ты задумал? Что это еще такое? Это снова твои грязные трюки? Ты не умеешь сражаться достойно! Но даже так тебе это не поможет!,,,,,
"H """"",H_961c0f94,Все закончится вот так? Чего ты стоишь?! Даже не думай сдаваться!,,,,,
"Os """"",Os_ebab2a2c,Сда-аться?! Никто и не говорит о сдаче!,,,,,
"Os """"",Os_32de168f,"Двигайся! Двигайся, чертово тело!",,,,,
"M """"",M_95ceb04f,"Да нам вообще плевать. Поубиваете друг друга - только тише в округе станет, да и места больше свободного.",,,,,
"Ze """"",Ze_2bc14d34,"Хе-хе-хе-хе, неужели ему настанет конец?!",,,,,
"G """"",G_b49b156b,"(А??? Не может быть, неужели это... псионика?! Но откуда здесь эта сила? Просто немыслимо!)",,,,,
"""""",narrator_2d7b50fa,Ранее не заинтересованный страж весьма оживился.,,,,,
"SO """"",SO_8991eb22,"Ого, хозяйка владеет такой силой и смогла остановить одного из лидеров! Как хорошо, что я на правильной стороне, хи-хе-хи.",,,,,
"SO """"",SO_21e464de,"Хм... А можно ли использовать эту силу по-другому? Например, для того, чтобы потрогать мои члены *неразборчивые звуки*? Интересно, какие ощущения испытывают во время этого? Я был бы определенно не против!!!",,,,,
"S """"",S_fb308650,(Лучше бы ты говорил об этом про себя...),,,,,
"""""",narrator_7882a302,"Сара прикрыла глаза, решая устранить одну из своих преград. Осквернитель был поднят в воздух, что уже шокировало всех лидеров. Особенно самого осквернителя.",,,,,
"SO """"",SO_2884b3bd,Вау! Хозяйка и на такое способна? Вот это будет весело!,,,,,
"Os """"",Os_a4de90de,"Ч-что происходит, п-почему я парю в воздухе?",,,,,
"Os """"",Os_4d73a3d3,П-поставьте меня на место! Это не сме-ешно!!!,,,,,
"G """"",G_2639c8bb,!!!,,,,,
"G """"",G_29016c23,(Подняла с такой легкостью. Быть такого не может! Она с невероятными способностями в псионике...),,,,,
"""""",narrator_d9ea77f1,"Он беспорядочно барахтался в воздухе, продолжая бесполезные попытки освободиться.",,,,,
"Os """"",Os_0ff42ee9,П-поставь...,,,,,
"S """"",S_a54f7df1,А???,,,,,
"S """"",S_ed2b0982,Упс... Вот это звук!,,,,,
"""""",narrator_b6c2309b,"Осквернитель сам не до конца понял, что произошло. Одно было ясно точно: его швырнули в стену. Смачно вписавшись в нее, он оставил отпечаток собственного тела.",,,,,
"Os """"",Os_ad0dd7f2,WHAT'S MAGIC IS IT???,,,,,
"S """"",S_9b0e1cf8,"(Ух-ты, это было так... просто? Ничего подобного раньше у меня не получалось... Я смогла поднять его, будто он был легкой пушинкой. Раньше мне пришлось бы вложить куда больше сил...)",,,,,
"S """"",S_e5e4411a,(Это все из-за мутации? Мне начинает это нравиться.),,,,,
"S """"",S_b624367f,У меня нет времени на все это!,,,,,
"M """"",M_9bf83aec,"(Это просто поразительно, это определенно псионика, только Владычица может ее использовать.)",,,,,
"""""",narrator_75d3bcfb,"Недавно приунывший муталиск также оживился, начиная вместе с остальными наблюдать за происходящим.",,,,,
"M """"",M_1e58a68e,"(Не может быть, чтобы этот терран... была настолько сильна. Ее псионика может сравниться с силами Владычицы! Нет, возможно, она даже превосходит ее! Поразительно!)",,,,,
"H """"",H_42881194,"(Эта человечишка все никак не успокоится? Что она сделала, чтобы заставить осквернителя летать? Здесь есть ее союзники? Нужно быть наготове...)",,,,,
"S """"",S_196e32cf,Теперь вы готовы меня выслушать?!,,,,,
"U """"",U_fdf89e2d,{size=+4}Ты... как ты могла...{/size},,,,,
"U """"",U_609bf124,Что ты о себе возомнила?! Это моя добыча!!!,,,,,
"""""",narrator_62f72c4d,"Голос ультралиска с каждым новым словом менялся. Он приобретал гневный рык, полностью отображая эмоциональное состояние хозяина.",,,,,
"M """"",M_d7dbaedd,Стой! Ты снова начнешь безумства!,,,,,
"U """"",U_44429c8d,Ты позволила себе слишком много! КТО ДАЛ ТЕБЕ ПРАВО ЛЕЗТЬ В МОЮ СХВАТКУ?!,,,,,
"U """"",U_e053f52d,Тебе не сбежать от меня! Ты вывела меня из себя! Я тебя уничтожу!,,,,,
"""""",narrator_6783dd3d,"Громила повернулся к Саре всем корпусом, выдвигая его вперед, предвещая, что его цель изменилась. Его взгляд мог напугать кого угодно, но Сара была не из пугливых. Безумный огонь в его взгляде ее никак не тревожил.",,,,,
"""""",narrator_215c8bfd,"Все лидеры быстро отступили подальше, чтобы обезопасить себя.",,,,,
"M """"",M_79320454,"(Никто в здравом смысле не захотел бы связываться с ним, особенно когда он впадает в ярость...)",,,,,
"M """"",M_39cd1060,(Она хочет нашей гибели? Его же теперь не остановить!),,,,,
"U """"",U_96b9b15c,Даже мольбы о пощаде тебя не спасут!,,,,,
"G """"",G_639bab86,"О нет... Нет-нет-нет, она ведет к очень плохому исходу... Он неконтролируемый, если поддается ярости!",,,,,
"G """"",G_b998c445,"Я даже подумать не мог, что все обернется вот так...",,,,,
"H """"",H_d8e72d57,"Эй, слышишь, пора сматывать удочки... Я не хочу составить ей компанию в последний путь!",,,,,
"G """"",G_f812e98b,"(Даже обладая этой силой... ей вряд ли удастся справиться с ним... Ультралиск безумен в этом состоянии, даже ее псионика не спасет!)",,,,,
