location,source,target,ID,fuzzy,context,translator_comments,developer_comments
"""""",narrator_a53a0d7f,"Зерглинг принял свою боевую позицию, она мало чем отличалась от того, как он держал себя обычно. Но Сара сразу же заметила жажду убийства. Он медленно приближался к Саре, хищно скалясь. Пассивная реакция Сары его только больше раздражала.",,,,,
"Ze """"",Ze_208930c5,Выскочка! Тебе просто повезло... От меня живой ты не уйдешь!,,,,,
"S """"",S_1eee667f,"Ну давай посмотрим, кто окажется сильнее.",,,,,
"Ze """"",Ze_816f5f6f,!!!,,,,,
"Ze """"",Ze_4fe645e4,Ч-что???,,,,,
"""""",narrator_ed039ece,"Ультралиск грузно стал между ними, предотвращая драку, для обоих было внезапным его появление.",,,,,
"U """"",U_dbd1bb96,Остановись...,,,,,
"Ze """"",Ze_1acd4bf4,Ты зачем мне мешаешь..?,,,,,
"Ze """"",Ze_09d614ae,Дай я разорву ее!,,,,,
"Uside2 """"",Uside2_3e58dfe2,"Это последний раз, когда я делаю тебе одолжение и спасаю от глупой гибели. А если и не гибели, то от удара по твоему самолюбию. В следующий раз такого не повторится, если ты действительно хочешь закончить так, то пусть закончит свое дело...",,,,,
"""""",narrator_6aa1b372,"Громила надменно посмотрел на Сару сверху вниз, возвращаясь на свое место. Оставляя возможность продолжить их схватку, но его слова дали свой вес.",,,,,
"Uside2 """"",Uside2_d23a4206,Даже мне не справиться с ней.,,,,,
"Ldrs """"",Ldrs_089671ca,!!!,,,,,
"Hside1 """"",Hside1_0f6154de,(Он что?...),,,,,
"Ze """"",Ze_d6944c8d,"(Что с ним произошло, он что, признал ее силу?! Ультралиск?! Бред какой-то...)",,,,,
"""""",narrator_c21752b6,"Все лидеры удивленно уставились на ультралиска, пытаясь осознать его слова.",,,,,
"Gside1 """"",Gside1_edb97080,(Я никогда ничего прежде не слышал...),,,,,
"""""",narrator_6c7162e7,"Никто и никогда не слышал от него подобных слов, не было противника, равному ему. Но то, что он не захотел вступать в бой с Сарой, уже о многом говорило.",,,,,
"""""",narrator_374f8f8d,"Никто не стал проверять, повезло ли Саре, хотя каждый из них и так знал, что везение тут совсем ни при чем.",,,,,
"Ze """"",Ze_ee6677df,"Пф... Тебе повезло, человечишка! Я отступлю, если так того хочет ультралиск. Так что будь ему благодарна!",,,,,
"""""",narrator_ca919d7b,"Слова зерглинга отличались от его действий. Все его тело было напряжено, но он уже не так спешил бросаться.",,,,,
"Uside1 """"",Uside1_6dc9f894,"Продолжай свою мысль, страж.",,,,,
"S """"",S_957a8bb0,"(Я была о нем другого мнения, хоть он и громила, но все же не совсем тупой.)",,,,,
"Gside1 """"",Gside1_19700d89,"Да, как ты можешь видеть, у нас нет лидера. Его место временно занимает тот, кто самый сильный в иерархии.",,,,,
"S """"",S_f1e4a05a,"Ультралиск. Не нужно быть гением, чтобы понять, кто тут главный.",,,,,
"Gside1 """"",Gside1_30c56ef5,"Верно, сейчас командует он.",,,,,
"S """"",S_56babb0b,"(Тогда и неудивительно, почему же тут все так происходит... поставить во главу громилу не всегда является хорошей идеей. Но ничего, это временно.)",,,,,
"S """"",S_cde6c989,А в чем проблема? Разве я не могу просто побороться с ультралиском и занять его место?,,,,,
"Gside1 """"",Gside1_5adbc27d,"Нет, потому что это иерархия. Тебе нужно подняться с низов к ультралиску. Получить одобрение и эссенцию всех семи лидеров. Тогда ты сама станешь верхушкой иерархии и мы будем обязаны подчиниться тебе.",,,,,
"S """"",S_dececf6b,"И какая же у вас тут иерархия? Дай угадаю, низ в вашей иерархии занимает он?",,,,,
"""""",narrator_22ef3f40,"Сара насмешливо указала на зерглинга, которого начало трясти от накопленного гнева.",,,,,
"Zeside1 """"",Zeside1_81ae2add,Арррг! Ты!,,,,,
"SOside1 """"",SOside1_809099d5,"Вообще... Это я первый в твоей очереди. Лидер Сошс, я первый лидер дронов.",,,,,
"S """"",S_6231e55d,"Ох... совсем из головы вылетело, что ты тоже лидер. То есть... Мне придется и тебя удовлетворить?",,,,,
"SOside1 """"",SOside1_b3ac0ba2,"Ну... хи-ха-хо. Да, хозяйка.",,,,,
"S """"",S_629bccdd,Отлично! Просто замечательно!,,,,,
"SOside1 """"",SOside1_01d3e6c9,"Хозяйка мечтала потрогать меня за член, хе-хи-хе?",,,,,
"S """"",S_595042d2,Нет! Точно нет! Об этом я мечтать точно не могла.,,,,,
"SOside1 """"",SOside1_936d35a2,"Такое слышать вообще было бы обидно, но не Сошсу. Одна мысль о том, что Сара потрогает его, весьма поднимает настроение, и не только настроение. Так что он ни чуточку не в обиде за ее слова.",,,,,
"S """"",S_614922a0_4,...,,,,,
"S """"",S_1bf5b725,Мне как-то плевать.,,,,,
"Mside1 """"",Mside1_3fb6434d,"Теперь ты знаешь о том, как у нас тут все устроено. И каков будет твой ответ сейчас?",,,,,
"S """"",S_1d5c184c,Ответ??? Вы еще спрашиваете...,,,,,
"S """"",S_ebe6c225,"Конечно же, я...",,,,,
"S """"",S_a7d4789e,"Я выполню ваши задания! Мне нужна ваша поддержка, если нет другого пути, то пусть будет так.",,,,,
"S """"",S_899a1cd6,"Я буду играть по вашим правилам, и вы сами все увидите.",,,,,
"S """"",S_220b9015,"Вам следует подготовиться! Я не остановлюсь ни перед чем, я докажу всем, что стану лидером и свергну Владычицу.",,,,,
"S """"",S_0aeed95e,(Никто не посмеет сомневаться во мне! Особенно Владычица.),,,,,
"Mside1 """"",Mside1_caa5efd8,Отличный ответ!,,,,,
"Zeside1 """"",Zeside1_d29b7cdb,"Теперь мы сможем ей показать, что с нами шутки плохи!",,,,,
"Hside1 """"",Hside1_ea15a54f,"Ха-ха-ха, вот это будет веселье!",,,,,
"""""",narrator_7644fee8,"Теперь вам доступны задания лидеров. Чтобы получить эссенцию, сперва нужно выполнить их поручения.",,,,,
"""""",narrator_fef24d6a,Верный слуга Сошс готов поделиться своей эссенцией без выполнения задания.,,,,,
