location,source,target,ID,fuzzy,context,translator_comments,developer_comments
"L ""%%""",L_93a626d6,(Все это ради важного дела... Я наконец-то стала полезной... Не только Сара что-то делает. Я теперь тоже!),,,,,
"L ""%%""",L_9c36a7f2,"(Она столько всего пережила... Это мелочи, по сравнению с ее жертвами!)",,,,,
"L ""%%""",L_91d86209,"(Я выложусь и задержу этих монстров на столько, сколько понадобится!)",,,,,
"L ""%%""",L_eb7307bb,О ВЕЛИКАЯ КХАЛА!!!,,,,,
"""%%""",narrator_e7d2ae96,"Лиззара пыталась зарядить себя мотивацией, но резкий толчок огромного члена любого бы сбил с мысли. Протосса почти разрывало от того, насколько глубоко в нее засадили член. От резкой боли все кружилось перед глазами, но постепенно ощущения дискомфорта стихали и Лиззара начинала понимать, в чем вся прелесть анальных бус.",,,,,
"""%%""",narrator_069109a1,"Монстры ответно выли, чувствуя и слыша, как приятно их самке. Это еще больше разогревало все естество протосса. Вся ее животная сущность выходила наружу и она полностью забыла, что это неправильно. В ее голове был только огромный бугристый член, на который ее насадили.",,,,,
"L ""%%""",L_1d47d2f3,(Ах... большой... он такой большой!),,,,,
"""%%""",narrator_29b2c00c,"Протоссу было не до того, что происходило вокруг нее. Но языки, которые так приятно ласкали кожу, куда-то делись. Лиззара жалобно застонала в надежде, что все вернется на круги своя, но все осталось по-прежнему. Пока в ней был один член, остальные двое затеяли небольшую драку за следующее место под солнцем. ",,,,,
"L ""%%""",L_b9a77683,"(Н-наверное... Они решили, что я очень хорошая самка и теперь все меня хотят... Ха-ах.)",,,,,
"""%%""",narrator_34eb473f,"Все тело Лиззары содрогалось от сильных толчков и звуки, которые издавал зверь, говорили о том, что ему очень хорошо. Это только сильнее подбивало других драться за свою очередь, чтобы ощутить узкую дырку такой доступной самки. ",,,,,
"L ""%%""",L_48a2268c,"(Дерутся за меня... Кто будет следующий, ах! На моей родине никогда такого не происходило... Я чувствую себя такой особенной... сексуальной, ахх!)",,,,,
"""%%""",narrator_251c2bfb,"Стоны протосса становились все громче, делая ее желанной добычей. А женственные черты подливали масла в огонь. Она никогда не думала, что ей может понравиться, как за нее будут драться сильные самцы. Сердце делало кульбиты от внутренних и внешних ощущений и Лиззара была готова поклясться, что не может дышать от нахлынувших ощущений.",,,,,
"L ""%%""",L_3f401d7d,"Ах, такой напор! Так сильно долбится!",,,,,
"""%%""",narrator_5acaa560,"Монстр продолжал вбиваться в податливое тело, создавая невероятное трение с бусами. Лиззара не могла представить, что это будет настолько приятно, когда маленькие шарики перекатываются от глубоких толчков.",,,,,
"""%%""",narrator_b4cbd5fd,"Лиззара уже не могла сказать, как долго в нее вбивался первый монстр, пока другие за ними наблюдали. Протосс перестала чувствовать себя неловко, начиная получать дополнительное удовольствие от посторонних зрителей.",,,,,
"L ""%%""",L_a842805b,Ах... АХ! Да... еще...,,,,,
"""%%""",narrator_f1a3e459,"Зверь не сбавлял обороты, с каждым толчком выбивая остатки здравомыслия из Лиззары. Протосс уже перестала думать о том, куда она попала и о том, что их там еще много. Она больше не боялась того, что это только первый пользуется ею для удовлетворения. Поток времени проходил сквозь нее и кандалы больше не имели значения.",,,,,
"L ""%%""",L_95f1d437,"Т-ты разрываешь меня, ах!!!",,,,,
"""%%""",narrator_095f0755,"У нее не было шанса на побег даже без кандалов. Бусы в заднице, пульсирующий член в киске стали ее главным препятствием.",,,,,
"L ""%%""",L_f95a7e21,(Это все так чувствуется внутри... Он как будто пихает эту игрушку все глубже!),,,,,
"""%%""",narrator_41b20627,"Протосса забавляло, как кандалы звенели в ритм толчков, что создавало приятную мелодию этого безумного процесса.",,,,,
"L ""%%""",L_09d432df,"(Сколько еще я смогу продержаться... Он пробирается так глубоко, что скоро проткнет меня насквозь! И почему я так этого хочу... Я чувствую себя грязной...)",,,,,
"L ""%%""",L_dd3587da,"(Ах... похотливый протосс, который попал в такую глупую ловушку... АХ!)",,,,,
"""%%""",narrator_2cc70b39,"Монстр стал двигаться сильнее. Если бы не оковы, Лиззара бы не удержалась на ногах от таких мощных толчков. Все внутри нее сворачивалось и бурлило от нового темпа, за которым протосс не поспевала. Двигаясь в другом ритме, она особо сильно сталкивалась с телом зерга, загоняя его член до предела.",,,,,
"L ""%%""",L_82db4d89,"{size=+2}АХ? Н-невозможно, еще быстрее? С-стой!{/size}",,,,,
"""%%""",narrator_09e51e86,"Зверь дико завопил, в разы ускоряя темп. Протосс еще не понимала, что монстр собирается обильно кончить в нее, но уже ощущала отдающую по всему телу пульсацию.",,,,,
"L ""%%""",L_39a87f71,(Ч-что... Ч-что это за чувство?),,,,,
"L ""%%""",L_5e1c250c,(Он так ускорился... И МОЕ ТЕЛО ОТВЕЧАЕТ!),,,,,
"""%%""",narrator_1a8a241e,"Двое других существ заметно оживились, подходя ближе к самке. По их реакции протосс окончательно поняла, что дело идет к концу и ей стоило бы подготовиться к этому. Звери начали выть и издавать странные звуки, проводя свои совершенно непонятные ритуалы.",,,,,
"""%%""",narrator_bbbec042,"Лиззара ощущала себя дикаркой, которая наконец нашла свое место. Она даже не пыталась врать себе, что ей это не нравится. Животное совокупление было тем, ради чего она была готова остаться тут и отдаться этому навсегда.",,,,,
"L ""%%""",L_10aaa0d0,АААААХХХХ!!! Д-даааааа!,,,,,
"""%%""",narrator_dc8d3452,РААААХХХ!!!,,,,,
"L ""%%""",L_0b7f25c3,КАК ЭТО ПРЕКРАСНО!,,,,,
"""%%""",narrator_70ff36da,"Существо сделало еще пару толчков и в последний раз засадило поглубже. Протосс готова была начать паниковать, но вскоре почувствовала теплую и очень водянистую жидкость, которая начала извергаться, попадая и на кожу протосса.",,,,,
"L ""%%""",L_e771212a,ММММ!! Он м-меня заливает! В-ВСЮ... Моя кожа так быстро все это впитывает изнутри!,,,,,
"L ""%%""",L_59739327,Я могу почувствовать ее на вкус... Она заполняет всю меня! ЕЕ ТАК МНОГО!!!,,,,,
"""%%""",narrator_ccd9156c,"Протосс остро реагировала на сперму, которая напрямую влияла на ее разум. Ее количество, впитываемое телом, становилось слишком большим, сводя Лиззару с ума.",,,,,
"L ""%%""",L_74149ff6,АХХХХ!!!,,,,,
"L ""%%""",L_a4b29c0c,Ч-что ты со мной делаешь?,,,,,
"L ""%%""",L_efac8cc8,"Я не смогу уйти потом, а меня ждут! МММММ!!!",,,,,
"L ""%%""",L_0d0275e0,ЭТОТ ЧЛЕН!,,,,,
"L ""%%""",L_dec69f11,ЕГО РАЗМЕРЫ ПОЛНОСТЬЮ СЕБЯ ОПРАВДАЛИ!,,,,,
"""%%""",narrator_354a37f8,"Лиззара без сил обмякла на все еще извергающимся члене, теряя связь с реальностью.",,,,,
"""%%""",narrator_b261638b,Через какое-то время поток прекратился и член с громким хлюпом вышел из растянутого лона.,,,,,
"L ""%%""",L_bdce36f7,"(Х-ха... хааа... с ума сойти... это невозможно передать словами... кто же знал, что они такие дикие... грязные... п-похотивые...)",,,,,
"""%%""",narrator_eaebca9d,"Лиззара уже собиралась перевести дыхание, но следующий монстр не стал ее разочаровывать и сразу же приблизился к дрожащему телу.",,,,,
"L ""%%""",L_b53fd5ef,(Ч-что... Даже передохнуть не дадут?),,,,,
"L ""%%""",L_d7040eac,"П-постой, н-нельзя же вот так, я еще совсем слаба... м-мое тело сейчас очень чувствительно!",,,,,
"""%%""",narrator_4a594d2b,"Лиззара не знала точно, какой по счету монстр и как ее имел. Но в одном она была уверена: этот член ощущался по-другому, наверняка он был последний и решил пользоваться ей особенно долго. Внутри нее хлюпала скопившаяся сперма.",,,,,
"L ""%%""",L_b8555503,(Еще один вошел... Ах! Каждый из них побывал во мне... Столько спермы... И она вся смешалась!),,,,,
"""%%""",narrator_defbb651,"От таких мыслей протосс невольно сжалась, сильнее возбуждая зверя. Он начал неистово двигаться в ней, раззадориваясь от реакций самки на него.",,,,,
"L ""%%""",L_153a8166,"(Ах... Ты так долго ждал... Ты весь изнывал от желания! Теперь ты отдаешь себя без остатка, хочешь выложиться как следует... Это такая честь, ах-хах.)",,,,,
"""%%""",narrator_2852ceea,"Лиззара потеряла последнюю каплю самосохранения, ритмично сжимая свои стеночки. Они и так оказались сильно растянуты, охватывая внушительных размеров член, но протосс была преисполнена похотью. На грани таких действий существо было готово кончить.",,,,,
"L ""%%""",L_8106bb21,"О да... Это именно то, чего я хочу! Отдай мне всю свою сперму! МММММ!!!",,,,,
"L ""%%""",L_769b5db6,Такая вкуснятина!,,,,,
"""%%""",narrator_e0e16716,"Лиззара пошло облизнулась, ощущая, как ее тело готовится к принятию новой порции.",,,,,
"""%%""",narrator_e9c21351,"Сама не замечая этого за собой, Лиззара понимала, когда звери подходят к концу. ‘Статистика’ накопилась в моменты прошлых кремпаев, они отлично выдрессировали ее, заливая своими членами густую сперму в глубины матки.",,,,,
"L ""%%""",L_81715731,"Ммм... да, ты же хочешь этого... ах...",,,,,
"""%%""",narrator_de4289f0,"Монстры больше не дрались между собой, отдыхая после длительного совокупления. Протосс чувствовала себя очень гордо, смотря на исход своих стараний.",,,,,
"L ""%%""",L_677f3a6d,"(Все оказалось куда интереснее, чем я могла представить, ах...)",,,,,
"""%%""",narrator_68d2dbe2,"Ее гордости становилось все больше, когда зверь приближался к разрядке.",,,,,
"L ""%%""",L_8d600d09,Давай. Удовлетвори свою самку по полной! Войди в меня еще глубже! Т-ты же так долго ждал этого!,,,,,
"""%%""",narrator_cbce3ae4,"От того, что зверь долбился так неистово, он быстрее доходил до пика. Все его тело напряглось, а движения ничуть не замедлились, пока он не был полностью готов кончить.",,,,,
"L ""%%""",L_e51ab5fb,!!!,,,,,
"""%%""",narrator_341c1ae9,{size=+4}РААААХХХ!!!{/size},,,,,
"L ""%%""",L_f4595d0b,ДАААААА!!!,,,,,
"""%%""",narrator_f53ab2f4,"Тело протосса все так же дрожало, а разум все больше испытывал такой же восторг. Лиззара становилась зависима от того, что получала, она старалась как следует насладиться, впитывая в себя его семя.",,,,,
"L ""%%""",L_156580df,Ха-ха-аа... да... еще... п-продолжает заливать меня! Так много спермы!,,,,,
"L ""%%""",L_9f429bd8,(Ммм... они каждый раз кончают так обильно...),,,,,
"""%%""",narrator_6a917f52,"Протосс уже готовилась к тому, что существо выйдет из нее и ей придется удерживать в себе его сперму, но монстр почему-то не торопился. Он неподвижно стоял, пока его член продолжал пульсировать, изливаясь небольшими, но постоянными порциями жидкости.",,,,,
"L ""%%""",L_6daaec1b,(Что он заставляет меня чувствовать... Я никогда не хотела сидеть на члене так сильно!),,,,,
"""%%""",narrator_f9d867bc,"Лиззара была удивлена этим, но еще больше ее удивляло, что она была не против. В какой-то мере ей хотелось бы, чтобы он остался в ней надолго и позволил всей сперме впитаться без потерь.",,,,,
"L ""%%""",L_4fc8ba38,(Если бы меня кто-то увидел... Ч-что бы они обо мне подумали... ах... я не совсем похожа на жертву...),,,,,
"L ""%%""",L_5befa4f1,(Н-не с таким выражением лица... ах... ничего не могу с собой поделать.),,,,,
"""%%""",narrator_43acbc54,"Ее счастье длилось недолго, потому что зверь все же вышел из нее и упал на землю. По нему было видно, что он выложился больше, чем мог, и последние силы ушли на удовлетворение самки.",,,,,
"L ""%%""",L_d71d8ae5,(Ах... из этих троих... этот здоровяк определенно мой любимчик!),,,,,
"L ""%%""",L_b4b0b891,(!!!),,,,,
"L ""%%""",L_6c0052ec,"Боже, о чем я таком думаю? Нет-нет-нет, нужно гнать эти мысли прочь!",,,,,
"L ""%%""",L_49524311,"(Но... постой, я справилась!)",,,,,
"L ""%%""",L_06c202c6,(СЛАВА КХАЛЕ! Я СПРАВИЛАСЬ!!!),,,,,
"""%%""",narrator_06fb9dc6,"Лиззара стала радоваться, понимая, что каждый из них был удовлетворен и опустошен.",,,,,
"L ""%%""",L_5971afab,"(Интересно, а другие тоже уже все справились? Ах, руки уже ноют от этих кандалов...)",,,,,
"L ""%%""",L_af9abd13,А?,,,,,
"""%%""",narrator_790257d1,"Знакомая тень снова нависла над ней, показывая всем своим видом, что снова готов к бою.",,,,,
"L ""%%""",L_0bba2a5b,Ч-что происходит? Н-неужели вы хотите...,,,,,
"L ""%%""",L_3987aeaf,Быть того не может...,,,,,
"L ""%%""",L_a56913d2,П-ПРОДОЛЖЕНИЯ?!,,,,,
"""%%""",narrator_3b2b713f,"Лиззаре стало безразлично, кто конкретно ее имеет, уже в конце второго круга. Это длилось бесконечно, круг за кругом в ее нутро входили огромные члены и сменяли друг друга. Обильно заполняя ее промежность.",,,,,
"L ""%%""",L_23c407a2,(Я почти ничего не понимаю... Мое тело так ноет!),,,,,
"L ""%%""",L_0d82bbdf,(Еще бы... Такой марафон у меня впервые... Голова кругом идет.),,,,,
"L ""%%""",L_736bee9e,"(Они раз за разом кончают в меня, а потом меняются... меняются и потом кончают! Побыстрее бы он кончил в меня!)",,,,,
"L ""%%""",L_ab2c076c,(Ммм... Хочу только эту теплую сперму...),,,,,
"L ""%%""",L_daf8cee0,(Этот момент... Самый лучший!),,,,,
"L ""%%""",L_5c36cf93,"{size=+2}Ах... почти, я почти!{/size}",,,,,
"""%%""",narrator_7d1138ad,"Лиззара замерла, затаив дыхание, когда вдалеке послышался устрашающий вой. Она изначально не придала ему значения, только лишь после того, как существо перестало ее насаживать.",,,,,
"L ""%%""",L_8cad6afc,А? Эй... п-почему ты встал? Это все из-за странного звука?,,,,,
"""%%""",narrator_719c116d,"Все монстры насторожились, уставившись вдаль. Лиззара разочарованно смотрела по сторонам, не понимая, что происходит, но существам стало не до нее.",,,,,
"""%%""",narrator_f2930a0c,"Спустя мгновение они начали отступать, пока не решили резко уйти в неизвестном направлении. Даже тот который был внутри протосса, без колебаний вытащил свой член, не завершив разрядку.",,,,,
"L ""%%""",L_bc3d22fe,А как же... Мммг... Как всегда! Просто взяли и бросили.,,,,,
"L ""%%""",L_6b64080b,Что это вообще был за звук? И почему они так отреагировал? С Сарой что-то случилось?,,,,,
"L ""%%""",L_2a9b1f80,...,,,,,
"L ""%%""",L_303bec1d,"Н-нет. Скорее, страж что-то натворил и они ринулись на помощь.",,,,,
"L ""%%""",L_66c75f6e,... ...,,,,,
"L ""%%""",L_2a6c39b0,А последний даже не кончил... Какая жалость!,,,,,
"L ""%%""",L_f17bf9d3,... ... ...,,,,,
"L ""%%""",L_c77ea14b,"(Постой, так это же значит...)",,,,,
"L ""%%""",L_96d668e0,"Ха-а-а-ах, а я ведь спасена!",,,,,
"""%%""",narrator_a5eae616,"Только сейчас до девушки дошло, что ее задача выполнена сполна и остается лишь ждать подкрепления, чтобы ее освободили.",,,,,
"L ""%%""",L_4a1757bb,(Сколько бы это еще продолжалось... Они такие активные в сексуальном плане...),,,,,
"L ""%%""",L_2da346ea,"(Ах, не удивительно. Я вся пропитана их феромоном!)",,,,,
"L ""%%""",L_72292ab4,"(Неужели они так сильно возбудились от него? А если учесть, что моя кожа начала впитывать его... Она теперь еще долгое время будет им пахнуть...)",,,,,
"L ""%%""",L_d43b496a,"(Надеюсь, что это не привлечет таких чудищ на мостик.)",,,,,
"L ""%%""",L_6598f7fc,"(Второй марафон я могу не пережить, ха-ха.)",,,,,
"L ""%%""",L_4595fef1,(Все тело теперь ноет... А как будет болеть завтра? Я выживу вообще?),,,,,
"L ""%%""",L_d8c7814c,"(Надеюсь, зерги сделали что-то заживляющее такие глубокие раны.)",,,,,
"L ""%%""",L_1114f0fa,"(Арх, я слишком устала. Нужно воспользоваться временем до прибытия Сары и немного отдохнуть...)",,,,,
"intro ""%%""",intro_dc0c9760,,,,,,
"""%%""",narrator_f00a069e,"В это же время Сара пыталась оторваться от погони, которую затеяла одна любопытная особь заинтересовавшись терраном.",,,,,
"S ""%%""",S_bca3db61,"Нужно скрывать свое присутствие, и он точно меня не найдет. Хах, не только он хорош в маскировке.",,,,,
"""%%""",narrator_4aaca474,"Параллельно во время бега Сара максимально подавляла силу, скрывая свое присутствие. Ее все еще можно было почувствовать, но не понять ее точное местонахождение. Вместе с постоянным перемещением это был действительно хитрый ход, заметающий следы.",,,,,
"S ""%%""",S_6d7f7315,(Все должно пройти точно по плану... И долгожданная эссенция моя. Жертвы не могут быть напрасными.),,,,,
"S ""%%""",S_ca54971a,"(Всего лишь нужно отвлекать его. Не такой уж он и умный, надеюсь...)",,,,,
"""%%""",narrator_544dbdc8,"Сара продолжала скрываться, придерживаясь своего плана, но некое чувство терзало ее. Она сама еще не понимала, чем именно оно было вызвано, ровно до тех пор, пока не почувствовала, что чудовище приближается.",,,,,
"S ""%%""",S_8d730894,(ЧТО?),,,,,
"S ""%%""",S_f362170d,(Быть такого не может... Как он? Мне же не могло показаться.),,,,,
