location,source,target,ID,fuzzy,context,translator_comments,developer_comments
"S """"",S_siNEZsKj,"(Ч-что он вытворяет! Я никогда бы не подумала, что мне понравится что-то подобное!)",S_siNEZsKj,,,,
"""""",narrator_cj8oH2LP,"Террану хотелось кричать от получаемого удовольствия, но сквозь всю пелену она помнила о никуда не ушедшей угрозе.",narrator_cj8oH2LP,,,,
"S """"",S_353ussxQ,(Э-это все... Просто невероятно! Н-но я все же не хочу закончить тут свое существование. Я все еще помню опыт Лиззары и их ненасытность.),S_353ussxQ,,,,
"""""",narrator_Avcjpk4J,"Зверь продолжал двигаться короткими, но сильными толчками, пытаясь вырваться наружу. Он лично мог почувствовать, как его достоинство натягивало вокруг себя внутренности, из-за близкого контакта живота Сары с его брюхом.",narrator_Avcjpk4J,,,,
"""""",narrator_WtBKatyh,ГРРР!,narrator_WtBKatyh,,,,
"""""",narrator_CzYSoBMP,"Девушка с трудом заметила, как член стал пульсировать сильнее, а движения стали более рваными. Чудовище готово было догнать Сару и заполнять ее спермой.",narrator_CzYSoBMP,,,,
"S """"",S_saVs6n6E,С-собираешь залить меня до предела? Давай! Я и не такие объемы принимала...,S_saVs6n6E,,,,
"""""",narrator_RhhydQ2Y,"Урсадонт возбужденно порыкивал, ткнувшись последний раз в самую глубину. Девушка чувствовала, как ее живот вздымается, демонстрируя внушительно выпирающую головку.",narrator_RhhydQ2Y,,,,
"""""",narrator_CVUdYBJU,"Горячее семя ударялось мощной струей в заднюю стенку матки. Каждый поток растягивал девушку еще сильнее, головка плотно закрывала проход наружу.",narrator_CVUdYBJU,,,,
"S """"",S_9vdf4spn,(ОН СВОДИТ МЕНЯ С УМА! Т-ТОЛЬКО ПОДУМАТЬ... ОН НЕ ДАЕТ СВОЕЙ СПЕРМЕ ВЫЙТИ!),S_9vdf4spn,,,,
"S """"",S_UvJqUUwb,(!!!),S_UvJqUUwb,,,,
"S """"",S_szU52huu,К-КАКОЙ ТЫ П-ПОДЛЫЙ!,S_szU52huu,,,,
"S """"",S_3hxDXBLz,Т-ты хочешь... чтобы я потом не смогла уйти? Т-ты этого добиваешься?!,S_3hxDXBLz,,,,
"S """"",S_aPndX5px,(Я не выдержу... Из-за его спермы так тепло внутри...),S_aPndX5px,,,,
"""""",narrator_ivZmYR6Q,ГР-А-АА!,narrator_ivZmYR6Q,,,,
"S """"",S_QqPozUeB,{size=+8}ОО-ОХ! ЧЕРТ!!!{/size},S_QqPozUeB,,,,
"""""",narrator_Ehw4GChp,"От ощущения потока жидкости глубоко внутри затухающий оргазм вернулся с новой силой, позволяя девушке принимать все больше и больше в себя.",narrator_Ehw4GChp,,,,
"S """"",S_bpumQfPe,(Ч-черт... Так эта сперма никогда из меня не выйдет!),S_bpumQfPe,,,,
"S """"",S_GGsXZvE5,К-Как хорошо...,S_GGsXZvE5,,,,
"""""",narrator_eNrCTsTo,"Терран позволила себе немного насладиться тем, как хорошо член внутри распирал ее, вызывая волну необыкновенного удовольствия.",narrator_eNrCTsTo,,,,
"S """"",S_VkpNTcg7,Я... Как будто выполнила миссию одного из лидеров...,S_VkpNTcg7,,,,
"S """"",S_PNsaktcQ,Извращенную...,S_PNsaktcQ,,,,
"S """"",S_6opDgm77,Но такую необычную...,S_6opDgm77,,,,
"""""",narrator_ggEye4Kz,"Зверь завыл, напрягаясь и пуская последний поток спермы. У девушка была пара мгновений прийти в себя, но жидкость слишком соблазнительно булькала от каждого движения.",narrator_ggEye4Kz,,,,
"S """"",S_SaWEGRes,(Я уже не чувствую себя человеком... Меня нагло использовали и мне это понравилось.),S_SaWEGRes,,,,
"S """"",S_LifFZhLT,АА-ах... В-выходи уже из меня.,S_LifFZhLT,,,,
"S """"",S_bBiq2Q48,Я не могу проторчать здесь вечность!,S_bBiq2Q48,,,,
"""""",narrator_Teq3Fijs,"Член начал обмякать, но все равно не мог выйти обратно. Зверь сделал пару ленивых попыток, после чего под давление мышцы снова расслабились и выпустили все содержимое киски наружу.",narrator_Teq3Fijs,,,,
"S """"",S_EtAWqnbg,АХ! Н-нет!!!,S_EtAWqnbg,,,,
"S """"",S_XHoQjPL9,Н-Не так быстро... Ах!,S_XHoQjPL9,,,,
"""""",narrator_YWWCUExS,"Девушка никак не могла остановить процесс выливания спермы из себя. Ей хотелось хотя бы рукой остановить это безумие, но Саре все еще приходилось держаться за урсадонта.",narrator_YWWCUExS,,,,
"S """"",S_ZDYmEnrr,Я… Это невыносимо! Мои стеночки так сжимаются...,S_ZDYmEnrr,,,,
"""""",narrator_psccz3F6,"Вся нижняя часть тела была облита густой спермой, толкая террана на грязные и пошлые мысли о том, как она будет выглядеть при возвращении.",narrator_psccz3F6,,,,
"S """"",S_MEVtq73u,П-почти все вышло... Еле держусь... Нужно немедленно возвращаться или я сорвусь с него.,S_MEVtq73u,,,,
"""""",narrator_3UwVFyfK,*Хлюп* *Хлюп*,narrator_3UwVFyfK,,,,
"S """"",S_eWfFy9op,Я... Теперь буду издавать такие звуки при каждом движении?,S_eWfFy9op,,,,
"""""",narrator_khCeKMh6,"Девушка уже потихоньку приходила в себя, понимая, что консистенция спермы позволяла ей долго оставаться внутри нее.",narrator_khCeKMh6,,,,
"S """"",S_d4zULWoV,"А ты... еще хуже, чем я думала!",S_d4zULWoV,,,,
"S """"",S_dA4uETQd,Возвращаться в таком виде нельзя... Все сразу все поймут! Еще и эти звуки...,S_dA4uETQd,,,,
"S """"",S_EJJtPxcL,"Черт, не время об этом думать!",S_EJJtPxcL,,,,
"centered """"",centered_5XG3uioU,"Девушке пришлось изменить свою тактику, она не могла продолжать дальше и теперь выходом было скрыться от урсадонта.",centered_5XG3uioU,,,,
"centered """"",centered_PM3HAH3G,"Это было еще той проблемой, учитывая то, что силы были на исходе, а тело ощущалось будто ватным.",centered_PM3HAH3G,,,,
"S """"",S_XQqXKGhv,Наконец я могу нормально стоять на ногах... От этой гонки меня до сих пор укачивает.,S_XQqXKGhv,,,,
"""""",narrator_nkuajrQ9,"Девушка начала оглядываться по сторонам в попытке узнать, преследует ли ее животное.",narrator_nkuajrQ9,,,,
"S """"",S_qX3kn2du,"Кажется, оторвалась. Думаю, хвоста нет.",S_qX3kn2du,,,,
"S """"",S_MQtihTcW,Фу-у-у-у-у-у-у-у-х...,S_MQtihTcW,,,,
"""""",narrator_dA9NsA4K,"Девушка повалилась на землю, впервые за долгое время смогла расслабиться и привести голову в порядок.",narrator_dA9NsA4K,,,,
"S """"",S_euzRkArH,"Отлично... руки ноги на месте, все остальное тоже...",S_euzRkArH,,,,
"S """"",S_eYVMtMcc,"Но чувство, что мне что-то мешает, до сих пор никуда не ушло. Может в матке осталось немного его спермы?",S_eYVMtMcc,,,,
"S """"",S_R6cRDPyw,Аххх... ч-что это?!,S_R6cRDPyw,,,,
"S """"",S_k2jxFmiH,Это чувство... неужели это...,S_k2jxFmiH,,,,
"""""",narrator_A2k2pALq,"Сара резко почувствовала до боли знакомое чувство. Она не могла поверить в это, но была точно уверена...",narrator_A2k2pALq,,,,
"S """"",S_7ZYTYbNr,Эссенция? Не может быть.,S_7ZYTYbNr,,,,
"centered """"",centered_S5woPHXk,"В следующую секунду тело Сары проткнуло небывалой энергией, это была энергия самого существования урсадонта.",centered_S5woPHXk,,,,
"centered """"",centered_eK2XvTWU,Да-а-а-а... невероятная сила...,centered_eK2XvTWU,,,,
"centered """"",centered_d5vQaGmh,"Мощь стала переполнять ее тело, впитываясь все быстрее и быстрее, это был необратимый процесс.",centered_d5vQaGmh,,,,
"centered """"",centered_RqpTSzyC,"Ах... а-а-а-ах... еще... хочу еще, этого приятного нектара...",centered_RqpTSzyC,,,,
"centered """"",centered_ieJNXoTB,"Прилив сил продолжался, тело становилось все легче и легче, не переставая удивлять Сару.",centered_ieJNXoTB,,,,
"centered """"",centered_EP3XicLK,Сколько же в ней силы... просто невероятно.,centered_EP3XicLK,,,,
"centered """"",centered_KSR3z3Ky,"Спустя мгновение, все прекратилось, Сара снова вернулась в реальность и, конечно же, бремя их спаривания никуда не делись.",centered_KSR3z3Ky,,,,
"S """"",S_5gm8jrmJ,"Ахх... черт, нужно скорее выбираться отсюда... Я сейчас слишком уязвима...",S_5gm8jrmJ,,,,
"S """"",S_6SMkWHdY,Все же на этот раз пришлось его отпустить...,S_6SMkWHdY,,,,
"S """"",S_RnwJXXo8,"Кто знает, что со мной бы стало, если бы мы продолжили...",S_RnwJXXo8,,,,
"S """"",S_Bw2Y7s2y,"Думаю, он тоже был не в состоянии, раз не преследует меня...",S_Bw2Y7s2y,,,,
"""""",narrator_r5mwnF3t,"Сара вспомнила момент когда соскочила с него. Существо сразу же остановилось в метрах десяти от нее и они сошлись взглядами, после чего он продолжил свою дорогу.",narrator_r5mwnF3t,,,,
"S """"",S_ABX3LnRP,Но в его взгляде что-то было... что же он задумал...,S_ABX3LnRP,,,,
"S """"",S_6ufuq5QY,"Хм... и что же мне делать с его эссенцией... нет, ну она, конечно же, лишней не будет...",S_6ufuq5QY,,,,
"S """"",S_Q3JcU48y,"Да и татуировка светлее не стала, а значит, она никак на прогресс не влияет... Видимо, все же тут важна эссенция лидеров стаи, интересненько.",S_Q3JcU48y,,,,
"S """"",S_QkUryy22,Это... Такой мини презент за все произошедшее?,S_QkUryy22,,,,
"S """"",S_85PfiQo5,"Или, может, я неосознанно это сделала... Вообще ничего не понимаю...",S_85PfiQo5,,,,
"S """"",S_68vJkJv2,"Кто бы мог подумать, что у меня окажется его эссенция...",S_68vJkJv2,,,,
"S """"",S_U8E87FHJ,Ну... По крайней мере это оправдывает мой поход сюда.,S_U8E87FHJ,,,,
"S """"",S_5h4dBoCD,Гр-р-р-р-р...,S_5h4dBoCD,,,,
"S """"",S_UdA7AXFc,"Хотя стоп, почему я вообще злюсь? Я-то в плюсе в любом случае.",S_UdA7AXFc,,,,
"S """"",S_DCC5ajd5,"Приберегу ее, авось найдется для нее применение.",S_DCC5ajd5,,,,
"S """"",S_MTQvP6Na,"В следующий раз будет знать, как мои яблоки воровать!",S_MTQvP6Na,,,,
"S """"",S_9pmDbMsL,"Черт, но должна отдать ему должное: я никогда ничего такого прежде не испытывала...",S_9pmDbMsL,,,,
"S """"",S_MZ32oMeD,"Если даже глянуть на всю эту ситуацию с другой стороны... то чем я вообще думала, совершая все это?..",S_MZ32oMeD,,,,
"S """"",S_tGdVMhMc,"Запрыгнула на него... устроила там родео... а после... забрала его эссенцию, хи-хи-хи.",S_tGdVMhMc,,,,
"""""",narrator_ZbWtRcan,"Девушка не могла усидеть на месте, каждый раз меняя положение, запрокинув ноги наверх и свесив голову.",narrator_ZbWtRcan,,,,
"S """"",S_J9DLmCJR,"Действительно, отвлечься от рутины никогда лишним не будет...",S_J9DLmCJR,,,,
