location,source,target,ID,fuzzy,context,translator_comments,developer_comments
"""%%""",narrator_32e9b35a,"Сара осматривала огромную пустыню перед собой, не представляя как что-то настолько масштабное можно помещаться на корабле. Она не видела конца этой пустыни, наблюдая за бесконечными песочными холмами из подозрительно светлого песка.",,,,,
"S ""%%""",S_b6659278,"(Песок, который я видела обычно более жёлтый и песчинки были крупнее. Почему этот похож на плохо измельченную муку?)",,,,,
"""%%""",narrator_7961b033,"Девушка не хотела долго заострять на этом внимание, продолжая свои исследования. Вдалеке виделись примечательные обломки, резко бросающиеся в глаза из-за яркого цвета.",,,,,
"S ""%%""",S_81c4da60,Эти места такие... Заброшенные. Сколько лет здесь никто не обитает?,,,,,
"Gside1 ""%%""",Gside1_bf2a998f,"Я не могу сказать тебе точный временной отрезок. Но, судя по состоянию окружения, еще недостаточно долго, чтобы окружение успело полностью восстановиться. Здесь все еще видны раны от прошедшего боя.",,,,,
"S ""%%""",S_6635692e,"Это и так видно... Столько трупов, будто кто-то намеренно хотел уничтожить здесь все живое.",,,,,
"Gside1 ""%%""",Gside1_1f9d3480,"Мы не можем утверждать. Нет никого, кто бы уцелел и рассказал нам историю этой местности. Мы можем тешить себя лишь догадками.",,,,,
"S ""%%""",S_7e8a92d9,"(Просто сказал бы, что не знаешь...)",,,,,
"Gside1 ""%%""",Gside1_16d86579,"Но тут точно раньше была чья-то стая, потому что трупы не имеют большого разнообразия видов. Может, она просто вымерла естественным путем? Такое тоже вероятно. А может...",,,,,
"S ""%%""",S_b81663f6,Специально истребили? Но кому это может понадобиться?,,,,,
"Gside1 ""%%""",Gside1_d382d8e4,"Этот вариант более правдоподобный, судя по следам борьбы. Кто-то очень хотел помочь этим существам уйти из жизни... Столько причин, столько вариантов.",,,,,
"S ""%%""",S_ddee77ef,Много ли причин? Обычно это просто борьба за территорию.,,,,,
"Gside1 ""%%""",Gside1_02f8ff21,"Сара-Сара, тебе ли не знать, как для получения одного и того же результата использовать разные мотивы.",,,,,
"S ""%%""",S_abf5fe53,Что ты?... Ты что-то знаешь?,,,,,
"Gside1 ""%%""",Gside1_1ab76fe8,Я много чего знаю.,,,,,
"S ""%%""",S_f6e14856,...,,,,,
"S ""%%""",S_ea1bef0e,Все эти разрушения. Разве кто-то в Рое может быть заинтересован в истреблении стаи?,,,,,
"Gside1 ""%%""",Gside1_421cac82,"В этом месте возможно все, ибо тут царит хаос.",,,,,
"G ""%%""",G_cffe3ee8,Мы называем это место зоной испытаний. У Владычицы очень специфические вкусы и подходы.,,,,,
"S ""%%""",S_eab54251,Насколько?,,,,,
"G ""%%""",G_72e60a07,"Как видишь, иногда они доходят до разрушительных масштабов. Не удивлюсь, если она создала стаю и то чудовище, чтобы они схлестнулись в поединке. Что-то сродни естественному отбору. Стая ее не прошла.",,,,,
"S ""%%""",S_94e3532a,Жестоко.,,,,,
"G ""%%""",G_d85dacca,"Таково наше существование, мы постоянно боремся за право жить. Потому что выживает сильнейший. Рою не нужны слабые.",,,,,
"S ""%%""",S_4a8df892,"Слушай, а почему вы тогда такие медленные? Разве это не слабость?",,,,,
"G ""%%""",G_2bb0ce70,М-медленные?,,,,,
"S ""%%""",S_f944fb1b,"Я бы уже давно была на месте, если бы сама знала, куда идти. Мы точно успеем за сегодня хотя бы прибыть в место назначения?",,,,,
"G ""%%""",G_cebe2413,"Успеем, не волнуйся...",,,,,
"L2side2 ""%%""",L2side2_e880e07b,"(Сара права, мы еле плетемся... вон даже та улитка нас перегнала...)",,,,,
"G ""%%""",G_b887236a,"Гр... Еще раз повторяю. Нам не нужно быть быстрыми, у нас совершенно другие задачи.",,,,,
"G ""%%""",G_f7e982b0,...,,,,,
"G ""%%""",G_3debb6ce,"Вообще не так уж и медленно мы идем, хороший темп.",,,,,
"S ""%%""",S_28284c8e,"Да какой хороший? Даже пожилые терраны нас бы уже перегнали! А они не очень-то быстро ногами передвигают, знаешь ли.",,,,,
"G ""%%""",G_fa2df12d,Неправда!,,,,,
"S ""%%""",S_b726a486,"Надо поговорить с Абатуром, чтобы он удлинил вам задние конечности... Может, это поможет.",,,,,
"G ""%%""",G_64eb9c12,Не нужно нам ничего... Мы и так хорошо справляемся.,,,,,
"S ""%%""",S_d3c91dde,"А там это чудовище не помрет со скуки, пока мы идем?",,,,,
"G ""%%""",G_f7e982b0_1,...,,,,,
"G ""%%""",G_31105fa9,Все это время оно прекрасно выживало.,,,,,
"S ""%%""",S_ff72f673,Титаническая у него выдержка...,,,,,
"G ""%%""",G_b50d5d34,Мы прибыли.,,,,,
"S ""%%""",S_11e10f37,А ты... уверен?,,,,,
"""%%""",narrator_5ae74997,"Сара стала оглядываться по сторонам, но вокруг не увидела абсолютно ничего. Даже присутствия живых особей не было замечено.",,,,,
"S ""%%""",S_b63dce7c,"Я не ощущаю ничего живого, кроме нас. Да и Шпиля не вижу.",,,,,
"S ""%%""",S_93c3c1bb,"Шпи-и-и-иль, ты где?",,,,,
"G ""%%""",G_d4300272,"Дальше идти нельзя. Если мы приблизимся, то они могут нас моментально заметить. И тогда драки не избежать.",,,,,
"S ""%%""",S_3d75512a,Но почему тогда я не ощущаю это чудовище?,,,,,
"G ""%%""",G_a7dd4c8a,Он весьма преуспел в маскировке и сокрытии своего сознания. С ним нужно быть очень осторожным.,,,,,
"S ""%%""",S_d0880c42,"(Что же это за чудище такое, чем еще он способен обладать?)",,,,,
"S ""%%""",S_b58b030a,(Хм... интересно-интересно.),,,,,
"G ""%%""",G_f344cb51,Далее нам придется разделиться. Сейчас твоей задачей является закрепить приманку и ждать в засаде.,,,,,
"L2side6 ""%%""",L2side6_21ebc48e,Закрепить?,,,,,
"G ""%%""",G_8bdaa7cd,"Да, мы подготовили для тебя место, где ты бы была закреплена, и специальный костюм.",,,,,
"L2side6 ""%%""",L2side6_a5377a3a,З-зачем меня закреплять? И какой еще костюм?,,,,,
"G ""%%""",G_db64ae84,О... Ты умеешь говорить? Разве это возможно для протосса?,,,,,
"S ""%%""",S_ab43c855,Это долгая история. Ближе к делу!,,,,,
"""%%""",narrator_629a5fb3,"Страж с большим нежеланием отвел удивленный взгляд от протосса, сдерживая поток интересующих его вопросов.",,,,,
"G ""%%""",G_8e8e62af,"У этих существ в разы сильнее развиты инстинкты. Они чуют не только жертв, находящихся поблизости, но и их состояние.",,,,,
"G ""%%""",G_da8db71d,"Нам придется действительно подготовить приманку, поэтому необходима настоящая ловушка. Полное погружение, так сказать.",,,,,
"G ""%%""",G_9dad6964,"Он почувствует то, что исходит от тела жертвы. Если на ней не будет настоящих кандалов, то количества страха окажется недостаточным. Он может что-то заподозрить...",,,,,
"G ""%%""",G_17c795a7,"Уровень кортизола очень влияет на реакцию тела. Испуганная жертва будет обильно потеть, дрожать, что с легкостью заметит наш враг. Испуганное существо – лучшая добыча, потому что страх замедляет реакцию.",,,,,
"G ""%%""",G_d62fa0c4,"Но если что-то будет выглядеть не так... Или протоссу будет недостаточно страшно, то наш враг может посчитать это ловушкой.",,,,,
"G ""%%""",G_3b0caee2,"Хм... Существо в гневе тоже выделяет кортизол, но совсем в других пропорциях и связях. Тогда реакция монстра будет другой, и он может не клюнуть.",,,,,
"G ""%%""",G_d2d68c40,Не просто так он выжил здесь и считается таким опасным зверем.,,,,,
"S ""%%""",S_0cef2849,"Хм... получается, тело и мозг не обмануть... Без настоящих кандалов не обойтись.",,,,,
"""%%""",narrator_da46a724,"Сара посмотрела на Лиззару, которая уже начала немного нервничать, но согласно кивала, смотря в ответ.",,,,,
"G ""%%""",G_642b30ce,"Еще мы будем использовать феромон, чтобы он точно не решил напасть.",,,,,
"S ""%%""",S_3e4ebc82,Ф-феромон? Откуда он у тебя???,,,,,
"G ""%%""",G_10a83bee,"Хе-хе-хе, я как следует подготовился. А вы думали, я пальцем деланный?",,,,,
"L2side2 ""%%""",L2side2_503acc42,Разве тогда он не 'нападет' на меня в другом смысле?,,,,,
"G ""%%""",G_bdf9aecb,"Феромоны используются не только для соблазнения. Животные выпускают феромон для доказательства своего лидерства, признания поражения или завлечения другой особи. И у нас есть определенные цели.",,,,,
"S ""%%""",S_9d2e31de,"Хотелось бы знать, в какой момент он начинает ощущать ее присутствие.",,,,,
"G ""%%""",G_a046f90d,"По нашему опыту мы знаем, что он нападает на все живое, что попадает в поле его зрения. И он может долго преследовать свою жертву, так что тебе нельзя здесь оставаться.",,,,,
"G ""%%""",G_8c1e0c90,"Если уж он тебя заметит, то... даже не знаю, что посоветовать. Но помни: это место не выдержит еще одного истребления.",,,,,
"S ""%%""",S_85afc3e3,Да помню я... будто у меня есть желание творить что-то такое...,,,,,
"S ""%%""",S_a5cf8c14,Все будет сделано в лучшем виде. Сосредоточьтесь лучше на своей части.,,,,,
"G ""%%""",G_51291961,"Хорошо, тогда мы будем ждать твоего сигнала и тут же приступим к извлечению.",,,,,
"""%%""",narrator_3510e2c4,"Лиззара смущенно прикрывала свое тело, чувствуя себя неловко в новом костюме. Лоскуты ткани почти ничего не прикрывали, заставляя протосса чувствовать себя максимально неловко и неудобно.",,,,,
"L ""%%""",L_15c26cff,(Да... Жертвой я себя как раз очень даже чувствую...),,,,,
"""%%""",narrator_65d5904c,"Сара не обращала на нее внимание, разбираясь в первую очередь с кандалами. Она пыталась быстрее справиться с этим, унимая нервную дрожь.",,,,,
"S ""%%""",S_e2675605,"Должно быть, это чудовище очень ужасно, если оно участвовало в разрушении этого места... Тут явно происходили зверские вещи, но... почему?",,,,,
"""%%""",narrator_045ae4a8,"Девушка жестом подозвала протосса к себе, приставляя ее к месту временного заключения. Рассуждая о чем-то своем, Сара жестко закрепляла конечности Лиззары, не обращая внимания на нарастающий испуг протосса.",,,,,
"S ""%%""",S_0589dc59,Если Владычица делала все это просто для веселья... Как расточительно.,,,,,
"S ""%%""",S_2f474284,"Но весьма в ее стиле. Она сделает все, чтобы хорошенько развлечься.",,,,,
"S ""%%""",S_1dddee9c,"И когда это чудовище наконец покажет себя? Эта тайна, покрытая мраком, не на шутку интригует.",,,,,
"intro ""%%""",intro_e40967d6,,,,,,
"""%%""",narrator_13c26f87,"Девушка защелкнула механизм кандалов, после чего достала следующее приспособление. В ее руках оказались анальные бусы.",,,,,
"L ""%%""",L_96f111cc,Что?...,,,,,
"""%%""",narrator_29349938,"Лиззара наконец оживилась, замечая в переданных вещах анальные бусы. Они вместе удивленно переглянулись, возвращая взгляд на игрушку.",,,,,
"S ""%%""",S_a6783f94,"Да, я знаю... Тебе это не понравится.",,,,,
"L ""%%""",L_82c83f30,З-зачем тебе что-то подобное?,,,,,
"S ""%%""",S_19a22025,Чтобы ты чувствовала себя некомфортно и еще более напугано. Все твое тело будет источать слабость и именно это должно сыграть для нас.,,,,,
"S ""%%""",S_97f191df,"У нас одна попытка и рисковать нельзя. Если он что-то заподозрит, то второго шанса у нас может и не оказаться.",,,,,
"L ""%%""",L_a668b653,Я-я понимаю... но бусы...,,,,,
"L ""%%""",L_8f0fe765,"Ладно! Если нужно, значит нужно!",,,,,
"""%%""",narrator_7cfda01b,"Лиззара уже заметно подрагивала, когда Сара обошла ее и присела возле ягодиц. Протосс задавалась вопросом, почему девушка так спокойна, но не решалась его задать вслух.",,,,,
"S ""%%""",S_b95faedf,"Расслабься, иначе может быть немного дискомфортно.",,,,,
"""%%""",narrator_a175d437,"Лиззара испугано старалась посмотреть назад, одновременно послушно пытаясь расслабиться. Кончик анальных бус опасно приблизился к заднему проходу, заставив протосса снова сильно напрячься.",,,,,
"S ""%%""",S_b37e7778,"Лиззара, я не хочу делать тебе больно...",,,,,
"L ""%%""",L_46f690fa,Я... я пытаюсь.,,,,,
"L ""%%""",L_4d1d5f18,Ах!,,,,,
"S ""%%""",S_fd8a1d1d,Вот черт... сейчас-сейчас...,,,,,
"""%%""",narrator_b015960b,"Со второй попытки бусы все-таки вошли в узкий анус, даря Лиззаре новые, но не менее пугающие ощущения. Анус немного жгло от резкого расширения, но ощущение чего-то постороннего возбуждало не меньше.",,,,,
"L ""%%""",L_7a96f010,Ах!!! О-они огромные!,,,,,
"S ""%%""",S_88214b01,"Отлично. Думаю, так будет достаточно.",,,,,
"S ""%%""",S_27353016,"Хи-хи, у тебя как будто появился маленький хвостик.",,,,,
"""%%""",narrator_97783b40,"Сара продолжала улыбаться, немного поигрывая с бусами, которые торчали снаружи.",,,,,
"L ""%%""",L_08979451,"С-сара! П-прекрати, что ты делаешь?! Ах...",,,,,
"S ""%%""",S_b1a3d69a,"Ладно-ладно, осталось дело за малым... Полить тебя феромоном.",,,,,
"""%%""",narrator_7b5ee120,"Сара достала некий флакон, больше походящий на живой мешочек, с резко пахнущей жидкостью.",,,,,
"S ""%%""",S_a90c005f,Ой... вот это запах... фу-у-у-у...,,,,,
"S ""%%""",S_209df2b4,"Слушай, Лиззара, а вы вообще ощущаете запахи?",,,,,
"L ""%%""",L_b9d341cb,Давай об этом поговорим в другом более уютном месте...,,,,,
"S ""%%""",S_c3efc0e9,"Хах, и то верно... хорошо.",,,,,
"L ""%%""",L_af5ea12e,"Я боюсь, что со всем этими приготовлениями он убьет меня в попытке... Войти в меня.",,,,,
"S ""%%""",S_f83feb5d,"Если это случится, я переманю его на себя. Для этого я и буду рядом.",,,,,
"S ""%%""",S_1a4cea28,"Не разочароваться бы, если он окажется не таким уж и сильным...",,,,,
"S ""%%""",S_75df584e,"Хотя... А существует ли он вообще? Я до сих пор ничего не чувствую. Может, меня вообще обвели вокруг пальца и мы занимаемся каким-то бредом.",,,,,
"S ""%%""",S_e38fe49b,Бредом для какого-то извращенца... который хочет поиграться с телом невинного протосса...,,,,,
"L ""%%""",L_3b7234bc,!!!,,,,,
"S ""%%""",S_1295afff,Хм...,,,,,
"S ""%%""",S_8b919477,"Хи-хи-хи, было бы смешно, окажись это тупым розыгрышем... Так и знала, что невозможно столь легко получить эссенцию.",,,,,
"S ""%%""",S_f9c65f6a,Но рискнул бы ли он меня так обманывать? Я ведь и разозлиться могу.,,,,,
"""%%""",narrator_795ea315,"Сара открывала странный флакончик, оставленный стражем, без особой осторожности, чудом не попадая на себя.",,,,,
"S ""%%""",S_e332be8a,"А он уж точно от меня не убежит, хи-хи.",,,,,
"S ""%%""",S_947eeacf,Ох ему не поздоровится...,,,,,
"""%%""",narrator_37ccbeae,"Сара размашисто наносила жидкость на протосса, считая прошедшие минуты подготовки. Вскоре почти все тело Лиззары было покрыто полупрозрачной и почти не пахнущей жидкостью.",,,,,
"S ""%%""",S_7dcc5d0d,"Вот сюда чуть-чуть... и сюда... и вот на носик, хи-хи!",,,,,
"L ""%%""",L_1cd5ae70,Такое странное чувство... ах... моя кожа начинает его впитывать...,,,,,
"S ""%%""",S_6fe27f8f,"Да уж. Но потерпи чуть-чуть, скоро все закончится... еще совсем немного осталось.",,,,,
"L ""%%""",L_20d85115,"{size=+4}С-САРА, СМОТРИ!{/size}",,,,,
"S ""%%""",S_6d60b5ff,А?,,,,,
"""%%""",narrator_78306fa0,"Лиззара с ужасов наблюдала, как девушка случайно дернула рукой и пролила на себя пару капель.",,,,,
"L ""%%""",L_e05a0c0a,Ты пролила на себя...,,,,,
"S ""%%""",S_33616b51,Черт! Арх...,,,,,
"""%%""",narrator_88927873,"Изначально девушка не придала этому значению, но сразу через миг ей открылась полная картина произошедшего. Она поняла, что действовать нужно быстро, это может поставить всю операцию под опасность.",,,,,
"L ""%%""",L_88eb8e20,Эта штука очень ядреная...,,,,,
"S ""%%""",S_2cf44e57,Это может все испортить... ДА ПОЧЕМУ СЕЙЧАС?!,,,,,
"S ""%%""",S_c7dc2f32,Ммммм...,,,,,
"S ""%%""",S_7ad11476,Нужно уходить...,,,,,
"S ""%%""",S_f03be010,"Пого... Ох, это не розыгрыш. Теперь я чувствую!",,,,,
"S ""%%""",S_518e6126,Мне придется оставить тебя... Сейчас же!,,,,,
"""%%""",narrator_32986a7c,"Сара рванула в совершенно другую сторону. Она использовала не только свои мышцы, но и усиляла их псионикой, пытаясь как можно быстрее отдалиться от Лиззары.",,,,,
"S ""%%""",S_adff68fd,"У-удачи, Лиззара. Не переживай, скоро увидимся!",,,,,
"S ""%%""",S_8b2242c0,"(И... Как далеко мне стоит уходить? Хех, это из-за стража я забыла, как нормально передвигаться... ну сейчас мы наверстаем упущенное!)",,,,,
"S ""%%""",S_70756809,"(К черту куда, нужно просто бежать отсюда как можно дальше.)",,,,,
"S ""%%""",S_458505f4,"(Хах... Я, похоже, начинаю любить конкретные цифры.)",,,,,
"S ""%%""",S_deddeccb,Лишь бы не сорвался... наш план...,,,,,
"S ""%%""",S_cd4431a1,"Черт, Страж! Точно, нужно сообщить, что все готово...!",,,,,
"S ""%%""",S_96535981,(Страж! Ты меня слышишь?),,,,,
"Gside1 ""%%""",Gside1_794f2d03,"(Сара? Да, я тебя слышу. Как все прошло?)",,,,,
"S ""%%""",S_d8587f16,(Приманка установлена. Вы можете выдвигаться!),,,,,
"Gside1 ""%%""",Gside1_cc379cbb,(Принято! Мы мигом!),,,,,
"S ""%%""",S_926d8b19,"(Мигом относительно Венеры? Там, может быть вы как раз достигаете средней, а то и высокой скорости.)",,,,,
"S ""%%""",S_8241009a,(Двигаясь вы мигом относительно Земли... Не пришлось бы нам все это выдумывать...),,,,,
"Gside1 ""%%""",Gside1_77ebf1dd,"(Может, и не пришлось бы. Но когда еще бы терран объединился с протоссом для решения проблем зерга?)",,,,,
"Gside1 ""%%""",Gside1_0b2cc7ab,"(Черт, это даже произносить странно, не то что участвовать...)",,,,,
"S ""%%""",S_dd583408,(Да... Лиззара уже не раз меня выручает в ваших делах...),,,,,
