location,source,target,ID,fuzzy,context,translator_comments,developer_comments
"""""",narrator_omooCGRL,"Сара пыталась строить планы на следующий день, когда ее застало врасплох желание проверить одну местность.",narrator_omooCGRL,,,,
"S """"",S_GVZiaXMC,Глупости... Сегодня есть вещи и поважнее.,S_GVZiaXMC,,,,
"S """"",S_gSiNoNqM,"Если я буду руководствоваться мимолетными желаниями, я ни в чем не преуспею.",S_gSiNoNqM,,,,
"""""",narrator_9z7ErxCq,"Девушка скатилась по трону ниже, принимая полулежачее положение. Назойливая мысль сбивала ее с настроя.",narrator_9z7ErxCq,,,,
"S """"",S_pffmWz9d,"Хотя проверка территории тоже важна. Муталиск говорила мне, что я должна заботиться о своих потенциальных подчиненных... Мне должно это зачесться.",S_pffmWz9d,,,,
"S """"",S_oeK7JzbF,"У меня и так достаточно плюсиков в репутации, чтобы заниматься такой ерундой.",S_oeK7JzbF,,,,
"S """"",S_BPB7DzJd,Эта территория спокойно существовала без чьего-либо вмешательства. И еще поживет.,S_BPB7DzJd,,,,
"S """"",S_S6fEPgZR,"Нужно пойти, определенно! Тем более мне есть кого там проверить...",S_S6fEPgZR,,,,
"S """"",S_M6y3Dm6C,"Нехорошо так бросать своих старых знакомых. Особенно, когда так тесно с ними общался...",S_M6y3Dm6C,,,,
"S """"",S_eEic4AYt,Будет шанс свести счеты.,S_eEic4AYt,,,,
"""""",narrator_9RFh7Enp,"Сара не без удовольствия рассматривала знакомый ландшафт, даже не пытаясь объяснить себе, почему так рада.",narrator_9RFh7Enp,,,,
"S """"",S_WT7tWeVN,"Мне, по идее, нужно было бы ощущать негативные эмоции. В конце концов, это чудовище нагло воспользовалось моим положением. Ненавижу так позорно проигрывать...",S_WT7tWeVN,,,,
"""""",narrator_AyyRvoQ4,"Воспоминания о произошедшем проигрывались сами по себе, вызывая тянущее желание внизу живота.",narrator_AyyRvoQ4,,,,
"S """"",S_Zj5GKTga,Я не словила момент тогда. Зато сейчас у меня есть отличная возможность взять верх над этим невежеством.,S_Zj5GKTga,,,,
"S """"",S_qG5spnMB,Это и так было не плохо... Но кто в здравом уме откажется от большего? Взять такого здоровяка самой...,S_qG5spnMB,,,,
"S """"",S_HXebydjf,"Думаю, это будет вполне справедливой платой за тот раз.",S_HXebydjf,,,,
"""""",narrator_qJ9oySRJ,"Девушка кивнула, соглашаясь сама с собой.",narrator_qJ9oySRJ,,,,
"S """"",S_GpZNQsnX,"Осталось только поймать это чудовище... Жаль, что феромонов у меня не осталось.",S_GpZNQsnX,,,,
"S """"",S_YJVw9DvR,Они бы здорово упростили мне задачу.,S_YJVw9DvR,,,,
"""""",narrator_Le4cVJ4V,Сара не беспокоилась о его поимке. Пси-сила позволяла определить местонахождение зерга с точностью до метра.,narrator_Le4cVJ4V,,,,
"S """"",S_kv4cJPzH,"Странно... Я чувствую такой восторг из-за своей мощи, из-за нового подчиненного или... Исключено!",S_kv4cJPzH,,,,
"S """"",S_f5cvFq72,"Вот что-что, а это точно не по мне...",S_f5cvFq72,,,,
"S """"",S_eNDN7BEu,Все ради власти!,S_eNDN7BEu,,,,
"""""",narrator_HGnWD584,"Девушка сама улыбнулась от фразы, говоря ее больше в шутку, чем всерьез.",narrator_HGnWD584,,,,
"S """"",S_t4UA4uqF,"Разве мотивация так важна? Как по мне, процесс намного увлекательнее.",S_t4UA4uqF,,,,
"S """"",S_cnrHjWeB,"Эй, зверь! Не хочешь обсудить свое невероятно оскорбительное поведение?",S_cnrHjWeB,,,,
"S """"",S_keaw9DP3,Я пришла вернуть должок...,S_keaw9DP3,,,,
"""""",narrator_3is4X3Cm,"Сара спрыгнула прямо перед монстром, заставляя его резко затормозить. Девушка ни на секунду не зажмурила глаза, когда чудовище тормозило на полной скорости.",narrator_3is4X3Cm,,,,
"S """"",S_gR7ekewi,"Выглядишь удивленным. Не почувствовал в прошлый раз, с кем связался?",S_gR7ekewi,,,,
"""""",narrator_SgpUeEuv,"Сара уперла руки в бока, не реагируя на устрашающий рык урсадонта.",narrator_SgpUeEuv,,,,
"""""",narrator_WDeJ7giR,"Несмотря на ее ожидание, зверь не стал вступать с ней в конфронтацию. После провалившегося запугивания чудище пустилось в изначальный бег, оставляя девушку в клубе дыма.",narrator_WDeJ7giR,,,,
"S """"",S_3GhNMucH,"Кхе, кхе! Это что такое было? Он просто взял и убежал? ОТ МЕНЯ?!",S_3GhNMucH,,,,
"S """"",S_SnYBjCq8,"Сначала преследовал меня, а как пришло время нести ответственность, так сразу в бега.",S_SnYBjCq8,,,,
"S """"",S_dL5snaJK,Ну ничего... Мы тоже умеем бегать.,S_dL5snaJK,,,,
"""""",narrator_fDqHQCxz,"План созрел сам собой. Сара удивилась такому рвению. Хоть месть и была ценной, у девушки были варианты получить аналогичное удовольствие при таких же затратах усилий.",narrator_fDqHQCxz,,,,
"S """"",S_DJPLpWbz,Оно действительно того стоит?,S_DJPLpWbz,,,,
"S """"",S_oaRRohXB,"Ай, ладно! Один раз живем.",S_oaRRohXB,,,,
"""""",narrator_kApt5FGB,"Сара оценила расстояние, на которое зверь успел от нее убежать. Ей хватило небольших усилий, а потом и одного прыжка, чтобы не только настигнуть урсадонта, но и зацепиться за него.",narrator_kApt5FGB,,,,
"S """"",S_M5pVFfiU,И-и-и-и-и-и-и-и-ха!!!!,S_M5pVFfiU,,,,
"S """"",S_TFKvxXna,"А ты резвый... Я это, конечно, еще по прошлому разу поняла. Но тогда тебя не приходилось седлать, хи-хи.",S_TFKvxXna,,,,
"""""",narrator_4xoP9Zx2,"Тело девушки подрагивало, не то от предвкушения, не то от железной хватки за монстра.",narrator_4xoP9Zx2,,,,
"S """"",S_juMDQG5y,Я… А на тебе не так уж и легко удержаться.,S_juMDQG5y,,,,
"""""",narrator_dUFkcWwv,"Девушка хваталась изо всех сил, ожидая, что чудовище попробует ее скинуть, но тот игнорировал чужое присутствие на себе. Сара ухватилась за его пышную шерсть, еще плотнее оседлав монстра.",narrator_dUFkcWwv,,,,
"S """"",S_4377E8Cb,"У тебя какой-то план? Ты чересчур странно себя ведешь. Я бы сказала,, даже непредсказуемо...",S_4377E8Cb,,,,
"S """"",S_kUEaPF7s,(Да и скорость в прошлый раз у него была куда выше...),S_kUEaPF7s,,,,
"""""",narrator_ppug6cMD,"Сара решила немного подождать, чтобы удостовериться в действенности собственного плана. Урсадонт продолжил игнорировать ее присутствие, и девушка решила действовать.",narrator_ppug6cMD,,,,
"S """"",S_hDSDncfF,Ах!,S_hDSDncfF,,,,
"""""",narrator_3iiF4CZW,"Саре пришлось немного ослабить хватку, чтобы соскользнуть вниз и уже закрепиться там. У девушки бешено колотилось сердце, ей казалось, что в последний момент ей не хватит ловкости схватиться или зверь резко двинет в сторону и она не успеет среагировать.",narrator_3iiF4CZW,,,,
"S """"",S_h79aajL6,Хах! Это было рисково.,S_h79aajL6,,,,
"S """"",S_bzjCR9so,"Надеюсь, тебя не смутит мой близкий контакт с твоим уязвимым местом?",S_bzjCR9so,,,,
"""""",narrator_M8Gwgy6n,"Сару переполняли различные эмоции по поводу происходящего. Мысли о том, что она будет заниматься сексом в таком положении, еще и на ходу, вызывали множество противоречивых эмоций.",narrator_M8Gwgy6n,,,,
"S """"",S_DJ3xpKVd,(Черт... Что я вытворяю! Это чудище побуждает меня заниматься такими странными вещами...),S_DJ3xpKVd,,,,
"S """"",S_REV4PNX3,(И не то чтобы первый раз с ним прошел без происшествий.),S_REV4PNX3,,,,
"""""",narrator_KxyaMPLb,"Какая-то странная химия толкала террана на опрометчивые, но от того только более заманчивые поступки. Девушка стала продвигаться ближе к члену, натыкаясь на возбужденный половой орган.",narrator_KxyaMPLb,,,,
"S """"",S_YBLUkT3U,Ой!,S_YBLUkT3U,,,,
"S """"",S_ikhCbEyu,Вот как... Так ты совсем не против?,S_ikhCbEyu,,,,
"S """"",S_PLNzgagR,Это была очередная ловушка с твоей стороны? Или хитроумный план?,S_PLNzgagR,,,,
"S """"",S_xpqk7FxN,!!!,S_xpqk7FxN,,,,
"""""",narrator_82yYvMDE,"Саре показалось, что чудовище специально притормозило, пытаясь насадить девушку на свой член. Но его размеры были слишком впечатляющими, чтобы сразу проникнуть в киску Сары.",narrator_82yYvMDE,,,,
"S """"",S_cRkQWL5w,Ах! Ты! Ты это специально?!,S_cRkQWL5w,,,,
"S """"",S_r5GfY4gE,А ты не так прост...,S_r5GfY4gE,,,,
"""""",narrator_RxYogiXT,"Сару пожирало недовольство тем, что монстр снова пытается поймать ее в ловушку.",narrator_RxYogiXT,,,,
"S """"",S_MssYfHcL,Это я придумала этот гениальный план! Не смей присваивать его себе и снова пользоваться мной...,S_MssYfHcL,,,,
"""""",narrator_PZqFJUPL,"Девушка поддалась назад, едва удерживаясь на бегу. Урсадонт недовольно заурчал, но террану было по большей степени все равно на его реакцию. Она была преисполнена своей целью.",narrator_PZqFJUPL,,,,
"S """"",S_NhW5LsSB,"Арх… Не нравится, что идет не так, как ты хотел?",S_NhW5LsSB,,,,
"S """"",S_fN5wfMor,"Теперь я выбираю, когда член попадет в мою киску. Тебе остается только сдаться.",S_fN5wfMor,,,,
"""""",narrator_mjybL5ja,"Сара хотела потянуть немного времени, чтобы довести зверя до точки кипения. Но и ее собственное либидо требовало насадиться на достоинство, которое так соблазнительно находилось рядом.",narrator_mjybL5ja,,,,
"S """"",S_MWeNFe4s,(Нет... Я не могу так легко ему сдаться!),S_MWeNFe4s,,,,
"S """"",S_KvyxBziE,"(Тогда получится, что он снова выиграл...)",S_KvyxBziE,,,,
"S """"",S_7Gs8LP9J,(Я не выдержу этого позора и... придется вернуться за реваншем.),S_7Gs8LP9J,,,,
"""""",narrator_sNbE2vpB,"Мысли о реванше все сильнее закрадывались в голову террана: сколько бы она не сопротивлялась, но ее все сильнее и сильнее тянуло к существу.",narrator_sNbE2vpB,,,,
"S """"",S_amfCVmpg,(А потом он снова нагло мной воспользуется и я буду приходить так до бесконечности!),S_amfCVmpg,,,,
"S """"",S_hkH5LTtm,Не хватало еще стать личной дыркой дикой твари!,S_hkH5LTtm,,,,
"S """"",S_ZpsZyy32,А-а-а-а-а-рг!,S_ZpsZyy32,,,,
"S """"",S_GzEjD7Ne,Это я тут существо разумное! Я буду руководить процессом!,S_GzEjD7Ne,,,,
"S """"",S_BFvwoy7s,"Слышишь меня, здоровяк?",S_BFvwoy7s,,,,
"S """"",S_fudZQ6YJ,Готовься к мести!,S_fudZQ6YJ,,,,
"S """"",S_kmMhZ8UF,Ах… ААХ! Да… Черт…,S_kmMhZ8UF,,,,
"""""",narrator_j4dKYKQQ,"Сара не отдавала себе отчета, как вообще получилось, что она насажена на огромный член и безостановочно скачет на нем. Все, что ее волновало, как бы быстрее кончить и при этом удержаться на не менее огромном звере.",narrator_j4dKYKQQ,,,,
"""""",narrator_3c4G6hCX,"Урсадонт не сбавлял темп, толкаясь в теплое нутро с каждым шагом. Член не входил в самку полностью, что не давало существу покоя, но Сара еще могла контролировать процесс и остановить необратимое. Сознание девушки то включалось, то отключалось, без возможности постоянно обрабатывать получаемые ощущения.",narrator_3c4G6hCX,,,,
"S """"",S_98fpJ2af,"(К-как так получилось? Я с-собиралась его немного помучить... Что за феромоны у его члена, что я не могу устоять?)",S_98fpJ2af,,,,
"S """"",S_cSnSpBjB,"(Или это все невероятный шарм прошлого раза? Х-хорошо хоть теперь я выбирала, куда ему войти...)",S_cSnSpBjB,,,,
"""""",narrator_XreZ7VoA,"Сара не понимала, как такой огромный член ворвался в ее киску без всяких препятствий, потому что сейчас он проникал с большим усилием.",narrator_XreZ7VoA,,,,
"S """"",S_JJhjEq7e,"Т-ты разрываешь меня, мммм!!!",S_JJhjEq7e,,,,
"""""",narrator_QTFye44x,"Стенки влагалища до предела растягивались вокруг пульсирующего органа, даря девушке ощущения на грани с оргазмом.",narrator_QTFye44x,,,,
"S """"",S_B9fiRK5F,(Я не могу поверить… Что моя киска способна на такое!),S_B9fiRK5F,,,,
"S """"",S_DmTUpdHy,"(Мне многое приходилось пережить... Но не настолько, мммм!!!)",S_DmTUpdHy,,,,
"""""",narrator_9fBAainA,Только невероятная химия между ними позволяла террану принимать что-то подобное по размеру так глубоко в себя.,narrator_9fBAainA,,,,
"S """"",S_BH8hj4We,"(Если он толкнется чуть сильнее... Он проткнет меня насквозь, ммм!!! Я этого не выдержу... Я и так на пределе!)",S_BH8hj4We,,,,
"S """"",S_MiEeXbNb,(Ах… Он еще и играется со мной! На поворотах его член... Т-так и просится войти в меня на всю длину.),S_MiEeXbNb,,,,
"S """"",S_m794xbcR,(Но я ему такой чести не устрою...),S_m794xbcR,,,,
"""""",narrator_nr3zLTjk,"Зверь готовился ускоряться, пытаясь получить удовольствие если не от полного погружения, то хотя бы от быстрого темпа. Урсадонт не понимал, почему раньше он заходил в самку по основание, а теперь ему приходилось довольствоваться меньшим.",narrator_nr3zLTjk,,,,
"S """"",S_ZHgkFvjr,"{size=+4}АХ? АХ!! Ч-что, нет, постой! Ты негодник!{/size}",S_ZHgkFvjr,,,,
"""""",narrator_HdRHH9ps,"Монстр стал издавать громкие возгласы, найдя для себя идеальный ритм. Киска девушки позорно хлюпала, позволяя урсадонту проскользнуть дальше от получаемого экстаза.",narrator_HdRHH9ps,,,,
"S """"",S_tdAaGfT9,(М-мое тело сдается... К-как его член может зайти еще дальше?),S_tdAaGfT9,,,,
"S """"",S_pDHChaP2,(Ах! Его вой способен привлечь других... Я не могу этого допустить!),S_pDHChaP2,,,,
"S """"",S_cPGYAo8o,Заткнись!,S_cPGYAo8o,,,,
"""""",narrator_h6dRdEnk,"Вой прекратился, Сара не знала, сработает ли это на нем, но так как он также обладал сознанием, все получилось.",narrator_h6dRdEnk,,,,
"""""",narrator_fFQcrpVA,"Сара не представляла, как ей ускорить финал и убраться побыстрее, но она чувствовала реакцию других особей в округе. Они приближались медленно и с интересом, девушка готова была поклясться, что они не откажутся присоединиться.",narrator_fFQcrpVA,,,,
"S """"",S_VE2emKa4,"Я не против попробовать еще парочку твоих друзей, но планы у меня были только на тебя...",S_VE2emKa4,,,,
"""""",narrator_9XDaCnm5,"Терран позволила себе пару секунд помечтать о том, что сулило ей ее глупое решение остаться в этом месте после прибытия подмоги. Остатки здравого смысла забили тревогу, отговаривая от безрассудной мысли.",narrator_9XDaCnm5,,,,
"S """"",S_W8jeTmp7,"(Черт, как бы это ни было заманчиво... Стоит просто насладиться мыслью и сосредоточиться на деле.)",S_W8jeTmp7,,,,
"""""",narrator_n78FkNun,"Сара не стала ничего менять в ритме, он ее полностью устраивал. Она лишь сильнее вцепилась в шкуру зверя, двигаясь ему навстречу. Только теперь она ощущала, как головка опасно давила на шейку матки, грозясь войти слишком глубоко.",narrator_n78FkNun,,,,
"S """"",S_FoU5K7BG,(Ах…Стоит быть осторожнее... Этот здоровяк может и не отпустить меня после такого!),S_FoU5K7BG,,,,
"""""",narrator_C5aCnQHS,"Девушку немного смущало то, насколько ловко существо орудовало своим достоинством на такой скорости. Член ни разу не выскользнул наружу, как будто зверь часто проворачивал такую авантюру.",narrator_C5aCnQHS,,,,
"S """"",S_YYadvktH,ААмм... У м-меня такое ощущение... Что я нашла скрытого главаря извращенцев... Н-на этом корабле.,S_YYadvktH,,,,
"S """"",S_JmbqDRma,"Г-главное... Ах, чтобы ты не пересекал эту черту!",S_JmbqDRma,,,,
"""""",narrator_E7riiFaQ,"Урсадонт злорадно прорычал, заставляя думать Сару, на какие еще ухищрения способен этот зверь. От этих мыслей девушка сильнее сжала член в себе, чувствуя, что эта стимуляция очень нравится монстру.",narrator_E7riiFaQ,,,,
"""""",narrator_HKRF7q4b,"Террану пришлось быстро пожалеть о своей непроизвольной реакции. Зверь захотел большего, вынимая член почти полностью и на огромной скорости вгоняя его обратно.",narrator_HKRF7q4b,,,,
"S """"",S_NMfWxcEx,МММММ!!!,S_NMfWxcEx,,,,
"S """"",S_rpTUQdBF,Ч-ЧТО ТЫ ТВОРИШЬ?,S_rpTUQdBF,,,,
"S """"",S_FVzX4ATC,У... У-у тебя не получится войти дальше!,S_FVzX4ATC,,,,
"""""",narrator_nzAATvDp,"Резкий толчок прошел волной по всему телу, не только пугая Сару, но и доводя до звездочек перед глазами. Тело реагировало непривычно, девушка не до конца могла понять, что испытывает из-за непрерывных фрикций.",narrator_nzAATvDp,,,,
"S """"",S_MbbJyHmn,(Боже... Ч-что он удумал? Проход в матку слишком узкий... Он туда не войдет!),S_MbbJyHmn,,,,
"""""",narrator_CA47WGKQ,"Монстр не сбавлял мощи своих толчков, создавая непрерывную вибрацию. Сара в блаженстве откинула голову, мечтая только не упасть в самый ответственный момент.",narrator_CA47WGKQ,,,,
"S """"",S_ssAUMm9N,"Что ты со мной делаешь? Я... Н-не на это рассчитывала, ммм!!!",S_ssAUMm9N,,,,
"""""",narrator_YMz9WGqy,"От блаженства терран расслабилась, насколько это было возможно в ее положении. Под напором здоровенная головка наконец проникла глубже, застряв из-за своей формы.",narrator_YMz9WGqy,,,,
"""""",narrator_oKjQFSPL,"Еще чуть-чуть и девушка могла отпустить руки, забыв, что ей все еще необходимо держаться за него.",narrator_oKjQFSPL,,,,
"S """"",S_3FK7XDcT,!!!,S_3FK7XDcT,,,,
"""""",narrator_XHAfivyZ,ГРАААА!!!,narrator_XHAfivyZ,,,,
"S """"",S_HfiKgtBW,"ОХ, ЧЕРТ!!!",S_HfiKgtBW,,,,
"""""",narrator_TJKB6YCk,"Тело девушки задрожало, испытывая новые смешанные эмоции. В глубине сознания Сара ощущала восторг от того, что такой член смог поместиться в ее киску. Какая-то ее часть ликовала от происходящего разврата.",narrator_TJKB6YCk,,,,
"S """"",S_jrLrTihg,Ха-аа… О-он так глубоко! Он насадил меня полностью! Он трахает меня в матку!,S_jrLrTihg,,,,
"S """"",S_BLqXnfWK,ММММх! Я н-не могу...,S_BLqXnfWK,,,,
"""""",narrator_NDHwmpfM,"Оргазм пробрался сквозь обилие ощущений, доводя Сару до грани отключки. Тело продолжало тряски от долгожданной разрядки и члена, распирающего самую чувствительную часть девушки.",narrator_NDHwmpfM,,,,
