location,source,target,ID,fuzzy,context,translator_comments,developer_comments,gametemplate
,S_76158a6a,"Это, конечно, звучит странно, так как броня призраков и так очень легкая и почти не сковывает движения. Но в данной ситуации важен каждый лишний грамм.",,,,,,"S ""%%"""
,C_22f86ad9,"(Так, может, перед попыткой нужно по-большому сходить?)",,,,,,"C ""%%"""
,S_ceb8f960,...,,,,,,"S ""%%"""
,S_e3596c98,Ты идиот?,,,,,,"S ""%%"""
,C_1d3af5ec,(... Нет...),,,,,,"C ""%%"""
,S_902f3b9b,А мне кажется да...,,,,,,"S ""%%"""
,S_ceb8f960_1,...,,,,,,"S ""%%"""
,S_66f2de2a,"Так вот, таким образом я буду еще быстрее, также собираюсь использовать один боевой прием.",,,,,,"S ""%%"""
,C_f43ef46c,"(Ну знаешь, идея действительно хорошая, Стукову не придется раздевать тебя, а значит вы быстрее перейдете к его игре.)",,,,,,"C ""%%"""
,S_ceb8f960_2,...,,,,,,"S ""%%"""
,S_a2d7ae7d,Ты меня вообще слушал? Я не об этом говорила!,,,,,,"S ""%%"""
,C_56958eac,(Ха-ха-ха.),,,,,,"C ""%%"""
,S_02399315,"(Ладно, время пришло, нужно начинать.)",,,,,,"S ""%%"""
,narrator_8c62c55b,"Неспешно Сара начала оголять свое тело, сначала скинув броню, а после и свое нижнее белье.",,,,,,"""%%"""
,C_48864d7b,(Мне кажется или я чувствую небольшое возбуждение от предстоящего?),,,,,,"C ""%%"""
,S_e49b9ae6,"М-мое тело само реагирует, когда я подхожу к этой стенке...",,,,,,"S ""%%"""
,C_31c2ff47,(Ну это не так плохо. Хе-хе.),,,,,,"C ""%%"""
,S_1d1a3d0c,Я должна максимально сосредоточиться...,,,,,,"S ""%%"""
,S_6cc9a338,Но в случае неудачи... Меня будет ждать снова его игра... ахх...,,,,,,"S ""%%"""
,narrator_ec12f5f1,Тыж,,,,,,"""%%"""
,narrator_ed75371a,"Сара решила привести себя в чувство, ударив двумя руками по щекам.",,,,,,"""%%"""
,S_e7f444b5,"Отлично, так-то лучше.",,,,,,"S ""%%"""
,C_49087b2a,"Может, нужно было лучше по ягодицам или по груди?",,,,,,"C ""%%"""
,S_fdb1c571,Тссс!,,,,,,"S ""%%"""
,S_ac88b94c,Я готова!,,,,,,"S ""%%"""
,narrator_2cd8eee8,"Настает момент – разбежка, прыжок и вот Сара уже в заранее спланированном полёте. Группируется, обученным приемом в атаке выставляет ноги.",,,,,,"""%%"""
,S_590bb426,Ха-я!,,,,,,"S ""%%"""
,narrator_956fa4b6,*Удар*,,,,,,"""%%"""
,S_c0836b2f,Да как так-то?!,,,,,,"S ""%%"""
,S_0e78e610,"У меня почти получилось... Но черт... застрять тут, да и еще в такой позе...",,,,,,"S ""%%"""
,C_81802ffd,(Да... неловко получилось...),,,,,,"C ""%%"""
,C_dd3196e9,(...),,,,,,"C ""%%"""
,C_72b372a3,"(Знаешь, я бы не хотел оказаться с тобой в одном надзирателе...)",,,,,,"C ""%%"""
,S_9676b118,"Что ты несешь, каком еще надзирателе...",,,,,,"S ""%%"""
,C_dd3196e9_1,(...),,,,,,"C ""%%"""
,S_a2283fed,Ааа...!!! Придурок...,,,,,,"S ""%%"""
,S_494cbfe6,Ты и так со мной в одном 'надзирателе'.,,,,,,"S ""%%"""
,C_1d6cf45e,"(Вот-вот, но я бы не хотел...)",,,,,,"C ""%%"""
,S_f9ca60b1,Не отвлекай меня...,,,,,,"S ""%%"""
,C_3226b2b9,"(Но хочу заметить, что я был весьма удивлен, у тебя действительно почти получилось! Ты была так близко, еще бы чуть-чуть и ты пролезла!)",,,,,,"C ""%%"""
,S_9d4986c0,"Что, правда???",,,,,,"S ""%%"""
,C_bc9589b3,(Нет.),,,,,,"C ""%%"""
,S_a9373d9a,Грр... САЙ'МОН! Не самое подходящее время ты выбрал для шуток своих!,,,,,,"S ""%%"""
,S_baaee901,"(Черт... теперь эта идея не выглядит такой уж хорошей, как до этого...)",,,,,,"S ""%%"""
,S_011aa6a8,"Черт, совсем никак не выбраться...",,,,,,"S ""%%"""
,C_ceeb1918,"(Ладно, тогда, я думаю, стоит позвать Стукова. Вот он удивится от увиденного, ха-ха-ха.)",,,,,,"C ""%%"""
,S_dc780b35,"С-стой... возможно, п-получится у меня...",,,,,,"S ""%%"""
,S_873a55f3,(Черт... как всегда намертво...),,,,,,"S ""%%"""
,S_daa7c9c1,Выхода нет... остается звать...,,,,,,"S ""%%"""
,narrator_c10a464c,"Периодически Сара делала попытки освободиться, но все они были безуспешными.",,,,,,"""%%"""
,centered_cc2d05b6,"Прошло некоторое время, прежде чем Стуков пришел.",,,,,,"centered ""%%"""
,Aside4_90bf63ff,"Так-так-так, кто-то у нас т...",,,,,,"Aside4 ""%%"""
,Aside8_fc86a80c,...,,,,,,"Aside8 ""%%"""
,Aside4_e6e52039,"Хо-хо-хо, вот это я удачненько.",,,,,,"Aside4 ""%%"""
,Aside11_35d6a4fa,"Очень рад, что мы с тобой на одной волне, мне тоже немного надоело однообразие. И вот я прихожу, а тут ты мне приготовила такой вот сюрприз. Хе-хе-хе.",,,,,,"Aside11 ""%%"""
,S_6696dc24,"Н-не выдумывай, я просто пробовала новый способ...",,,,,,"S ""%%"""
,Aside4_1df3fda1,"Да-да-да, не важно. В общем, не будем терять время.",,,,,,"Aside4 ""%%"""
,S_8f421a93,(Черт... эти его 'игры'...),,,,,,"S ""%%"""
,narrator_0081f912,"Стуков, облизнувшись, начал подходить к Саре ускоренным шагом.",,,,,,"""%%"""
,Aside11_cf5ab2bd,"Раз ты сегодня такая выдумщица, думаю, мне также нужно сделать тебе небольшой сюрприз.",,,,,,"Aside11 ""%%"""
,S_80d8076f,"Никакая я не выдумщица, и не нужно мне никаких подарков... п-просто начинай свою игру и покончим с этим скорее.",,,,,,"S ""%%"""
,S_5616b0ff,(О чем он говорит... я просто хотела выбраться...),,,,,,"S ""%%"""
,Aside2_63edb037,"Деточка, будь с собой откровенной. Я уже отсюда могу увидеть, насколько влажная твоя киска.",,,,,,"Aside2 ""%%"""
,S_2961757d,(П-прекрати на нее пялиться... ахх...),,,,,,"S ""%%"""
,Aside3_08afb1cc,"Ты уже там себе нафантазировала небось, что же это может быть?",,,,,,"Aside3 ""%%"""
,Aside4_475464cc,Ха-ха-ха-ха!,,,,,,"Aside4 ""%%"""
,S_be8c55de,Н-неправда...,,,,,,"S ""%%"""
,S_42934917,"(Аххх... но моя киска действительно начала увлажняться, как только он пришел...)",,,,,,"S ""%%"""
,S_93780d91,Это все из-за твоих извращенных игр...,,,,,,"S ""%%"""
,Aside11_0574421b,"Хе-хе, я рад это слышать.",,,,,,"Aside11 ""%%"""
,Aside10_9ec5ffe2,Но сперва нам нужно как следует тебя подготовить к этому.,,,,,,"Aside10 ""%%"""
,S_3cb86711,Подготовить? Раньше не было никаких подготовок!,,,,,,"S ""%%"""
,Aside11_499489f9,Раньше ты не дразнила меня своим развратным телом настолько сильно. Хе-хе-хе.,,,,,,"Aside11 ""%%"""
,S_4ff6261e,(Аааааа... я и сейчас этого не делаю... аххх.. черт...),,,,,,"S ""%%"""
,S_3887f81c,!!!,,,,,,"S ""%%"""
,S_d2c1235e,Стена... с ней что-то происходит...,,,,,,"S ""%%"""
,Aside2_814606d3,"Не бойся, просто расслабься. Все идет строго по плану.",,,,,,"Aside2 ""%%"""
,S_7924f93c,(Расслабиться? Как тут можно расслабиться???),,,,,,"S ""%%"""
,S_4d068a92,"Аахххх... ч-что это за жидкость, ммм... м-мое тело.",,,,,,"S ""%%"""
,narrator_fd6e2973,"Стена стала издавать странные звуки и через мгновение из пор внутри стены начала выделяться неизвестная жидкость, которая постепенно, дюйм за дюймом покрыла все голое тело Сары.",,,,,,"""%%"""
,Aside11_c544f191,"Подожди еще чуть-чуть, ты ее полюбишь, хе-хе-хе.",,,,,,"Aside11 ""%%"""
,S_98aff98f,"Полюблю??? Этого не может быть... аххх... п-после этой жидкости тело начинает щипать и оно становится... таким горячим, ахх...",,,,,,"S ""%%"""
,Aside10_d8d27f14,"Именно, в этом вся суть.",,,,,,"Aside10 ""%%"""
,S_a68a4da1,"(Аххх... нет... эта жидкость... она продолжает выделяться, черт... аххх.. я так с ума сойду...)",,,,,,"S ""%%"""
,S_9bc1b015,"М-мое тело... все мое тело покалывает, и оно... как же оно чешется...",,,,,,"S ""%%"""
,narrator_d5650878,"Жидкость продолжала покрывать тело Сары целиком, не оставляя ни одного сухого места на нем.",,,,,,"""%%"""
,Aside4_564a801e,"Ха-ха-ха, ты так развратно извиваешься, это просто праздник для моих глаз.",,,,,,"Aside4 ""%%"""
,S_cbf28f2f,"(Ахх... н-не смотри на меня, ты делаешь только хуже...)",,,,,,"S ""%%"""
,S_0c9a850d,М-мне нужно почесать его... Но я не могу себе помочь... аххх...,,,,,,"S ""%%"""
,Aside2_2934a622,"Не переживай, я как раз тут для этого. Хе-хе-хе.",,,,,,"Aside2 ""%%"""
,S_c223fdd7,"Ты только и ждешь этого, аххх... ммм...",,,,,,"S ""%%"""
,S_f2c498f0,"(Ч-черт... на самом деле сейчас я даже не против, чтобы он почесал его... ахх...)",,,,,,"S ""%%"""
,Aside11_ad6b01d6,"Давай, скажи мне, какую часть ты хочешь, чтобы я потрогал?",,,,,,"Aside11 ""%%"""
,S_d77d0a4b,"(Т-так чешется... мне нужно э-это! Проклятая жидкость, чертов Стуков, они заставляют меня.)",,,,,,"S ""%%"""
,S_65f1856c,"Грудь...{w} я хочу, чтобы ты унял это чувство на моей груди.",,,,,,"S ""%%"""
,S_9304f741,"Живот, я не могу больше... он так жжется, потри его скорее!",,,,,,"S ""%%"""
,S_607cb0c9,Т-там снизу...{w} потри там снизу... все просто в огне!,,,,,,"S ""%%"""
,Aside8_fc86a80c_1,...,,,,,,"Aside8 ""%%"""
,A_6ca6217c,"Мы с тобой это уже проходили. Если ты хочешь, чтобы я 'помог' тебе, то ты должна как следует меня попросить.",,,,,,"A ""%%"""
,S_c0eac00f,Т-ты снова за свое... с-сейчас не лучшее время!,,,,,,"S ""%%"""
,Aside9_fd2de4ca,"Ха-ха-ха! Еще как лучшее! Давай, ты должна четко и ясно дать мне понять, чего именно ты от меня хочешь.",,,,,,"Aside9 ""%%"""
,S_bc101b27,"(Аххх... он снова хочет перекрутить все так, будто извращенка тут я...)",,,,,,"S ""%%"""
,S_9c80e5d9,(Но если я этого не сделаю... то сойду с ума...),,,,,,"S ""%%"""
,Aside11_120fcd21,"Давай, я жду.",,,,,,"Aside11 ""%%"""
,S_90a82854,"Я хочу, чтобы ты поиграл с моей грудью... и не забудь про мои возбужденные соски.",,,,,,"S ""%%"""
,S_ac5bf513,П-поиграйся с моим развратным животом... м-мне это очень нужно...,,,,,,"S ""%%"""
,S_4c91824b,"М-мне нужно, чтобы ты поигрался с моей промежностью... аххх... и с моим грязным клитором!",,,,,,"S ""%%"""
,S_227aa018,(Ч-черт... с каждым новым разом мне становится все легче говорить ему грязные вещи... и в это же время внутри меня прямо что-то загорается. Неужели мне и вправду так нравится это?),,,,,,"S ""%%"""
,Aside4_ba79c8b6,"Хе-хе, ну раз ты так просишь, то как я могу отказать? Готов протянуть тебе руку помощи.",,,,,,"Aside4 ""%%"""
,S_e0727af0,"Да-да-да! Скорее, я не могу больше!",,,,,,"S ""%%"""
,S_5b5b5f12,Ооо дааа... сильнее!!! То есть н-нет... аххх... Ууууу!!!,,,,,,"S ""%%"""
,Aside11_74f7905b,"Это только начало, подожди немножко, сейчас будет лучше. Хе-хе-хе.",,,,,,"Aside11 ""%%"""
,S_2325deb4,"Мммм, даааа!!!",,,,,,"S ""%%"""
,Aside4_7a1efd2e,"Ты действительно становишься все ближе к типу девушек, которые мне нравятся. Хе-хе-хе.",,,,,,"Aside4 ""%%"""
,S_970d32bc,"Х-хватит, п-просто продолжай т-тереть их...",,,,,,"S ""%%"""
,Aside11_a44321fb,"Не стесняйся, говори прямо: тереть твои развратные сиськи и торчащие соски.",,,,,,"Aside11 ""%%"""
,S_cfa33e00,"Да-да-да, мои сосочки... ммм...",,,,,,"S ""%%"""
,S_e8b30d56,Мои развратные соски!!! МММ!!!,,,,,,"S ""%%"""
,S_9793aebc,"Х-хватит, п-просто продолжай...",,,,,,"S ""%%"""
,Aside2_84abe5c0,"Тебе нравится это, да?",,,,,,"Aside2 ""%%"""
,S_579a6b16,"Да-да-да, главное не останавливайся!",,,,,,"S ""%%"""
,Aside11_689f74d8,А как тебе вот тут?,,,,,,"Aside11 ""%%"""
,S_38afc45d,Ммм!!!,,,,,,"S ""%%"""
,S_8fbe7d49,Как же х-хорошо...,,,,,,"S ""%%"""
,Aside4_f345dab1,"Черт, я и не думал, что тебя это настолько заведет, хе-хе-хе, так куда интересней.",,,,,,"Aside4 ""%%"""
,S_34ef2c6b,(Аххх... чего он остановился?... м-мне нужно еще... этого недостаточно!),,,,,,"S ""%%"""
,Aside11_4631d863,"Отлично, с чем ты хочешь, чтобы я дальше поиграл?",,,,,,"Aside11 ""%%"""
,S_3b8abadb,"М-мало, г-грудь... нужно больше, ... п-поиграйся с моими развратными сиськами, сжимай их... делай все, что хочешь, и погрубее, только начинай быстрее!",,,,,,"S ""%%"""
,Aside4_e71e10e8,"Ха-ха-ха, тебе все мало? Я же только закончил с твоей грудью!",,,,,,"Aside4 ""%%"""
,S_6502880f,Аххх... п-просто сделай это!,,,,,,"S ""%%"""
,S_54fcd83c,"Г-грудь...{w} мои развратные сиськи. П-поиграйся с ними, сжимай их...{w} делай все, что хочешь, только начинай быстрее!",,,,,,"S ""%%"""
,Aside10_8ff2b749,"А как же сосочки? Ты ничего про них не сказала. Неужели ты не хочешь, чтобы я с ними поигрался?",,,,,,"Aside10 ""%%"""
,S_adf48f7f,"(Ч-черт... аххх... он специально тянет время... он дьявол во плоти... я держусь из последних сил... мое тело не продержится так долго, оно все в огне!)",,,,,,"S ""%%"""
,S_3fb77be2,"Х-хочу! Я люблю, когда ты играешься с ними. Т-ты знаешь, мне нравится, когда ты их очень сильно сжимаешь! М-можешь прямо с них и начать!",,,,,,"S ""%%"""
,S_889c486e,"М-мне мало... х-хочу еще... т-три мой живот! Я хочу, чтобы ты занялся им... и как можно грубее, как ты любишь, п-поиграйся с ним как следует! И поскорее!",,,,,,"S ""%%"""
,Aside4_8d66187a,"Ха-ха-ха, я же только с ним закончил, неужели тебе так сильно понравилось?",,,,,,"Aside4 ""%%"""
,S_903be604,"Да, я обожаю, когда ты его трешь, п-потри его снова...",,,,,,"S ""%%"""
,S_7ecb7f21,"Т-три мой живот! Я хочу, чтобы ты занялся им...{w} п-поиграйся с ним как следует! Только не тяни, аххх... я долго не выдержу...",,,,,,"S ""%%"""
,Aside10_ac86000a,"А пупок? Тебе нравится, когда я уделяю ему внимание?",,,,,,"Aside10 ""%%"""
,S_a67a8de3,(Он издевается... он специально тянет время...),,,,,,"S ""%%"""
,S_0145ce05,"О-обожаю!!! Можешь прямо с него и начать, только скорее!",,,,,,"S ""%%"""
,S_46d78a03,"М-мало, п-промежность... мою грязную киску... поиграйся с ней еще! Она вся горит. И как можно грубее! И возле нее тоже...",,,,,,"S ""%%"""
,Aside11_e6f5fe2e,"Тебе так понравилось? Рад слышать, что ты хочешь погрубее, хе-хе-хе.",,,,,,"Aside11 ""%%"""
,S_48952c23,П-промежность... мою грязную текущую киску... поиграй с ней! Она просто горит! И возле нее тоже...,,,,,,"S ""%%"""
,Aside10_5597fdab,"Ты ничего не сказала по поводу клитора. Неужели ты не хочешь, чтобы я с ним поигрался?",,,,,,"Aside10 ""%%"""
,S_ca2ff998,(Ч-черт... аххх... он специально тянет время... он дьявол во плоти... я держусь из последних сил... мое тело не продержится так долго...),,,,,,"S ""%%"""
,S_a7394f8f,"Х-хочу, играйся с ним... я люблю, когда ты играешься с ним... особенно сжимаешь его очень сильно. Можешь делать с ним все, что угодно!!",,,,,,"S ""%%"""
,Aside4_ee8e6858,"Ха-ха-ха, знаешь, в таком состоянии ты мне нравишься куда больше. Возможно, тебя стоит всегда держать в такой кондиции? Ха-ха-ха.",,,,,,"Aside4 ""%%"""
,S_d82b218b,Х-хватит разговоров! Я уже на грани! Ну же поиграйся с моим телом мной!!!,,,,,,"S ""%%"""
,S_9c150a73,Даааа!!! Даже не думай останавливаться!!!,,,,,,"S ""%%"""
,Aside11_0ff4d23e,"Хе-хе, ты знаешь, меня об этом можно не просить.",,,,,,"Aside11 ""%%"""
,S_3122edc2,"(Это так приятно, я не хочу, чтобы он останавливался!)",,,,,,"S ""%%"""
,Aside10_c4c45162,"Ну что, как поживает моя сучка?",,,,,,"Aside10 ""%%"""
,S_3f85ebfd,"Х-х-хорошо, ммммм!!! Н-н-но нужно еще, не останавливайся!",,,,,,"S ""%%"""
,S_84103468,"(Мне сложно говорить, когда он так жестко насилует мое тело.)",,,,,,"S ""%%"""
,Aside2_fd390178,"Я, конечно, не вижу лица, но тело и стоны говорят за тебя.",,,,,,"Aside2 ""%%"""
,Aside10_2607eaba,"Каждый раз, когда я сжимаю соски, твое тело начинает вздрагивать. И чем сильнее я это делаю, тем мощнее толчки.",,,,,,"Aside10 ""%%"""
,Aside11_7e33b3c5,Правду ведь я говорю?,,,,,,"Aside11 ""%%"""
,S_3c42cf20,ММММ!!! Д-да-да-да!!! Правда-правда-правда!,,,,,,"S ""%%"""
,Aside8_5ed52bfe,"Каждый раз, когда я играюсь с пупком, твое тело начинает вздрагивать. И чем напористей я это делаю, тем мощнее толчки.",,,,,,"Aside8 ""%%"""
,Aside11_bacd70f1,"Я не думал, что такое место тебя так сильно заведет, ты еще та извращенка. Правду ведь я говорю?",,,,,,"Aside11 ""%%"""
,S_11d91112,"ММММ!!! Д-да-да-да!!! Я обожаю, когда насилуют мой пупок! Правда-правда-правда!",,,,,,"S ""%%"""
,Aside10_568bb4c7,"Каждый раз когда я сжимаю твой клитор, тело начинает вздрагивать. И чем сильнее я это делаю, тем мощнее конвульсии.",,,,,,"Aside10 ""%%"""
,Aside11_7e33b3c5_1,Правду ведь я говорю?,,,,,,"Aside11 ""%%"""
,S_b01b64d9,"ММММ!!! Д-да-да-да!!! М-мой клитор, х-хорошо! Правда-правда-правда. Сильнее!!!",,,,,,"S ""%%"""
,Aside11_a46f8508,"Тебя уже не удовлетворить обычными ласками, хе-хе-хе.",,,,,,"Aside11 ""%%"""
,S_dd45d5c8,"Да-да-да, я хочу грубее, нет...{w} мне нужно ГРУБЕЕ!!! Будь со мной грубее!",,,,,,"S ""%%"""
,Aside2_819d4089,"Хе-хе-хе, ну это я могу тебе предоставить.",,,,,,"Aside2 ""%%"""
,S_6f95dd61,"УУУУУ, Ааахх, Ууууу УУУ!!!",,,,,,"S ""%%"""
,narrator_748bc761,С каждым новым прикосновением Стукова тело Сары начинало дрожать от удовольствия.,,,,,,"""%%"""
,S_386f72cc,(Я схожу с ума-аааааааааа!!!),,,,,,"S ""%%"""
,S_703cddbf,"Мммммм, ммннн!",,,,,,"S ""%%"""
,narrator_6896cebd,Еще одно движение рукой и по телу Сары прошла волна удовольствия.,,,,,,"""%%"""
,Aside11_ec6323e0,"Хе-хе-хе, для таких сучек у меня есть особое средство, ха-ха-ха. Если ты попросишь как следует, то, так уж и быть, я вознесу тебя на небеса наслаждения.",,,,,,"Aside11 ""%%"""
,S_6c77b542,"Аххх, используй его, используй это средство, я-я на все готова, мне оно нужно!",,,,,,"S ""%%"""
,Aside8_f7d5f9aa,Неубедительно.,,,,,,"Aside8 ""%%"""
,S_a6dc7270,"Сделай это, я извращенка и жажду узнать, что ты мне подготовил!!!",,,,,,"S ""%%"""
,Aside1_5b30b706,"Хочу тебя предупредить: это можно использовать на самых развратных извращенках. И если ты не являешься такой, то я просто не могу это сделать.",,,,,,"Aside1 ""%%"""
,S_4d32c971,"(Аххх... я не могу сейчас отказаться! М-мне нужно это, всего один разочек!!!)",,,,,,"S ""%%"""
,S_c46ab27b,"Нет, я как раз такая, я извращенная мазохистка, которая любит, когда грубо играются с моими сосками. клитором, со всем, чем угодно! Это я, используй его!",,,,,,"S ""%%"""
,Aside4_49e08a67,"Ха-ха-ха, вот это ближе к истине! Ну раз ты так хочешь этого...",,,,,,"Aside4 ""%%"""
,Aside11_8f159d8f,То получай!,,,,,,"Aside11 ""%%"""
,narrator_c246ea66,*Удар*,,,,,,"""%%"""
,S_a4c1febb,"Аххх, ох, УУУуу!",,,,,,"S ""%%"""
,S_55b1b64c,МММММММММ!!!,,,,,,"S ""%%"""
,S_6e402d0f,ДА-ДА-ДА-ДА! Я КОНЧАЮ!!! Извращенная мазохистка кончает!!!,,,,,,"S ""%%"""
,narrator_b53224e7,"Этот удар был направлен на промежность Сары, а именно на клитор. В совокупности с действием жидкости это было удовольствие, которое вырывалось наружу.",,,,,,"""%%"""
