location,source,target,ID,fuzzy,context,translator_comments,developer_comments,gametemplate
,S_3072cdd1,!!!,,,,,,"S ""%%"""
,S_25090f94,"Кажется, я что-то нашла.",,,,,,"S ""%%"""
,C_e588db96,(!!!),,,,,,"C ""%%"""
,narrator_3c533730,"Сара увидела свернутый клочок бумаги, он находился в непроглядном месте.",,,,,,"""%%"""
,S_3072cdd1_1,!!!,,,,,,"S ""%%"""
,S_9cc66dcd,Ч-что это???,,,,,,"S ""%%"""
,S_fe583423,"Кажется, это какой-то кусок бумаги.",,,,,,"S ""%%"""
,S_d30194d0,Возможно это чертежи этой базы?,,,,,,"S ""%%"""
,C_46bc7be8,(И что бы они тут делали?),,,,,,"C ""%%"""
,S_7a2ddfe2,Откуда мне знать? И вообще это неважно!,,,,,,"S ""%%"""
,narrator_8c5e5c22,"Сара развернула клочок бумаги, на нем была нарисована очень красивая длинноволосая девушка в странном древнем наряде.",,,,,,"""%%"""
,S_f3a7b65f,Это не похоже на чертежи...,,,,,,"S ""%%"""
,S_a3e890a5,Кто это?,,,,,,"S ""%%"""
,C_dc1b2894,"(Ммм, а она секси.)",,,,,,"C ""%%"""
,S_9f723941,...,,,,,,"S ""%%"""
,S_1f28effd,(А тебя только это и беспокоит... извращенец.),,,,,,"S ""%%"""
,C_88bc939c,"(Она такая же как и ты, ты ее знала?)",,,,,,"C ""%%"""
,S_65af127e,"Нет, она одета в странную одежду, такое никто уже давным давно не носит.",,,,,,"S ""%%"""
,narrator_c3c276d5,"Сара тщательнее осмотрела рисунок, повернув его и так и сяк, даже водила по нему пальцами в попытках рассмотреть девушку.",,,,,,"""%%"""
,S_1f15b318,А в чем это он? Это какая-то белая субстанция...,,,,,,"S ""%%"""
,C_a23ed98c,"(Кажется, я знаю, что это.)",,,,,,"C ""%%"""
,C_e4fe99a4,(Эт...{w=1.0} {nw}),,,,,,"C ""%%"""
,S_3072cdd1_2,!!!,,,,,,"S ""%%"""
,S_ae3f5b03,Молчи! Я не хочу об этом знать...,,,,,,"S ""%%"""
,C_51e5f288,(...),,,,,,"C ""%%"""
,S_e556e008,Это отвратительно!,,,,,,"S ""%%"""
,C_336f86b9,"(Но да, ты все правильно подумала!)",,,,,,"C ""%%"""
,S_9f723941_1,...,,,,,,"S ""%%"""
,S_5d827bfc,"Я же тебе сказала, заткнись!",,,,,,"S ""%%"""
,C_51e5f288_1,(...),,,,,,"C ""%%"""
,S_3182c1a3,Не хочу к нему прикасаться!,,,,,,"S ""%%"""
,narrator_b5e07ebe,"Сара, закрыв глаза от отвращения, положила свиток обратно.",,,,,,"""%%"""
,narrator_d8645d89,"Она тратит на это очень много времени, но, к сожалению, ей так и не удалось ничего найти.",,,,,,"""%%"""
,narrator_31e0e010,"Сара, то ли от усталости, то ли от безысходности, садится на кровать.",,,,,,"""%%"""
,S_f5aca979,(Неужели тут и вправду ничего нет?),,,,,,"S ""%%"""
,S_b07c79b1,(Черт!),,,,,,"S ""%%"""
,S_f877f524,*Удар*,,,,,,"S ""%%"""
,narrator_f753cda2,От досады Сара вскочила с кровати и со всей силы ударила по стене.,,,,,,"""%%"""
,S_abd62307,!!!,,,,,,"S ""%%"""
,narrator_e16c0701,"К ее удивлению раздался очень странный звук. И он совсем не походил на тот, что был ранее.",,,,,,"""%%"""
,S_f10bfb21,Ты слышал это???,,,,,,"S ""%%"""
,C_6f4ad889,(Ты о чем?),,,,,,"C ""%%"""
,C_a5d25031,"(Я только, что проверил твое состоянии, мне кажется, это мог быть твой желудок.)",,,,,,"C ""%%"""
,S_7f62d457,Да нет же!,,,,,,"S ""%%"""
,S_4d6319b7,Вот тут слушай.,,,,,,"S ""%%"""
,S_b2bfa663,*Удар*{w=0.5}{nw},,,,,,"S ""%%"""
,S_4e82d01e, *Удар*,,,,,,"S ""%%"""
,C_a48d0160,"(Хм, и правда, что-то тут не так.)",,,,,,"C ""%%"""
,S_00a5cfb5,"Когда я в прошлый раз ударила стену в другом месте, то такого звука не было.",,,,,,"S ""%%"""
,S_49e7a482,Сейчас проверим...,,,,,,"S ""%%"""
,narrator_81b10b72,Сара идет в другую часть комнаты.,,,,,,"""%%"""
,S_b2bfa663_1,*Удар*{w=0.5}{nw},,,,,,"S ""%%"""
,S_4e82d01e_1, *Удар*,,,,,,"S ""%%"""
,S_2a815d05,"Да, я так и знала! Это точно мой шанс выбраться.",,,,,,"S ""%%"""
,S_22380cc4,Но с виду он не отличается от обычной стены.,,,,,,"S ""%%"""
,C_3e7dc8e0,(И что ты собираешься с ней делать?),,,,,,"C ""%%"""
,S_7ff81cf1,"Конечно же, сделать тут дыру, достаточную для того, чтобы выбраться с этой комнаты и сбежать!",,,,,,"S ""%%"""
,C_7616b480,"(Но тебе не кажется, что у тебя нет нужных инструментов для этого?)",,,,,,"C ""%%"""
,S_a0a3507e,"Мое тело и есть инструмент. Тренировки, которые мы проходили в академии призраков, сделали наши тела смертоносным оружием!",,,,,,"S ""%%"""
,C_b1e42e7a,(...),,,,,,"C ""%%"""
,C_edfa6f47,(Ну ладно. Я тебя не буду останавливать.),,,,,,"C ""%%"""
,S_2fcf4d52,"А? Я думала, ты сразу же сообщишь владычице об этом или еще хуже Стукову.",,,,,,"S ""%%"""
,C_b7660379,"(Мне просто любопытно, что у тебя из этого выйдет.)",,,,,,"C ""%%"""
,S_6beddd1f,"Смотри, чтобы твое любопытство не привело тебя к плачевному результату. Потому что как только я выберусь отсюда, следующим делом я буду искать способ убрать тебя из моей головы!",,,,,,"S ""%%"""
,C_f42cbad8,"(Мне тоже будет интересно узнать, получится ли у тебя.)",,,,,,"C ""%%"""
,S_cbe613ff,...,,,,,,"S ""%%"""
,C_f2be3e75,"(Кстати, если Стуков узнает об этом, то он обязательно примет меры.)",,,,,,"C ""%%"""
,S_abd62307_1,!!!,,,,,,"S ""%%"""
,S_3c089811,Вот черт...,,,,,,"S ""%%"""
,S_8a9ff4c8,У меня есть идея!,,,,,,"S ""%%"""
,C_24e0f050,(Неплохая идея.),,,,,,"C ""%%"""
,S_cbe613ff_1,...,,,,,,"S ""%%"""
,S_9d504d81,"Я никак не могу привыкнуть, что ты читаешь мои мысли...",,,,,,"S ""%%"""
,C_e805ede7,(В этом есть и свои плюсы.),,,,,,"C ""%%"""
,narrator_3933b710,"Сара некоторое время ходит из угла в угол комнаты, как будто пытается что-то вспомнить.",,,,,,"""%%"""
,S_9aa69596,"(Черт, где же он.)",,,,,,"S ""%%"""
,C_b1e42e7a_1,(...),,,,,,"C ""%%"""
,narrator_764d70c3,*Чпоньк*,,,,,,"""%%"""
,S_a55b2430,(!!!),,,,,,"S ""%%"""
,narrator_1be36021,"Сай’мон взял контроль над телом Сары и повел ее туда, где она обнаружила вещь, которую пыталась найти.",,,,,,"""%%"""
,narrator_764d70c3_1,*Чпоньк*,,,,,,"""%%"""
,S_2731dc11,Точно! Вот оно.,,,,,,"S ""%%"""
,narrator_f9117e66,"В руках Сары был тот самый клочок бумаги, который она ранее нашла в комнате.",,,,,,"""%%"""
,S_440d9d46,"Если ты думаешь, что я поблагодарю тебя, то ты ошибаешься.",,,,,,"S ""%%"""
,C_bab50646,(Даже не думал об этом.),,,,,,"C ""%%"""
,narrator_0691bf61,Она сразу же направилась к уязвимому месту. После чего развернула бумагу и приложила ее к стене.,,,,,,"""%%"""
,S_dbef2b56,"Отлично, как раз.",,,,,,"S ""%%"""
,S_68efea0c,"Хм, а как же мне его прикрепить сюда?",,,,,,"S ""%%"""
,S_abd62307_2,!!!,,,,,,"S ""%%"""
,narrator_0b2ad612,Вскоре Саре в голову пришла одна идея.,,,,,,"""%%"""
,C_eec166ba,(Хм.),,,,,,"C ""%%"""
,S_cbe613ff_2,...,,,,,,"S ""%%"""
,narrator_14cb36bf,"Сара направилась в сторону тентакля, который дает ей еду.",,,,,,"""%%"""
,S_ee4b527e,Давай же...,,,,,,"S ""%%"""
,narrator_2491d807,"Сара начала рукой собирать оставшуюся субстанцию, которая стекала с конца тентакля.",,,,,,"""%%"""
,narrator_d350a5d2,После чего она намазала участки на бумаге слизью от тентакля.,,,,,,"""%%"""
,S_5ba3189b,"Отлично, должно же получиться.",,,,,,"S ""%%"""
,S_0343aec1,"Ну, была не была!",,,,,,"S ""%%"""
,narrator_69070b0f,Сара одним движением прикрепила кусок бумаги к стене.,,,,,,"""%%"""
,narrator_eb2e6d03,"Подождав некоторое время, Сара убедилась, что бумага на стене хорошо прикреплена.",,,,,,"""%%"""
,C_b72b82fb,"(Использовать слизь, чтобы зафиксировать бумагу — это неплохо.)",,,,,,"C ""%%"""
,S_2cc25297,Ха! Мне не нужно твоих похвал!,,,,,,"S ""%%"""
,C_522ad447,(Как скажешь.),,,,,,"C ""%%"""
,S_7f6a8518,"Отлично, теперь остается только объяснить Стукову, почему я ее сюда повесила...",,,,,,"S ""%%"""
,C_2bfdb552,"(Да, выйдет интересный диалог.)",,,,,,"C ""%%"""
,S_12a71a28,Теперь у меня точно все получится!,,,,,,"S ""%%"""
,C_f2b859fe,"(Да, думаю, теперь ты должна пролезть.)",,,,,,"C ""%%"""
,narrator_0b2fa9d4,Сара осторожно начинает залезать внутрь.,,,,,,"""%%"""
,narrator_8370206a,"Сара, просунув сначала вперед руки, начала потихоньку залезать в дыру.",,,,,,"""%%"""
,narrator_ff1cda8d,"После рук в ход пошла голова, потом плечи и торс.",,,,,,"""%%"""
,narrator_d4feeeef,Зад Сары все еще был в ее комнате.,,,,,,"""%%"""
,S_d7abb7a3,"Отлично, у меня выходит! Еще чуть-чуть и я пролезу!",,,,,,"S ""%%"""
,narrator_e3cc6f36,Сара делает пару извилистых движений.,,,,,,"""%%"""
,narrator_884707c0,"Сара заметила, что стена начала восстанавливаться.",,,,,,"""%%"""
,S_6b7ce0f7,!!!,,,,,,"S ""%%"""
,S_8cf14c2b,"Черт! Что это, почему стенка начала восстанавливаться???",,,,,,"S ""%%"""
,S_512277ff,"О нет! Я, кажется, застряла!",,,,,,"S ""%%"""
,S_142be3a4,"Что это такое, Сай’мон? Это твои проделки?",,,,,,"S ""%%"""
,C_5a8a197f,"(Нет, это не я.)",,,,,,"C ""%%"""
,narrator_ad99bc8d,"Сара попыталась выбраться из 'объятий' стены, избивая её руками, но ничего не получалось. Стена вдруг стала очень прочной.",,,,,,"""%%"""
,narrator_1e33eb4e,"Ее руки, голова и грудь выглядывали из коридора, а задняя часть все еще была в комнате.",,,,,,"""%%"""
,S_79f062d9,Что не так с этой стеной?!,,,,,,"S ""%%"""
,C_bdf1edcb,(Это больше похоже на ловушку.),,,,,,"C ""%%"""
,S_77cd4af8,Ловушку?,,,,,,"S ""%%"""
,Aside3_cf0a49fe,"Да, Сай’мон прав.",,,,,,"Aside3 ""%%"""
,Aside4_1debfa18,Ха-ха-ха.,,,,,,"Aside4 ""%%"""
,Aside12_4e8ca543,"Привет-привет, Сара.",,,,,,"Aside12 ""%%"""
,S_ecb68f9e,Ах ты!,,,,,,"S ""%%"""
,Aside9_e24f0da1,"Ты так и не послушала меня. Я же говорил, что тебе не сбежать отсюда...",,,,,,"Aside9 ""%%"""
,Aside10_f12e9f89,"И продолжила свои попытки... Но знаешь, наблюдать за ними было даже весело.",,,,,,"Aside10 ""%%"""
,S_4f94ec9e,Ах ты ж гад! Ты ему все рассказал???,,,,,,"S ""%%"""
,Aside3_d6146675,"Нет, он ничего мне не говорил. Ты думаешь, что случайно нашла эту 'дыру'? Конечно нет! Она специально создана для непослушных сучек.",,,,,,"Aside3 ""%%"""
,Aside11_0e8a8a0b,"И конечно же для того, чтобы преподать им урок!",,,,,,"Aside11 ""%%"""
,S_b67f0bb3,Урок? Что ты собираешься делать?,,,,,,"S ""%%"""
,Aside4_5b4f6698,"Аха-ха, не торопись, скоро ты все узнаешь.",,,,,,"Aside4 ""%%"""
,Aside11_651a02df,"Знаешь, ты отлично смотришься в таком положении!",,,,,,"Aside11 ""%%"""
,S_6c591624,(Извращенец...),,,,,,"S ""%%"""
,Aside11_a44d2a81,"Но я точно знаю, как ты будешь выглядеть еще лучше. Сними-ка верхнюю часть брони. Да, и белье не забудь.",,,,,,"Aside11 ""%%"""
,S_3f871d9c,Что?! Да как ты... ,,,,,,"S ""%%"""
,narrator_0dcb4ca1,Сара не успела договорить.,,,,,,"""%%"""
,Aside2_937a5ea1,Это твое наказание. Непослушных сучек нужно наказывать. Иначе я тебя отсюда не выпущу.,,,,,,"Aside2 ""%%"""
,Aside8_5ad5626d,Тем более что тебе стесняться? Я же уже все видел. Ха-ха-ха!,,,,,,"Aside8 ""%%"""
,S_141e33de,Я не буду этого делать!,,,,,,"S ""%%"""
,Aside9_e7426bfb,...,,,,,,"Aside9 ""%%"""
,Aside8_f8b9cfba,"Ты забыла, что было в прошлый раз?",,,,,,"Aside8 ""%%"""
,S_8aeaff86,Я помню...,,,,,,"S ""%%"""
,S_ae7ba0ea,"(Этот гад, он оставил меня... привязанной к тентаклям... и ушел...)",,,,,,"S ""%%"""
,Aside3_fde522c0,"Я могу тебя оставить тут одну, чтобы ты смогла все как следует обдумать.",,,,,,"Aside3 ""%%"""
,S_0a05846b,"(Черт, видимо, мне придется это сделать.)",,,,,,"S ""%%"""
,S_07291cf1,Я... я сделаю это...,,,,,,"S ""%%"""
,S_c9b94644,После этого ты меня выпустишь?,,,,,,"S ""%%"""
,Aside4_88cae19c,"Посмотрим, тут все зависит от тебя. Давай уже раздевайся!",,,,,,"Aside4 ""%%"""
,narrator_da91534b,"Сара молча сняла верх брони, а затем и лифчик.",,,,,,"""%%"""
,Aside11_280b8371,"Ну вот, отлично выглядишь! А теперь замри ненадолго, мне нужно сделать еще одну твою голограмму.",,,,,,"Aside11 ""%%"""
,Aside11_c810a274,"Ну вот, отлично выглядишь! А теперь замри ненадолго, мне нужно сделать одну твою голограмму.",,,,,,"Aside11 ""%%"""
,S_10272554,Что? Мы так не договаривались!,,,,,,"S ""%%"""
,S_f90b03b0,(Я не хочу... чтобы этот больной извращенец делал еще больше своих голограмм...),,,,,,"S ""%%"""
,S_8832acb4,(Я не хочу... чтобы этот больной извращенец делал мою голограмму...),,,,,,"S ""%%"""
,narrator_1d7392f4,Сара закрыла лицо руками.,,,,,,"""%%"""
,Aside4_5ae19f98,"Хорошо, ничего страшного. Это не проблема.",,,,,,"Aside4 ""%%"""
,narrator_6c5867d4,"Стуков развернулся и ушел в противоположном направлении, оставив Сару с голой грудью.",,,,,,"""%%"""
,S_27b42b8e,Стой! Куда ты? Ты не можешь так меня оставить.,,,,,,"S ""%%"""
,narrator_836b104a,Стуков проигнорировал слова Сары и продолжил свой путь.,,,,,,"""%%"""
,narrator_b8e013f8,Через минуту Стуков был уже в комнате Сары и рассматривал ее зад.,,,,,,"""%%"""
,Aside11_f3b85eb3,"Не волнуйся ты так, я никуда не ушел.",,,,,,"Aside11 ""%%"""
,narrator_b864c6f1,Сара отчетливо слышала голос Стукова.,,,,,,"""%%"""
,S_a09ae384,Что? Что ты там делаешь?,,,,,,"S ""%%"""
,Aside11_7ac653e5,"Детка, у тебя шикарная задница!",,,,,,"Aside11 ""%%"""
,narrator_e4da118f,Не долго думаю Стуков отстегнул низ брони Сары.,,,,,,"""%%"""
,S_9a6780e0,"Ах, нет, не трогай меня!",,,,,,"S ""%%"""
,Aside11_4f124673,Ух! Ты такая горячая!,,,,,,"Aside11 ""%%"""
,S_2d89d215,Хватит говорить такие вещи! Что ты собрался делать?,,,,,,"S ""%%"""
,Aside2_c853e84b,"Как что? Ты мешала мне сделать хорошую голограмму для дрочки, вот я и решил сделаю другую голограмму, твоего зада.",,,,,,"Aside2 ""%%"""
,Aside4_382a7f0d,"Ха-ха-ха, тут-то тебе нечем его прикрывать.",,,,,,"Aside4 ""%%"""
,Aside11_3327eb8f,"Черт, твоя промежность, она такая сочная.",,,,,,"Aside11 ""%%"""
,narrator_12e3346f,Некоторое время Стуков пялился на зад Сары.,,,,,,"""%%"""
,S_8d1a8948,(Ах... Извращенец... н-не смотри на нее.),,,,,,"S ""%%"""
,S_58e29399,Стой! Ладно... я дам тебе сделать... голограмму...,,,,,,"S ""%%"""
,Aside8_774d694e,Ммм??? Точно?,,,,,,"Aside8 ""%%"""
,S_97375eb1,"Да-да, только оставь мою попу в покое!",,,,,,"S ""%%"""
,Aside2_0e81e759,Ну вот! Это другой разговор.,,,,,,"Aside2 ""%%"""
,narrator_9fede03c,Стуков вышел из ее комнаты и через минуту уже стоял перед ней.,,,,,,"""%%"""
,Aside11_1bf104ed,"Ну что, давай не будем тянуть. Будь хорошей сучкой.",,,,,,"Aside11 ""%%"""
,S_41f485d3,Не называй меня так!,,,,,,"S ""%%"""
,narrator_2ef1dcfb,Сара послушно убирает руки переставая прикрывать грудь.,,,,,,"""%%"""
,S_7769b546,(В этой ситуации это так странно...),,,,,,"S ""%%"""
,Aside2_d977db28,Отлично! Ты готова?,,,,,,"Aside2 ""%%"""
,S_696f158b,Да...{w=1.0}{nw},,,,,,"S ""%%"""
,narrator_603fbd0d,"Не дожидаясь ответа, по телу Сары прошелся знакомый луч света, который мог означать только одно: устройство в руке Стукова сделало еще одну голограмму обнаженной груди Сары.",,,,,,"""%%"""
,narrator_64ed0772,"Не дожидаясь ответа, по телу Сары прошелся знакомый луч света, который мог означать только одно: устройство в руке Стукова сделало одну голограмму обнаженной груди Сары.",,,,,,"""%%"""
,Aside11_63935eb8,"Ох, отлично получилось, еще одна развратная голограмма! Хе-хе-хе, как ты думаешь, чем я займусь сегодня вечером?",,,,,,"Aside11 ""%%"""
,S_b0692c0e,(Что же еще может делать этот извращенец со своими голограммами...),,,,,,"S ""%%"""
,Aside8_70c1d45d,"Но знаешь, я пока не готов тебя выпустить. Никак не выходит из головы твой зад. Твое тело меня не на шутку заводит!",,,,,,"Aside8 ""%%"""
,narrator_2e0c3eb7,Молча Стуков пошел в направлении комнаты Сары.,,,,,,"""%%"""
,S_4d2f677a,"Эй, стой ты куда, освободи меня!",,,,,,"S ""%%"""
,Aside11_c03043f5,"Отлично, теперь давай сделаем голограмму вида сзади. Хе-хе-хе.",,,,,,"Aside11 ""%%"""
,S_16c9d5d0,"Стой, ты обманул меня, мы так не договаривались!",,,,,,"S ""%%"""
,Aside8_37e5ca72,"Обманул? Да, возможно, но это все из-за твоего зада. Ты совратила меня им, тебе показать мой стояк?",,,,,,"Aside8 ""%%"""
,S_6b7ce0f7_1,!!!,,,,,,"S ""%%"""
,S_e0ff269e,Даже не думай доставать его! Я не хочу его видеть...,,,,,,"S ""%%"""
,Aside11_11e86069,"И если ты не хочешь, чтобы я прямо тут использовал тебя как материал для дрочки, то не сопротивляйся.",,,,,,"Aside11 ""%%"""
,S_daafbe18,"(Ах, нет, он собирается сделать голограмму моей обнаженной промежности...)",,,,,,"S ""%%"""
,S_fa8d3507,(Это ужасно! Он будет рассматривать мою промежность... а потом удовлетворять себя.. ммм...),,,,,,"S ""%%"""
,Aside8_e6b205e3,!!!,,,,,,"Aside8 ""%%"""
,Aside3_100f4542,"Хех, ты что начала представлять себе все это?",,,,,,"Aside3 ""%%"""
,S_ae2d46e0,Это не так!,,,,,,"S ""%%"""
,Aside11_adebf877,"Ты меня не обманешь, тут хватит одного взгляда на твою киску, она вся сочится.",,,,,,"Aside11 ""%%"""
,S_8eb0f58b,"З-заткнись, делай свою голограмму и выпускай меня...",,,,,,"S ""%%"""
,S_cead5ada,"(Ах, черт, мое тело предает меня... как это все может мне нравиться... это ненормально...)",,,,,,"S ""%%"""
,Aside3_06079c2b,"Готово, я закончил делать голограмму твоей голой киски. Ха-ха-ха.",,,,,,"Aside3 ""%%"""
,S_c2051ec2,В-выпускай меня отсюда.,,,,,,"S ""%%"""
,Aside2_50d5b093,"Да, кончено.",,,,,,"Aside2 ""%%"""
,intro_0e099107,,,,,,,"intro ""%%"""
,narrator_b6545cd1,Через некоторое время дыра в стене начала увеличиваться и Сара смогла освободиться.,,,,,,"""%%"""
,A_9310eb39,"Я надеюсь, ты извлекла пользу из этого урока и у тебя больше не появится желание лезть в эту дыру.",,,,,,"A ""%%"""
,S_68717752,...,,,,,,"S ""%%"""
,A_417e9aab,"А теперь прости, мне нужно идти. У меня появились неотложные дела. Ха-ха-ха.",,,,,,"A ""%%"""
,narrator_0711961d,На лице Стукова можно было прочитать довольную улыбку. Он торопливо покинул комнату Сары.,,,,,,"""%%"""
,S_25c10208,Черт! Даже эта комната извращенная!,,,,,,"S ""%%"""
,S_1d80a1d8,(САЙ'МОН!),,,,,,"S ""%%"""
,C_2d4d4b0b,(Что?),,,,,,"C ""%%"""
,S_428be260,"(Скажи честно, ты знал про то, что это ловушка?)",,,,,,"S ""%%"""
,C_9594450c,(Нет.),,,,,,"C ""%%"""
,S_da1d6e11,(Почему мне сложно поверить в это?),,,,,,"S ""%%"""
,C_f5415761,"(Потому что вы, люди, вечно не доверяете никому.)",,,,,,"C ""%%"""
,S_c88ce311,(...),,,,,,"S ""%%"""
,S_3e2d7fbc,Я должна выбраться отсюда!,,,,,,"S ""%%"""
,S_9d181776,"Но... я не уверена, что успею пролезть, пока стена не зарастет. Мне надо больше тренироваться, чтобы стать быстрее.",,,,,,"S ""%%"""
,S_ed83341d,"Нужно попытаться пролезть в эту дыру снова. В прошлый раз у меня не получилось, но только из-за того, что я была не готова! Теперь я учла все и не попадусь в эту ловушку.",,,,,,"S ""%%"""
,S_49d4db06,"Мне нужно будет быстро проскользнуть в эту дырку, пока я снова не застряну в ней.",,,,,,"S ""%%"""
,C_76d0be4f,"(Ты не забыла, чем закончилась твоя предыдущая попытка?)",,,,,,"C ""%%"""
