location,source,target,ID,fuzzy,context,translator_comments,developer_comments,gametemplate
,S_a86b742b,"(Они думают, что совладают со мной... Что ж, пусть попробуют, хорошо смеется тот, кто смеется последним.)",,,,,,"S ""%%"""
,H_c4366ab5,Ты вообще жива?,,,,,,"H ""%%"""
,S_e7d48835,А??? Ммм...,,,,,,"S ""%%"""
,S_024c02b5,"Д-да... я здесь, ха-ха...",,,,,,"S ""%%"""
,H_93ac59cc,У тебя было такое пошлое выражение лица... Ты явно витала где-то не здесь.,,,,,,"H ""%%"""
,S_59f8f133,Это было так... Только все хорошее здесь быстро заканчивается.,,,,,,"S ""%%"""
,H_2ff72833,"Я на секунду стал тебе завидовать. Ты выглядела так, будто тебе в разы приятнее, чем мне.",,,,,,"H ""%%"""
,S_d37f7f83,А ты что думал? Когда принимаешь эссенцию... это тяжело даже описать. Ты не ощущаешь свое тело. Ты где-то намного выше всего этого. Но не надолго.,,,,,,"S ""%%"""
,H_0d82ea92,"Понимаю... Эти сиськи тоже выбивают меня из реальности, хе-хе-хе.",,,,,,"H ""%%"""
,H_d7967640,"Я даже немного испугался. Подумал, что никогда не трахну такие сиськи больше....",,,,,,"H ""%%"""
,S_3023c11a,"Все в порядке, просто... этот момент... забудь, ты все равно не поймешь.",,,,,,"S ""%%"""
,narrator_fc0f0136,"Сара продолжала приходить в себя, ощущая прилив сил. Казалось, что она в силах свернуть горы.",,,,,,"""%%"""
,S_070220d8,"(Ммм, а если так посмотреть, то у этой груди могут быть свои плюсы... правда... Я так плохо еще ее контролирую.)",,,,,,"S ""%%"""
,narrator_9e4c4882,"Девушка посмотрела на свои мокрые соски, с которых продолжало сочиться молоко. Они временами подергивались, но были твердые как камень.",,,,,,"""%%"""
,H_09f5e178,"Ч-чеееерт, я говорю, твои сиськи выжали все из меня... ах... последний раз это было так давно...",,,,,,"H ""%%"""
,H_ca274781,"Но... хе-хе-хе, кажется, не один я тут получил массу удовольствия.",,,,,,"H ""%%"""
,S_abd6f1fd,"(Это просто побочный эффект мутации, не более...)",,,,,,"S ""%%"""
,S_8ef7667d,"(Черт, ну и залил ты меня... Постыдился бы спускать столько даме в рот...)",,,,,,"S ""%%"""
,H_a804acb1,"Ха-ха-ха, ничего не могу поделать перед твоими буферами... Ну а ты что скажешь? Оценила мою эссенцию? Никто еще не дарил тебе что-то подобное. Я уж в этом уверен.",,,,,,"H ""%%"""
,S_c21e8bee,(Какое самомнение... Но в чем-то он прав.),,,,,,"S ""%%"""
,S_f6501eb6,"(Предыдущие эссенции были великолепны... Чем выше я поднимаюсь по этой иерархии, тем больше экстаза получаю... Когда я соберу все эссенции, ммм!!! Это может быть опасно...)",,,,,,"S ""%%"""
,S_7c2bc8cf,(Это слишком дурманит мою голову! Нужно сосредоточиться...),,,,,,"S ""%%"""
,H_ecd34c2f,"Черт... Если бы мог, я бы задержался тут надолго! Эти сиськи! Нужно передать Абатуру, чтобы он сделал мне парочку для личных нужд.",,,,,,"H ""%%"""
,S_afbb8ed6,Только попробуй. Будто он сможет повторить мои груди.,,,,,,"S ""%%"""
,S_b55faca8,*Гулп* *Гулп* *Гулп*,,,,,,"S ""%%"""
,S_7a5fd1d5,"Не могу не признать, но ты и правда хорошо постарался, хи-хи.",,,,,,"S ""%%"""
,S_f7cb9fa6,"Правда, если бы еще не вся эта суматоха с сиськами...",,,,,,"S ""%%"""
,S_7497ffcb,"{size=-4}Черт... Может быть, и сегодня, хотя мой живот полон до краев...{/size}",,,,,,"S ""%%"""
,intro_c9a44873,,,,,,,"intro ""%%"""
,S_7891136b,"Давай лучше поговорим о делах насущных. Эссенция у меня, а значит ты мне подчинишься, правда ведь?",,,,,,"S ""%%"""
,H_2cd6c442,"После того, что увидел, я не могу противиться твоим си...",,,,,,"H ""%%"""
,H_0138ae0f,"...тебе, да! Ты обладаешь нужным разме...",,,,,,"H ""%%"""
,H_bdaae118,"Нужными... качествами лидера, за которым я буду следовать.",,,,,,"H ""%%"""
,S_42a32325,"(Хоть бы постыдился пялиться на мои груди во время того, как присягает мне... Хотя чего уж от них ожидать? Они же все же животные в первую очередь...)",,,,,,"S ""%%"""
,S_624b2a19,"Отлично, еще один этап пройден, осталось совсем чуть-чуть и мой план...",,,,,,"S ""%%"""
,S_8180d183,"Да, кстати... нам нужно обо многом поговорить.",,,,,,"S ""%%"""
,H_3e940a82,???,,,,,,"H ""%%"""
,S_aefcde51,...ты мне можешь пригодиться для одного небольшого дела.,,,,,,"S ""%%"""
,H_cccddda6,"Ооо, раз так, тогда, может, в следующий раз попросим Абатура сделать их ГИГАНТСКИМИ???",,,,,,"H ""%%"""
,S_a4270501,Заткнись!,,,,,,"S ""%%"""
,H_3a623104,"ОГРОМЕННЫМИ, такими, чтобы на корабле больше места не осталось!",,,,,,"H ""%%"""
,H_57d110cd,Заполним сиськами весь мир! НАВОДНЕНИЕ СИСЕК!!!,,,,,,"H ""%%"""
,S_08242d55,Еще одно слово про сиськи и я тебя приволоку к Абатуру за хвост. И он сделает тебе сиськи! Прямо у тебя над членом!,,,,,,"S ""%%"""
,H_696637e6,...А это идея.,,,,,,"H ""%%"""
,S_d81b5494,...,,,,,,"S ""%%"""
,S_5c9572bc,"Еще одно слово 'сиськи', и тебя будут соскребать со стен!",,,,,,"S ""%%"""
,intro_c9a44873_1,,,,,,,"intro ""%%"""
