location,source,target,ID,fuzzy,context,translator_comments,developer_comments,gametemplate
,H_370589f8,Ого-го! Кого я вижу. Неужели ты решилась на изменения в своем теле?,,,,,,"H ""%%"""
,S_dbc809da,"Как видишь. Меня таким не испугать. Даже не знаю... ты надеялся на то, что я струшу, или мечтал о том, что я решусь на мутацию?",,,,,,"S ""%%"""
,H_979f3fb3,Мои мысли останутся при мне.,,,,,,"H ""%%"""
,H_b17ad5ae,"Да и как я мог отказаться от такой возможности и позволить тебе струсить? Никто больше на всем этом корабле не выполнил бы мою маленькую просьбу так, как это сделала ты.",,,,,,"H ""%%"""
,H_d69c3ccf,"Ну же, давай, покажи мне их!",,,,,,"H ""%%"""
,narrator_5afd32ee,"Девушка на секундочку засомневалась но после все же поборола слабость и отстегнула верх брони. Бронелифчик моментально упал на землю, издавая звонкий звук, освобождая грудь.",,,,,,"""%%"""
,Hside1_6ce82feb,СИСЬКИ!!! ХЕ-ХЕ-ХЕ-ХЕ!,,,,,,"Hside1 ""%%"""
,S_49b29eb0,...,,,,,,"S ""%%"""
,Hside1_d49a52e7,Огромные БУФЕРА! ДА ТАКИМИ МОЖНО УБИТЬ КОГО-НИБУДЬ СЛУЧАЙНО!,,,,,,"Hside1 ""%%"""
,S_da94f4b0,"З-заткнись, они такие не по моей воле...",,,,,,"S ""%%"""
,S_fefb1751,"Знаешь, сколько она дискомфорта мне доставляет? Я еще не могу вернуть ее в обычную форму...",,,,,,"S ""%%"""
,Hside1_1ca2a465,"Хе-хе-хе, я только знаю, сколько она мне радости будет сейчас доставлять. Хе-хи-хе!",,,,,,"Hside1 ""%%"""
,S_79688d1b,(Он только и думает о своем...),,,,,,"S ""%%"""
,narrator_4333c8ee,"Гидралиск рассматривал грудь Сары с разных сторон и расстояния, не прекращая пошло облизываться.",,,,,,"""%%"""
,Hside1_cbf57f3b,"Мммм, вижу-вижу. Абатур проделал прекрасную работу. Все как я и планировал.",,,,,,"Hside1 ""%%"""
,S_8ec3f94d,"Кто бы сомневался, что ты не сможешь сдержаться и сам приложишь к этому руку. Слишком пошлая мутация получилась по итогу.",,,,,,"S ""%%"""
,Hside1_e8b24ca1,"Ну же, подойди ближе, я хочу как следует их рассмотреть.",,,,,,"Hside1 ""%%"""
,Hside1_7e5d5cda,"Оооо да! ОГРОМНЫЕ СИСЬКИ! Я ПРЯМО СЕЙЧАС ЧУВСТВУЮ, КАК МОЯ ЭССЕНЦИЯ БУРЛИТ ВО МНЕ!",,,,,,"Hside1 ""%%"""
,S_6fc4313b,Ага... эссенция...,,,,,,"S ""%%"""
,Hside1_72b585a2,"Черт, а ну потряси ими перед моим лицом.",,,,,,"Hside1 ""%%"""
,S_e6fcaa4b,Еще чего! Мы здесь не для этого собрались!,,,,,,"S ""%%"""
,Hside1_618da9bb,"Тс... ладно, согласен.",,,,,,"Hside1 ""%%"""
,Hside1_207cfbe4,"(Хе-хе-хе, придет время и она согласится, ее сиськи будут биться об мое лицо!... всему свое время, так даже лучше, да-а-а-а-а!)",,,,,,"Hside1 ""%%"""
,Hside1_766f8c86,ЕХЕХЕХЕХЕХХЕЕХ!!!,,,,,,"Hside1 ""%%"""
,S_ba90aa9e,С тобой все в порядке? У тебя только что было такое похотливое лицо...,,,,,,"S ""%%"""
,Hside1_8318f0c8,"Кхм, я просто был очень рад. Мне посчастливилось урвать такой экземпляр. Надеюсь, мы хорошо проведем время.",,,,,,"Hside1 ""%%"""
,S_099309c4,Конечно-конечно. Я уж точно хорошо проведу время. Когда ты подчинишься мне!,,,,,,"S ""%%"""
,S_02cb705f,Можешь в этом не сомневаться.,,,,,,"S ""%%"""
,Hside1_fd29604d,"Вот это настрой! А тебе палец в рот не клади... Может, мне не стоит доверять тебе свой член? Еще откусишь и я останусь без своего достоинства.",,,,,,"Hside1 ""%%"""
,S_6c379d7e,"Достоинство ли это, мы еще посмотрим... Но у тебя и правда есть то, что можно назвать не то что достоинством... Это настоящее сокровище!",,,,,,"S ""%%"""
,Hside1_b30eef95,"Никогда не видел, чтобы у кого-то так блестели глаза, когда он говорит об эссенции.",,,,,,"Hside1 ""%%"""
,S_50261f4e,Я не могу говорить о ней по-другому...,,,,,,"S ""%%"""
,S_dcddcf42,"Кхм, мы слишком много болтаем! Давай приступать ближе к делу.",,,,,,"S ""%%"""
,intro_f668e793,,,,,,,"intro ""%%"""
,narrator_a93f6cd2,Сара чувствовала на себе изучающий взгляд гидралиска. Он поглощал ее глазами.,,,,,,"""%%"""
,S_cd86eba4,Все никак не можешь налюбоваться? У меня вся кожа на груди начинает гореть от твоего пристального взгляда!,,,,,,"S ""%%"""
,H_aba85136,Как я могу на них не смотреть? ЭТО ЖЕ СИСЬКИ! Я все это время только о них и думал...,,,,,,"H ""%%"""
,S_83e0c544,"Хватит так пялиться! Ты раньше был более приятным оппонентом, чем сейчас.",,,,,,"S ""%%"""
,S_763ee36b,"Тем более сейчас моя главная цель - эссенция, а не ты!",,,,,,"S ""%%"""
,H_954ef8f5,"Все верно, хе-хе-хе, но это не мешает мне наслаждаться проделанной работой! Кто еще мог бы пойти на такое: заставить будущего лидера увеличить себе сиськи? Они стали такими развратными и такими горячими, прямо как я люблю.",,,,,,"H ""%%"""
,H_2f1acc0e,"В такие моменты я завидую вам, терранам. У вас есть руки, которыми вы можете их мацать. Гр...",,,,,,"H ""%%"""
,H_4d80afd0,"Как ты уже могла понять, мое тело не предназначено для такого рода утех. Тогда...",,,,,,"H ""%%"""
,S_e8a7d551,"Стой, ты не собираешься мне сейчас рассказать какую-то о-о-о-о-очень длинную и нудную историю о твоей любви к сиськам?",,,,,,"S ""%%"""
,H_2c9bb936,Гмн... конечно же нет.,,,,,,"H ""%%"""
,H_7aec468b,"В общем, у меня было очень много времени и я нашел нечто, что может помочь тебе в этом!",,,,,,"H ""%%"""
,S_2b2ef3c9,"Ну же, не тяни уже, а?",,,,,,"S ""%%"""
,H_8129538d,"Ха-ха-ха, а тебе все расскажи да покажи. Но ладно... ",,,,,,"H ""%%"""
,narrator_72a57c31,"Гидралиск еще более вальяжно развалился перед Сарой, выглядя максимально довольным.",,,,,,"""%%"""
,H_b2bebab4,Мою эссенцию обычными способами не получить.,,,,,,"H ""%%"""
,S_2377c9ce,А?,,,,,,"S ""%%"""
,H_40549351,"Конечно, я не хотел тебе сразу об этом рассказывать. Но ты сделала многое, чтобы доказать свою заинтересованность. Так что я пойду тебе навстречу.",,,,,,"H ""%%"""
,H_aeb7f2a0,"Мало просто подрочить мне классными сиськами. Мою эссенцию сдерживает защитный механизм, который не позволяет ей выйти при обычной дрочке.",,,,,,"H ""%%"""
,S_95b91384,"Ах ты проказник, ты действительно планировал скрыть это от меня...",,,,,,"S ""%%"""
,H_cf6e0c5a,"Хе-хе-хе, на самом деле это было бы прекрасно. Но, увидев твои СИСЬКИ, я... решил подчиниться.",,,,,,"H ""%%"""
,H_5a837a9a,Я не могу врать таким прелестным СИСЬКАМ!,,,,,,"H ""%%"""
,S_f5887cc5,Черт... снова ты за свое...,,,,,,"S ""%%"""
,S_01d9c40c,"И что мне тогда делать? Может, тебя убить легче, чем ублажить?",,,,,,"S ""%%"""
,S_f6505af8,А что... идея!,,,,,,"S ""%%"""
,H_cb458298,"Убить? Почему сразу убить? Какая ты кровожадная... Хотя, если речь идет об удушении...",,,,,,"H ""%%"""
,S_6abffe48,ЗАТКНИСЬ! Ни о каком удушении сиськами речи и не может быть...,,,,,,"S ""%%"""
,H_b1aab240,Тс...,,,,,,"H ""%%"""
,H_140ac2ec,"Ладно, на самом деле все не так сложно, как тебе могло показаться. Этот защитный механизм необходим для того, чтобы эссенция случайно не вышла. Так как я...",,,,,,"H ""%%"""
,S_f1c5c135,"Да-да-да, любишь сиськи, я поняла!",,,,,,"S ""%%"""
,H_a8096d9e,"Не просто сиськи, а ОГРОМНЫЕ СИИИИИСЬКИ!",,,,,,"H ""%%"""
,S_62a17ce3,...,,,,,,"S ""%%"""
,H_3707cf7c,"Это значит, что твоя задача держать меня возбужденным определенное количество времени. Смекаешь, о чем я? Дрочить мне так, чтобы я не кончил раньше времени. Когда эссенция будет готова, я дам тебе знать и как следует позабочусь об остальном, хе-хе-хе!",,,,,,"H ""%%"""
,S_890f4059,"Что будет, если я не справлюсь? Есть какие-то ограничения?",,,,,,"S ""%%"""
,H_e47a598a,"Оооо, можешь не переживать, с твоими сиськами у нас нет никаких ограничений. Одного взгляда на них будет достаточно, чтобы мое семя оказалось готово!",,,,,,"H ""%%"""
,S_6da29e77,Ты неисправим...,,,,,,"S ""%%"""
,S_729d396e,"Ладно, хорошо хоть предупредил об этом... Но это ни о чем не говорит, избавляйся от своих похотливых мыслишек, я пришла за эссенцией!",,,,,,"S ""%%"""
,H_5ce8f725,"Хе-хе-хе, сейчас я научу тебя работать с ним.",,,,,,"H ""%%"""
,S_24761eec,Не недооценивай меня! Я и не с такими экземплярами справлялась!,,,,,,"S ""%%"""
,H_f1f88fea,"Тише-тише, я тебе верю. Не кипятись, я ведь хочу помочь.",,,,,,"H ""%%"""
,H_b1ae43f2,"Я просто хочу, чтобы все прошло максимально удачно. Так что думаю лишней моя помощь не будет.",,,,,,"H ""%%"""
,H_4dddcf7a,"Большой член, нужен жар, но немного, совсем чуть-чуть. Черт, были бы у меня руки, я бы сам твоими прелестными СИСЬКАМИ показал, как это делается.",,,,,,"H ""%%"""
,S_958bedda,"Ладно-ладно, заткнись и просто говори, все ли в порядке.",,,,,,"S ""%%"""
,H_183aa07a,"Ооо, это я могу!",,,,,,"H ""%%"""
,S_5a5d2512,"(Кажется, я немного перестаралась... Стоить вспомнить все, что я выучила за это время.)",,,,,,"S ""%%"""
,S_0036b6d3,"(Если сжать грудью его член, то это точно должно снять возбуждение...)",,,,,,"S ""%%"""
,S_0a7ec0b7,"(Нужно еще и не перестараться... Теперь моя грудь чуть больше, чем раньше. Если сожму слишком сильно...)",,,,,,"S ""%%"""
,S_ea4e4100,!!!,,,,,,"S ""%%"""
,narrator_56c53485,Пщ-щ-щ-щ-щ-щ...,,,,,,"""%%"""
,narrator_55432032,"Сара старалась максимально аккуратно остановить нарастающее возбуждение гидралиска, но вместо этого заставила его кончить.",,,,,,"""%%"""
,S_148d2f93,"Моя грудь! Я забыла, что она такая чувствительная!",,,,,,"S ""%%"""
,narrator_e14ccf2b,"Девушка почувствовала сильный разряд удовольствия от своих действий и теплой спермы, которая начала покрывать ее.",,,,,,"""%%"""
,H_904caeb9,"Хе-хе-хе, смирись и давай развлечемся. Все равно твои попытки приводят к тому же результату.",,,,,,"H ""%%"""
,S_8d2df1d9,Еще чего! Повеселишься в следующий раз...,,,,,,"S ""%%"""
,narrator_56c53485_1,Пщ-щ-щ-щ-щ-щ...,,,,,,"""%%"""
,H_b4c9e6b8,"ДА!!! Я так надеялся, что ты не справишься с этим!",,,,,,"H ""%%"""
,S_48f61a96,Слишком много радости!,,,,,,"S ""%%"""
,H_367e178b,"Как я могу не радоваться? Еще больше времени наедине с этими прекрасными сиськами. Я буду совсем не против, если мы проведем так целый день.",,,,,,"H ""%%"""
,S_d16f383a,А вот я против...,,,,,,"S ""%%"""
,H_0b524828,"В любом случае все нужно начинать сначала. Эссенция не прощает таких ошибок, а я вот очень даже.",,,,,,"H ""%%"""
,H_49d2039d,"Ха! А ты продолжаешь меня баловать, ммм.",,,,,,"H ""%%"""
,S_d0fcb777,Н-нет! Только не снова!,,,,,,"S ""%%"""
,narrator_56c53485_2,Пщ-щ-щ-щ-щ-щ...,,,,,,"""%%"""
,narrator_952560ce,"Гидралиск выглядел очень довольным, наблюдая, как новая порция спермы попадает на сиськи Сары.",,,,,,"""%%"""
,H_5a6b4c5b,"Лучшего вида и не придумаешь! Я уже готов кончить еще пару раз. Лови момент, Сара. Может, в один из них тебе перепадет немного эссенции.",,,,,,"H ""%%"""
,S_3e702d0a,"Надеюсь, на мне до этого момента останется хоть одно чистое место...",,,,,,"S ""%%"""
,narrator_7d35e52e,"Сара посмотрела на возбужденный член перед собой, все меньше веря в сказанное ранее.",,,,,,"""%%"""
,H_8313251e,"Я бы на твоем месте не надеялся, хе-хе-хе. Эти сиськи делают меня способным на многое...",,,,,,"H ""%%"""
,narrator_56c53485_3,Пщ-щ-щ-щ-щ-щ...,,,,,,"""%%"""
,H_b9697d72,"Хе-хе, все сначала и сначала. Кажется, ты это специально.",,,,,,"H ""%%"""
,S_c83899c1,Еще чего! Просто не повезло...,,,,,,"S ""%%"""
,H_8f0f7d81,Только посмотри на свои сиськи! Они стали еще больше... Да ты точно жаждешь быть залитой с ног до головы.,,,,,,"H ""%%"""
,S_e067e54a,Н-нет! С чего ты взял...,,,,,,"S ""%%"""
,H_25fe96f8,"Да ты только посмотри! Ты аж вся затряслась от предвкушения! Я так и чувствовал, что прошу об этой услуге правильного человека, хе-хе-хе.",,,,,,"H ""%%"""
,S_9f538aa0,Ничего я не тряслась...,,,,,,"S ""%%"""
,narrator_56c53485_4,Пщ-щ-щ-щ-щ-щ...,,,,,,"""%%"""
,H_4df49573,Да! Как тебе моя сперма? Входишь во вкус?,,,,,,"H ""%%"""
,S_4cb9703c,Твоя сперма ничего такая...,,,,,,"S ""%%"""
,H_8a992fc5,Ничего такая? Я ожидал более бурной реакции.,,,,,,"H ""%%"""
,S_eaa32a64,"Вот отдашь мне свою эссенцию, тогда увидишь мою реакцию во всей красе, хи-хи.",,,,,,"S ""%%"""
,H_13179665,"Так забери. Сама же тянешь время. Не хочешь признаваться, что понравилось?",,,,,,"H ""%%"""
,S_fe7cc92d,"Может, и понравилось. Но эссенция мне точно понравится больше, так что давай займемся уже делом.",,,,,,"S ""%%"""
,H_69fdca4c,"Мой член всегда готов ко встрече с твоими сиськами, хе-хе-хе.",,,,,,"H ""%%"""
,narrator_56c53485_5,Пщ-щ-щ-щ-щ-щ...,,,,,,"""%%"""
,H_df764d4d,Я бы вечность провел с этими сиськами!,,,,,,"H ""%%"""
,S_64b21a3b,Кто бы сомневался...,,,,,,"S ""%%"""
,H_48836177,"Серьёзно, такие сиськи это сокровище. Хочу их себе. Как думаешь, их можно как-нибудь по-другому трахнуть?",,,,,,"H ""%%"""
,S_a617c4ab,Даже не думай!,,,,,,"S ""%%"""
,H_360210b5,"Ооо да, половина пути пройдена, еще чуть-чуть и ты получишь свое! Придерживайся той же стратегии. Дрочи мой член своими СИСЬКАМИ!",,,,,,"H ""%%"""
,S_d7af68cd,"А я чем тут, по-твоему, занимаюсь???",,,,,,"S ""%%"""
,S_5fbb56dd,"(Кажется, я начинаю чувствовать грань. Но это опасно, его член весьма нестабилен. Неужели ему действительно так приятно?)",,,,,,"S ""%%"""
,H_526059a7,Вот... Вот... Мы уже на финишной прямой!,,,,,,"H ""%%"""
,S_d4aba07c,"Ч-что, правда? Дело сделано? Теперь наконец-то можно не сдерживаться???",,,,,,"S ""%%"""
,H_412d9dbf,"Д-д-даааа!!! Она готова, она полностью готова! ТВОИ СИСЬКИ ПРОСТО ВЫЖИМАЮТ ВСЕ СОКИ ИЗ МЕНЯ!",,,,,,"H ""%%"""
,S_9efc1e56,"Отлично, тогда...",,,,,,"S ""%%"""
,S_875b637b,...Хе-хе-хе.,,,,,,"S ""%%"""
,narrator_c6557e1a,"Через секунду Сара с еще большим упорством стала двигать грудью, желая скорейшего завершения этого испытания. Обхватывая места, которые раньше не задевала.",,,,,,"""%%"""
,S_3ca82054,"Хорошо, теперь уж твоя очередь, не огорчи меня! Ммм, я ожидаю свою эссенцию!",,,,,,"S ""%%"""
,S_c14bf88f,До последней капли... ммм...,,,,,,"S ""%%"""
,H_9f552a54,"АРГ! Черт, меня хотят высушить до дна, наяривая мой член развратными СИСЬКАМИ!",,,,,,"H ""%%"""
,S_3b0b0004,"(О да! Я уже ощущаю эту мощь! И все это мне... Я это заслужила, хах. Так старательно работала своей грудью... Ммм!)",,,,,,"S ""%%"""
,S_177e524a,(Даже пару раз пришлось искупаться в его сперме...),,,,,,"S ""%%"""
,S_0a79f27c,(Натирала его твердый елдак...),,,,,,"S ""%%"""
,narrator_31238d75,"От предвкушения девушка готова была пойти на все, чтобы получить свою награду.",,,,,,"""%%"""
,H_219d5a73,Вот это напор! Так я и пары секунд не продержусь!... Такая концентрация СИСЕК!!!,,,,,,"H ""%%"""
,S_961a6cad,"Если бы я была такой все время... Т-то уже через пару твоих разрядок ты бы умолял меня остановиться, чтобы я не высосала тебя досуха!",,,,,,"S ""%%"""
,H_bfccd9de,Я не против... умереть под давлением СИСЕК! Таких угроз я еще не слышал. Обязательно... нужно воспользоваться возможностью и проверить на деле!,,,,,,"H ""%%"""
,S_4298474d,Заткнись и дай мне уже свою эссенцию!,,,,,,"S ""%%"""
,H_ea8db36b,"АРГХ! ОНА ВЫХОДИТ! ТВОИ СИСЬКИ СДЕЛАЛИ ЭТО! Я НЕ ДУМАЛ, ЧТО ЭТО ВОЗМОЖНО! М-МОЯ ЭССЕНЦИЯ! МОЯ...",,,,,,"H ""%%"""
,H_713f45a7,Не упусти ее! Прими ее всю! Я подчиняюсь твоим СИСЬКАМ!,,,,,,"H ""%%"""
,H_4442c6f5,ССНННИИНСССГЬЬЬГКККГИИИ!!!,,,,,,"H ""%%"""
,S_6f5b4eee,!!!,,,,,,"S ""%%"""
,S_11b914b6,(Вот она! Мне нужно получить все!),,,,,,"S ""%%"""
,S_0ad4505b,(Как ее много. Осталось только поглотить всю... не упустить ни капли...),,,,,,"S ""%%"""
,S_244850a1,"(Черт! Кажется, это только больше меня заводит, хи-хи. Неожиданная реакция.)",,,,,,"S ""%%"""
,S_598a33b1,Мммм...,,,,,,"S ""%%"""
,H_d7857ce2,Даааа!!! Получай мою эссенцию!!!,,,,,,"H ""%%"""
,S_ced818b6,Мнг!!!,,,,,,"S ""%%"""
,S_ed6e5882,*Гулп* *Гулп* *Гулп*,,,,,,"S ""%%"""
,S_d95a8409,"(Ах... их эссенция, она такая разная... у каждой свой уникальный вкус... Это что-то намного лучше, хи-хи! Мое тело распирает от силы!!!)",,,,,,"S ""%%"""
,narrator_5394dc5d,"Девушка ни на секунду не останавливалась, она продолжала поглощать эссенцию, которая пьянила ей голову. Отдаваясь приятной дрожью по всему телу.",,,,,,"""%%"""
,S_c4f8d936,"(Надеюсь, во мне хватит места... Я чувствую себя иначе. Муталиск была права...)",,,,,,"S ""%%"""
,narrator_1e7c2d73,"Девушка машинально продолжала сдавливать член грудьми в надежде, что это поможет получить еще больше нектара.",,,,,,"""%%"""
,S_de6e44af,"Да... еще больше... я не могу остановиться, я продолжаю поглощать ее... Чувствую как она протекает... льется сквозь мое тело... сливается со всем остальным...",,,,,,"S ""%%"""
,S_29278217,Я не могу остановиться... ах...,,,,,,"S ""%%"""
,S_b5e9504a,(Низ моего живота распирает... Столько энергии! Я выдержу? Я определенно должна принять в себя все до последней капли...),,,,,,"S ""%%"""
,centered_0527ac01,"Сара в наслаждении закрыла глаза, позволяя себе вдоволь насладиться своим положением.",,,,,,"centered ""%%"""
,S_f3c53b6a,"(Я чувствую свою мощь! Никаким Владычицам со мной не сравниться, ха-ха-ха!!! Вся эта сила достанется мне... И только мне.)",,,,,,"S ""%%"""
,centered_4f714f75,"Девушка ощущала невероятную легкость. Ничего физического больше не заставляло ее помнить о том, что она в реальности. Была только она и ее сила.",,,,,,"centered ""%%"""
,S_e45f7042,"(Теперь понимаю, почему Королева Клинков так сильно хочет вырваться... Чувствовать свое превосходство, ммм... Так возбуждает.)",,,,,,"S ""%%"""
,S_d5ad20f9,"(Скоро моего тела будет не хватать, чтобы удерживать всю эту энергию в себе! Эти лидеры, все они падут к моим ногам!)",,,,,,"S ""%%"""
